username,date,retweets,favorites,text,geo,mentions,hashtags,id,permalink,place,key
TepianEtam,2014-10-04 16:14:00,0.0,0.0,DIJUAL TANAH 2 Ha (poros #Samarinda - #Bontang KM 48 ) lokasi pinggir jalan besar luas 2 Ha >>> surat PPAT>>. info... http:// fb.me/26VnmPJeI,,,#Samarinda #Bontang,5.18313294508e+17,https://twitter.com/TepianEtam/status/518313294507950080,jalan besar mrt station,jalan besar
Hakimkennedy,2014-10-04 16:14:00,0.0,0.0,@MuhdIs12 bedok mall kan,,@MuhdIs12,,5.18313239433e+17,https://twitter.com/Hakimkennedy/status/518313239432552448,bedok mrt station,bedok
patrickpang,2014-10-04 16:14:00,2.0,0.0,"If you are staying in Punggol or have friends staying there, tell them to like Punggol 21. http://www. facebook.com/punggol21",,,,5.18313174144e+17,https://twitter.com/patrickpang/status/518313174144012288,punggol mrt station,punggol
ruinedmascaraa,2014-10-04 16:17:00,0.0,0.0,Otw to bishan,,,,5.18313846025e+17,https://twitter.com/ruinedmascaraa/status/518313846025371649,bishan mrt station,bishan
Recneps0610,2014-10-04 16:17:00,0.0,0.0,"Just reported a jam on Bendemeer Rd, Kallang , http:// goo.gl/KKaaSf using @waze - Social GPS.",,@waze,,5.18313893052e+17,https://twitter.com/Recneps0610/status/518313893052301312,kallang mrt station,kallang
GOSingaporeNews,2014-10-04 16:18:00,0.0,0.0,Singapore - Clarke quay /4k http:// bit.ly/1Ec3X8K http:// bit.ly/1cbdBJ1 #singapore,,,#singapore,5.18314114125e+17,https://twitter.com/GOSingaporeNews/status/518314114125275136,clarke quay mrt station,clarke quay
Satubudakk,2014-10-04 16:19:00,0.0,0.0,Tampines such a fucking alien place,,,,5.18314384117e+17,https://twitter.com/Satubudakk/status/518314384116830208,tampines mrt station,tampines
Recneps0610,2014-10-04 16:19:00,0.0,0.0,"Just reported a jam on Bendemeer Rd, Kallang , http:// goo.gl/rR3qdK using @waze - Social GPS.",,@waze,,5.18314332964e+17,https://twitter.com/Recneps0610/status/518314332963504128,kallang mrt station,kallang
butterfingers67,2014-10-04 16:19:00,0.0,1.0,if only i stay buona vista . shiok. kedai phoon huat depan mata. biggest.,,,,5.1831455998e+17,https://twitter.com/butterfingers67/status/518314559979802624,buona vista mrt station,buona vista
AlfianCine,2014-10-04 16:19:00,0.0,0.0,@changi airport now,,@changi,,5.18314517714e+17,https://twitter.com/AlfianCine/status/518314517713780736,changi airport mrt station,changi airport
Power98,2014-10-04 16:19:00,0.0,0.0,"It's Ben & Jerry's CHUNKFEST! We're here @The Meadow, Gardens By The Bay <3 Hurry on down & have a... http:// fb.me/3pILhVSov",,@The,,5.18314354836e+17,https://twitter.com/Power98/status/518314354836393985,gardens by the bay mrt station,gardens by the bay
zulr17,2014-10-04 16:20:00,0.0,0.0,off to bedok for tear down!!,,,,5.1831457971e+17,https://twitter.com/zulr17/status/518314579709792256,bedok mrt station,bedok
StreetCub_Bpp,2014-10-04 16:20:00,0.0,1.0,#tanahmerah #samboja #beach #SalamAntiSpakbor #StreetCub #Streetcubbalikpapan #streetcubkaltim … http:// instagram.com/p/tuUGIfnyCM/,,,#tanahmerah #samboja #beach #SalamAntiSpakbor #StreetCub #Streetcubbalikpapan #streetcubkaltim,5.18314689341e+17,https://twitter.com/StreetCub_Bpp/status/518314689340899329,tanah merah mrt station,tanah merah
shafaabilla12,2014-10-04 16:20:00,0.0,0.0,(with Dhiya at Tanah Merah Ferry Terminal) [pic] — https:// path.com/p/4vOAb4,,,,5.18314734496e+17,https://twitter.com/shafaabilla12/status/518314734496411648,tanah merah mrt station,tanah merah
newsbear_,2014-10-04 16:21:00,0.0,0.0,Inside Gardens by the Bay in #Singapore #MarinaBay —... #home http:// dlvr.it/75n3kH,,,#Singapore #MarinaBay #home,5.18314937689e+17,https://twitter.com/newsbear_/status/518314937689468929,gardens by the bay mrt station,gardens by the bay
zhiyuuu_l,2014-10-04 16:21:00,0.0,1.0,@Itacho Sushi at Tampines Mall http:// instagram.com/p/tuUO06GwGO/,,@Itacho,,5.18314987539e+17,https://twitter.com/zhiyuuu_l/status/518314987538763776,tampines mrt station,tampines
StreetCub_Bpp,2014-10-04 16:21:00,0.0,0.0,#tanahmerah #samboja #beach #SalamAntiSpakbor #StreetCub #Streetcubbalikpapan #streetcubkaltim … http:// instagram.com/p/tuUO_-HyCX/,,,#tanahmerah #samboja #beach #SalamAntiSpakbor #StreetCub #Streetcubbalikpapan #streetcubkaltim,5.18314994233e+17,https://twitter.com/StreetCub_Bpp/status/518314994232856576,tanah merah mrt station,tanah merah
StreetCub_Bpp,2014-10-04 16:21:00,0.0,0.0,#tanahmerah #samboja #beach #SalamAntiSpakbor #StreetCub #Streetcubbalikpapan #streetcubkaltim … http:// instagram.com/p/tuULUcHyCS/,,,#tanahmerah #samboja #beach #SalamAntiSpakbor #StreetCub #Streetcubbalikpapan #streetcubkaltim,5.18314867439e+17,https://twitter.com/StreetCub_Bpp/status/518314867439435776,tanah merah mrt station,tanah merah
Power98,2014-10-04 16:21:00,0.0,0.0,"It's Ben & Jerry's CHUNKFEST today! Swing on by The Meadow, Gardens By The Bay for a CHUNKYLICIOUS & EUPHORIC... http:// fb.me/1JzY9UNp9",,,,5.18315064576e+17,https://twitter.com/Power98/status/518315064575533057,gardens by the bay mrt station,gardens by the bay
syifahannany,2014-10-04 16:22:00,0.0,1.0,“@paistulang_: Love lock at bishan https://twitter.com/paistulang_/status/518311407176019968/photo/1 pic.twitter.com/pR2fnFL2AI ”,,@paistulang_,,5.18315198017e+17,https://twitter.com/syifahannany/status/518315198017335296,bishan mrt station,bishan
tepoyG,2014-10-04 16:22:00,0.0,0.0,I'm at Tampines Mall in Singapore https://www. swarmapp.com/c/j52zBnODLwk,,,,5.18315220906e+17,https://twitter.com/tepoyG/status/518315220906037248,tampines mrt station,tampines
StreetCub_Bpp,2014-10-04 16:22:00,0.0,0.0,#tanahmerah #samboja #beach #SalamAntiSpakbor #StreetCub #Streetcubbalikpapan #streetcubkaltim … http:// instagram.com/p/tuUXyRHyCn/,,,#tanahmerah #samboja #beach #SalamAntiSpakbor #StreetCub #Streetcubbalikpapan #streetcubkaltim,5.1831529504e+17,https://twitter.com/StreetCub_Bpp/status/518315295040360449,tanah merah mrt station,tanah merah
StreetCub_Bpp,2014-10-04 16:22:00,0.0,0.0,#tanahmerah #samboja #beach #SalamAntiSpakbor #StreetCub #Streetcubbalikpapan #streetcubkaltim … http:// instagram.com/p/tuUTbtHyCh/,,,#tanahmerah #samboja #beach #SalamAntiSpakbor #StreetCub #Streetcubbalikpapan #streetcubkaltim,5.18315145878e+17,https://twitter.com/StreetCub_Bpp/status/518315145878319105,tanah merah mrt station,tanah merah
SxmWxlf,2014-10-04 16:23:00,0.0,0.0,@iheartputri Hais tahan okay syg? Paya lebar lagi skejap sampai tanah merah da syg (': Mwaa,,@iheartputri,,5.18315394504e+17,https://twitter.com/SxmWxlf/status/518315394503696385,paya lebar mrt station,paya lebar
sihxi,2014-10-04 16:23:00,0.0,0.0,how the fuck does the train take 10 minutes from khatib to yio chu kang sia zz even those cement trucks also faster zz @smrt_singapore,,@smrt_singapore,,5.18315523449e+17,https://twitter.com/sihxi/status/518315523449167872,yio chu kang mrt station,yio chu kang
StreetCub_Bpp,2014-10-04 16:23:00,0.0,0.0,#tanahmerah #samboja #beach #SalamAntiSpakbor #StreetCub #Streetcubbalikpapan #streetcubkaltim … http:// instagram.com/p/tuUa6HnyCr/,,,#tanahmerah #samboja #beach #SalamAntiSpakbor #StreetCub #Streetcubbalikpapan #streetcubkaltim,5.1831540241e+17,https://twitter.com/StreetCub_Bpp/status/518315402410360832,tanah merah mrt station,tanah merah
tabsjusttabs,2014-10-04 16:23:00,0.0,0.0,Getting it together now. @The Meadow Gardens By The Bay http:// instagram.com/p/tuUehRqlPH/,,@The,,5.18315525459e+17,https://twitter.com/tabsjusttabs/status/518315525458653184,gardens by the bay mrt station,gardens by the bay
SamuelYh,2014-10-04 16:24:00,0.0,0.0,I'm at Singapore Changi Airport (SIN) - @fansofchangi in Singapore https://www. swarmapp.com/c/gD2Q45FVNE8,,@fansofchangi,,5.18315772042e+17,https://twitter.com/SamuelYh/status/518315772041764865,changi airport mrt station,changi airport
IAmMackySuson,2014-10-04 16:24:00,0.0,0.0,Kallang #singaporeindoorstadium http:// instagram.com/p/tuUkTpnDco/,,,#singaporeindoorstadium,5.18315724814e+17,https://twitter.com/IAmMackySuson/status/518315724813893632,kallang mrt station,kallang
Efegena,2014-10-04 16:25:00,0.0,0.0,Feeling #photofaceoff #historychannel #addict @Gardens by the Bay http:// instagram.com/p/tuUpRXRUyP/,,@Gardens,#photofaceoff #historychannel #addict,5.18315896205e+17,https://twitter.com/Efegena/status/518315896205361152,gardens by the bay mrt station,gardens by the bay
f4sha_,2014-10-04 16:25:00,0.0,0.0,What school? — bukit batok ! http:// ask.fm/a/bc7oo4q6,,,,5.18316048371e+17,https://twitter.com/f4sha_/status/518316048370917377,bukit batok mrt station,bukit batok
BrianEmma2,2014-10-04 16:25:00,0.0,0.0,Outdoor pool hall in order to punk to preschool punggol : jwsjakGyT,,,,5.18315931085e+17,https://twitter.com/BrianEmma2/status/518315931085205505,punggol mrt station,punggol
sum_mahajan,2014-10-04 16:26:00,0.0,0.0,A few more hours ......Ritu and Vanya I have reached Singapore. — at Changi Airport http:// fb.me/74HLwtiID,,,,5.18316138431e+17,https://twitter.com/sum_mahajan/status/518316138430992384,changi airport mrt station,changi airport
angelinehwee,2014-10-04 16:26:00,0.0,0.0,to tampines IKEA yayz,,,,5.18316199466e+17,https://twitter.com/angelinehwee/status/518316199466127362,tampines mrt station,tampines
MikolRayne,2014-10-04 16:27:00,0.0,0.0,Kent Ridge trails no joke sia.,,,,5.1831644511e+17,https://twitter.com/MikolRayne/status/518316445109731328,kent ridge mrt station,kent ridge
amirahrazalee,2014-10-04 16:27:00,0.0,0.0,Guess what? This mamat met me at Tanah Merah MRT.. In the end we decided to just chill at Bedok Mac cz we are too lazy,,,,5.18316497929e+17,https://twitter.com/amirahrazalee/status/518316497928593408,bedok mrt station,bedok
tunacan_ac,2014-10-04 16:28:00,0.0,0.0,OH AND PASIR RIS HAS JUBEAT SAUCER NOW,,,,5.18316747309e+17,https://twitter.com/tunacan_ac/status/518316747309326336,pasir ris mrt station,pasir ris
brianleethatsit,2014-10-04 16:29:00,0.0,0.0,"""It's only at woodlands , theres a direct MRT there, dumbass""",,,,5.18317064223e+17,https://twitter.com/brianleethatsit/status/518317064222547968,woodlands mrt station,woodlands mrt
SxmWxlf,2014-10-04 16:29:00,0.0,0.0,“ @iheartputri : Kimak baru bedok ke siala nak kencing sak ” TAHAN BB TAHAN I KNW YOU CAN DO IT B,,@iheartputri,,5.18316866721e+17,https://twitter.com/SxmWxlf/status/518316866721165313,bedok mrt station,bedok
PegaKok,2014-10-04 16:29:00,0.0,0.0,A #house without a #cat is like a #kiss without a #hug @Blk 789 Yishun Ave 2 http:// instagram.com/p/tuVJsfymlb/,,@Blk,#house #cat #kiss #hug,5.18317009731e+17,https://twitter.com/PegaKok/status/518317009730568192,yishun mrt station,yishun
ItsYaBoiiDanish,2014-10-04 16:29:00,0.0,1.0,@sandrawong_ HOSEH BEDOK MALL.THANK YOU <3,,@sandrawong_,,5.18316962985e+17,https://twitter.com/ItsYaBoiiDanish/status/518316962984644608,bedok mrt station,bedok
tomyuo,2014-10-04 16:31:00,0.0,0.0,@Kelangdbn ですです、ありがとうございます。裏側にできた Gardens by the Bay へ足を伸ばして撮ってきました。,,@Kelangdbn,,5.18317529958e+17,https://twitter.com/tomyuo/status/518317529958072321,gardens by the bay mrt station,gardens by the bay
DoodlePumpkin,2014-10-04 16:31:00,0.0,1.0,There's this super cool BnJ carnival thing at Gardens by the Bay omg,,,,5.18317429794e+17,https://twitter.com/DoodlePumpkin/status/518317429793910785,gardens by the bay mrt station,gardens by the bay
rcb_629,2014-10-04 16:31:00,0.0,0.0,Finally the sun shined!!! #gardensbythebay @Gardens by the Bay http:// instagram.com/p/tuVVmWRl-m/,,@Gardens,#gardensbythebay,5.18317418331e+17,https://twitter.com/rcb_629/status/518317418331250688,gardens by the bay mrt station,gardens by the bay
keropokman,2014-10-04 16:31:00,0.0,0.0,It's time for Chunk Fest 2014! #coresg @The Meadow Gardens By The Bay http:// instagram.com/p/tuVUeYChbb/,,@The,#coresg,5.18317380624e+17,https://twitter.com/keropokman/status/518317380624056320,gardens by the bay mrt station,gardens by the bay
dak_oh,2014-10-04 16:31:00,0.0,0.0,"I'm at Shell in Tanah Merah , Kelantan https://www. swarmapp.com/c/5q5kljfwFZg",,,,5.18317515438e+17,https://twitter.com/dak_oh/status/518317515437789184,tanah merah mrt station,tanah merah
SxmWxlf,2014-10-04 16:31:00,1.0,1.0,FINALLY TANAH MERAH BAE YESSA HI FIVE! @iheartputri,,@iheartputri,,5.18317368507e+17,https://twitter.com/SxmWxlf/status/518317368506716160,tanah merah mrt station,tanah merah
itsamirliani,2014-10-04 16:32:00,1.0,0.0,Akhirnya sampai ke destinasi yang dituju. Jalan jem drpd tanah merah sampai kota bharu.,,,,5.18317820678e+17,https://twitter.com/itsamirliani/status/518317820677873664,tanah merah mrt station,tanah merah
rcb_629,2014-10-04 16:32:00,0.0,0.0,#gardensbythebay #weekendgetaway @Gardens by the Bay http:// instagram.com/p/tuVcdJxl-u/,,@Gardens,#gardensbythebay #weekendgetaway,5.18317653636e+17,https://twitter.com/rcb_629/status/518317653635891200,gardens by the bay mrt station,gardens by the bay
mrlawrencesiao,2014-10-04 16:33:00,0.0,0.0,#lazy @McDonald's™ Kallang http:// instagram.com/p/tuVn47TMra/,,@McDonald,#lazy,5.18318047405e+17,https://twitter.com/mrlawrencesiao/status/518318047405166592,kallang mrt station,kallang
johnpatrickrod,2014-10-04 16:33:00,0.0,0.0,We're goin' home :) (@Singapore Changi Airport (SIN) - @fansofchangi in Singapore) https://www. swarmapp.com/c/6wx6OZpVOY3,,@Singapore @fansofchangi,,5.18318026606e+17,https://twitter.com/johnpatrickrod/status/518318026605592578,changi airport mrt station,changi airport
XuBin_BinGo,2014-10-04 16:33:00,9.0,22.0,"Thanks for coming down to Bedok Mall to support @Xubin_ . Remember to watch #118 fr 20/10, 7.30pm Mon to Fri :) pic.twitter.com/TJY9Bc44Zy",,@Xubin_,#118,5.18318066602e+17,https://twitter.com/XuBin_BinGo/status/518318066602479616,bedok mrt station,bedok
praiseKeana,2014-10-04 16:33:00,0.0,0.0,Bored here waiting at Tampines Macs. Gosh can skip the meeting? sleepy... pic.twitter.com/q0Ga8w01F1,,,,5.18317916446e+17,https://twitter.com/praiseKeana/status/518317916446400512,tampines mrt station,tampines
mejoguapo,2014-10-04 16:34:00,0.0,0.0,I'm at Singapore Changi Airport (SIN) - @fansofchangi in Singapore https://www. swarmapp.com/c/8pVT0DgqBTD,,@fansofchangi,,5.18318146215e+17,https://twitter.com/mejoguapo/status/518318146214952960,changi airport mrt station,changi airport
pahveetrah,2014-10-04 16:34:00,0.0,0.0,Tampines .,,,,5.18318287181e+17,https://twitter.com/pahveetrah/status/518318287180926976,tampines mrt station,tampines
iamjoycekole,2014-10-04 16:35:00,0.0,0.0,@AshriLicious Tampines !,,@AshriLicious,,5.18318503196e+17,https://twitter.com/iamjoycekole/status/518318503195992064,tampines mrt station,tampines
REIVAXKZZ_,2014-10-04 16:35:00,0.0,0.0,U stay near where? — I stay bukit panjang http:// ask.fm/a/bahb4j7l,,,,5.18318398947e+17,https://twitter.com/REIVAXKZZ_/status/518318398946967552,bukit panjang mrt station,bukit panjang
_meilinggz,2014-10-04 16:35:00,0.0,0.0,bedok 85 for dinner later,,,,5.18318556816e+17,https://twitter.com/_meilinggz/status/518318556815966208,bedok mrt station,bedok
insaneofzayn,2014-10-04 16:36:00,0.0,0.0,i have to be in toa payoh in 40 minutes oh,,,,5.18318622016e+17,https://twitter.com/insaneofzayn/status/518318622016430080,toa payoh mrt station,toa payoh
sherylbizarre,2014-10-04 16:37:00,0.0,0.0,@AINNPastrano nearest mrt is at tanjong pagar :) at 100 tras street!,,@AINNPastrano,,5.18318930851e+17,https://twitter.com/sherylbizarre/status/518318930851397632,tanjong pagar mrt station,tanjong pagar
Danndanz,2014-10-04 16:37:00,0.0,0.0,@Feedofeedofeedo aku now Kat yishun . Ada event kene buat. Lol tk Boleh skate. Kalau skate pon after 10 maybe,,@Feedofeedofeedo,,5.18318990121e+17,https://twitter.com/Danndanz/status/518318990121111552,yishun mrt station,yishun
Pxilopxobia,2014-10-04 16:37:00,0.0,1.0,""" @Danndanz : @Feedofeedofeedo aku now Kat yishun . Ada event kene buat. Lol tk Boleh skate. Kalau skate pon after 10 maybe"" aku ajak aidil",,@Danndanz @Feedofeedofeedo,,5.18319100335e+17,https://twitter.com/Pxilopxobia/status/518319100334841858,yishun mrt station,yishun
hypesg,2014-10-04 16:37:00,0.0,0.0,One of the few games you can play at Chunkfest! #coresg #hypesg @The Meadow Gardens By The Bay http:// instagram.com/p/tuWAssPK0g/,,@The,#coresg #hypesg,5.18318900577e+17,https://twitter.com/hypesg/status/518318900576940033,gardens by the bay mrt station,gardens by the bay
shaminlolz,2014-10-04 16:39:00,0.0,3.0,what is core – with @isabeltanyingxc (@Tampines Mall in Singapore) https://www. swarmapp.com/c/9bNYu2Efsw9 pic.twitter.com/pvG6SsAoVT,,@isabeltanyingxc @Tampines,,5.18319563093e+17,https://twitter.com/shaminlolz/status/518319563092811776,tampines mrt station,tampines
getzombiefied,2014-10-04 16:39:00,0.0,0.0,I'm at Toa Payoh Mall in Singapore https://www. swarmapp.com/c/hmZ9V90piC8,,,,5.18319492582e+17,https://twitter.com/getzombiefied/status/518319492582354944,toa payoh mrt station,toa payoh
Mingy_Ang,2014-10-04 16:40:00,0.0,0.0,"@JMaxTan 打bball 出气, 来明天8点来lorong chuan",,@JMaxTan,,5.18319747017e+17,https://twitter.com/Mingy_Ang/status/518319747016830976,lorong chuan mrt station,lorong chuan
Karankoutinho,2014-10-04 16:40:00,0.0,0.0,Match at kent ridge sec :),,,,5.1831975741e+17,https://twitter.com/Karankoutinho/status/518319757410324480,kent ridge mrt station,kent ridge
huipingx_,2014-10-04 16:43:00,0.0,0.0,otw to bukit batok,,,,5.18320535487e+17,https://twitter.com/huipingx_/status/518320535487262722,bukit batok mrt station,bukit batok
RM0_10,2014-10-04 16:44:00,0.0,0.0,"@hamdanalias83 kalau dah sampai grik, berhenti makan durian jela. Pastu sambung ke tanah merah terus. Pastu raya kat KB",,@hamdanalias83,,5.18320802836e+17,https://twitter.com/RM0_10/status/518320802836389889,tanah merah mrt station,tanah merah
izdihhhar_,2014-10-04 16:44:00,0.0,0.0,I was on my way to tampines when i had that devastating news :'(,,,,5.18320706405e+17,https://twitter.com/izdihhhar_/status/518320706405146624,tampines mrt station,tampines
AzriRdn,2014-10-04 16:45:00,0.0,0.0,going boonlay ..umah abg mok..lepas tu tkda plan..klau cha nak keluar baru keluar,,,,5.18320933728e+17,https://twitter.com/AzriRdn/status/518320933728055298,boon lay mrt station,boon lay
JESSICAYJ_,2014-10-04 16:45:00,0.0,0.0,I'm at Hougang Mall in Singapore https://www. swarmapp.com/c/hBek8J4H51F,,,,5.18321037114e+17,https://twitter.com/JESSICAYJ_/status/518321037113843712,hougang mrt station,hougang
tabsjusttabs,2014-10-04 16:46:00,0.0,0.0,And this is how we do it. Always a part of my life :) @Gardens By The Bay - The Meadows http:// instagram.com/p/tuXBysqlBl/,,@Gardens,,5.18321135743e+17,https://twitter.com/tabsjusttabs/status/518321135742910464,gardens by the bay mrt station,gardens by the bay
adxycia,2014-10-04 16:47:00,0.0,0.0,meeting bf at haw par villa ♡,,,,5.18321470079e+17,https://twitter.com/adxycia/status/518321470078869504,haw par villa mrt station,haw par villa
desireekoh13,2014-10-04 16:47:00,0.0,0.0,"@sumana_raja is going to this very cool #wedding under a #banyan #tree at #Kallang Riverside #Park ,… http:// instagram.com/p/tuXK-BNNfh/",,@sumana_raja,#wedding #banyan #tree #Kallang #Park,5.18321451008e+17,https://twitter.com/desireekoh13/status/518321451007746049,kallang mrt station,kallang
_meilinggz,2014-10-04 16:49:00,0.0,0.0,bedok 85 at night.,,,,5.18321902424e+17,https://twitter.com/_meilinggz/status/518321902423519232,bedok mrt station,bedok
PAM_NM,2014-10-04 16:49:00,0.0,0.0,#trafficNM JAKARTA BARAT: PAL Merah /Slipi-Petamburan- Tanah Abang,,,#trafficNM,5.18321976507e+17,https://twitter.com/PAM_NM/status/518321976507498496,tanah merah mrt station,tanah merah
apozgaming,2014-10-04 16:49:00,0.0,0.0,Going back to jakarta #singapore #garudaairlines #changiairport,,,#singapore #garudaairlines #changiairport,5.18322110667e+17,https://twitter.com/apozgaming/status/518322110666534912,changi airport mrt station,changi airport
TXiiaozh,2014-10-04 16:50:00,0.0,0.0,"""@paistulang_: Love lock at bishan https://twitter.com/paistulang_/status/518311407176019968/photo/1 pic.twitter.com/L2Jz7hKMwV ""someone should clean this. seriously",,@paistulang_,,5.18322181202e+17,https://twitter.com/TXiiaozh/status/518322181202116608,bishan mrt station,bishan
nurfaraahin_,2014-10-04 16:50:00,0.0,1.0,"Depa yg pijak tanah merah , aku yg kene kemas kereta . Ish , tak guna lahhh",,,,5.18322233925e+17,https://twitter.com/nurfaraahin_/status/518322233924546560,tanah merah mrt station,tanah merah
SGnews,2014-10-04 16:50:00,0.0,0.0,[TODAY] Certis Cisco police officer found dead at Changi Airport http:// bit.ly/1vvOqKS,,,,5.18322189352e+17,https://twitter.com/SGnews/status/518322189352042496,changi airport mrt station,changi airport
togusachan,2014-10-04 16:50:00,0.0,0.0,Just posted a video @Marina South Pier http:// instagram.com/p/tuXgbuBLBV/,,@Marina,,5.18322189012e+17,https://twitter.com/togusachan/status/518322189011918849,marina south pier mrt station,marina south pier
Monsterzsx,2014-10-04 16:50:00,0.0,0.0,@ariellee13 yesh u stay @hougang,,@ariellee13 @hougang,,5.18322339638e+17,https://twitter.com/Monsterzsx/status/518322339637764097,hougang mrt station,hougang
PapaJoshV,2014-10-04 16:51:00,0.0,0.0,here at singapore changi airport,,,,5.18322542428e+17,https://twitter.com/PapaJoshV/status/518322542428188672,changi airport mrt station,changi airport
dollonstrings7,2014-10-04 16:52:00,0.0,0.0,I finally visited! the gardens by the bay . *yawn* http:// instagram.com/p/tuXzEkOvz3/,,,,5.18322828761e+17,https://twitter.com/dollonstrings7/status/518322828761124864,gardens by the bay mrt station,gardens by the bay
monggmonggie,2014-10-04 16:52:00,0.0,0.0,@hanlin2002 omg. U at bedok mall??,,@hanlin2002,,5.18322795185e+17,https://twitter.com/monggmonggie/status/518322795185336320,bedok mrt station,bedok
TrekBlu,2014-10-04 16:52:00,0.0,0.0,Boring afternoon in Bishan City pic.twitter.com/HnRECmm0ku,,,,5.1832271218e+17,https://twitter.com/TrekBlu/status/518322712180031488,bishan mrt station,bishan
PhebeKwek,2014-10-04 16:54:00,0.0,0.0,I'm at Gardens By The Bay in Singapore https://www. swarmapp.com/c/g5jlv4hYY33,,,,5.18323383886e+17,https://twitter.com/PhebeKwek/status/518323383885651969,gardens by the bay mrt station,gardens by the bay
TODAYonline,2014-10-04 16:55:00,21.0,3.0,Certis Cisco police officer found dead at Changi Airport http:// tdy.sg/1xObrNQ,,,,5.18323622046e+17,https://twitter.com/TODAYonline/status/518323622046232576,changi airport mrt station,changi airport
jermrocktheboat,2014-10-04 16:56:00,0.0,0.0,"Bedok corner, it's been so long! http:// instagram.com/p/tuYRy_v3sq/",,,,5.18323884434e+17,https://twitter.com/jermrocktheboat/status/518323884433870848,bedok mrt station,bedok
ZINGOR,2014-10-04 16:57:00,0.0,0.0,"Just reported a hazard on Upp East Coast Rd, Bedok , http:// goo.gl/zpI1qf using @waze - Social GPS.",,@waze,,5.18324040785e+17,https://twitter.com/ZINGOR/status/518324040784941056,bedok mrt station,bedok
candytango,2014-10-04 16:59:00,0.0,1.0,I'm at Singapore Changi Airport (SIN) - @fansofchangi in Singapore https://www. swarmapp.com/c/eITAoBxwYFu,,@fansofchangi,,5.1832449075e+17,https://twitter.com/candytango/status/518324490749902848,changi airport mrt station,changi airport
KiyrthanHere,2014-10-04 17:00:00,0.0,0.0,@Vrindaaaa haven't yet reaching bishan now,,@Vrindaaaa,,5.18324667753e+17,https://twitter.com/KiyrthanHere/status/518324667753312256,bishan mrt station,bishan
_clarice92,2014-10-04 17:00:00,0.0,0.0,Flying off to BKK in a while~~ *time pass slowly when we are there please~* @Changi Airport Terminal 2 http:// instagram.com/p/tuYsewDY37/,,@Changi,,5.1832480156e+17,https://twitter.com/_clarice92/status/518324801560383488,changi airport mrt station,changi airport
erjhamanish,2014-10-04 17:01:00,0.0,0.0,Cycling at. Yishun park #Singapore @Yishun Safra Country Club http:// instagram.com/p/tuY0lZvGZt/,,@Yishun,#Singapore,5.18325079903e+17,https://twitter.com/erjhamanish/status/518325079902806017,yishun mrt station,yishun
KyanKoh,2014-10-04 17:01:00,0.0,0.0,Healthy Saturday @Yishun Gym.,,@Yishun,,5.18325020817e+17,https://twitter.com/KyanKoh/status/518325020817235970,yishun mrt station,yishun
ChapterXIl,2014-10-04 17:01:00,0.0,0.0,""" @TODAYonline : Certis Cisco police officer found dead at Changi Airport http:// tdy.sg/1xObrNQ "" Singapore still safe??",,@TODAYonline,,5.18324969496e+17,https://twitter.com/ChapterXIl/status/518324969495724034,changi airport mrt station,changi airport
amerulafis,2014-10-04 17:02:00,0.0,0.0,So tk jadi nak gi marsiling . Cook tmrw then,,,,5.18325177932e+17,https://twitter.com/amerulafis/status/518325177931665408,marsiling mrt station,marsiling
JCXX0609,2014-10-04 17:02:00,0.0,0.0,at toa payoh interchange?,,,,5.18325363249e+17,https://twitter.com/JCXX0609/status/518325363248623616,toa payoh mrt station,toa payoh
hshanSJ,2014-10-04 17:03:00,0.0,0.0,Damn jcube got tioheng siax .. no need to go buona vista liao,,,,5.18325484825e+17,https://twitter.com/hshanSJ/status/518325484824702976,buona vista mrt station,buona vista
757LiveSG,2014-10-04 17:05:00,0.0,0.0,#Certis Cisco police officer found dead at Changi Airport - TODAYonline http:// ift.tt/1EccnNx,,,#Certis,5.18326016956e+17,https://twitter.com/757LiveSG/status/518326016956456960,changi airport mrt station,changi airport
PegaKok,2014-10-04 17:05:00,0.0,0.0,Miniature clay serving as cookware in the afterlife • #BukitBrown #librarysg @Lee Kong Chian… http:// instagram.com/p/tuZSZ8Smp8/,,@Lee,#BukitBrown #librarysg,5.18326105418e+17,https://twitter.com/PegaKok/status/518326105418104832,bukit brown mrt station,bukit brown
rzny_,2014-10-04 17:06:00,0.0,0.0,Reaching pasir ris,,,,5.18326198389e+17,https://twitter.com/rzny_/status/518326198389063680,pasir ris mrt station,pasir ris
SingaporeAdv,2014-10-04 17:07:00,0.0,0.0,Certis Cisco police officer found dead at Changi Airport - TODAYonline http:// dlvr.it/75p0Hh,,,,5.18326584257e+17,https://twitter.com/SingaporeAdv/status/518326584256626689,changi airport mrt station,changi airport
