username,date,retweets,favorites,text,geo,mentions,hashtags,id,permalink,place,key
HWTours,2014-09-19 11:05:00,0.0,0.0,"3.Mustafa Center terletak di Syed Alwi Road, Little India . Jika naik MRT dr manapun di Singapura, tinggal turun di Stasiun MRT Little India",,,,5.12799700089e+17,https://twitter.com/HWTours/status/512799700089450497,little india mrt station,little india mrt
TodayIndiaJobs,2014-09-19 11:05:00,0.0,0.0,"#Customer Service Officer, Walking Distance from Raffles Place Data Entry Processing Application. Comfortable wi... http:// ift.tt/XPB6Gi",,,#Customer,5.12799615876e+17,https://twitter.com/TodayIndiaJobs/status/512799615876214788,raffles place mrt station,raffles place
Hansfcb,2014-09-19 11:06:00,0.0,0.0,@Oh_Aqilah haha cant blame you. Super hot. Woodlands and aljunied still heating up.,,@Oh_Aqilah,,5.12799746499e+17,https://twitter.com/Hansfcb/status/512799746499432448,aljunied mrt station,aljunied
LUshiteru,2014-09-19 11:06:00,0.0,0.0,@peekaboojae bishan leh miss clara,,@peekaboojae,,5.12799766448e+17,https://twitter.com/LUshiteru/status/512799766447534081,bishan mrt station,bishan
simei_774,2014-09-19 11:08:00,0.0,0.0,レトロでいいな、欲しい。,,,,5.12800424207e+17,https://twitter.com/simei_774/status/512800424206684161,simei mrt station,simei
akiddmarzel,2014-09-19 11:09:00,0.0,0.0,That was at bedok mall tho,,,,5.12800541794e+17,https://twitter.com/akiddmarzel/status/512800541794004992,bedok mrt station,bedok
nabeelaaah,2014-09-19 11:12:00,0.0,0.0,Outram park to pasir ris later zzzz,,,,5.12801366063e+17,https://twitter.com/nabeelaaah/status/512801366062804992,outram park mrt station,outram park
supaklailert,2014-09-19 11:12:00,0.0,0.0,I'm at Singapore Changi Airport (SIN)! http:// 4sq.com/8tpTpD,,,,5.12801440327e+17,https://twitter.com/supaklailert/status/512801440327155713,changi airport mrt station,changi airport
Fyrzxc,2014-09-19 11:14:00,0.0,0.0,@ShahrilL_ YISHUN !!!!!,,@ShahrilL_,,5.1280186797e+17,https://twitter.com/Fyrzxc/status/512801867969990656,yishun mrt station,yishun
punggollatest,2014-09-19 11:15:00,0.0,0.0,Good morning Punggol . It's finally FRIDAY. Have a great day ahead.,,,,5.1280218961e+17,https://twitter.com/punggollatest/status/512802189610188800,punggol mrt station,punggol
Matt_Shafiq,2014-09-19 11:15:00,0.0,1.0,Wahh its so crowded near the apple shop at bedok,,,,5.12802020408e+17,https://twitter.com/Matt_Shafiq/status/512802020407787520,bedok mrt station,bedok
Ruslan_Sgp,2014-09-19 11:15:00,0.0,0.0,"Is your mobile broadband slow, too in the last 2-3 weeks or it's just me? #StarHub #AngMoKio #CastleGreen",,,#StarHub #AngMoKio #CastleGreen,5.12802007305e+17,https://twitter.com/Ruslan_Sgp/status/512802007304765441,ang mo kio mrt station,ang mo kio
qxxncy_,2014-09-19 11:15:00,0.0,0.0,my sci practical at siglap sec where is that,,,,5.12802056181e+17,https://twitter.com/qxxncy_/status/512802056180994048,siglap mrt station,siglap
yazbanz,2014-09-19 11:17:00,0.0,0.0,@JakartaCasual I didn't bother to watch the first series in Hougang . Would I break the bank to fly to HK? 55555,,@JakartaCasual,,5.12802660391e+17,https://twitter.com/yazbanz/status/512802660391464960,hougang mrt station,hougang
BrianEmma2,2014-09-19 11:17:00,0.0,0.0,Outdoor outfield so as to kid over preschool punggol : OlFpjKfYS,,,,5.12802717623e+17,https://twitter.com/BrianEmma2/status/512802717622730753,punggol mrt station,punggol
Kelsibarka,2014-09-19 11:18:00,0.0,0.0,Ok i want to move to pasir ris,,,,5.1280294672e+17,https://twitter.com/Kelsibarka/status/512802946719838208,pasir ris mrt station,pasir ris
jackojeka,2014-09-19 11:18:00,0.0,0.0,Cb 700 jalan lain route. Fuck. Sekarang timbul kat tanjong pagar mrt. Fuck f1 man. Serious. Everywhere road close.,,,,5.12802973131e+17,https://twitter.com/jackojeka/status/512802973131345921,tanjong pagar mrt station,tanjong pagar
ruthskeens44,2014-09-19 11:18:00,0.0,0.0,WTB: High Price Iphone 6+ in Quantity Deal at Bukit Batok !!! http:// ift.tt/1ugsCCk,,,,5.12802870748e+17,https://twitter.com/ruthskeens44/status/512802870748401666,bukit batok mrt station,bukit batok
priscillaherrr,2014-09-19 11:19:00,0.0,0.0,@mingyou7313 simei one ah?,,@mingyou7313,,5.1280301611e+17,https://twitter.com/priscillaherrr/status/512803016110395393,simei mrt station,simei
shaunthatsheep,2014-09-19 11:19:00,0.0,1.0,Gardens by the Ba(e)y. @Gardens by the Bay http:// instagram.com/p/tHJvdki28J/,,@Gardens,,5.12803157861e+17,https://twitter.com/shaunthatsheep/status/512803157861072897,gardens by the bay mrt station,gardens by the bay
Dwikiharry,2014-09-19 11:20:00,0.0,0.0,@Gapernah_update: @DropOut_Venue I Vote @tanahmerah #Membakarbatas2014,,@Gapernah_update @DropOut_Venue @tanahmerah,#Membakarbatas2014,5.12803470203e+17,https://twitter.com/Dwikiharry/status/512803470202503168,tanah merah mrt station,tanah merah
mmm_bvvty,2014-09-19 11:21:00,0.0,0.0,Kimak i went out wearing my siglap sec p.e shirt abeh budak2 laki uppersec from opp my house nk step lambai senyum2 kat aku bila jln dpn aku,,,,5.12803714126e+17,https://twitter.com/mmm_bvvty/status/512803714126454784,siglap mrt station,siglap
yazbanz,2014-09-19 11:23:00,0.0,0.0,@JakartaCasual might as well for the October 14 extravaganza in new Kallang . Brazil vs Japan.. 555555,,@JakartaCasual,,5.12804034915e+17,https://twitter.com/yazbanz/status/512804034915217410,kallang mrt station,kallang
siddharthaaneja,2014-09-19 11:25:00,0.0,0.0,Massive Rome like structures at Stadium MRT #singapore pic.twitter.com/U7xLvqEEz5,,,#singapore,5.12804706021e+17,https://twitter.com/siddharthaaneja/status/512804706020622336,stadium mrt station,stadium mrt
faiqhayaza,2014-09-19 11:26:00,0.0,0.0,Worth it waiting for 10 hours in changi airport and being the 2nd buyer in singapore #iPhone6 … http:// instagram.com/p/tHKkGTLF8a/,,,#iPhone6,5.12804966172e+17,https://twitter.com/faiqhayaza/status/512804966172327937,changi airport mrt station,changi airport
azlanahmad,2014-09-19 11:29:00,0.0,0.0,Touchdown..! (@Singapore Changi Airport (SIN) - @fansofchangi in Singapore) https://www. swarmapp.com/azlanahmad/che ckin/541ba2fe498e03575f8f6824?s=UNffHtXyOcMwIFOC_tl0quXlRZE&ref=tw …,,@Singapore @fansofchangi,,5.12805540821e+17,https://twitter.com/azlanahmad/status/512805540821356546,changi airport mrt station,changi airport
Kyotachin,2014-09-19 11:30:00,0.0,0.0,@ValiantNeki kk I'll meet up with you at Bishan stn at 8.40 then if that's alright with you?,,@ValiantNeki,,5.12805983903e+17,https://twitter.com/Kyotachin/status/512805983903428608,bishan mrt station,bishan
dbsbank,2014-09-19 11:30:00,0.0,0.0,"@myriadz Hi, for lost DBS iB Secure Device, replacement fee is S$20. You may visit a DBS/POSB Branch except DBS Buona Vista & POSB (cont)",,@myriadz,,5.12805791913e+17,https://twitter.com/dbsbank/status/512805791913361408,buona vista mrt station,buona vista
iArchiee,2014-09-19 11:32:00,0.0,0.0,Heading to Yishun to my mum's place tonight.,,,,5.12806338322e+17,https://twitter.com/iArchiee/status/512806338322104320,yishun mrt station,yishun
Evaneyf,2014-09-19 11:33:00,0.0,0.0,@kyish Republic of Aljunied -Hougang-PunggolEast. #indyref #WPReferendum,,@kyish,#indyref #WPReferendum,5.12806718766e+17,https://twitter.com/Evaneyf/status/512806718766469120,aljunied mrt station,aljunied
FloatNSting,2014-09-19 11:34:00,1.0,0.0,@asaad1201 go bishan gym da . The crowd is all pretty girls there.. tryna do squats,,@asaad1201,,5.12806970525e+17,https://twitter.com/FloatNSting/status/512806970525380609,bishan mrt station,bishan
DeannaN_MTA,2014-09-19 11:34:00,0.0,0.0,Todays view @Novotel Singapore Clarke Quay http:// instagram.com/p/tHLdVOA2Zs/,,@Novotel,,5.12806932668e+17,https://twitter.com/DeannaN_MTA/status/512806932667592704,clarke quay mrt station,clarke quay
sha_naddya,2014-09-19 11:35:00,0.0,0.0,"Jejalan dulu — at Bandar Tanah Merah ,Kelantan http:// fb.me/6maQfVsSK",,,,5.12807099135e+17,https://twitter.com/sha_naddya/status/512807099135320064,tanah merah mrt station,tanah merah
master__O,2014-09-19 11:36:00,0.0,0.0,Goin to . Be safe everyone in Manila. @Dover MRT Station http:// instagram.com/p/tHLuCRRU8Y/,,@Dover,,5.12807506616e+17,https://twitter.com/master__O/status/512807506616131584,dover mrt station,dover mrt
tsuzureori,2014-09-19 11:36:00,0.0,0.0,これも可愛!(￣▽￣)b @Cloud Forest Dome At Gardens by the Bay http:// instagram.com/p/tHLrWhiv4m/,,@Cloud,,5.12807414551e+17,https://twitter.com/tsuzureori/status/512807414551154688,gardens by the bay mrt station,gardens by the bay
leeyaynaye,2014-09-19 11:36:00,0.0,3.0,First to reach Woodlands even though i live all the way in Pasir Ris do i get an award guys @jolinisme @akeeeee_ @lazypig000,,@jolinisme @akeeeee_ @lazypig000,,5.12807370914e+17,https://twitter.com/leeyaynaye/status/512807370913611776,pasir ris mrt station,pasir ris
scoo_ps,2014-09-19 11:37:00,0.0,0.0,(sna) PAP's two-time loser Desmond Choo seeking for his fortune at Tampines GRC on next GE http:// scoo.ps/1ripfMN,,,,5.12807563503e+17,https://twitter.com/scoo_ps/status/512807563503497216,tampines mrt station,tampines
newsSG,2014-09-19 11:37:00,0.0,0.0,(sna) PAP's two-time loser Desmond Choo seeking for his fortune at Tampines GRC on next GE http:// scoo.ps/1ripfMN,,,,5.12807575474e+17,https://twitter.com/newsSG/status/512807575474028544,tampines mrt station,tampines
scoopsg,2014-09-19 11:37:00,0.0,0.0,(sna) PAP's two-time loser Desmond Choo seeking for his fortune at Tampines GRC on next GE http:// scoo.ps/1ripfMN,,,,5.12807563789e+17,https://twitter.com/scoopsg/status/512807563788681216,tampines mrt station,tampines
FloatNSting,2014-09-19 11:38:00,1.0,0.0,@asaad1201 Haahaha! Kidding.. just go bishan . Very motivating,,@asaad1201,,5.12807957374e+17,https://twitter.com/FloatNSting/status/512807957373800450,bishan mrt station,bishan
YeoZongHaan,2014-09-19 11:38:00,0.0,0.0,I'm at Bishan - Ang Mo Kio Park in Singapore https://www. swarmapp.com/yeozonghaan/ch eckin/541ba537498ed6a734c7d122?s=_v6SYIyT8HLH9IVTNxjnaavCnCw&ref=tw …,,,,5.12807926311e+17,https://twitter.com/YeoZongHaan/status/512807926310772737,ang mo kio mrt station,ang mo kio
HOHOHOWEI,2014-09-19 11:38:00,0.0,0.0,I'm at Hougang Mall in Singapore https://www. swarmapp.com/hohohowei/chec kin/541ba544498ebce1339c763a?s=Fb1VuHdOEUy6Xu8EVi_6L9Bl3xQ&ref=tw …,,,,5.12807982208e+17,https://twitter.com/HOHOHOWEI/status/512807982208278529,hougang mrt station,hougang
Ugeddd,2014-09-19 11:40:00,0.0,0.0,"Fine evening in Clarke Quay , 3 years ago http:// instagram.com/p/tHMF7ihGZQ/",,,,5.12808327878e+17,https://twitter.com/Ugeddd/status/512808327877636096,clarke quay mrt station,clarke quay
yazbanz,2014-09-19 11:40:00,0.0,0.0,"Certainly NO players from Home, Balestier and Tampines will be going due to Singapore Cup next weekdays. More from Warriors then.",,,,5.12808390931e+17,https://twitter.com/yazbanz/status/512808390930599936,tampines mrt station,tampines
SGManyTutors,2014-09-19 11:41:00,0.0,0.0,"P1 Tamil - Hougang , Near Kovan MRT: by JT1234 (Posted Fri Sep 19, 2014 11:07 am)assignment availableRead Main Topic http:// bit.ly/1syB5yE",,,,5.12808644749e+17,https://twitter.com/SGManyTutors/status/512808644748914689,hougang mrt station,hougang
hafizrazmusic,2014-09-19 11:42:00,0.0,0.0,@GermaineCYS bedok mall! Whyy you wanna buy clothes and get discount right?! Hahahahha,,@GermaineCYS,,5.12808891164e+17,https://twitter.com/hafizrazmusic/status/512808891164282880,bedok mrt station,bedok
iamwillytan,2014-09-19 11:43:00,0.0,0.0,@AuraShai I was told that you can find that at the mamak at Aljunied MRT station. But when the staff didn’t understand my order…,,@AuraShai,,5.12809107934e+17,https://twitter.com/iamwillytan/status/512809107934294016,aljunied mrt station,aljunied
dashingmonda52,2014-09-19 11:44:00,0.0,0.0,Aslam Alkam Good Mrng n subho bakhar frnds heav a nyc day mri zat zra-a- bishan http:// fb.me/1BloiYlt6,,,,5.12809499988e+17,https://twitter.com/dashingmonda52/status/512809499988475904,bishan mrt station,bishan
markbuntzen,2014-09-19 11:46:00,0.0,0.0,Highly recommend William Kentridge exhibition @CityGalleryWgtn what an amazing man. pic.twitter.com/axuarFq2fg,,@CityGalleryWgtn,,5.12809853476e+17,https://twitter.com/markbuntzen/status/512809853476020224,kent ridge mrt station,kent ridge
johan_sarah,2014-09-19 11:47:00,1.0,1.0,KLIA is too big to ignore. traffic numbers will probably be equal to Singapore’s Changi Airport by year-end http://www. kwiknews.my/news/british-a irways-returns … wow!,,,,5.12810232075e+17,https://twitter.com/johan_sarah/status/512810232074891264,changi airport mrt station,changi airport
amiraldia,2014-09-19 11:47:00,0.0,0.0,With @greensashaa at Tanah Merah Ferry Terminal — https:// path.com/p/mIOBo,,@greensashaa,,5.12810279328e+17,https://twitter.com/amiraldia/status/512810279327899648,tanah merah mrt station,tanah merah
W_eiYi,2014-09-19 11:48:00,0.0,0.0,Les Patisseries – Bakery Cafe Is One Bright Spark At Toa Payoh http:// ift.tt/1miOrT2,,,,5.1281046243e+17,https://twitter.com/W_eiYi/status/512810462430240770,toa payoh mrt station,toa payoh
mattmarcjacobs,2014-09-19 11:48:00,0.0,0.0,As a first time when I went to bedok gymboxx. This branch pretty cozy and empty. Quite shiok,,,,5.12810337025e+17,https://twitter.com/mattmarcjacobs/status/512810337024757760,bedok mrt station,bedok
GartnerGarden,2014-09-19 11:48:00,0.0,0.0,Tanjong Rhu Singapore http:// dld.bz/deTmw #singapore pic.twitter.com/XG21udxNxL,,,#singapore,5.12810429606e+17,https://twitter.com/GartnerGarden/status/512810429605625856,tanjong rhu mrt station,tanjong rhu
karenngml,2014-09-19 11:49:00,0.0,0.0,Woke up with a lion's mane.. Time to tame the crowning glory @Dolly's Secret @One-North Residences http:// instagram.com/p/tHNISnHEf0/,,@Dolly @One,,5.12810607721e+17,https://twitter.com/karenngml/status/512810607720943616,one-north mrt station,one-north
salihin_rafael,2014-09-19 11:49:00,0.0,0.0,from pasir ris to amk also leceh,,,,5.1281077418e+17,https://twitter.com/salihin_rafael/status/512810774180286465,pasir ris mrt station,pasir ris
insanevanity_,2014-09-19 11:50:00,0.0,1.0,bedok to boon lay eh..,,,,5.12810900391e+17,https://twitter.com/insanevanity_/status/512810900391096320,bedok mrt station,bedok
dabianfoo,2014-09-19 11:50:00,0.0,0.0,Omg to hougang stadium gym,,,,5.12810869261e+17,https://twitter.com/dabianfoo/status/512810869260972032,hougang mrt station,hougang
GVMovieClub,2014-09-19 11:50:00,0.0,0.0,Our Surprise Screening of a HORROR MOVIE is back @GV Yishun on 22 Sep! Be adventurous! tix: http:// goo.gl/6VajJi ! pic.twitter.com/CaScIQKkI4,,@GV,,5.12810930418e+17,https://twitter.com/GVMovieClub/status/512810930418118656,yishun mrt station,yishun
LTAsg,2014-09-19 11:50:00,2.0,0.0,Accident on TPE (towards SLE) after Punggol Rd Exit. Avoid lane 1,,,,5.12810844414e+17,https://twitter.com/LTAsg/status/512810844413911041,punggol mrt station,punggol
LTAsg,2014-09-19 11:51:00,0.0,0.0,Accident on TPE (towards SLE) after Punggol Rd Exit with congestion till Punggol Rd Exit. Avoid lane 1,,,,5.12811272392e+17,https://twitter.com/LTAsg/status/512811272392302592,punggol mrt station,punggol
leethelily,2014-09-19 11:52:00,0.0,0.0,Wtf. Did i just see someone jump into the kallang river? But he disappeared. Holyshit.,,,,5.12811421143e+17,https://twitter.com/leethelily/status/512811421143269377,kallang mrt station,kallang
TodayIndiaJobs,2014-09-19 11:52:00,0.0,0.0,"#Retail Packer, 3 – 13 Oct 14, Toa Payoh Working Location: Toa Payoh Duration: 3 – 13 Oct, must able to commit S... http:// ift.tt/XPOslK",,,#Retail,5.12811395516e+17,https://twitter.com/TodayIndiaJobs/status/512811395516071936,toa payoh mrt station,toa payoh
news_singapore,2014-09-19 11:53:00,0.0,0.0,(SgNA) PAP's two-time loser Desmond Choo seeking his fortune at Tampines GRC for next GE http:// dlvr.it/6xvwWz,,,,5.12811589188e+17,https://twitter.com/news_singapore/status/512811589188059138,tampines mrt station,tampines
BarneyBlues,2014-09-19 11:53:00,0.0,0.0,Waiting for bus. (@Bus Stop 75059 (SAFRA Tampines ) in Singapore) https://www. swarmapp.com/barneyblues/ch eckin/541ba8b3498eb0ce2d22e71b?s=Z1NWjhTQByRBDEky86gWNLZYG1E&ref=tw …,,@Bus,,5.12811667508e+17,https://twitter.com/BarneyBlues/status/512811667508305921,tampines mrt station,tampines
UnLovelivers,2014-09-19 11:53:00,0.0,0.0,From Manila Bay i take a nearest MRT station at EDSA to my Hotel for 2nd night near the Stadium pic.twitter.com/ANZYcrRyUd,,,,5.12811796789e+17,https://twitter.com/UnLovelivers/status/512811796789338113,stadium mrt station,stadium mrt
tetsufung,2014-09-19 11:53:00,0.0,0.0,無人駕駛 @Bishan Circle Line MRT Station http:// instagram.com/p/tHNnH4p8Qa/,,@Bishan,,5.12811667357e+17,https://twitter.com/tetsufung/status/512811667357331456,bishan mrt station,bishan
LTAsg,2014-09-19 11:54:00,0.0,0.0,Accident on TPE (towards SLE) after Punggol Rd Exit with congestion till Punggol Rd Exit. Avoid lanes 1 and 2,,,,5.12811910342e+17,https://twitter.com/LTAsg/status/512811910341734402,punggol mrt station,punggol
Y_anling,2014-09-19 11:54:00,0.0,0.0,Les Patisseries – Bakery Cafe Is One Bright Spark At Toa Payoh http:// ift.tt/1miOrT2,,,,5.12811869632e+17,https://twitter.com/Y_anling/status/512811869631836161,toa payoh mrt station,toa payoh
DeanBoyBoy,2014-09-19 11:55:00,0.0,0.0,Les Patisseries – Bakery Cafe Is One Bright Spark At Toa Payoh http:// ift.tt/1miOrT2,,,,5.12812266153e+17,https://twitter.com/DeanBoyBoy/status/512812266152939520,toa payoh mrt station,toa payoh
hashtagreshnu,2014-09-19 11:55:00,0.0,0.0,@Narmax_Lah 2pm bukitbatok,,@Narmax_Lah,,5.12812089292e+17,https://twitter.com/hashtagreshnu/status/512812089291726848,bukit batok mrt station,bukit batok
JasonLiew,2014-09-19 11:56:00,0.0,0.0,<ADV: Sale in Yishun by http://www. singaporepropertyagent.sg > Blk 805 4RM 84sqm for sale in Yishun ! Asking price $390K... http:// fb.me/3Yc7mpgcV,,,,5.12812498165e+17,https://twitter.com/JasonLiew/status/512812498165063680,yishun mrt station,yishun
FarzBoy,2014-09-19 11:56:00,0.0,0.0,Les Patisseries – Bakery Cafe Is One Bright Spark At Toa Payoh http:// ift.tt/1miOrT2,,,,5.12812504809e+17,https://twitter.com/FarzBoy/status/512812504808841216,toa payoh mrt station,toa payoh
MalindaCrellin,2014-09-19 11:56:00,0.0,0.0,Les Patisseries – Bakery Cafe Is One Bright Spark At Toa Payoh http:// ift.tt/1miOrT2,,,,5.12812367336e+17,https://twitter.com/MalindaCrellin/status/512812367336321025,toa payoh mrt station,toa payoh
Si_Mei85,2014-09-19 11:57:00,0.0,0.0,Les Patisseries – Bakery Cafe Is One Bright Spark At Toa Payoh http:// ift.tt/1miOrT2,,,,5.12812808476e+17,https://twitter.com/Si_Mei85/status/512812808476426240,toa payoh mrt station,toa payoh
D_ellaChan,2014-09-19 11:57:00,0.0,0.0,Les Patisseries – Bakery Cafe Is One Bright Spark At Toa Payoh http:// ift.tt/1miOrT2,,,,5.12812813212e+17,https://twitter.com/D_ellaChan/status/512812813211815937,toa payoh mrt station,toa payoh
AjithVerma,2014-09-19 11:57:00,0.0,0.0,Les Patisseries – Bakery Cafe Is One Bright Spark At Toa Payoh http:// ift.tt/1miOrT2,,,,5.1281282056e+17,https://twitter.com/AjithVerma/status/512812820560236545,toa payoh mrt station,toa payoh
WeiYen85,2014-09-19 11:57:00,0.0,0.0,Les Patisseries – Bakery Cafe Is One Bright Spark At Toa Payoh http:// ift.tt/1miOrT2,,,,5.12812604814e+17,https://twitter.com/WeiYen85/status/512812604813615104,toa payoh mrt station,toa payoh
JohnSowders,2014-09-19 11:57:00,0.0,0.0,Les Patisseries – Bakery Cafe Is One Bright Spark At Toa Payoh http:// ift.tt/1miOrT2,,,,5.12812801594e+17,https://twitter.com/JohnSowders/status/512812801593577472,toa payoh mrt station,toa payoh
E_thelChua,2014-09-19 11:57:00,0.0,0.0,Les Patisseries – Bakery Cafe Is One Bright Spark At Toa Payoh http:// ift.tt/1miOrT2,,,,5.12812816987e+17,https://twitter.com/E_thelChua/status/512812816986681344,toa payoh mrt station,toa payoh
F_aithNg,2014-09-19 11:57:00,0.0,0.0,Les Patisseries – Bakery Cafe Is One Bright Spark At Toa Payoh http:// ift.tt/1miOrT2,,,,5.12812813199e+17,https://twitter.com/F_aithNg/status/512812813199228928,toa payoh mrt station,toa payoh
JacVandelous,2014-09-19 11:57:00,0.0,0.0,@R_3_M_Y are you at Bishan MRT or did I recognise the wrong person Lol,,@R_3_M_Y,,5.12812726075e+17,https://twitter.com/JacVandelous/status/512812726075138049,bishan mrt station,bishan
SilverArrowsHAM,2014-09-19 11:57:00,0.0,1.0,@helenstone11 @MissusWebb Sounds like a great idea! :) We could meet Andy and Sarah then all get the MRT to Marina Bay & meet you there?,,@helenstone11 @MissusWebb,,5.12812798687e+17,https://twitter.com/SilverArrowsHAM/status/512812798686920704,marina bay mrt station,marina bay mrt
M_ichellePau,2014-09-19 11:58:00,0.0,0.0,Les Patisseries – Bakery Cafe Is One Bright Spark At Toa Payoh http:// ift.tt/1miOrT2,,,,5.12812834414e+17,https://twitter.com/M_ichellePau/status/512812834414002176,toa payoh mrt station,toa payoh
D_anMan,2014-09-19 11:58:00,0.0,0.0,Les Patisseries – Bakery Cafe Is One Bright Spark At Toa Payoh http:// ift.tt/1miOrT2,,,,5.12812830417e+17,https://twitter.com/D_anMan/status/512812830416830464,toa payoh mrt station,toa payoh
NatTeoYA,2014-09-19 11:59:00,0.0,1.0,"""From the Inside out & With Everything - Live in Miami"" One track playing from Simei all the way to City Hall. 19mins of pure awesome.",,,,5.12813253316e+17,https://twitter.com/NatTeoYA/status/512813253315919872,simei mrt station,simei
smartfrencare,2014-09-19 11:59:00,0.0,0.0,"@Antonio_YoelAYR 2. nama jalan besar menuju lokasi, jumlah signal, tgl terjadi & no alternatif ya. Tks.)",,@Antonio_YoelAYR,,5.12813304847e+17,https://twitter.com/smartfrencare/status/512813304847147008,jalan besar mrt station,jalan besar
evonnieworld,2014-09-19 11:59:00,0.0,0.0,Back in Singapore!! Our first lunch at Ssik Sin @Bedok Point :) @Ssik Sin Korean Grill Bbq Buffet at… http:// instagram.com/p/tHOQbyL0Fu/,,@Bedok @Ssik,,5.12813086622e+17,https://twitter.com/evonnieworld/status/512813086621700096,bedok mrt station,bedok
pnatjo,2014-09-19 12:00:00,0.0,0.0,I'm at One Raffles Place in Singapore w/ @duckyqueck https://www. swarmapp.com/dearjacq/check in/541baa4c498ec72aea09dc06?s=1LJsqGasfSdVQ3a9P-AyePnQThU&ref=tw …,,@duckyqueck,,5.12813383222e+17,https://twitter.com/pnatjo/status/512813383221903360,raffles place mrt station,raffles place
JasonLiew,2014-09-19 12:00:00,0.0,0.0,"Looking for a unit just mins walk to Khatib MRT ? Blk 805 4rm unit for sale. High floor, no west sun. Ask $399K... http:// fb.me/3bOLWoVcd",,,,5.12813473253e+17,https://twitter.com/JasonLiew/status/512813473252655105,khatib mrt station,khatib mrt
photin18,2014-09-19 12:01:00,0.0,0.0,"@vanetttta @ciarakoko it's already a tragedy for someone like me who comes from the east, but not as east as pasir ris",,@vanetttta @ciarakoko,,5.12813815936e+17,https://twitter.com/photin18/status/512813815935692800,pasir ris mrt station,pasir ris
lonecxnt,2014-09-19 12:02:00,0.0,0.0,I'm at Jurong East MRT Interchange (NS1/EW24) - @smrt_singapore in Singapore https://www. swarmapp.com/_littleboi_/ch eckin/541baaef498e3543ca514f27?s=WsIH1LWf7nDarJtk9Hs30CXGghs&ref=tw …,,@smrt_singapore,,5.12814066201e+17,https://twitter.com/lonecxnt/status/512814066201419776,jurong east mrt station,jurong east
mrbrown,2014-09-19 12:02:00,95.0,39.0,Glasgow is the Aljunied GRC of Scotland. #ScotlandDecides,,,#ScotlandDecides,5.12813957451e+17,https://twitter.com/mrbrown/status/512813957451481088,aljunied mrt station,aljunied
DanielFoodDiary,2014-09-19 12:03:00,1.0,0.0,Les Patisseries – Bakery Cafe Is One Bright Spark At Toa Payoh http:// ift.tt/1miOrT2 #sgfood,,,#sgfood,5.12814145872e+17,https://twitter.com/DanielFoodDiary/status/512814145872207872,toa payoh mrt station,toa payoh
fiqahsyaafiqah,2014-09-19 12:03:00,0.0,0.0,going changi airport to studyyy later on,,,,5.12814226889e+17,https://twitter.com/fiqahsyaafiqah/status/512814226889392129,changi airport mrt station,changi airport
mycommspace,2014-09-19 12:06:00,0.0,0.0,"#Rent - new #Office 1200sf near #macpherson mrt , aircon/ false ceiling/flooring, attached toilet, gd corp image,$neg, #Singapore #property",,,#Rent #Office #macpherson #Singapore #property,5.12815048226e+17,https://twitter.com/mycommspace/status/512815048226398211,macpherson mrt station,macpherson mrt
utasHM,2014-09-19 12:06:00,0.0,0.0,I'm at Novotel Clarke Quay - @novotelsg in Singapore https://www. swarmapp.com/utashm/checkin /541babd2498ecfe5519ad42c?s=-z8zgQ0SzAkYCB2Xq2wSI6PQvmo&ref=tw …,,@novotelsg,,5.12815016828e+17,https://twitter.com/utasHM/status/512815016827813888,clarke quay mrt station,clarke quay
stompsingapore,2014-09-19 12:06:00,16.0,3.0,Police called in to Tampines Mall and 112 Katong -- after arguments over iPhone 6 queues http:// goo.gl/THjSOA pic.twitter.com/1ODgW553pD,,,,5.12814861811e+17,https://twitter.com/stompsingapore/status/512814861810556929,tampines mrt station,tampines
SusanWong71,2014-09-19 12:08:00,0.0,0.0,"iPhone craze at Tampines Mall. For heaven's sake I am not in the queue, obasan simply on her way to NTUC — feeling amused",,,,5.1281540751e+17,https://twitter.com/SusanWong71/status/512815407510474753,tampines mrt station,tampines
yellowrong,2014-09-19 12:08:00,0.0,0.0,LOL “ @mrbrown : Glasgow is the Aljunied GRC of Scotland. #ScotlandDecides ”,,@mrbrown,#ScotlandDecides,5.12815480642e+17,https://twitter.com/yellowrong/status/512815480642351104,aljunied mrt station,aljunied
riyriylee,2014-09-19 12:09:00,0.0,1.0,Towards sembawang,,,,5.12815693675e+17,https://twitter.com/riyriylee/status/512815693675241472,sembawang mrt station,sembawang
Khairul__asyari,2014-09-19 12:09:00,0.0,0.0,Been awhile since i last came to tampines .,,,,5.12815738546e+17,https://twitter.com/Khairul__asyari/status/512815738545897473,tampines mrt station,tampines
mrbrown,2014-09-19 12:09:00,1.0,0.0,@allthemaths Or Punggol .,,@allthemaths,,5.12815692568e+17,https://twitter.com/mrbrown/status/512815692567957505,punggol mrt station,punggol
