username,date,retweets,favorites,text,geo,mentions,hashtags,id,permalink,place,key
tana_poso,2014-11-08 19:48:00,0.0,1.0,"Hot berarti yah @OblongBogor: Sejenis Cabe merah min..hehe""@tanah _poso: Pacar itu apa? @OblongBogor",,@OblongBogor @tanah @OblongBogor,,5.31050638e+17,https://twitter.com/tana_poso/status/531050638000402432,tanah merah mrt station,tanah merah
eXeQzaLie,2014-11-08 19:48:00,0.0,0.0,At Gardens By The Bay [pic] — https:// path.com/p/29fyk9,,,,5.31050722969e+17,https://twitter.com/eXeQzaLie/status/531050722968629248,gardens by the bay mrt station,gardens by the bay
CalistaWillis_,2014-11-08 19:48:00,0.0,0.0,"To go to bedok just for pizza sushi and gong cha , or to just stay home and have macs",,,,5.31050704824e+17,https://twitter.com/CalistaWillis_/status/531050704824053760,bedok mrt station,bedok
DelphinaSmexy_,2014-11-08 19:49:00,0.0,0.0,I'm at Singapore Changi Airport (SIN) - @fansofchangi in Singapore https://www. swarmapp.com/c/25MgfH5zziC,,@fansofchangi,,5.31050832205e+17,https://twitter.com/DelphinaSmexy_/status/531050832205459456,changi airport mrt station,changi airport
blurmeiling,2014-11-08 19:50:00,0.0,0.0,"My satdate with my ""mummy"" whn for thejoytruck event at bishan park. #thejoytruck #mummy &daughtertime… http:// instagram.com/p/vIz-ksg0Dc/",,,#thejoytruck #mummy,5.3105117087e+17,https://twitter.com/blurmeiling/status/531051170870329344,bishan mrt station,bishan
HXYE_,2014-11-08 19:51:00,0.0,0.0,"@TeckchinZ next time you come Clarke quay kimak every 3-5 mins some bad ass car goes by , saw a Maserati , a p1 , a fking mustang also",,@TeckchinZ,,5.31051320825e+17,https://twitter.com/HXYE_/status/531051320824696832,clarke quay mrt station,clarke quay
lwkyssnsf,2014-11-08 19:52:00,0.0,0.0,@justchangming yishun,,@justchangming,,5.31051733578e+17,https://twitter.com/lwkyssnsf/status/531051733577764865,yishun mrt station,yishun
DarwisAshraf,2014-11-08 19:52:00,0.0,0.0,Family gathering @Yishun Safra pic.twitter.com/N9Q8rmp02K,,@Yishun,,5.31051587658e+17,https://twitter.com/DarwisAshraf/status/531051587657953280,yishun mrt station,yishun
DDDesmondy,2014-11-08 19:53:00,0.0,0.0,Heading to Tampines,,,,5.31051868018e+17,https://twitter.com/DDDesmondy/status/531051868017799168,tampines mrt station,tampines
syaemokidd,2014-11-08 19:53:00,0.0,0.0,Going simpang bedok with le family.,,,,5.3105181504e+17,https://twitter.com/syaemokidd/status/531051815039533056,bedok mrt station,bedok
tuanflurry,2014-11-08 19:53:00,0.0,1.0,but anyways HI IM OUTSIDE IN FACT IM IN DHOBY GHAUT LOL,,,,5.31051813672e+17,https://twitter.com/tuanflurry/status/531051813672194050,dhoby ghaut mrt station,dhoby ghaut
ChenShowMao,2014-11-08 19:53:00,1.0,0.0,Happy wishes of Thithikkum Deepavali for 2014 from Aljunied GRC ! http:// fb.me/3p6uU3RRL,,,,5.31051771444e+17,https://twitter.com/ChenShowMao/status/531051771444363264,aljunied mrt station,aljunied
Mxn_Nxmxy,2014-11-08 19:53:00,0.0,0.0,"@amxraurxra working at Cuba Libre, clarke quay ..",,@amxraurxra,,5.31051909948e+17,https://twitter.com/Mxn_Nxmxy/status/531051909948264449,clarke quay mrt station,clarke quay
SudismanAnjan,2014-11-08 19:54:00,0.0,0.0,akhirny hujan pun tiba membasahi ibu pertiwi tanah air beta tumpah darah kita..sang saka merah putih di tarik... http:// fb.me/3EpYW7qcG,,,,5.31052122667e+17,https://twitter.com/SudismanAnjan/status/531052122666962944,tanah merah mrt station,tanah merah
SnarkyPlatypus,2014-11-08 19:55:00,0.0,1.0,The Singapore Eye (not its official name) @Gardens by the Bay http:// instagram.com/p/vI0hOni2oS/,,@Gardens,,5.31052361415e+17,https://twitter.com/SnarkyPlatypus/status/531052361415135233,gardens by the bay mrt station,gardens by the bay
jovannn_,2014-11-08 19:55:00,0.0,0.0,Going bedok mall after cycling. MAC TIME,,,,5.31052494898e+17,https://twitter.com/jovannn_/status/531052494898466817,bedok mrt station,bedok
vanitychildd,2014-11-08 19:55:00,0.0,0.0,I'm at Toa Payoh in Singapore https://www. swarmapp.com/c/1XyAR9qyYR6,,,,5.31052426351e+17,https://twitter.com/vanitychildd/status/531052426351378432,toa payoh mrt station,toa payoh
tana_poso,2014-11-08 19:56:00,0.0,0.0,"Lg nunggu bookingan haha ""@OblongBogor: Bangeet,mimin nggk malming""@tanah _poso: Hot berarti yah @OblongBogor: Sejenis Cabe merah min..hehe""",,@OblongBogor @tanah @OblongBogor,,5.31052643608e+17,https://twitter.com/tana_poso/status/531052643607539714,tanah merah mrt station,tanah merah
shaaafiqq_,2014-11-08 19:56:00,0.0,0.0,Simpang Bedok again,,,,5.31052731608e+17,https://twitter.com/shaaafiqq_/status/531052731608215552,bedok mrt station,bedok
GIANT61BABY,2014-11-08 19:57:00,0.0,0.0,we passed!!!! #100happydays #ricshappydays #day15 @hougang sec http:// instagram.com/p/vI0yIioBWA/,,@hougang,#100happydays #ricshappydays #day15,5.31052943815e+17,https://twitter.com/GIANT61BABY/status/531052943814840321,hougang mrt station,hougang
Fab_PAP,2014-11-08 19:57:00,0.0,0.0,"Huat Ah, from surplus to deficit in 2 years!!. WP took over Aljunied with a surplus of $3.3 million from George... http:// fb.me/3qtkbs7nZ",,,,5.31052830715e+17,https://twitter.com/Fab_PAP/status/531052830715412480,aljunied mrt station,aljunied
aimeemoon_08,2014-11-08 19:58:00,0.0,0.0,Touchdown #Singapore #AimsSGdiaries :) @Golden Village @Yishun http:// instagram.com/p/vI00WVmeyK/,,@Golden @Yishun,#Singapore #AimsSGdiaries,5.31053019543e+17,https://twitter.com/aimeemoon_08/status/531053019542978560,yishun mrt station,yishun
InnocentlyM3,2014-11-08 19:58:00,0.0,0.0,@limzijian bedok hahahaha,,@limzijian,,5.31053183393e+17,https://twitter.com/InnocentlyM3/status/531053183393488896,bedok mrt station,bedok
SnarkyPlatypus,2014-11-08 19:58:00,0.0,0.0,Some fancy light show in the alien forest @Gardens by the Bay http:// instagram.com/p/vI05XgC2pz/,,@Gardens,,5.31053191656e+17,https://twitter.com/SnarkyPlatypus/status/531053191656267779,gardens by the bay mrt station,gardens by the bay
zullitrulli,2014-11-08 19:58:00,0.0,0.0,@patZAItrick Yess!! Boon Lay .. Blk 176.. Kau nk number die?,,@patZAItrick,,5.31053112661e+17,https://twitter.com/zullitrulli/status/531053112660729857,boon lay mrt station,boon lay
ucancallmerissa,2014-11-08 19:58:00,0.0,1.0,"Oh yeah baby!!! Pork BBQ!!! @Grandeur 8 Condo, Ang Mo Kio Central http:// instagram.com/p/vI06iFwekd/",,@Grandeur,,5.31053231796e+17,https://twitter.com/ucancallmerissa/status/531053231795744768,ang mo kio mrt station,ang mo kio
JeffreyBoomz,2014-11-08 19:59:00,0.0,0.0,I'm at Toa Payoh Central in Singapore https://www. swarmapp.com/c/fYNJadRdWvP,,,,5.31053478937e+17,https://twitter.com/JeffreyBoomz/status/531053478937104384,toa payoh mrt station,toa payoh
syznsayyn,2014-11-08 19:59:00,0.0,0.0,Kuyuuuu je mata dia hais dah lah eksyen ngan aku mentang2 aku dah lama tak balik punggol pic.twitter.com/VYW51Xtpys,,,,5.31053430295e+17,https://twitter.com/syznsayyn/status/531053430295371776,punggol mrt station,punggol
XxCalibrexX,2014-11-08 19:59:00,0.0,0.0,Apparently the CEO of changi airport is coming back. So my dad has to arrange his transport. Lol,,,,5.31053466622e+17,https://twitter.com/XxCalibrexX/status/531053466622246914,changi airport mrt station,changi airport
iyliaaa,2014-11-08 20:00:00,0.0,0.0,taking circle line home from kallang . i will def reach home at 9.,,,,5.31053755983e+17,https://twitter.com/iyliaaa/status/531053755983097857,kallang mrt station,kallang
jordancjq,2014-11-08 20:00:00,0.0,0.0,Met so many people at tampines mall. Such a coincidence.,,,,5.31053591734e+17,https://twitter.com/jordancjq/status/531053591734153217,tampines mrt station,tampines
enzoticaaa,2014-11-08 20:00:00,0.0,0.0,@Sgboy01 dont think have night rider frm Hume Avenue to Punggol .,,@Sgboy01,,5.31053693442e+17,https://twitter.com/enzoticaaa/status/531053693441826818,punggol mrt station,punggol
TPConfessions,2014-11-08 20:00:00,7.0,2.0,"Ever since the last shuttle at bedok was shortened to 8:15am, I always arrive late for class -.- #tpconfessions",,,#tpconfessions,5.31053670743e+17,https://twitter.com/TPConfessions/status/531053670742654976,bedok mrt station,bedok
HotelJenOG,2014-11-08 20:00:00,1.0,1.0,Don't forget to drop by Changi Airport tomorrow as our Jen ambassadors brighten up the halls with colourful luggage! pic.twitter.com/zliOsUfWQa,,,,5.31053538852e+17,https://twitter.com/HotelJenOG/status/531053538852339714,changi airport mrt station,changi airport
ImWeekiang,2014-11-08 20:01:00,0.0,0.0,I'm at Pasir Ris Park BBQ Pit 23 https://www. swarmapp.com/c/81tBpcpO8cm,,,,5.31053899567e+17,https://twitter.com/ImWeekiang/status/531053899567104000,pasir ris mrt station,pasir ris
izzatijuffri,2014-11-08 20:01:00,0.0,0.0,Heading to Hougang for soccer night with family,,,,5.31053973709e+17,https://twitter.com/izzatijuffri/status/531053973709414401,hougang mrt station,hougang
azchxyo,2014-11-08 20:01:00,0.0,0.0,Spent my afternoon at Gardens by the Bay & had lots of fun there (uhm kinda) http:// instagram.com/p/vI1QglE9iZ/,,,,5.31053986687e+17,https://twitter.com/azchxyo/status/531053986686963713,gardens by the bay mrt station,gardens by the bay
mxhdajizxx,2014-11-08 20:02:00,0.0,2.0,@simpang bedok now,,@simpang,,5.3105422502e+17,https://twitter.com/mxhdajizxx/status/531054225019523072,bedok mrt station,bedok
chiisairoru,2014-11-08 20:03:00,0.0,0.0,Thanks papoji u might as well fetch me from bedok to school since ive been coming to class late,,,,5.31054520043e+17,https://twitter.com/chiisairoru/status/531054520042668033,bedok mrt station,bedok
ichill21,2014-11-08 20:04:00,0.0,0.0,@CondezIan Nasaan ka bedok ?,,@CondezIan,,5.31054691925e+17,https://twitter.com/ichill21/status/531054691925250048,bedok mrt station,bedok
tgrankin,2014-11-08 20:04:00,0.0,0.0,Cool tour arte da Roma William Kentridge al MAXXI per il progetto Tevereterno. http://www. rai.tv/dl/RaiTV/progr ammi/media/ContentItem-b94dd0e6-cd3a-4395-a00e-b77ce590fc60.html …,,,,5.31054572056e+17,https://twitter.com/tgrankin/status/531054572056223744,kent ridge mrt station,kent ridge
chxryl,2014-11-08 20:05:00,0.0,0.0,Aaaw I liked Garden Rhapsody @Gardens by the Bay !,,@Gardens,,5.31054928409e+17,https://twitter.com/chxryl/status/531054928408502272,gardens by the bay mrt station,gardens by the bay
MSBMSBJ,2014-11-08 20:06:00,0.0,0.0,I'm out to Changi Airport ... #leggo http:// instagram.com/p/vI10JgQOBX/,,,#leggo,5.31055210883e+17,https://twitter.com/MSBMSBJ/status/531055210882670592,changi airport mrt station,changi airport
drippinsanity,2014-11-08 20:06:00,1.0,1.0,i need to know how ppl like @eunhaelicious_ even survive cs ive never attended a sch out of yishun lol how do you survive,,@eunhaelicious_,,5.31055135095e+17,https://twitter.com/drippinsanity/status/531055135095418880,yishun mrt station,yishun
dingsosweet_,2014-11-08 20:06:00,1.0,0.0,won 12-0 well done ohh tia and marsiling boys,,,,5.31055102841e+17,https://twitter.com/dingsosweet_/status/531055102841196544,marsiling mrt station,marsiling
JunBinn_,2014-11-08 20:10:00,0.0,0.0,@fzrlhzn_ serangoon stadium?,,@fzrlhzn_,,5.31056084652e+17,https://twitter.com/JunBinn_/status/531056084652265474,serangoon mrt station,serangoon
bharra22,2014-11-08 20:11:00,0.0,0.0,Smile is medicine (at Port Of Kideco - Tanah Merah Coal Terminal) [pic] — https:// path.com/p/ocEuh,,,,5.31056444805e+17,https://twitter.com/bharra22/status/531056444804575232,tanah merah mrt station,tanah merah
kimikimiboo,2014-11-08 20:12:00,0.0,0.0,River Cruise along Clarke Quay and Marina Bay.. Followed by dinner by the river.. #singapore #day6 … http:// instagram.com/p/vI2clBy5Gd/,,,#singapore #day6,5.31056599843e+17,https://twitter.com/kimikimiboo/status/531056599843229696,clarke quay mrt station,clarke quay
vindmarley,2014-11-08 20:13:00,0.0,0.0,At boonlay,,,,5.31056799114e+17,https://twitter.com/vindmarley/status/531056799114219520,boon lay mrt station,boon lay
Jayohwhyyyyy,2014-11-08 20:14:00,0.0,0.0,We did some #heartwork today around esplanade mrt area! #Heartattack ed people//children with free… http:// instagram.com/p/vI2u-QQYfM/,,,#heartwork #Heartattack,5.3105723216e+17,https://twitter.com/Jayohwhyyyyy/status/531057232159715329,esplanade mrt station,esplanade mrt
surota_cowboy,2014-11-08 20:14:00,0.0,0.0,シンガポールのチャンギ空港の囲い。何か出来るの？ #changiairport #disney http:// instagram.com/p/vI2u-0Rhcx/,,,#changiairport #disney,5.310572326e+17,https://twitter.com/surota_cowboy/status/531057232600117249,changi airport mrt station,changi airport
YanChipmunk,2014-11-08 20:14:00,0.0,0.0,@fifirocck yeah. Now at jurong East .,,@fifirocck,,5.31057101691e+17,https://twitter.com/YanChipmunk/status/531057101691293696,jurong east mrt station,jurong east
izaxz,2014-11-08 20:15:00,0.0,0.0,at bedok now,,,,5.31057504084e+17,https://twitter.com/izaxz/status/531057504084434944,bedok mrt station,bedok
XxXfadhedXxX,2014-11-08 20:15:00,0.0,0.0,Gather all the LOVE you can get and devour it!!! #fluffbakery @Blk 859 Tampines Ave 5 http:// instagram.com/p/vI237uDN9-/,,@Blk,#fluffbakery,5.31057540147e+17,https://twitter.com/XxXfadhedXxX/status/531057540147458049,tampines mrt station,tampines
HaZizoZazi,2014-11-08 20:15:00,0.0,0.0,Happy Birthday Din! :OD @Orchid Bowl @SAFRA Tampines http:// instagram.com/p/vI20BeMVSc/,,@Orchid @SAFRA,,5.31057405628e+17,https://twitter.com/HaZizoZazi/status/531057405627744256,tampines mrt station,tampines
surota_cowboy,2014-11-08 20:15:00,0.0,0.0,気になる(´ω｀) #changiairport #disney http:// instagram.com/p/vI23EgxhdY/,,,#changiairport #disney,5.31057510934e+17,https://twitter.com/surota_cowboy/status/531057510933725184,changi airport mrt station,changi airport
johnrobiuy,2014-11-08 20:15:00,0.0,0.0,Kallang night! Meet and Greet! #InstaSize @Ikkoryu Fukuoka Ramen SM Aura http:// instagram.com/p/vI20s9pctl/,,@Ikkoryu,#InstaSize,5.31057429636e+17,https://twitter.com/johnrobiuy/status/531057429635543040,kallang mrt station,kallang
cherylxje,2014-11-08 20:16:00,0.0,0.0,I'm at Choa Chu Kang Bus Interchange - @smrt_singapore in Singapore https://www. swarmapp.com/c/fLBp5fdwK0k,,@smrt_singapore,,5.31057590513e+17,https://twitter.com/cherylxje/status/531057590512648193,choa chu kang mrt station,choa chu kang
ahmad_penguinz,2014-11-08 20:16:00,0.0,0.0,Not going to anywhere far unless it is jurong east not more.,,,,5.31057788878e+17,https://twitter.com/ahmad_penguinz/status/531057788877680640,jurong east mrt station,jurong east
Jayohwhyyyyy,2014-11-08 20:17:00,0.0,0.0,We did some #heartwork today around esplanade mrt area! #Heartattack ed people//children with free… http:// instagram.com/p/vI3CUbQYQ7/,,,#heartwork #Heartattack,5.3105789793e+17,https://twitter.com/Jayohwhyyyyy/status/531057897929572353,esplanade mrt station,esplanade mrt
DorjeeFTW,2014-11-08 20:17:00,0.0,1.0,@witheringdreams lai bishan,,@witheringdreams,,5.31057897389e+17,https://twitter.com/DorjeeFTW/status/531057897388523522,bishan mrt station,bishan
hunnyrolls,2014-11-08 20:18:00,0.0,2.0,"Freshening up. I'll make do with exploring the entire Boat Quay and possibly Clarke Quay tonight, so I won't have to tomorrow.",,,,5.31058070378e+17,https://twitter.com/hunnyrolls/status/531058070378385408,clarke quay mrt station,clarke quay
DorjeeFTW,2014-11-08 20:18:00,0.0,0.0,@LijiangLeySiao bishan leh,,@LijiangLeySiao,,5.31058111415e+17,https://twitter.com/DorjeeFTW/status/531058111415451649,bishan mrt station,bishan
Chutchapol,2014-11-08 20:19:00,0.0,0.0,"กระทงปีนี้... #ช้าหน่อยแต่ก็ได้ลอย @Indo Chine Clarke Quay , Singapore http:// instagram.com/p/vI3On5FbgM/",,@Indo,#,5.31058319357e+17,https://twitter.com/Chutchapol/status/531058319356870656,clarke quay mrt station,clarke quay
Lydeeeee,2014-11-08 20:19:00,0.0,1.0,What could be better that night than taking a shit while enjoying aircon at Clarke Quay w a live band outside singing happy birthday to you,,,,5.31058336683e+17,https://twitter.com/Lydeeeee/status/531058336683130882,clarke quay mrt station,clarke quay
heyitskaede,2014-11-08 20:20:00,0.0,0.0,I'm at Pasir Ris Beach (Area 3) in Singapore w/ @genoace_genesis https://www. swarmapp.com/c/6Iija50JQud,,@genoace_genesis,,5.31058716667e+17,https://twitter.com/heyitskaede/status/531058716666511361,pasir ris mrt station,pasir ris
S3XYKISSES,2014-11-08 20:20:00,0.0,0.0,It's 9% and I'm still at Chinatown not even bedok wtf,,,,5.31058729991e+17,https://twitter.com/S3XYKISSES/status/531058729991421952,bedok mrt station,bedok
MrBryan86,2014-11-08 20:20:00,0.0,0.0,Showcasing the beauty and grace of a Singapore Airlines B777-312ER on approach to Changi Airport (WSSS). Photo ©... http:// fb.me/30LXtpRno,,,,5.31058745779e+17,https://twitter.com/MrBryan86/status/531058745779171328,changi airport mrt station,changi airport
leejovan9,2014-11-08 20:21:00,0.0,0.0,"Championship game this morning. 2nd championship game, 2nd time being 2nd. #meangreen @Tiong Bahru Field http:// instagram.com/p/vI3dAWrd9V/",,@Tiong,#meangreen,5.31058813446e+17,https://twitter.com/leejovan9/status/531058813445873665,tiong bahru mrt station,tiong bahru
Belvinwks,2014-11-08 20:21:00,0.0,0.0,I'm at 619 Bedok Reservoir Road https://www. swarmapp.com/c/8FjQeBHpFYs,,,,5.31058938239e+17,https://twitter.com/Belvinwks/status/531058938239012864,bedok mrt station,bedok
tevereterno,2014-11-08 20:21:00,0.0,0.0,Tevereterno and William Kentridge are at about minute 11:00. http:// fb.me/2AaucSRIA,,,,5.31058866243e+17,https://twitter.com/tevereterno/status/531058866243391488,kent ridge mrt station,kent ridge
Celenaateysh,2014-11-08 20:21:00,0.0,1.0,Dinner with family . (@Punggol Plaza - @punggollatest in Singapore w/ @_jcxy ) https://www. swarmapp.com/c/2cdPpk6c2RW,,@Punggol @punggollatest @_jcxy,,5.3105898756e+17,https://twitter.com/Celenaateysh/status/531058987559829504,punggol mrt station,punggol
ezrikjy,2014-11-08 20:22:00,0.0,0.0,@surrealbanana i always buy the one at simei . the coffee shop beside simei mrt hahaha.,,@surrealbanana,,5.3105925032e+17,https://twitter.com/ezrikjy/status/531059250319990784,simei mrt station,simei
jaredczj_,2014-11-08 20:22:00,0.0,0.0,@ilyairdina eh just now u at serangoon stadium right,,@ilyairdina,,5.31059056094e+17,https://twitter.com/jaredczj_/status/531059056094351360,serangoon mrt station,serangoon
carrotoh,2014-11-08 20:23:00,0.0,0.0,Thank you for the dinner treat @buuboo #saboten #changiairport #terminal1 http:// instagram.com/p/vI3te1zRIF/,,@buuboo,#saboten #changiairport #terminal1,5.31059379878e+17,https://twitter.com/carrotoh/status/531059379878252545,changi airport mrt station,changi airport
DignityYL,2014-11-08 20:23:00,0.0,0.0,"I'm at Tampines Bus Interchange in Singapore, SINGAPORE w/ @weiyuan_lorh https://www. swarmapp.com/c/d5autVWhxkp",,@weiyuan_lorh,,5.3105954721e+17,https://twitter.com/DignityYL/status/531059547210006528,tampines mrt station,tampines
carrotoh,2014-11-08 20:24:00,0.0,0.0,This way to #changiairport #singapore http:// instagram.com/p/vI32WWzRI4/,,,#changiairport #singapore,5.31059694166e+17,https://twitter.com/carrotoh/status/531059694165839872,changi airport mrt station,changi airport
m_bishan,2014-11-08 20:24:00,0.0,2.0,الفوسفات حيث توجد هذه الرواسب على شكل حزام باتجاه الشمال الغربي ويمتد عبرالمنطقة الشمالية الخام الرئيسي معدن أباتايت. pic.twitter.com/X0onRRiD1G,,,,5.31059763795e+17,https://twitter.com/m_bishan/status/531059763795083266,bishan mrt station,bishan
xwjonathan,2014-11-08 20:24:00,0.0,0.0,@terencetch supper at bishan,,@terencetch,,5.3105976234e+17,https://twitter.com/xwjonathan/status/531059762339651585,bishan mrt station,bishan
InnocentlyM3,2014-11-08 20:24:00,0.0,1.0,@limzijian good next time we stay bedok tgt HAHHAA,,@limzijian,,5.3105969219e+17,https://twitter.com/InnocentlyM3/status/531059692189925376,bedok mrt station,bedok
delbchin,2014-11-08 20:24:00,0.0,0.0,wtf come all the way here to eat this... Toa Payoh also have wtf,,,,5.31059762075e+17,https://twitter.com/delbchin/status/531059762075410432,toa payoh mrt station,toa payoh
stupid_anjek,2014-11-08 20:25:00,0.0,0.0,"Workkkk @Serangoon Road, Little India http:// instagram.com/p/vI3_m9Dz-e/",,@Serangoon,,5.31060003609e+17,https://twitter.com/stupid_anjek/status/531060003608604674,serangoon mrt station,serangoon
lfdyizzat,2014-11-08 20:25:00,0.0,0.0,Bedok corner hey,,,,5.31059944557e+17,https://twitter.com/lfdyizzat/status/531059944557010944,bedok mrt station,bedok
WeiQianwwq,2014-11-08 20:26:00,0.0,0.0,; #ootd saturday to Yalun's & bii's fanmeet @jurong east http:// instagram.com/p/vI4HCRJA0S/,,@jurong,#ootd,5.31060257813e+17,https://twitter.com/WeiQianwwq/status/531060257813184512,jurong east mrt station,jurong east
kailinohhh,2014-11-08 20:26:00,0.0,0.0,@The Punggol Settlement http:// instagram.com/p/vI4DpYjYIk/,,@The,,5.31060141874e+17,https://twitter.com/kailinohhh/status/531060141874221056,punggol mrt station,punggol
NasrullahOmar,2014-11-08 20:27:00,0.0,0.0,@hairilfaiz4 kat tanah merah baru.,,@hairilfaiz4,,5.31060547979e+17,https://twitter.com/NasrullahOmar/status/531060547978924033,tanah merah mrt station,tanah merah
DarlingJJS,2014-11-08 20:28:00,0.0,0.0,Bela2in ke Tampines for the halal meatballs.. Enaaaakkk!! (with Dayita at IKEA Restaurant) [pic] — https:// path.com/p/22osgC,,,,5.31060590887e+17,https://twitter.com/DarlingJJS/status/531060590886662145,tampines mrt station,tampines
JEYZZIKA,2014-11-08 20:28:00,0.0,0.0,Time to enjoy my long bus ride from AMK to Pasir Ris,,,,5.31060755144e+17,https://twitter.com/JEYZZIKA/status/531060755143991296,pasir ris mrt station,pasir ris
jackmalaka,2014-11-08 20:28:00,0.0,0.0,Photo: the-gasoline- station : Marina Bay Sands by Conor MacNeill http:// tmblr.co/Z7i0Yx1V4poS7,,,,5.31060814422e+17,https://twitter.com/jackmalaka/status/531060814422474752,marina bay mrt station,marina bay station
apirat878,2014-11-08 20:29:00,0.0,0.0,Just posted a photo @Clarke Quay Bridge http:// instagram.com/p/vI4d-qEFEO/,,@Clarke,,5.31061045998e+17,https://twitter.com/apirat878/status/531061045998415873,clarke quay mrt station,clarke quay
faris_izzat_,2014-11-08 20:29:00,0.0,0.0,Bawak motor kt jalan besar lps tu x pakai helmet..mmg seronok la aku sakat..,,,,5.31060998758e+17,https://twitter.com/faris_izzat_/status/531060998757564416,jalan besar mrt station,jalan besar
_hhaziqakidd_,2014-11-08 20:29:00,0.0,0.0,at Yishun .,,,,5.3106096795e+17,https://twitter.com/_hhaziqakidd_/status/531060967950413824,yishun mrt station,yishun
NxrShxlinxh,2014-11-08 20:30:00,0.0,0.0,arrive raffles place yay,,,,5.31061267541e+17,https://twitter.com/NxrShxlinxh/status/531061267541135361,raffles place mrt station,raffles place
PetelovesCHI,2014-11-08 20:30:00,0.0,0.0,@fantabulousssss Haha cya tmrw u meeting at simei at 9?,,@fantabulousssss,,5.31061186583e+17,https://twitter.com/PetelovesCHI/status/531061186582700032,simei mrt station,simei
grantcunt,2014-11-08 20:31:00,0.0,0.0,@ShaylerHayler school ah!!!! against pasir ris ! tsk boyfriend kau tk bilang ehhh?,,@ShaylerHayler,,5.31061420424e+17,https://twitter.com/grantcunt/status/531061420423524352,pasir ris mrt station,pasir ris
_shahrinszl_,2014-11-08 20:31:00,0.0,0.0,Amik kat yewtee masih boleg terima lagi hajaj,,,,5.31061476082e+17,https://twitter.com/_shahrinszl_/status/531061476081946624,yew tee mrt station,yew tee
Khusairi92,2014-11-08 20:32:00,0.0,0.0,"Semalam punya ceriter.. Tjantek Art Bistro kat Jalan Besar Kuantan, just wow. Decoration superb,… http:// instagram.com/p/vI4zYYrdZT/",,,,5.31061781285e+17,https://twitter.com/Khusairi92/status/531061781285068800,jalan besar mrt station,jalan besar
Afiq1211,2014-11-08 20:32:00,0.0,0.0,I'm at Al Taqua Mosque in Bedok https://www. swarmapp.com/c/9OReqiLoIOE,,,,5.31061677623e+17,https://twitter.com/Afiq1211/status/531061677622837248,bedok mrt station,bedok
Godisapornstar_,2014-11-08 20:33:00,0.0,0.0,"I'm at Serangoon Stadium in Serangoon , Singapore https://www. swarmapp.com/c/60kFdKYjPOI",,,,5.31061829922e+17,https://twitter.com/Godisapornstar_/status/531061829922201600,serangoon mrt station,serangoon
drawntoyouu,2014-11-08 20:33:00,0.0,0.0,I'm at Upper Thomson Road in Singapore https://www. swarmapp.com/c/f1snm6Eefdn,,,,5.31061872742e+17,https://twitter.com/drawntoyouu/status/531061872741871616,upper thomson mrt station,upper thomson
josephatos_,2014-11-08 20:34:00,0.0,0.0,We can never take a proper picture. @Sembawang Fire Post http:// instagram.com/p/vI5BJ6JsWA/,,@Sembawang,,5.31062257057e+17,https://twitter.com/josephatos_/status/531062257057144832,sembawang mrt station,sembawang
cinthiasinta,2014-11-08 20:34:00,0.0,0.0,Nice.. (with Nona at Gardens By The Bay ) [pic] — https:// path.com/p/2XWf9e,,,,5.31062192159e+17,https://twitter.com/cinthiasinta/status/531062192158687232,gardens by the bay mrt station,gardens by the bay
Yxnxdiyxnx_,2014-11-08 20:36:00,0.0,0.0,want go cousin's takraw match @bedok tmrw !!,,@bedok,,5.31062600629e+17,https://twitter.com/Yxnxdiyxnx_/status/531062600629374976,bedok mrt station,bedok
FunnyPunjabiGuy,2014-11-08 20:36:00,0.0,1.0,"One more stop to tanah merah , come on train driver!",,,,5.31062699791e+17,https://twitter.com/FunnyPunjabiGuy/status/531062699791097856,tanah merah mrt station,tanah merah
yingyongx_,2014-11-08 20:37:00,0.0,0.0,@WinsterzK no thankyou. I need money to shop. HAHAHA flying off on 30th november. 7am be at changi airport ayy.,,@WinsterzK,,5.31063041719e+17,https://twitter.com/yingyongx_/status/531063041719152640,changi airport mrt station,changi airport
on1000highlow,2014-11-08 20:38:00,0.0,0.0,I'm at Tiong Bahru Market & Food Centre in Singapore https://www. swarmapp.com/c/1MyEQ3JuKqc,,,,5.31063207567e+17,https://twitter.com/on1000highlow/status/531063207566524416,tiong bahru mrt station,tiong bahru
joshua57ng,2014-11-08 20:38:00,0.0,0.0,I'm at Changi Airport Terminal 3 - @fansofchangi in Singapore https://www. swarmapp.com/c/881bXYpby9O,,@fansofchangi,,5.31063264244e+17,https://twitter.com/joshua57ng/status/531063264244170752,changi airport mrt station,changi airport
