username,date,retweets,favorites,text,geo,mentions,hashtags,id,permalink,place,key
Boueys,2014-11-08 16:09:00,0.0,0.0,"Pasien AIDS Bisa Disembuhkan dengan Mengubah Kode Genetik HIV: ""Penemuan ini ibarat sebuah jalan besar untuk p... http:// bit.ly/1si1bFP",,,,5.30995448363e+17,https://twitter.com/Boueys/status/530995448362708993,jalan besar mrt station,jalan besar
AchdiAzizy2,2014-11-08 16:09:00,0.0,0.0,"Pasien AIDS Bisa Disembuhkan dengan Mengubah Kode Genetik HIV: ""Penemuan ini ibarat sebuah jalan besar untuk p... http:// bit.ly/1wDIy5f",,,,5.30995441119e+17,https://twitter.com/AchdiAzizy2/status/530995441119150080,jalan besar mrt station,jalan besar
army_photoworks,2014-11-08 16:09:00,0.0,0.0,"Pasien AIDS Bisa Disembuhkan dengan Mengubah Kode Genetik HIV: ""Penemuan ini ibarat sebuah jalan besar untuk p... http:// bit.ly/1wDIy5f",,,,5.30995421653e+17,https://twitter.com/army_photoworks/status/530995421653368832,jalan besar mrt station,jalan besar
BAKTIUNAND,2014-11-08 16:09:00,0.0,0.0,"Pasien AIDS Bisa Disembuhkan dengan Mengubah Kode Genetik HIV: ""Penemuan ini ibarat sebuah jalan besar untuk p... http:// bit.ly/10HiTfp",,,,5.30995545461e+17,https://twitter.com/BAKTIUNAND/status/530995545460834305,jalan besar mrt station,jalan besar
crownieshil,2014-11-08 16:09:00,0.0,0.0,"#Share Pasien AIDS Bisa Disembuhkan dengan Mengubah Kode Genetik HIV: ""Penemuan ini ibarat sebuah jalan besar ... http:// bit.ly/1AE0fpj",,,#Share,5.30995564943e+17,https://twitter.com/crownieshil/status/530995564943396864,jalan besar mrt station,jalan besar
ichie_vivie,2014-11-08 16:09:00,0.0,0.0,"Pasien AIDS Bisa Disembuhkan dengan Mengubah Kode Genetik HIV: ""Penemuan ini ibarat sebuah jalan besar untuk p... http:// bit.ly/1AE4rW7",,,,5.30995415685e+17,https://twitter.com/ichie_vivie/status/530995415684874241,jalan besar mrt station,jalan besar
HelmyGala,2014-11-08 16:09:00,0.0,0.0,"@actuallyakif handsome, nak turon street pat simei ?",,@actuallyakif,,5.30995583419e+17,https://twitter.com/HelmyGala/status/530995583419285504,simei mrt station,simei
MadameIsis,2014-11-08 16:10:00,0.0,0.0,Pasir Ris Family for #FASMWED http:// instagram.com/p/vIaxUSHKsy/,,,#FASMWED,5.30995739708e+17,https://twitter.com/MadameIsis/status/530995739707854848,pasir ris mrt station,pasir ris
abuhanifah90,2014-11-08 16:10:00,0.0,0.0,"Pasien AIDS Bisa Disembuhkan dengan Mengubah Kode Genetik HIV: ""Penemuan ini ibarat sebuah jalan besar untuk p... http:// bit.ly/10HiTfp",,,,5.30995765901e+17,https://twitter.com/abuhanifah90/status/530995765900894208,jalan besar mrt station,jalan besar
kifazman,2014-11-08 16:10:00,0.0,0.0,@HelmyGala nari aku keluar ah beb lain kali aku turun haha simei street yang mana satu?,,@HelmyGala,,5.30995722465e+17,https://twitter.com/kifazman/status/530995722464661504,simei mrt station,simei
HelmyGala,2014-11-08 16:10:00,0.0,0.0,@actuallyakif Haha simei skrg tinggal satu ke street. Dekat hospital!,,@actuallyakif,,5.30995829856e+17,https://twitter.com/HelmyGala/status/530995829855637505,simei mrt station,simei
maglikeexo,2014-11-08 16:11:00,0.0,0.0,@XuBin_BinGo Is Xubin going to be at Bishan Park today?,,@XuBin_BinGo,,5.30995970893e+17,https://twitter.com/maglikeexo/status/530995970893287424,bishan mrt station,bishan
news_singapore,2014-11-08 16:11:00,0.0,0.0,(A1) Graffiti found on exterior of a train at Bishan depot http:// dlvr.it/7S943r,,,,5.30995905244e+17,https://twitter.com/news_singapore/status/530995905244045312,bishan mrt station,bishan
WorldUSNews,2014-11-08 16:12:00,0.0,0.0,http:// ift.tt/1pzqg4s SMRT train vandalised at Bishan depot #HeadlinesApp,,,#HeadlinesApp,5.30996349014e+17,https://twitter.com/WorldUSNews/status/530996349014409216,bishan mrt station,bishan
on1000highlow,2014-11-08 16:12:00,0.0,0.0,I'm at Bedok Jetty in Singapore https://www. swarmapp.com/c/69ViRzIK7LB,,,,5.3099623076e+17,https://twitter.com/on1000highlow/status/530996230760194048,bedok mrt station,bedok
__earth,2014-11-08 16:13:00,0.0,0.0,Emergency! RT: @TODAYonline : JUST IN: Graffiti discovered on exterior of train at Bishan depot this morning: LTA http:// tdy.sg/1wDHC0R,,@TODAYonline,,5.30996482288e+17,https://twitter.com/__earth/status/530996482288017408,bishan mrt station,bishan
Wikipedia_Ja,2014-11-08 16:13:00,0.0,0.0,【ホウガン・スタジアム】—（英: Hougang Stadium）は、シンガポールのホウガン地区にある多目的スタジアム。 http:// ja.wikipedia.org/wiki/%E3%83%9B %E3%82%A6%E3%82%AC%E3%83%B3%E3%83%BB%E3%82%B9%E3%82%BF%E3%82%B8%E3%82%A2%E3%83%A0 …,,,,5.30996593907e+17,https://twitter.com/Wikipedia_Ja/status/530996593906814979,hougang mrt station,hougang
DevilRays9,2014-11-08 16:14:00,0.0,0.0,Someone's backside itchy.. RT @TODAYonline Graffiti discovered on exterior of train at Bishan depot this morning: LTA http:// tdy.sg/1wDHC0R,,@TODAYonline,,5.3099681878e+17,https://twitter.com/DevilRays9/status/530996818780225537,bishan mrt station,bishan
nobi_wilson,2014-11-08 16:15:00,0.0,1.0,從民主國家回到獨裁國家 (@Singapore Changi Airport (SIN) - @fansofchangi in Singapore) https://www. swarmapp.com/c/k9EFjNivBsO,,@Singapore @fansofchangi,,5.30997049539e+17,https://twitter.com/nobi_wilson/status/530997049538670592,changi airport mrt station,changi airport
fareast14,2014-11-08 16:15:00,0.0,0.0,Wedding Affair. #cousins @Siglap Community Centre http:// instagram.com/p/vIbTjFHj1i/,,@Siglap,#cousins,5.30996915954e+17,https://twitter.com/fareast14/status/530996915954270208,siglap mrt station,siglap
mistyreaa,2014-11-08 16:15:00,0.0,0.0,@BevSempiternal are u like gg to kallang now,,@BevSempiternal,,5.30996912124e+17,https://twitter.com/mistyreaa/status/530996912124489728,kallang mrt station,kallang
Niezarmx,2014-11-08 16:15:00,0.0,0.0,"Colek dulu. Lama x lepak sini (@Pok Cik Colek Perut in Tanah Merah , Kelantan) https://www. swarmapp.com/c/cb11H16ovlh",,@Pok,,5.30996934032e+17,https://twitter.com/Niezarmx/status/530996934031712256,tanah merah mrt station,tanah merah
nessaflo,2014-11-08 16:16:00,0.0,0.0,"Pertama kali buat birthday cake, chocolate with cheese. Gatau lah apa… (w/ Mustaq at Bedok North St 2) [pic] — https:// path.com/p/1EQ2I4",,,,5.30997190144e+17,https://twitter.com/nessaflo/status/530997190143922176,bedok mrt station,bedok
NadyaNews21,2014-11-08 16:16:00,0.0,0.0,"Pasien AIDS Bisa Disembuhkan dengan Mengubah Kode Genetik HIV: ""Penemuan ini ibarat sebuah jalan besar untuk p... http:// bit.ly/1AE0fpj",,,,5.3099718936e+17,https://twitter.com/NadyaNews21/status/530997189359583232,jalan besar mrt station,jalan besar
george_hzx,2014-11-08 16:17:00,0.0,0.0,Good luck to friends and residents staying in Hougang and alijunied GRC. Hougang people should be thankful that... http:// fb.me/6TtUQvGUa,,,,5.30997480747e+17,https://twitter.com/george_hzx/status/530997480746659840,hougang mrt station,hougang
Mutya_HM,2014-11-08 16:17:00,0.0,0.0,"@Hardiwa_HM bubu wangi ya gol wkwkw wangi apa sayang bedok ? apa nya yg kecil,besar kali gitu mas wkwkkw",,@Hardiwa_HM,,5.30997558987e+17,https://twitter.com/Mutya_HM/status/530997558986813440,bedok mrt station,bedok
violaclie,2014-11-08 16:17:00,0.0,0.0,I miss my childhood #playground @Blk 48 Telok Blangah Drive http:// instagram.com/p/vIbjJZOol7/,,@Blk,#playground,5.30997453173e+17,https://twitter.com/violaclie/status/530997453172920320,telok blangah mrt station,telok blangah
MadameIsis,2014-11-08 16:18:00,0.0,0.0,Pasir Ris Family for #FASMWED http:// instagram.com/p/vIaxUSHKsy/,,,#FASMWED,5.30997695981e+17,https://twitter.com/MadameIsis/status/530997695981187072,pasir ris mrt station,pasir ris
insherficant_,2014-11-08 16:18:00,0.0,0.0,"it's been long HAHAHAHA (@Kallang Basin Swimming Complex in Kallang , Singapore) https://www. swarmapp.com/c/iDDHXsxPGit",,@Kallang,,5.30997661718e+17,https://twitter.com/insherficant_/status/530997661718315008,kallang mrt station,kallang
Niezarmx,2014-11-08 16:18:00,0.0,0.0,Colek dulu. #kejeiskeje #kejesambilholiday #thisiskotabharu #tanahmerah http:// instagram.com/p/vIbtIpCa5_/,,,#kejeiskeje #kejesambilholiday #thisiskotabharu #tanahmerah,5.3099779495e+17,https://twitter.com/Niezarmx/status/530997794950352896,tanah merah mrt station,tanah merah
newskabarberita,2014-11-08 16:18:00,0.0,0.0,"Pasien AIDS Bisa Disembuhkan dengan Mengubah Kode Genetik HIV: ""Penemuan ini ibarat sebuah jalan besar untuk p... http:// bit.ly/10HiTfp",,,,5.30997695553e+17,https://twitter.com/newskabarberita/status/530997695553343488,jalan besar mrt station,jalan besar
NejQifa71,2014-11-08 16:19:00,0.0,0.0,How to get to sembawang park?! someone help me pls,,,,5.30998024148e+17,https://twitter.com/NejQifa71/status/530998024147705856,sembawang mrt station,sembawang
snowkinz,2014-11-08 16:19:00,0.0,0.0,@TrulyELFs im reaching esplanade mrt sooooo!!!,,@TrulyELFs,,5.30998077738e+17,https://twitter.com/snowkinz/status/530998077738332160,esplanade mrt station,esplanade mrt
kellynnng,2014-11-08 16:20:00,0.0,0.0,I'm at Ang Mo Kio MRT Station (NS16) - @smrt_singapore in Singapore https://www. swarmapp.com/c/lNXJmRGrteY,,@smrt_singapore,,5.30998203568e+17,https://twitter.com/kellynnng/status/530998203567845376,ang mo kio mrt station,ang mo kio
mahirdesain,2014-11-08 16:20:00,0.0,0.0,"Pasien AIDS Bisa Disembuhkan dengan Mengubah Kode Genetik HIV: ""Penemuan ini ibarat sebuah jalan besar untuk p... http:// bit.ly/10HiTfp",,,,5.30998375622e+17,https://twitter.com/mahirdesain/status/530998375621988352,jalan besar mrt station,jalan besar
simei_takk_2,2014-11-08 16:20:00,0.0,0.0,( ´•௰•`),,,,5.3099823065e+17,https://twitter.com/simei_takk_2/status/530998230650068993,simei mrt station,simei
scarletxpebbles,2014-11-08 16:20:00,0.0,0.0,Love bishan 's library man,,,,5.30998300422e+17,https://twitter.com/scarletxpebbles/status/530998300422336512,bishan mrt station,bishan
sgtastemakers,2014-11-08 16:20:00,0.0,0.0,An SMRT train was found vandalised with graffiti at Bishan depot on Saturday morning.,,,,5.30998192692e+17,https://twitter.com/sgtastemakers/status/530998192692031488,bishan mrt station,bishan
embuhsuw1,2014-11-08 16:20:00,0.0,0.0,"Pasien AIDS Bisa Disembuhkan dengan Mengubah Kode Genetik HIV: ""Penemuan ini ibarat sebuah jalan besar untuk p... http:// bit.ly/1AE0fpj",,,,5.30998267736e+17,https://twitter.com/embuhsuw1/status/530998267736125441,jalan besar mrt station,jalan besar
oyekes,2014-11-08 16:20:00,0.0,0.0,"Pasien AIDS Bisa Disembuhkan dengan Mengubah Kode Genetik HIV: ""Penemuan ini ibarat sebuah jalan besar untuk p... http:// bit.ly/10HiTfp",,,,5.30998287093e+17,https://twitter.com/oyekes/status/530998287092809729,jalan besar mrt station,jalan besar
MacoocooTweets,2014-11-08 16:21:00,0.0,0.0,#Bangkok7s Match 7 : Women's Open Pool B Bedok Kings Skyllas (7) vs Bucks Singapore (26) #BKSkyllas : #bucks http:// macoo.co/448,,,#Bangkok7s #BKSkyllas #bucks,5.30998488264e+17,https://twitter.com/MacoocooTweets/status/530998488264212480,bedok mrt station,bedok
YxungGxd,2014-11-08 16:21:00,0.0,0.0,At tampines now for bowling with the lads,,,,5.30998647761e+17,https://twitter.com/YxungGxd/status/530998647761010689,tampines mrt station,tampines
ChangiAirport,2014-11-08 16:21:00,0.0,0.0,"@SophieWareing Hi, please advise the flight details eg flight number, date & time. Thank you CS",,@SophieWareing,,5.30998538818e+17,https://twitter.com/ChangiAirport/status/530998538818187264,changi airport mrt station,changi airport
Sean_Thye,2014-11-08 16:22:00,0.0,0.0,Going to Marina Bay! (@Jurong East MRT Interchange (NS1/EW24) - @smrt_singapore in Singapore) https://www. swarmapp.com/c/lS8Ct5o0uQD,,@Jurong @smrt_singapore,,5.30998739759e+17,https://twitter.com/Sean_Thye/status/530998739759276032,jurong east mrt station,jurong east
njbhckl,2014-11-08 16:22:00,0.0,0.0,"Pasien AIDS Bisa Disembuhkan dengan Mengubah Kode Genetik HIV: ""Penemuan ini ibarat sebuah jalan besar untuk p... http:// bit.ly/1AE0fpj",,,,5.30998739558e+17,https://twitter.com/njbhckl/status/530998739557552128,jalan besar mrt station,jalan besar
NonTania,2014-11-08 16:22:00,0.0,0.0,Terimakasiiih syg udah jd anak baiik pinter sehaat ga reweel selama… (at Changi Airport West Underpass) [pic] — https:// path.com/p/1VSjKj,,,,5.30998753789e+17,https://twitter.com/NonTania/status/530998753788821504,changi airport mrt station,changi airport
AnggiDre,2014-11-08 16:22:00,0.0,0.0,"Pasien AIDS Bisa Disembuhkan dengan Mengubah Kode Genetik HIV: ""Penemuan ini ibarat sebuah jalan besar untuk p... http:// bit.ly/10HiTfp",,,,5.30998907074e+17,https://twitter.com/AnggiDre/status/530998907073884160,jalan besar mrt station,jalan besar
MPT_Sg,2014-11-08 16:23:00,0.0,0.0,"Need a Tutor to teach English and Science for a Primary Level Student - Bedok Reservoir, Bedok - Apply Now http:// fb.me/3GVgGVC4W",,,,5.3099891045e+17,https://twitter.com/MPT_Sg/status/530998910450294784,bedok mrt station,bedok
KASUS880,2014-11-08 16:23:00,0.0,0.0,"Pasien AIDS Bisa Disembuhkan dengan Mengubah Kode Genetik HIV: ""Penemuan ini ibarat sebuah jalan besar untuk p... http:// bit.ly/1AE0fpj",,,,5.30999003706e+17,https://twitter.com/KASUS880/status/530999003706433536,jalan besar mrt station,jalan besar
game_mbel,2014-11-08 16:23:00,0.0,0.0,"Pasien AIDS Bisa Disembuhkan dengan Mengubah Kode Genetik HIV: ""Penemuan ini ibarat sebuah jalan besar untuk p... http:// migre.me/mIeLm",,,,5.30999120602e+17,https://twitter.com/game_mbel/status/530999120601694208,jalan besar mrt station,jalan besar
simei_takk_2,2014-11-08 16:23:00,0.0,0.0,@kamakirinoomame 特に何も考えてなかった w,,@kamakirinoomame,,5.30999085835e+17,https://twitter.com/simei_takk_2/status/530999085835091969,simei mrt station,simei
infoterkini_ID,2014-11-08 16:24:00,0.0,0.0,"Pasien AIDS Bisa Disembuhkan dengan Mengubah Kode Genetik HIV: ""Penemuan ini ibarat sebuah jalan besar untuk p... http:// bit.ly/1AE0fpj",,,,5.30999410004e+17,https://twitter.com/infoterkini_ID/status/530999410004484097,jalan besar mrt station,jalan besar
jecnnie,2014-11-08 16:24:00,0.0,0.0,"Pasien AIDS Bisa Disembuhkan dengan Mengubah Kode Genetik HIV: ""Penemuan ini ibarat sebuah jalan besar untuk p... http:// bit.ly/1AE0fpj",,,,5.30999341193e+17,https://twitter.com/jecnnie/status/530999341192736768,jalan besar mrt station,jalan besar
jecnnie,2014-11-08 16:24:00,0.0,0.0,"Pasien AIDS Bisa Disembuhkan dengan Mengubah Kode Genetik HIV: ""Penemuan ini ibarat sebuah jalan besar untuk p... http:// tinyurl.com/lekzo6j",,,,5.30999332838e+17,https://twitter.com/jecnnie/status/530999332837662720,jalan besar mrt station,jalan besar
irwanmantap1,2014-11-08 16:24:00,0.0,0.0,"Pasien AIDS Bisa Disembuhkan dengan Mengubah Kode Genetik HIV: ""Penemuan ini ibarat sebuah jalan besar untuk p... http:// bit.ly/1AE0fpj",,,,5.30999221563e+17,https://twitter.com/irwanmantap1/status/530999221562785792,jalan besar mrt station,jalan besar
Bunga4MU,2014-11-08 16:25:00,0.0,0.0,"Pasien AIDS Bisa Disembuhkan dengan Mengubah Kode Genetik HIV: ""Penemuan ini ibarat sebuah jalan besar untuk p... http:// bit.ly/1AE0fpj",,,,5.30999424911e+17,https://twitter.com/Bunga4MU/status/530999424911024128,jalan besar mrt station,jalan besar
singapore_buzz,2014-11-08 16:25:00,0.0,0.0,SMRT train vandalised at Bishan depot: An SMRT train was found vandalised with graffiti at Bishan depot on Saturday… http:// dlvr.it/7S9Sz7,,,,5.30999555681e+17,https://twitter.com/singapore_buzz/status/530999555681054720,bishan mrt station,bishan
kifazman,2014-11-08 16:27:00,0.0,0.0,What's nice to eat at Tampines Mall idk,,,,5.31000104833e+17,https://twitter.com/kifazman/status/531000104832876544,tampines mrt station,tampines
BelindaCHL,2014-11-08 16:27:00,0.0,0.0,3month ago i am at bishan for aaronyan fanmeet too,,,,5.30999986025e+17,https://twitter.com/BelindaCHL/status/530999986025005056,bishan mrt station,bishan
nazpro89,2014-11-08 16:28:00,0.0,0.0,Tiger air @changi airport singapore http:// instagram.com/p/vIc1RntdCK/,,@changi,,5.31000274627e+17,https://twitter.com/nazpro89/status/531000274626682881,changi airport mrt station,changi airport
FCUK_India,2014-11-08 16:30:00,0.0,0.0,"Enigmatic beauty at its best - add Gardens by the Bay , Singapore to your bucket list now! http:// ow.ly/i/7v1qF",,,,5.31000804175e+17,https://twitter.com/FCUK_India/status/531000804174753794,gardens by the bay mrt station,gardens by the bay
DianaBr44562703,2014-11-08 16:30:00,0.0,0.0,SMRT train vandalised at Bishan depot http:// cur.lv/fbhhs,,,,5.31000781089e+17,https://twitter.com/DianaBr44562703/status/531000781088886784,bishan mrt station,bishan
Gold_Storage,2014-11-08 16:30:00,0.0,0.0,今からタイに戻りま〜す (@Singapore Changi Airport (SIN) - @fansofchangi in Singapore) https://www. swarmapp.com/c/8X0mq7veNJo pic.twitter.com/V3JZPCMOYn,,@Singapore @fansofchangi,,5.31000905908e+17,https://twitter.com/Gold_Storage/status/531000905907585024,changi airport mrt station,changi airport
EustassRex,2014-11-08 16:30:00,0.0,0.0,Walking from sengkang to hougang is fun,,,,5.31000779868e+17,https://twitter.com/EustassRex/status/531000779868348416,hougang mrt station,hougang
SPHSBLLA,2014-11-08 16:31:00,0.0,0.0,WHERE DO U EAT THE KOREAN RESTAURANT???? — dhoby ghaut !!! http:// ask.fm/a/bcn9b257,,,,5.310010376e+17,https://twitter.com/SPHSBLLA/status/531001037600329729,dhoby ghaut mrt station,dhoby ghaut
ChannelNewsAsia,2014-11-08 16:32:00,11.0,7.0,SMRT train vandalised at Bishan depot http:// cna.asia/10BDDow,,,,5.31001201849e+17,https://twitter.com/ChannelNewsAsia/status/531001201848897536,bishan mrt station,bishan
rukxanarauf,2014-11-08 16:32:00,0.0,0.0,off to gardens by the bay,,,,5.31001392665e+17,https://twitter.com/rukxanarauf/status/531001392664571904,gardens by the bay mrt station,gardens by the bay
SHAMINTYQ,2014-11-08 16:33:00,0.0,0.0,I'm at Somerset MRT Station (NS23) - @smrt_singapore in Singapore https://www. swarmapp.com/c/7aNxZC5slTT,,@smrt_singapore,,5.3100162914e+17,https://twitter.com/SHAMINTYQ/status/531001629139804160,somerset mrt station,somerset mrt
blurshi,2014-11-08 16:33:00,0.0,0.0,At bishan park Lawn 1 for the event of #TheJoyTruck with @blurmeiling ! #081114 #MLS http:// instagram.com/p/vIdd2fpNkS/,,@blurmeiling,#TheJoyTruck #081114 #MLS,5.31001670361e+17,https://twitter.com/blurshi/status/531001670361030656,bishan mrt station,bishan
SGnews,2014-11-08 16:33:00,1.0,0.0,[TODAY] Exterior of train at Bishan depot vandalised: LTA http:// bit.ly/1tSPbzQ,,,,5.31001545321e+17,https://twitter.com/SGnews/status/531001545320824832,bishan mrt station,bishan
IqmalChicken,2014-11-08 16:34:00,0.0,1.0,“ @ChannelNewsAsia : SMRT train vandalised at Bishan depot http:// cna.asia/10BDDow ”,,@ChannelNewsAsia,,5.31001852444e+17,https://twitter.com/IqmalChicken/status/531001852444168192,bishan mrt station,bishan
chhelseax,2014-11-08 16:35:00,0.0,0.0,I'm at Aljunied MRT Station (EW9) - @smrt_singapore in Singapore https://www. swarmapp.com/c/ejOAvTVoVqu,,@smrt_singapore,,5.31001955549e+17,https://twitter.com/chhelseax/status/531001955548921856,aljunied mrt station,aljunied
Power98News,2014-11-08 16:37:00,0.0,0.0,"LTA has revealed that graffiti on the exterior of an SMRT train was discovered at Bishan depot this morning, before it was put into service.",,,,5.31002550087e+17,https://twitter.com/Power98News/status/531002550087335936,bishan mrt station,bishan
pixiedub,2014-11-08 16:38:00,0.0,0.0,#Saturday #skate with #hooligans . #sk8ordie #longboard #Singapore @Punggol Waterfront Promenade http:// instagram.com/p/vId-EMH_6C/,,@Punggol,#Saturday #skate #hooligans #sk8ordie #longboard #Singapore,5.31002776567e+17,https://twitter.com/pixiedub/status/531002776566788096,punggol mrt station,punggol
scoo_ps,2014-11-08 16:39:00,0.0,0.0,(CNA|sg) SMRT train vandalised at Bishan depot http:// scoo.ps/10BF4Ub,,,,5.31002950643e+17,https://twitter.com/scoo_ps/status/531002950642966528,bishan mrt station,bishan
scoopsg,2014-11-08 16:39:00,0.0,0.0,(CNA|sg) SMRT train vandalised at Bishan depot http:// scoo.ps/10BF4Ub,,,,5.31002986731e+17,https://twitter.com/scoopsg/status/531002986730762242,bishan mrt station,bishan
newsSG,2014-11-08 16:39:00,0.0,0.0,(CNA|sg) SMRT train vandalised at Bishan depot http:// scoo.ps/10BF4Ub,,,,5.31003042737e+17,https://twitter.com/newsSG/status/531003042737319938,bishan mrt station,bishan
chillyixing,2014-11-08 16:40:00,0.0,0.0,I'm at Serangoon in Singapore https://www. swarmapp.com/c/4n4FI3lHj2j,,,,5.31003219549e+17,https://twitter.com/chillyixing/status/531003219548573696,serangoon mrt station,serangoon
Aaa_03L,2014-11-08 16:40:00,0.0,0.0,@DarrylAloeVera Later zai tell u.. I meeting hanwen go serangoon leh. Go eat and do the cb singpass thing.,,@DarrylAloeVera,,5.3100339542e+17,https://twitter.com/Aaa_03L/status/531003395419537409,serangoon mrt station,serangoon
ridayujaafaran,2014-11-08 16:40:00,0.0,0.0,out to go bedok,,,,5.31003420803e+17,https://twitter.com/ridayujaafaran/status/531003420803477505,bedok mrt station,bedok
Go247news,2014-11-08 16:40:00,0.0,0.0,SMRT train vandalised at #Bishan depot http:// bit.ly/1si6JjB #November082014 pic.twitter.com/KfrdhFzBHe,,,#Bishan #November082014,5.31003392723e+17,https://twitter.com/Go247news/status/531003392722612224,bishan mrt station,bishan
Bryan_Boony,2014-11-08 16:40:00,0.0,0.0,Gng yishun safra play pool lo,,,,5.31003197012e+17,https://twitter.com/Bryan_Boony/status/531003197012205568,yishun mrt station,yishun
MDA_BR,2014-11-08 16:41:00,0.0,0.0,Pasir Ris <3,,,,5.31003539427e+17,https://twitter.com/MDA_BR/status/531003539426775040,pasir ris mrt station,pasir ris
adhitya_n,2014-11-08 16:41:00,0.0,0.0,Sy berdoa mudah2an bapak rudiantara bisa mewujudkan cita2 punya speed inet setara… (at Gardens By The Bay ) — https:// path.com/p/2fRkKb,,,,5.31003648823e+17,https://twitter.com/adhitya_n/status/531003648822624257,gardens by the bay mrt station,gardens by the bay
Jxckdanial,2014-11-08 16:41:00,0.0,0.0,This time should cycle to punggol end i think,,,,5.31003572277e+17,https://twitter.com/Jxckdanial/status/531003572276580352,punggol mrt station,punggol
pl0lolop,2014-11-08 16:41:00,0.0,0.0,"""I'm glad our final is gg 2 b at serangoon stadium instead of jalan besar because the atmosphere here is fantastic"" #shitnoonefuckingsays",,,#shitnoonefuckingsays,5.31003618682e+17,https://twitter.com/pl0lolop/status/531003618682351616,jalan besar mrt station,jalan besar
badoquecafe,2014-11-08 16:42:00,0.0,0.0,Spicy Saturday with #kepakbingbing Available at #upperthomson and #simpangbedok Photo courtesy of... http:// fb.me/3sVcjvx81,,,#kepakbingbing #upperthomson #simpangbedok,5.31003772647e+17,https://twitter.com/badoquecafe/status/531003772647243778,upper thomson mrt station,upper thomson
vertebres,2014-11-08 16:43:00,0.0,0.0,"organic froyo / topped with some mango / in toa payoh -- tried all flavours (natural, chocolate,… http:// instagram.com/p/vIeg6HEuEf/",,,,5.31003972204e+17,https://twitter.com/vertebres/status/531003972203839488,toa payoh mrt station,toa payoh
youyi_yy,2014-11-08 16:45:00,0.0,2.0,"We are here at Bishan park, come and join us now! #tapme #mystorysg #joytruck #mediacorp … http:// instagram.com/p/vIex0zxld0/",,,#tapme #mystorysg #joytruck #mediacorp,5.31004554629e+17,https://twitter.com/youyi_yy/status/531004554628702208,bishan mrt station,bishan
wngss_,2014-11-08 16:45:00,0.0,0.0,I'm at Somerset MRT Station (NS23) - @smrt_singapore in Singapore https://www. swarmapp.com/c/47zfarkmmDD,,@smrt_singapore,,5.3100466725e+17,https://twitter.com/wngss_/status/531004667250364416,somerset mrt station,somerset mrt
yokewan,2014-11-08 16:45:00,0.0,0.0,A walk in the park today hehe it's been a while ericlzh88 @Pasir Ris Park http:// instagram.com/p/vIezV5mCB1/,,@Pasir,,5.31004612149e+17,https://twitter.com/yokewan/status/531004612149379072,pasir ris mrt station,pasir ris
stompsingapore,2014-11-08 16:45:00,16.0,18.0,You don't see this everyday in S'pore: Flock of parakeets at Pasir Ris St 21 http:// bit.ly/1uKUmnG pic.twitter.com/BiLlPD4iLF,,,,5.31004522484e+17,https://twitter.com/stompsingapore/status/531004522483576832,pasir ris mrt station,pasir ris
S_U_D_I_N,2014-11-08 16:46:00,0.0,0.0,Off to bras basah . Again.,,,,5.31004747336e+17,https://twitter.com/S_U_D_I_N/status/531004747336015872,bras basah mrt station,bras basah
aishiteruluv,2014-11-08 16:47:00,0.0,0.0,At Changi Airport Terminal 2 Xperience Zone — https:// path.com/p/3zynA3,,,,5.31005190238e+17,https://twitter.com/aishiteruluv/status/531005190237741057,changi airport mrt station,changi airport
_andreagbt,2014-11-08 16:47:00,0.0,1.0,#ootd to meet bbg at hougang swimming complex ! It's #exerciseday for us ! pic.twitter.com/nhxKKRXAMz,,,#ootd #exerciseday,5.3100515881e+17,https://twitter.com/_andreagbt/status/531005158809817088,hougang mrt station,hougang
kuekjuewen,2014-11-08 16:47:00,0.0,0.0,Watching some innovation event at kallang by students and seriously impressed by some pri sch kids for the coupons thing. How they do that?,,,,5.31005144893e+17,https://twitter.com/kuekjuewen/status/531005144893120513,kallang mrt station,kallang
JocelynTann,2014-11-08 16:48:00,0.0,0.0,Clarke Quay http:// instagram.com/p/vIfHzkrALl/,,,,5.31005308375e+17,https://twitter.com/JocelynTann/status/531005308374896641,clarke quay mrt station,clarke quay
Kittymeowma,2014-11-08 16:48:00,0.0,0.0,"I'm at Blk 136, Bedok Reservoir Road w/ @seanleong108 https://www. swarmapp.com/c/lKOnYARjDRH",,@seanleong108,,5.31005357448e+17,https://twitter.com/Kittymeowma/status/531005357448232962,bedok mrt station,bedok
_SSSConfessions,2014-11-08 16:49:00,0.0,0.0,#1180 Who wants our Senior Rina to come back and sing for Siglap pls RT !! :DDD,,,#1180,5.31005642723e+17,https://twitter.com/_SSSConfessions/status/531005642723450880,siglap mrt station,siglap
_SSSConfessions,2014-11-08 16:49:00,0.0,1.0,#1179 i want the Senior Rina who sang in SGT 2012 to come back and sing for Siglap again ! pleassseeee ... Love her voice ! *.*,,,#1179,5.31005594472e+17,https://twitter.com/_SSSConfessions/status/531005594472165376,siglap mrt station,siglap
