username,date,retweets,favorites,text,geo,mentions,hashtags,id,permalink,place,key
ainunhanna,2014-10-04 10:55:00,0.0,0.0,@Rwalidayn @pin_alpin11 iya iya mas bedok yg banyak fans adek kelasnya ngahahaha,,@Rwalidayn @pin_alpin11,,5.18232983049e+17,https://twitter.com/ainunhanna/status/518232983048691712,bedok mrt station,bedok
Sheila_Sim,2014-10-04 10:55:00,0.0,2.0,"118 family is gonna be at Bedok Mall, 230pm. See you later alligator! In awhile crocodile! http:// instagram.com/p/ttu2v4OVWk/",,,,5.18232795073e+17,https://twitter.com/Sheila_Sim/status/518232795072974848,bedok mrt station,bedok
HougangUnited,2014-10-04 10:55:00,0.0,0.0,"the heroes from the ""sleague"" selection takes on harimau muda B at hougang stadium #supportyourlocalleague http:// fb.me/6XyTq0F7y",,,#supportyourlocalleague,5.182330217e+17,https://twitter.com/HougangUnited/status/518233021699604480,hougang mrt station,hougang
letylesss,2014-10-04 10:55:00,0.0,0.0,"@Maiden_801 Cara, eu tenho no anime, pode ser?? vou te mandar o link de uma, mas não ria, please!! hahaah quero ler as tuas *-*",,@Maiden_801,,5.18232980926e+17,https://twitter.com/letylesss/status/518232980926369792,tuas link mrt station,tuas link
babes_mentionz,2014-10-04 10:55:00,0.0,0.0,"#Nowplaying #Deicide #HMPlaylist #DeathMetalWeekend ♫ ""Dead By Dawn"" by Deicide (@Kallang Riverside Park) http:// sdtk.fm/Z3D2LV [pic]",,@Kallang,#Nowplaying #Deicide #HMPlaylist #DeathMetalWeekend,5.18232932873e+17,https://twitter.com/babes_mentionz/status/518232932872646656,kallang mrt station,kallang
shadiqhussein,2014-10-04 10:56:00,0.0,0.0,his. #foodporn #nofilter #whitagram #instatext #waylatergram #supper @Spize@Bedok http:// instagram.com/p/ttvBl1Jw90/,,@Spize @Bedok,#foodporn #nofilter #whitagram #instatext #waylatergram #supper,5.1823316819e+17,https://twitter.com/shadiqhussein/status/518233168189849600,bedok mrt station,bedok
boyehartmann,2014-10-04 10:56:00,0.0,0.0,I'm at Singapore Changi Airport (SIN) - @fansofchangi in Singapore https://www. swarmapp.com/c/3w6XwEwDxwW,,@fansofchangi,,5.18233095129e+17,https://twitter.com/boyehartmann/status/518233095129272321,changi airport mrt station,changi airport
weatherlah,2014-10-04 10:57:00,0.0,0.0,The water level at Tampines Rd / Jalan Teliti was Drain 51% to 75% full it has now fallen to Drain <=50% full #sgflood #sgweather,,,#sgflood #sgweather,5.18233366718e+17,https://twitter.com/weatherlah/status/518233366718459904,tampines mrt station,tampines
dcslimousines,2014-10-04 10:57:00,0.0,0.0,"Just reported a hazard on West Coast Highway, Tanjong Pagar , http:// goo.gl/cSl08Z using @waze - Social GPS.",,@waze,,5.1823345248e+17,https://twitter.com/dcslimousines/status/518233452479774721,tanjong pagar mrt station,tanjong pagar
DARINECHOO98,2014-10-04 10:58:00,0.0,0.0,So xu bin(idk how spell his name) Will be at bedok mall ltr....lol,,,,5.18233790716e+17,https://twitter.com/DARINECHOO98/status/518233790716444673,bedok mrt station,bedok
hafies_djoesman,2014-10-04 10:58:00,0.0,0.0,NEXT AT BLOGG 'Sungai Menit RW.05 Tanah Merah ' http:// kualaterapung.blogspot.com / http:// fb.me/3kneabMUN,,,,5.18233753823e+17,https://twitter.com/hafies_djoesman/status/518233753823350784,tanah merah mrt station,tanah merah
shadiqhussein,2014-10-04 10:59:00,0.0,0.0,spicy breakfast. #nofilter #foodporn #macaroni #homemade #homecooked @Punggol Punks http:// instagram.com/p/ttvXv9Jw-R/,,@Punggol,#nofilter #foodporn #macaroni #homemade #homecooked,5.18233929808e+17,https://twitter.com/shadiqhussein/status/518233929808367616,punggol mrt station,punggol
ginafauziah_n,2014-10-04 10:59:00,0.0,0.0,Satu hari hanya kamu dan dirimu menikmatin tanah yang kau injak memandangin langin… ♫ Tanggal Merah by Tulus — https:// path.com/p/4vGC9c,,,,5.18233977497e+17,https://twitter.com/ginafauziah_n/status/518233977497194496,tanah merah mrt station,tanah merah
ch8sg,2014-10-04 11:00:00,1.0,4.0,"Star-studded cast for brandnew socio-drama 《118》 starting 20 Oct, every Mon to Fri, 7.30pm. Meet them at Bedok ... http:// fb.me/2g73lPnwH",,,,5.1823406023e+17,https://twitter.com/ch8sg/status/518234060230234112,bedok mrt station,bedok
yap_weijie,2014-10-04 11:00:00,0.0,0.0,@CH3RYLLLL yew tee no nice food!,,@CH3RYLLLL,,5.18234099547e+17,https://twitter.com/yap_weijie/status/518234099547271168,yew tee mrt station,yew tee
weatherlah,2014-10-04 11:01:00,0.0,0.0,The water level at Bishan St 21 was Drain 51% to 75% full it has now fallen to Drain <=50% full #sgflood #sgweather,,,#sgflood #sgweather,5.18234398643e+17,https://twitter.com/weatherlah/status/518234398643060736,bishan mrt station,bishan
aiyanything,2014-10-04 11:01:00,0.0,0.0,"wow Pandora is everywhere now. bishan have, serangoon going to open one more hahahs",,,,5.18234467539e+17,https://twitter.com/aiyanything/status/518234467538714624,bishan mrt station,bishan
Vanagloria21,2014-10-04 11:02:00,0.0,0.0,I'm at Leisure Park Kallang in Singapore https://www. swarmapp.com/c/bd1CWSmBZyi,,,,5.18234610842e+17,https://twitter.com/Vanagloria21/status/518234610841686016,kallang mrt station,kallang
StopDropRO,2014-10-04 11:02:00,0.0,0.0,Working at bedok can die de sia. The distance:(,,,,5.18234784456e+17,https://twitter.com/StopDropRO/status/518234784456138752,bedok mrt station,bedok
jcxe__,2014-10-04 11:03:00,0.0,0.0,Heading to nex (@Sengkang MRT /LRT Interchange (NE16/STC) in Singapore) https://www. swarmapp.com/c/iyuC8vXngWO,,@Sengkang,,5.18235013566e+17,https://twitter.com/jcxe__/status/518235013566177280,sengkang mrt station,sengkang mrt
babes_mentionz,2014-10-04 11:04:00,0.0,0.0,#Nowplaying 1000 Eyes #Death #Symbolic #HMPlaylist #DeathMetalWeekend R.I.P Chuck \m/\m/ @Eunos MRT … http:// instagram.com/p/ttv9eTjRoW/,,@Eunos,#Nowplaying #Death #Symbolic #HMPlaylist #DeathMetalWeekend,5.18235225899e+17,https://twitter.com/babes_mentionz/status/518235225898627072,eunos mrt station,eunos mrt
4feetchxrry,2014-10-04 11:04:00,0.0,0.0,I'm at Bishan @PublicLibrarySg in Singapore https://www. swarmapp.com/c/lg2BIw02JTV,,@PublicLibrarySg,,5.18235241921e+17,https://twitter.com/4feetchxrry/status/518235241920884736,bishan mrt station,bishan
c4ncersticks,2014-10-04 11:05:00,0.0,0.0,Wan to go kallang wave,,,,5.18235543155e+17,https://twitter.com/c4ncersticks/status/518235543155376128,kallang mrt station,kallang
AziqNazim,2014-10-04 11:05:00,0.0,1.0,@NazSaarute rindu browsing pat aljunied isit?,,@NazSaarute,,5.18235326616e+17,https://twitter.com/AziqNazim/status/518235326616043521,aljunied mrt station,aljunied
DesignerGrabs,2014-10-04 11:05:00,0.0,0.0,Hujan rahmat di Tampines ... Alhamdulillah... Selamat Berpuasa semua ~ :),,,,5.1823536869e+17,https://twitter.com/DesignerGrabs/status/518235368689516544,tampines mrt station,tampines
KhairiGrimmie,2014-10-04 11:05:00,0.0,0.0,Otw to Tanah Merah and there's a jam. Plus its raining heavily. Damn,,,,5.18235424884e+17,https://twitter.com/KhairiGrimmie/status/518235424884396033,tanah merah mrt station,tanah merah
AmaLeaMit,2014-10-04 11:06:00,0.0,0.0,"Old lighthouse through the lovely vegetation. #nofilter #latergram @Fort Canning Park, Singapore http:// instagram.com/p/ttwHzhOPBV/",,@Fort,#nofilter #latergram,5.18235580493e+17,https://twitter.com/AmaLeaMit/status/518235580493496321,fort canning mrt station,fort canning
kartikaaacandra,2014-10-04 11:07:00,0.0,0.0,At Jungle WaterWorld tanah merah,,,,5.1823604289e+17,https://twitter.com/kartikaaacandra/status/518236042890342400,tanah merah mrt station,tanah merah
tanhuiyi,2014-10-04 11:08:00,0.0,1.0,Just had my 1st driving experience in a thunderstorm. It's pouring in Bedok .,,,,5.18236188197e+17,https://twitter.com/tanhuiyi/status/518236188197388289,bedok mrt station,bedok
KennyTheGiant,2014-10-04 11:08:00,2.0,2.0,I'm at Blk 172 Bishan Street 13 in Singapore https://www. swarmapp.com/c/4Kd9xiJ5cbi,,,,5.18236072221e+17,https://twitter.com/KennyTheGiant/status/518236072220692480,bishan mrt station,bishan
CharlesENERO,2014-10-04 11:08:00,0.0,5.0,"Tanah Merah Ferry Terminal knows no customer service at all: one question, one answer. Please explain your procedure beetch!",,,,5.18236220649e+17,https://twitter.com/CharlesENERO/status/518236220648738817,tanah merah mrt station,tanah merah
itslynnykansas,2014-10-04 11:08:00,0.0,0.0,The Greasy spoon breakfast at #opendoorpolicy #yum #breakfast #pigout #tiongbahru #itslynnykansas http:// instagram.com/p/ttwdBkAvXa/,,,#opendoorpolicy #yum #breakfast #pigout #tiongbahru #itslynnykansas,5.18236309745e+17,https://twitter.com/itslynnykansas/status/518236309744529408,tiong bahru mrt station,tiong bahru
LeowJean,2014-10-04 11:08:00,0.0,0.0,Any rangels going bedok mall today?,,,,5.18236067787e+17,https://twitter.com/LeowJean/status/518236067787329537,bedok mrt station,bedok
reformingroy,2014-10-04 11:08:00,0.0,0.0,Homework group. @Serangoon North Ave 4 Blk 511 http:// instagram.com/p/ttwYQYO0QC/,,@Serangoon,,5.18236147471e+17,https://twitter.com/reformingroy/status/518236147470716928,serangoon mrt station,serangoon
grantcunt,2014-10-04 11:10:00,0.0,0.0,Which school are you in? — tampines seccccc :) http:// ask.fm/a/b89biii4,,,,5.18236570521e+17,https://twitter.com/grantcunt/status/518236570521194496,tampines mrt station,tampines
N_E_V_I_L_L_E,2014-10-04 11:10:00,0.0,0.0,I'm at Bayfront MRT Interchange (CE1/DT16) in Singapore https://www. swarmapp.com/c/6ifqKjbY5fT,,,,5.18236794036e+17,https://twitter.com/N_E_V_I_L_L_E/status/518236794035658753,bayfront mrt station,bayfront mrt
Bluryoses,2014-10-04 11:10:00,0.0,0.0,I hope that im not late tho ! Still at punggol omg hahahah,,,,5.18236661818e+17,https://twitter.com/Bluryoses/status/518236661818216448,punggol mrt station,punggol
FiizyBubbles,2014-10-04 11:11:00,0.0,0.0,heavy rain at tanjong pagar,,,,5.18236875057e+17,https://twitter.com/FiizyBubbles/status/518236875056619520,tanjong pagar mrt station,tanjong pagar
rhnhtbrt,2014-10-04 11:11:00,0.0,0.0,Dah penat sagat .. From pasir ris fishing but no fish . Wth ! pic.twitter.com/kd23958OOr,,,,5.18236888923e+17,https://twitter.com/rhnhtbrt/status/518236888923000833,pasir ris mrt station,pasir ris
AmaLeaMit,2014-10-04 11:11:00,0.0,0.0,"Gothic gate. #fortcanningpark #singapore @Fort Canning Park, Singapore http:// instagram.com/p/ttwyDcOPCJ/",,@Fort,#fortcanningpark #singapore,5.1823703379e+17,https://twitter.com/AmaLeaMit/status/518237033790046209,fort canning mrt station,fort canning
FiizyBubbles,2014-10-04 11:12:00,0.0,0.0,ooooo cpt la RT @MuhdAzwann: ooooooooo RT @FiizyBubbles : heavy rain at tanjong pagar,,@MuhdAzwann @FiizyBubbles,,5.18237221775e+17,https://twitter.com/FiizyBubbles/status/518237221774585856,tanjong pagar mrt station,tanjong pagar
missdeety,2014-10-04 11:13:00,0.0,0.0,Today! RT @BlessIncAsia : #sharingthegoodnews : Mini Melissa party happening at their One Raffles Place ... http:// tmi.me/1eMtd2,,@BlessIncAsia,#sharingthegoodnews,5.18237337554e+17,https://twitter.com/missdeety/status/518237337554145280,raffles place mrt station,raffles place
FiizyBubbles,2014-10-04 11:14:00,0.0,0.0,lmbt pe RT @MuhdAzwann: lagi 3 station RT @FiizyBubbles : ooooo cpt la RT @MuhdAzwann: oooooooo RT @FiizyBubbles : heavy rain at tanjong pagar,,@MuhdAzwann @FiizyBubbles @MuhdAzwann @FiizyBubbles,,5.18237631978e+17,https://twitter.com/FiizyBubbles/status/518237631977512960,tanjong pagar mrt station,tanjong pagar
BrianEmma2,2014-10-04 11:14:00,0.0,0.0,Outdoor rink seeing as how kid at preschool punggol : xEJSBDEgw,,,,5.18237673426e+17,https://twitter.com/BrianEmma2/status/518237673425629184,punggol mrt station,punggol
mnbtmn,2014-10-04 11:14:00,0.0,0.0,@ShayifulEusoff youre at yishun ?,,@ShayifulEusoff,,5.1823769446e+17,https://twitter.com/mnbtmn/status/518237694460035072,yishun mrt station,yishun
AmaLeaMit,2014-10-04 11:15:00,0.0,0.0,I need to post another one of these. #nofilter @Fort Canning Park http:// instagram.com/p/ttxJ35uPCz/,,@Fort,#nofilter,5.18237850388e+17,https://twitter.com/AmaLeaMit/status/518237850387890176,fort canning mrt station,fort canning
weatherlah,2014-10-04 11:17:00,0.0,0.0,The water level at Kallang River (Braddell Rd) was Drain 51% to 75% full it has now fallen to Drain <=50% full #sgflood #sgweather,,,#sgflood #sgweather,5.18238442149e+17,https://twitter.com/weatherlah/status/518238442149257216,kallang mrt station,kallang
thedijah,2014-10-04 11:17:00,0.0,0.0,"Hello jitraaaa (@Stesen Bas Tanah Merah in Jitra, Kedah) https://www. swarmapp.com/c/0gkCxzuCAZ3",,@Stesen,,5.18238427243e+17,https://twitter.com/thedijah/status/518238427243118592,tanah merah mrt station,tanah merah
flyingkiss_G1,2014-10-04 11:17:00,0.0,0.0,@gdragonnnnn transfer to Tampines already hahaha,,@gdragonnnnn,,5.18238443147e+17,https://twitter.com/flyingkiss_G1/status/518238443147497472,tampines mrt station,tampines
QieyQSHY,2014-10-04 11:18:00,0.0,0.0,"@NHanimHashim i dkt Tanah Merah ,Kelantan.. Huhuhu",,@NHanimHashim,,5.18238776519e+17,https://twitter.com/QieyQSHY/status/518238776519184384,tanah merah mrt station,tanah merah
amin_nasrin,2014-10-04 11:18:00,0.0,0.0,tanah merah,,,,5.18238768412e+17,https://twitter.com/amin_nasrin/status/518238768411578368,tanah merah mrt station,tanah merah
sgdailynews6,2014-10-04 11:19:00,0.0,0.0,The following is a comment by a PAP grassroots leader at its Bedok branch. This individual Kenneth Vaithilingam... http:// fb.me/7i1xPDOVd,,,,5.18238954223e+17,https://twitter.com/sgdailynews6/status/518238954223456256,bedok mrt station,bedok
CMantaras13,2014-10-04 11:20:00,0.0,0.0,Explota buona vista,,,,5.18239183145e+17,https://twitter.com/CMantaras13/status/518239183144755200,buona vista mrt station,buona vista
lalalamoca,2014-10-04 11:20:00,0.0,0.0,"Long time no upload, i miss you guys!! #tb #aidilfitri2014 @hougang ave 4 blk 668 http:// instagram.com/p/ttx0z8JZk3/",,@hougang,#tb #aidilfitri2014,5.18239326229e+17,https://twitter.com/lalalamoca/status/518239326229245952,hougang mrt station,hougang
L_KIM_MYUNGSOO,2014-10-04 11:20:00,1.0,0.0,"""Sentosa near pasir ris anot "" - @dorene_ang WTFFF TO LAUGH OR TO CRY LMAO",,@dorene_ang,,5.18239092904e+17,https://twitter.com/L_KIM_MYUNGSOO/status/518239092903915520,pasir ris mrt station,pasir ris
YongsukHur,2014-10-04 11:21:00,0.0,0.0,I'm at Bedok MRT Station (EW5) - @smrt_singapore in Singapore http:// 4sq.com/1oHnPGY,,@smrt_singapore,,5.18239492416e+17,https://twitter.com/YongsukHur/status/518239492415959040,bedok mrt station,bedok
YongsukHur,2014-10-04 11:21:00,0.0,0.0,I'm at Tanah Merah MRT Interchange (EW4) - @smrt_singapore in Singapore http:// 4sq.com/1uIVmrv,,@smrt_singapore,,5.18239543758e+17,https://twitter.com/YongsukHur/status/518239543758442496,tanah merah mrt station,tanah merah
MoveDatKakaArun,2014-10-04 11:22:00,0.0,0.0,"The lights were too bright, so I had to Dim Sum #BADJOKESATURDAY @Tim Ho Wan 添好運 at Bedok Mall http:// instagram.com/p/ttx8z9voqR/",,@Tim,#BADJOKESATURDAY,5.18239601908e+17,https://twitter.com/MoveDatKakaArun/status/518239601907871744,bedok mrt station,bedok
yanwingray,2014-10-04 11:22:00,0.0,0.0,Sweet seats. @Kallang MRT Station http:// instagram.com/p/ttx-Jsv__H/,,@Kallang,,5.1823964701e+17,https://twitter.com/yanwingray/status/518239647009636352,kallang mrt station,kallang
FizzFizul,2014-10-04 11:23:00,0.0,0.0,@AkuTweetFakta kekasih & EX dah arwah.. merah lagi tanah .. emmm.,,@AkuTweetFakta,,5.18239942842e+17,https://twitter.com/FizzFizul/status/518239942841884672,tanah merah mrt station,tanah merah
Evo9Nexus,2014-10-04 11:24:00,0.0,0.0,@shawnheng96 haha I go tampines one .next time lah haha,,@shawnheng96,,5.18240186258e+17,https://twitter.com/Evo9Nexus/status/518240186258292736,tampines mrt station,tampines
Buttercreamkia,2014-10-04 11:24:00,0.0,0.0,Saw Chen wei lian at bishan MRT. How many ppl still remember this blind singer? Everyone just walks past him like he's never a somebody,,,,5.18240239274e+17,https://twitter.com/Buttercreamkia/status/518240239274295298,bishan mrt station,bishan
ddl_muses,2014-10-04 11:25:00,0.0,0.0,@Real_Liam_Payne I love tampines too,,@Real_Liam_Payne,,5.18240583568e+17,https://twitter.com/ddl_muses/status/518240583567949824,tampines mrt station,tampines
w1cfm0,2014-10-04 11:26:00,0.0,0.0,eating lunch at Toastbox Bishan Junction 8 http:// fb.me/6ZeLBkCyF,,,,5.18240682784e+17,https://twitter.com/w1cfm0/status/518240682784198656,bishan mrt station,bishan
bibiayiem,2014-10-04 11:27:00,0.0,0.0,"WAJIB balik kelate makan mi kuah . @Mee Mat Zain, Atas Pasar Tanah Merah , Kelantan http:// instagram.com/p/ttynXlgiO9/",,@Mee,,5.1824106481e+17,https://twitter.com/bibiayiem/status/518241064809820160,tanah merah mrt station,tanah merah
Masqueradeswan,2014-10-04 11:27:00,0.0,0.0,@sayhonnn headache and gastric pain but I was sober... I'm at bedok eh hehe,,@sayhonnn,,5.18241046443e+17,https://twitter.com/Masqueradeswan/status/518241046442938369,bedok mrt station,bedok
lovelypal2010,2014-10-04 11:28:00,0.0,0.0,Wake up early to play online game. Now I'm having the lunch my dad buy @Singapore Sembawang http:// instagram.com/p/ttyuZDPSV3/,,@Singapore,,5.18241304133e+17,https://twitter.com/lovelypal2010/status/518241304132980736,sembawang mrt station,sembawang
therealdingg,2014-10-04 11:28:00,0.0,0.0,@MissJuneo sorry D:!! Y'all go eat first bah I don't think I'll reach by 12 I'm still around yio chu kang,,@MissJuneo,,5.18241196838e+17,https://twitter.com/therealdingg/status/518241196838109185,yio chu kang mrt station,yio chu kang
amirahrazalee,2014-10-04 11:28:00,0.0,0.0,Im soo going BEDOK later to get my KFC FROYO,,,,5.18241335493e+17,https://twitter.com/amirahrazalee/status/518241335493419008,bedok mrt station,bedok
merrylashes,2014-10-04 11:29:00,0.0,0.0,omg there's cath kidston at tampines ?!,,,,5.18241418339e+17,https://twitter.com/merrylashes/status/518241418339303424,tampines mrt station,tampines
angelseahx3,2014-10-04 11:29:00,0.0,0.0,Woke up with feels for churros and pancakes! But it's raining here at pasir ris,,,,5.18241532013e+17,https://twitter.com/angelseahx3/status/518241532013326336,pasir ris mrt station,pasir ris
_IqbalShafiq,2014-10-04 11:31:00,0.0,0.0,Aku mimpi brazil main dengan singapore nti kat jalan besar . Fred paling comel.,,,,5.18242086962e+17,https://twitter.com/_IqbalShafiq/status/518242086961692672,jalan besar mrt station,jalan besar
LeadsGenSupport,2014-10-04 11:31:00,0.0,0.0,E & G Tools Pte Ltd: 5 Upper Aljunied Link #03-02 QUARTZ INDUSTRIAL BUILDING Singapore 367903 Average rating o... http:// bit.ly/10qgHZT,,,#03,5.18241967848e+17,https://twitter.com/LeadsGenSupport/status/518241967847657472,aljunied mrt station,aljunied
mnhq_,2014-10-04 11:32:00,0.0,0.0,Saw daddy loo at bedok mall,,,,5.18242115537e+17,https://twitter.com/mnhq_/status/518242115537481728,bedok mrt station,bedok
matthewpjamess,2014-10-04 11:32:00,0.0,0.0,"Lol this girl.. Saying Lorong Chuan as ""Long long one""",,,,5.18242217522e+17,https://twitter.com/matthewpjamess/status/518242217521991680,lorong chuan mrt station,lorong chuan
hsetiadi,2014-10-04 11:32:00,0.0,0.0,Arrivedd (at Gate B1-B4 @T3 Changi Airport ) — https:// path.com/p/nDy65,,@T3,,5.18242257615e+17,https://twitter.com/hsetiadi/status/518242257615331328,changi airport mrt station,changi airport
aafham,2014-10-04 11:32:00,0.0,0.0,I'm at Perumahan Awam Tanah Merah https://www. swarmapp.com/c/6NMVO2KFnB0,,,,5.18242123239e+17,https://twitter.com/aafham/status/518242123238608897,tanah merah mrt station,tanah merah
hersheytugadi,2014-10-04 11:34:00,0.0,1.0,I'm at Singapore Changi Airport (SIN) - @fansofchangi in Singapore w/ @otsgomez https://www. swarmapp.com/c/gxsFoWwg9IC,,@fansofchangi @otsgomez,,5.18242795229e+17,https://twitter.com/hersheytugadi/status/518242795229020161,changi airport mrt station,changi airport
EngJingYu,2014-10-04 11:34:00,0.0,0.0,Omg so apparently dhoby ghaut stands for washing place in Hindi. #themoreyouknow,,,#themoreyouknow,5.18242848073e+17,https://twitter.com/EngJingYu/status/518242848072671232,dhoby ghaut mrt station,dhoby ghaut
H_Supremo,2014-10-04 11:34:00,0.0,0.0,Idky i bring umbrella for bcos at yishun jn raining in the mawning,,,,5.18242669718e+17,https://twitter.com/H_Supremo/status/518242669718282241,yishun mrt station,yishun
fatahbunehneh,2014-10-04 11:36:00,0.0,1.0,suppose to reach boon lay before 12. and now im still at hougang wow,,,,5.18243323011e+17,https://twitter.com/fatahbunehneh/status/518243323010506752,boon lay mrt station,boon lay
osnapitzlex,2014-10-04 11:37:00,0.0,0.0,@feefifofilza YES I DO ITS NEAR THE HOUGANG GREEN AND THE INSTITUTE AND U SENT ME A PIC LAST TIME,,@feefifofilza,,5.18243441504e+17,https://twitter.com/osnapitzlex/status/518243441503784960,hougang mrt station,hougang
gohjueqi,2014-10-04 11:39:00,0.0,0.0,@yuentingpwnz ok I at bukit batok !! 1 more stop!!!,,@yuentingpwnz,,5.18244001401e+17,https://twitter.com/gohjueqi/status/518244001401434112,bukit batok mrt station,bukit batok
babes_mentionz,2014-10-04 11:40:00,0.0,0.0,#Nowplaying Savagely Beaten #Inveracity #HMPlaylist #DeathMetalWeekend @Tampines Bus Interchange http:// instagram.com/p/tt0FWijRu6/,,@Tampines,#Nowplaying #Inveracity #HMPlaylist #DeathMetalWeekend,5.18244293153e+17,https://twitter.com/babes_mentionz/status/518244293153402881,tampines mrt station,tampines
j86869n,2014-10-04 11:41:00,0.0,0.0,"Photo: To market, to market to buy a fat….. (at Boon Lay Community) http:// tmblr.co/ZEVDfn1SJG-z5",,,,5.18244516269e+17,https://twitter.com/j86869n/status/518244516269420545,boon lay mrt station,boon lay
j86869n,2014-10-04 11:41:00,0.0,0.0,"To market, to market to buy a fat..... @Boon Lay Community http:// instagram.com/p/tt0LfAHtkK/",,@Boon,,5.18244503502e+17,https://twitter.com/j86869n/status/518244503501930496,boon lay mrt station,boon lay
SiCimicimi,2014-10-04 11:42:00,0.0,0.0,#SicimiKepo Tanah merah atau tanah kapur?,,,#SicimiKepo,5.18244817018e+17,https://twitter.com/SiCimicimi/status/518244817017782272,tanah merah mrt station,tanah merah
Yeni_Rahmann,2014-10-04 11:43:00,0.0,0.0,at Changi Airport http:// fb.me/6N2eqPxyr,,,,5.18244926024e+17,https://twitter.com/Yeni_Rahmann/status/518244926023536640,changi airport mrt station,changi airport
Iamedwardjingle,2014-10-04 11:43:00,0.0,0.0,@AizuddinHashim @TheDruggie for din to traverse to tamp to far. HOUGANG LAI LAIIII,,@AizuddinHashim @TheDruggie,,5.18244923494e+17,https://twitter.com/Iamedwardjingle/status/518244923493986304,hougang mrt station,hougang
eddyxzain,2014-10-04 11:44:00,0.0,0.0,Simei with Uncle Radha,,,,5.18245299652e+17,https://twitter.com/eddyxzain/status/518245299651756032,simei mrt station,simei
cblake,2014-10-04 11:44:00,0.0,0.0,Off to Malaysia for a spot of shopping on a lazy Saturday afternoon. (@Bus Stop 45139 ( Kranji Station )) https://www. swarmapp.com/c/43Go3tgG8Wg,,@Bus,,5.18245293969e+17,https://twitter.com/cblake/status/518245293968859137,kranji mrt station,kranji station
sehayana,2014-10-04 11:44:00,0.0,0.0,@AbuShauqi ade laaa. Tanah merah . Pstu nok cri kwn mu hok duk jeli hok ade kebun or. Ingat dop?? Hahaha,,@AbuShauqi,,5.18245273202e+17,https://twitter.com/sehayana/status/518245273202483200,tanah merah mrt station,tanah merah
tintinnz,2014-10-04 11:45:00,0.0,0.0,Memories and a sinful breakfast. (@Bishan - Ang Mo Kio Park in Singapore) https://www. swarmapp.com/c/axce2vwx5oD,,@Bishan,,5.18245487377e+17,https://twitter.com/tintinnz/status/518245487376617473,ang mo kio mrt station,ang mo kio
hussamkondarji,2014-10-04 11:45:00,0.0,0.0,Flying 2 CGK (@Singapore Changi Airport (SIN) - @fansofchangi in Singapore) https://www. swarmapp.com/c/gd0KfokMuxb,,@Singapore @fansofchangi,,5.18245547535e+17,https://twitter.com/hussamkondarji/status/518245547535499264,changi airport mrt station,changi airport
_Pandari,2014-10-04 11:45:00,0.0,0.0,@gdragonnnnn yeaaa rmb tanjong pagar there? Hahah so tiring aye and all i do is sit down only last min i go walkwalk AHAHA,,@gdragonnnnn,,5.18245409295e+17,https://twitter.com/_Pandari/status/518245409295069184,tanjong pagar mrt station,tanjong pagar
russelwongphoto,2014-10-04 11:46:00,0.0,0.0,My family home gone..sad. #siglap http:// instagram.com/p/tt0yT0vZgw/,,,#siglap,5.18245837375e+17,https://twitter.com/russelwongphoto/status/518245837374517248,siglap mrt station,siglap
hweeeechieh,2014-10-04 11:46:00,0.0,0.0,Urgkkkk that travel from nus to pasir ris .,,,,5.18245722924e+17,https://twitter.com/hweeeechieh/status/518245722924138496,pasir ris mrt station,pasir ris
u_unita,2014-10-04 11:48:00,0.0,0.0,Game of this long weekend..! (at Blk 165 Bishan Street 13) [pic] — https:// path.com/p/4ruR2Z,,,,5.18246342893e+17,https://twitter.com/u_unita/status/518246342892609536,bishan mrt station,bishan
anakhaswan,2014-10-04 11:49:00,1.0,0.0,Alhamdulillah . Sampai Harbourfront MRT Station sudah~ (: #Hwaiting #ShapeUpYourLife http:// instagram.com/p/tt1GgSKpvi/,,,#Hwaiting #ShapeUpYourLife,5.18246530768e+17,https://twitter.com/anakhaswan/status/518246530768453632,harbourfront mrt station,harborfront mrt
stompsingapore,2014-10-04 11:49:00,1.0,3.0,Bloody brawl after woman's fatal fall from Toa Payoh block http:// bit.ly/1rxysSr http:// twitpic.com/ecd9mo,,,,5.18246609847e+17,https://twitter.com/stompsingapore/status/518246609847480320,toa payoh mrt station,toa payoh
reefonline,2014-10-04 11:50:00,0.0,0.0,captain jack sparrow and comodore barbosa terrorizing the south east asian pirate fleets @Punggol … http:// instagram.com/p/tt1NEXKMPl/,,@Punggol,,5.18246756804e+17,https://twitter.com/reefonline/status/518246756803706880,punggol mrt station,punggol
isra_fill,2014-10-04 11:51:00,1.0,0.0,"Putih-putih Kain Kafan, Merah - merah Tanah Kubur, Iman dan Takwa jadi Bekalan, Hidup janganlah sombong dan Takbur...",,,,5.18247081103e+17,https://twitter.com/isra_fill/status/518247081102700545,tanah merah mrt station,tanah merah
dkkcrew_smg,2014-10-04 11:51:00,0.0,0.0,@AyuMarhaendra depan tbrs persis pinggir jalan besar jadi kelihatan bgt,,@AyuMarhaendra,,5.18247043535e+17,https://twitter.com/dkkcrew_smg/status/518247043534716928,jalan besar mrt station,jalan besar
