username,date,retweets,favorites,text,geo,mentions,hashtags,id,permalink,place,key
nigi2nigi,2014-11-08 12:33:00,0.0,0.0,#nigijourney #singapore @Changi Airport http:// instagram.com/p/vIB7M3SsQY/,,@Changi,#nigijourney #singapore,5.30941106276e+17,https://twitter.com/nigi2nigi/status/530941106276425728,changi airport mrt station,changi airport
Twt_Larkin,2014-11-08 12:33:00,2.0,3.0,"AFF Suzuki 2014, Singapura tuan rumah dan menggunakan 2 stadium bagi perlawanan peringkat kumpulan Stadium Jalan Besar dan Stadium Nasional",,,,5.3094127308e+17,https://twitter.com/Twt_Larkin/status/530941273079685120,jalan besar mrt station,jalan besar
RobinPullil,2014-11-08 12:34:00,0.0,0.0,Gardens By the Bay : http:// youtu.be/CbJURNDWbL4 via @YouTube,,@YouTube,,5.30941490525e+17,https://twitter.com/RobinPullil/status/530941490524991488,gardens by the bay mrt station,gardens by the bay
WeWePee,2014-11-08 12:34:00,0.0,0.0,@TheRonRonRon at least you're not in pasir ris,,@TheRonRonRon,,5.30941324166e+17,https://twitter.com/WeWePee/status/530941324166320128,pasir ris mrt station,pasir ris
AmrZln,2014-11-08 12:35:00,0.0,0.0,@daimshah_ serangoon stadium 7pm bro mahu join aku and halis?,,@daimshah_,,5.30941678551e+17,https://twitter.com/AmrZln/status/530941678551449600,serangoon mrt station,serangoon
ericljy,2014-11-08 12:36:00,0.0,0.0,@roldroldxz really look like you sia wear singlet all. Transit road there. Upperthomson . You were at the bus stop,,@roldroldxz,,5.30941819224e+17,https://twitter.com/ericljy/status/530941819224215552,upper thomson mrt station,upper thomson
nabil_sufyan,2014-11-08 12:36:00,0.0,0.0,Come marsiling ah b,,,,5.30942011567e+17,https://twitter.com/nabil_sufyan/status/530942011566596096,marsiling mrt station,marsiling
RaymondLau_,2014-11-08 12:37:00,0.0,0.0,Kallang iceworld open woohoo! Time to go there n try it out,,,,5.30942129699e+17,https://twitter.com/RaymondLau_/status/530942129699184641,kallang mrt station,kallang
angbaopig,2014-11-08 12:37:00,0.0,0.0,U made me travel me all the way to redhill and when the doors are closed and u dont have the freakin keys u told me to go to pasir ris,,,,5.30942080072e+17,https://twitter.com/angbaopig/status/530942080072167425,pasir ris mrt station,pasir ris
Yo_Kaii_,2014-11-08 12:37:00,0.0,0.0,On the way to Yishun now,,,,5.30942218136e+17,https://twitter.com/Yo_Kaii_/status/530942218136059904,yishun mrt station,yishun
tracyeinny,2014-11-08 12:37:00,0.0,0.0,Drop by our stores this weekend for our #newarrivals ! Store Locator : Bishan Junction 8... http:// fb.me/6TPtbVjBh,,,#newarrivals,5.30942088436e+17,https://twitter.com/tracyeinny/status/530942088435994625,bishan mrt station,bishan
QtieFoxes,2014-11-08 12:38:00,0.0,0.0,I'm at Bedok Mall in Singapore https://www. swarmapp.com/c/9erXQfOZI7d,,,,5.30942305709e+17,https://twitter.com/QtieFoxes/status/530942305709326337,bedok mrt station,bedok
reaperowl,2014-11-08 12:38:00,0.0,0.0,What's there to do in punggol ??,,,,5.30942392221e+17,https://twitter.com/reaperowl/status/530942392220672000,punggol mrt station,punggol
Twt_Larkin,2014-11-08 12:39:00,8.0,4.0,"AFF Suzuki, 2 perlawanan awal berlangsung di Stadium Jalan Besar , penyokong Malaysia ditempatkan digrandstand dengan 3,000 tiket (SGD 26)",,,,5.30942667619e+17,https://twitter.com/Twt_Larkin/status/530942667618676736,jalan besar mrt station,jalan besar
ZHIYIN_,2014-11-08 12:39:00,0.0,0.0,I'm at Basketball Court @Bukit Gombak CC https://www. swarmapp.com/c/aZi8nr5FwdO,,@Bukit,,5.3094278693e+17,https://twitter.com/ZHIYIN_/status/530942786930237440,bukit gombak mrt station,bukit gombak
JoshGandJaneO,2014-11-08 12:40:00,5.0,0.0,Pasir Ris Jane Oineza On ItsShowtime JoshAne On BananaSplitExtraScoop,,,,5.30942999279e+17,https://twitter.com/JoshGandJaneO/status/530942999279050752,pasir ris mrt station,pasir ris
JoshGandJaneO,2014-11-08 12:41:00,2.0,0.0,Tampines Jane Oineza On ItsShowtime JoshAne On BananaSplitExtraScoop,,,,5.30943043349e+17,https://twitter.com/JoshGandJaneO/status/530943043348598784,tampines mrt station,tampines
JoshGandJaneO,2014-11-08 12:41:00,1.0,0.0,Simei Jane Oineza On ItsShowtime JoshAne On BananaSplitExtraScoop,,,,5.30943067747e+17,https://twitter.com/JoshGandJaneO/status/530943067746869249,simei mrt station,simei
JoshGandJaneO,2014-11-08 12:41:00,0.0,0.0,Bedok Jane Oineza On ItsShowtime JoshAne On BananaSplitExtraScoop,,,,5.30943151637e+17,https://twitter.com/JoshGandJaneO/status/530943151637139456,bedok mrt station,bedok
JoshGandJaneO,2014-11-08 12:41:00,1.0,0.0,Tanah Merah Jane Oineza On ItsShowtime JoshAne On BananaSplitExtraScoop,,,,5.30943117898e+17,https://twitter.com/JoshGandJaneO/status/530943117898158080,tanah merah mrt station,tanah merah
NaoiseGaffney,2014-11-08 12:41:00,0.0,0.0,It's so hot. I'm on my third sweat-shower. (@Gardens By The Bay in Singapore) https://www. swarmapp.com/c/l6bXLYu2xEw,,@Gardens,,5.30943157891e+17,https://twitter.com/NaoiseGaffney/status/530943157891268610,gardens by the bay mrt station,gardens by the bay
Jialeeeee,2014-11-08 12:41:00,0.0,0.0,@AliciaKoh kallang only! Okay one Lai Lai Lai~ HAHAHAHAHA!,,@AliciaKoh,,5.30943249734e+17,https://twitter.com/Jialeeeee/status/530943249733537792,kallang mrt station,kallang
LTAsg,2014-11-08 12:43:00,0.0,0.0,Obstacle on PIE (towards Tuas) at Bedok North Rd Entrance. Bedok North Rd Entrance closed,,,,5.30943696326e+17,https://twitter.com/LTAsg/status/530943696326238208,bedok mrt station,bedok
joshua57ng,2014-11-08 12:43:00,0.0,0.0,I'm at Boon Lay MRT Station (EW27) - @smrt_singapore in Singapore https://www. swarmapp.com/c/9NjIsGxO5RV,,@smrt_singapore,,5.30943656984e+17,https://twitter.com/joshua57ng/status/530943656984084481,boon lay mrt station,boon lay
mohdamizal,2014-11-08 12:44:00,0.0,0.0,Bishan jahat sangat ka ?,,,,5.30943914866e+17,https://twitter.com/mohdamizal/status/530943914866262016,bishan mrt station,bishan
dnafrhna,2014-11-08 12:44:00,0.0,1.0,@_heyyrixn entah? Hahaha! 315? Journey from pasir ris to somerset how long?,,@_heyyrixn,,5.30943804137e+17,https://twitter.com/dnafrhna/status/530943804136648704,pasir ris mrt station,pasir ris
Alvin_lim19,2014-11-08 12:45:00,0.0,0.0,Fucking bacteria at Jurong East .,,,,5.30944128084e+17,https://twitter.com/Alvin_lim19/status/530944128083709952,jurong east mrt station,jurong east
Alvin_lim19,2014-11-08 12:46:00,0.0,0.0,I am never sitting at Jurong East MRT ever again.,,,,5.30944316869e+17,https://twitter.com/Alvin_lim19/status/530944316869316608,jurong east mrt station,jurong east
eddie97g,2014-11-08 12:46:00,0.0,1.0,I just saw Adrian Peterson at the gas station I know he lives in the woodlands and all but I've never seen around @AdrianPeterson,,@AdrianPeterson,,5.30944399984e+17,https://twitter.com/eddie97g/status/530944399983648768,woodlands mrt station,woodlands station
lwenzhen_,2014-11-08 12:48:00,0.0,0.0,It has been a long time since i took bus 21 from pasir ris to bedok ~,,,,5.3094488539e+17,https://twitter.com/lwenzhen_/status/530944885390462976,bedok mrt station,bedok
GohGilbert,2014-11-08 12:48:00,0.0,0.0,"The team working hard now painting the 3 room flat at Potong Pasir and spring cleaning the kitchen. At least, 12... http:// fb.me/6QyFNXGIy",,,,5.30944889098e+17,https://twitter.com/GohGilbert/status/530944889098219521,potong pasir mrt station,potong pasir
JoshGandJaneO,2014-11-08 12:48:00,1.0,0.0,Paya Lebar n Jane Oineza On ItsShowtime JoshAne On BananaSplitExtraScoop,,,,5.30944970468e+17,https://twitter.com/JoshGandJaneO/status/530944970467704832,paya lebar mrt station,paya lebar
Khidirafiq_,2014-11-08 12:49:00,0.0,0.0,YESTERDAY's . @IKEA Tampines http:// instagram.com/p/vIDukBErmW/,,@IKEA,,5.30945069575e+17,https://twitter.com/Khidirafiq_/status/530945069574918144,tampines mrt station,tampines
XuanWennn,2014-11-08 12:49:00,0.0,0.0,Its today! Rmb to come down to Bukit Batok CC Level 1 Hall ! Seeyou guys later! http:// instagram.com/p/vIDzTgg71D/,,,,5.30945231186e+17,https://twitter.com/XuanWennn/status/530945231185645568,bukit batok mrt station,bukit batok
nichmeatsix,2014-11-08 12:50:00,0.0,0.0,All the way at tampines .,,,,5.30945360467e+17,https://twitter.com/nichmeatsix/status/530945360466685952,tampines mrt station,tampines
Jethrotay,2014-11-08 12:50:00,0.0,0.0,I'm at Hougang Mall in Singapore https://www. swarmapp.com/c/0i24gLJPF55,,,,5.3094531183e+17,https://twitter.com/Jethrotay/status/530945311829942272,hougang mrt station,hougang
Mistervain_,2014-11-08 12:50:00,0.0,2.0,They're here in Punggol @HaiqalGonzalenz @Haziq_Syazwan_,,@HaiqalGonzalenz @Haziq_Syazwan_,,5.30945515228e+17,https://twitter.com/Mistervain_/status/530945515228123137,punggol mrt station,punggol
Jethrotay,2014-11-08 12:50:00,0.0,0.0,I'm at Hougang MRT Station (NE14) in Singapore https://www. swarmapp.com/c/ht9EvX7CYtw,,,,5.30945388758e+17,https://twitter.com/Jethrotay/status/530945388757647360,hougang mrt station,hougang
aaassliem,2014-11-08 12:51:00,0.0,0.0,"I'm at Tampines Bus Interchange in Singapore, SINGAPORE https://www. swarmapp.com/c/9p2AHJpZ8Q4",,,,5.30945762768e+17,https://twitter.com/aaassliem/status/530945762767937536,tampines mrt station,tampines
missjessicaril,2014-11-08 12:51:00,0.0,0.0,@IgnatiusVB huh first service at Buona vista ? Actually Idm going BV the atmosphere is good la but then so far zz,,@IgnatiusVB,,5.30945712767e+17,https://twitter.com/missjessicaril/status/530945712767246337,buona vista mrt station,buona vista
Chemist_Sim,2014-11-08 12:52:00,0.0,0.0,I'm at Kallang Estate Fresh Market & Food Centre in Singapore https://www. swarmapp.com/c/aUOCbnrKaxk,,,,5.3094581614e+17,https://twitter.com/Chemist_Sim/status/530945816140472320,kallang mrt station,kallang
delfa_dna,2014-11-08 12:52:00,0.0,0.0,Bishan - Ang Mo Kio Park Singapore http:// instagram.com/p/vIELQPOFmT/,,,,5.30946053421e+17,https://twitter.com/delfa_dna/status/530946053420621825,ang mo kio mrt station,ang mo kio
elfinvan,2014-11-08 12:52:00,0.0,1.0,I'm at Jurong East MRT Interchange (NS1/EW24) - @smrt_singapore in Singapore https://www. swarmapp.com/c/779tFsrDUJU,,@smrt_singapore,,5.30945848873e+17,https://twitter.com/elfinvan/status/530945848872828928,jurong east mrt station,jurong east
kohchunguan,2014-11-08 12:53:00,0.0,0.0,@hrr3p 12-4. Kallang cage. 11 nov. Dun call your other fren le,,@hrr3p,,5.3094626673e+17,https://twitter.com/kohchunguan/status/530946266729955329,kallang mrt station,kallang
medicfrontliner,2014-11-08 12:55:00,0.0,0.0,Bedok North Rd Entrance on PIE (towards Tuas) is closed to traffic due to an obstacle.,,,,5.30946771242e+17,https://twitter.com/medicfrontliner/status/530946771241799680,bedok mrt station,bedok
stompsingapore,2014-11-08 12:55:00,0.0,1.0,Another tree uprooted -- this time at Choa Chu Kang open-air carpark http:// bit.ly/1ADgPpi pic.twitter.com/wFggJv9kqH,,,,5.30946610684e+17,https://twitter.com/stompsingapore/status/530946610683850752,choa chu kang mrt station,choa chu kang
ChaebolEvents,2014-11-08 12:55:00,0.0,0.0,At punggol today! http:// fb.me/6QfSq9B5Q,,,,5.3094670959e+17,https://twitter.com/ChaebolEvents/status/530946709589729280,punggol mrt station,punggol
ai_eg,2014-11-08 12:56:00,0.0,0.0,#meecelup #food #tanahmerah #kelantankekite #sweatinglikebitch #pedas #haha http:// instagram.com/p/vIElMpqutJ/,,,#meecelup #food #tanahmerah #kelantankekite #sweatinglikebitch #pedas #haha,5.30946945071e+17,https://twitter.com/ai_eg/status/530946945070956546,tanah merah mrt station,tanah merah
mxlissaa,2014-11-08 12:56:00,4.0,1.0,DO YOU LIVE IN YEW TEE BECAUSE YOU ARE BEYEWTEEFUL HAHAHAHAHAHA,,,,5.30946845338e+17,https://twitter.com/mxlissaa/status/530946845338370048,yew tee mrt station,yew tee
netinachan13,2014-11-08 12:57:00,0.0,0.0,Rain water leak thro Tampines Mall http:// instagram.com/p/vIEvFZoyfS/,,,,5.30947284591e+17,https://twitter.com/netinachan13/status/530947284591448064,tampines mrt station,tampines
dianalorensa,2014-11-08 12:57:00,0.0,0.0,SDZ with my NRA loves and then surprise success for the nigga last night with my hougang peeps,,,,5.30947215033e+17,https://twitter.com/dianalorensa/status/530947215032713216,hougang mrt station,hougang
JilliCrab,2014-11-08 12:57:00,0.0,1.0,kallang in chinese is 加冷????????,,,,5.30947298999e+17,https://twitter.com/JilliCrab/status/530947298998505472,kallang mrt station,kallang
davidteng1996,2014-11-08 12:58:00,0.0,0.0,I'm at 153 Serangoon North Ave 1 https://www. swarmapp.com/c/hkLKLv9IluV,,,,5.30947429706e+17,https://twitter.com/davidteng1996/status/530947429705994240,serangoon mrt station,serangoon
BrianEmma2,2014-11-08 12:58:00,0.0,0.0,Outdoor billiard parlor replacing punk at preschool punggol : MgKbtwIWn,,,,5.30947546249e+17,https://twitter.com/BrianEmma2/status/530947546248540161,punggol mrt station,punggol
_alxff,2014-11-08 12:58:00,0.0,0.0,"Done with kompnag. Gosh, now another long bus ride back to chua chu kang then another long mrt ride back home.",,,,5.30947559213e+17,https://twitter.com/_alxff/status/530947559213113344,choa chu kang mrt station,chua chu kang
renaldildo,2014-11-08 12:58:00,0.0,0.0,bth the odour at bugis mrt every time,,,,5.30947550594e+17,https://twitter.com/renaldildo/status/530947550593814528,bugis mrt station,bugis mrt
x_brokenheart,2014-11-08 12:58:00,0.0,0.0,I'm at Upper Serangoon Shopping Centre in Singapore https://www. swarmapp.com/c/80as9ZjcpDU,,,,5.30947374043e+17,https://twitter.com/x_brokenheart/status/530947374043381760,serangoon mrt station,serangoon
MiNGwEiiii,2014-11-08 12:59:00,0.0,0.0,I'm at Hotel Fort Canning - @hfcsingapore in Singapore https://www. swarmapp.com/c/8TvkepceiP7,,@hfcsingapore,,5.30947594177e+17,https://twitter.com/MiNGwEiiii/status/530947594177232896,fort canning mrt station,fort canning
Jung__Yeoshin,2014-11-08 12:59:00,0.0,1.0,Now gg to jurong east ! aayan1120 wait for me!! http:// instagram.com/p/vIE7QHQgUq/,,,,5.30947704336e+17,https://twitter.com/Jung__Yeoshin/status/530947704336052225,jurong east mrt station,jurong east
appleyeohj,2014-11-08 13:00:00,0.0,1.0,Burden! Have to go toa Payoh for data collection for 4 hours. Oh lord,,,,5.30947890018e+17,https://twitter.com/appleyeohj/status/530947890017869824,toa payoh mrt station,toa payoh
JiahuiMuses,2014-11-08 13:00:00,0.0,0.0,#windowpeek on #silkair to #mandalay #myanmar .. #throwback #changiairport #travelwithsilkair … http:// instagram.com/p/vIE-wbEitV/,,,#windowpeek #silkair #mandalay #myanmar #throwback #changiairport #travelwithsilkair,5.30947824192e+17,https://twitter.com/JiahuiMuses/status/530947824192454656,changi airport mrt station,changi airport
miaerolinea,2014-11-08 13:00:00,0.0,0.0,Changi Airport welcomes MIAT Mongolian Airlines http:// ow.ly/DYsbP,,,,5.30947918649e+17,https://twitter.com/miaerolinea/status/530947918648594435,changi airport mrt station,changi airport
Dnlyong,2014-11-08 13:00:00,0.0,0.0,"1 hour remaining... @The Coffee Bean & Tea Leaf @Changi Airport T2, Singapore http:// instagram.com/p/vIFEYywoB6/",,@The @Changi,,5.30948016841e+17,https://twitter.com/Dnlyong/status/530948016841457664,changi airport mrt station,changi airport
Saudagar_MWT,2014-11-08 13:00:00,0.0,1.0,"Al Mu'aammar Tok Ayah Soleh bin Ali Bukit Panau, Tanah Merah ,Kelantan.. Usianya la ni mncecah 161.. Ziarah bliau.ALLAH pic.twitter.com/jjOaAxsAwM",,,,5.30948055768e+17,https://twitter.com/Saudagar_MWT/status/530948055768391680,tanah merah mrt station,tanah merah
kalaidegil,2014-11-08 13:00:00,0.0,1.0,So how did I end up in tampines,,,,5.30947856996e+17,https://twitter.com/kalaidegil/status/530947856996134913,tampines mrt station,tampines
ashatamashata,2014-11-08 13:00:00,0.0,0.0,Took the train to Tampines for my brothers enjoyment,,,,5.30948025901e+17,https://twitter.com/ashatamashata/status/530948025900736512,tampines mrt station,tampines
SyakirahNasri,2014-11-08 13:01:00,1.0,2.0,“ @sp_confessions : #4656 SP should build a skytrain to ABE and SB from Dover MRT .” OR FROM HILLTOP,,@sp_confessions,#4656,5.30948210131e+17,https://twitter.com/SyakirahNasri/status/530948210131357697,dover mrt station,dover mrt
tinan_t6,2014-11-08 13:01:00,0.0,0.0,"@NZzafirah_96 hahaa... biar mimpi smpai ke bintang... i dkt tanah merah ,queensland,australia nih..",,@NZzafirah_96,,5.30948083346e+17,https://twitter.com/tinan_t6/status/530948083345920000,tanah merah mrt station,tanah merah
Farhunt_Arwie,2014-11-08 13:02:00,0.0,0.0,@fourfeetall send to chua chu kang ah? Hahaha,,@fourfeetall,,5.30948446401e+17,https://twitter.com/Farhunt_Arwie/status/530948446400684032,choa chu kang mrt station,chua chu kang
beetilavela,2014-11-08 13:03:00,0.0,0.0,Ice soya+cincau+kacang merah + kacang tanah #hongtang #grandIndonesia http:// instagram.com/p/vIFXKTOJ5H/,,,#hongtang #grandIndonesia,5.30948661506e+17,https://twitter.com/beetilavela/status/530948661505978369,tanah merah mrt station,tanah merah
mangosandi,2014-11-08 13:03:00,0.0,1.0,going to bras basah / bras basah area is therapy for me bc it's so olden ish & just vibey,,,,5.30948818066e+17,https://twitter.com/mangosandi/status/530948818066354176,bras basah mrt station,bras basah
diraatiqah,2014-11-08 13:03:00,0.0,0.0,hmmm bedok when was the last time,,,,5.3094873556e+17,https://twitter.com/diraatiqah/status/530948735560216577,bedok mrt station,bedok
PlacidPri,2014-11-08 13:04:00,0.0,0.0,@xofirexo come sembawang but I'm gonna go for a run,,@xofirexo,,5.30948935427e+17,https://twitter.com/PlacidPri/status/530948935427166208,sembawang mrt station,sembawang
natashajefry,2014-11-08 13:04:00,0.0,0.0,Im use to seeing ws crowded so when i go bedok mall it feels so weird when its not crowded,,,,5.30948931073e+17,https://twitter.com/natashajefry/status/530948931073490944,bedok mrt station,bedok
ProfessorMAT,2014-11-08 13:05:00,0.0,0.0,So... some asian business for lunch. @Paradise Dynasty at Changi Airport Terminal 3 http:// instagram.com/p/vIFoIYGkZp/,,@Paradise,,5.30949244514e+17,https://twitter.com/ProfessorMAT/status/530949244514226176,changi airport mrt station,changi airport
yingshant_,2014-11-08 13:05:00,0.0,0.0,I'm at Hougang Mall in Singapore https://www. swarmapp.com/c/bSij5h5A1Tx,,,,5.30949225258e+17,https://twitter.com/yingshant_/status/530949225258164226,hougang mrt station,hougang
dayandut,2014-11-08 13:05:00,0.0,0.0,to aten engagement @marsiling pic.twitter.com/6YGl5ynbca,,@marsiling,,5.3094911142e+17,https://twitter.com/dayandut/status/530949111420157952,marsiling mrt station,marsiling
LTAsg,2014-11-08 13:06:00,0.0,0.0,Accident on PIE (towards Changi Airport ) after Adam Rd. Avoid lane 1,,,,5.30949415239e+17,https://twitter.com/LTAsg/status/530949415238766592,changi airport mrt station,changi airport
winxloo,2014-11-08 13:06:00,0.0,0.0,"Since I'm waiting for boarding, went and checked out the #butterfly #garden at #changi #airport . It's… http:// instagram.com/p/vIFvrXD80Y/",,,#butterfly #garden #changi #airport,5.30949504783e+17,https://twitter.com/winxloo/status/530949504782974976,changi airport mrt station,changi airport
HomeUtdFC,2014-11-08 13:07:00,1.0,0.0,"Hi Fans, This afternoon our U16 and U18 teams will be playing in their respective finals at Serangoon Stadium.... http:// fb.me/6XYYklRlG",,,,5.30949772078e+17,https://twitter.com/HomeUtdFC/status/530949772077965312,serangoon mrt station,serangoon
LTAsg,2014-11-08 13:08:00,0.0,0.0,Accident on PIE (towards Changi Airport ) after Adam Rd with congestion till Adam Rd. Avoid lane 1,,,,5.30949938713e+17,https://twitter.com/LTAsg/status/530949938713075712,changi airport mrt station,changi airport
EnumclawPolo,2014-11-08 13:08:00,0.0,1.0,"Region I, game 5 at Rogers HS: Kentridge 15, Auburn Riverside 10. Kentridge plays tomorrow at 5:30, Riverside's season comes to an end.",,,,5.30949966501e+17,https://twitter.com/EnumclawPolo/status/530949966500732928,kent ridge mrt station,kent ridge
Jethrotay,2014-11-08 13:08:00,0.0,0.0,I'm at Serangoon MRT Interchange (NE12/CC13) in Singapore https://www. swarmapp.com/c/1dROdDxeimY,,,,5.30949951355e+17,https://twitter.com/Jethrotay/status/530949951355109377,serangoon mrt station,serangoon
Marsieeeeeeee,2014-11-08 13:09:00,0.0,0.0,inside 190 and off to dhoby ghaut,,,,5.30950294122e+17,https://twitter.com/Marsieeeeeeee/status/530950294121611264,dhoby ghaut mrt station,dhoby ghaut
rentatsingapore,2014-11-08 13:09:00,0.0,0.0,3Rm HDB For Rent Near Lavender MRT Blk 462 Crawford Lane - http://www. rentatsingapore.com/ads/3rm-hdb-fo r-rent-near-lavender-mrt-blk-462-crawford-lane/ … pic.twitter.com/1wmglybo0Z,,,,5.30950206926e+17,https://twitter.com/rentatsingapore/status/530950206926249984,lavender mrt station,lavender mrt
i_syahirah,2014-11-08 13:10:00,0.0,0.0,"Stressnya jemputan kat kampung bila hujan : baju kasut karpet kereta semua terpalit tanah merah . =_=""",,,,5.30950586926e+17,https://twitter.com/i_syahirah/status/530950586926002176,tanah merah mrt station,tanah merah
WinstenT,2014-11-08 13:10:00,0.0,0.0,Yummy ramen near Clarke Quay !!! http:// instagram.com/p/vIGJtZoTOJ/,,,,5.3095039913e+17,https://twitter.com/WinstenT/status/530950399130210304,clarke quay mrt station,clarke quay
dnlkta_,2014-11-08 13:11:00,0.0,0.0,@Ha0Pei OFC ma nigga. Wanna meet up first or what? I gg Clarke Quay send some shit. Then I wanna go jalan jalan jap,,@Ha0Pei,,5.30950609307e+17,https://twitter.com/dnlkta_/status/530950609306779648,clarke quay mrt station,clarke quay
ZaaaEzza,2014-11-08 13:11:00,0.0,0.0,(with Adisti at Gardens By The Bay ) — https:// path.com/p/4npyce,,,,5.30950774898e+17,https://twitter.com/ZaaaEzza/status/530950774897917952,gardens by the bay mrt station,gardens by the bay
wongmelissa,2014-11-08 13:12:00,0.0,0.0,#starliving #upperthomson #philipssg #philipslighting #furniture #lighting #audio #starfurnituregroup … http:// instagram.com/p/vIGd4hrJyr/,,,#starliving #upperthomson #philipssg #philipslighting #furniture #lighting #audio #starfurnituregroup,5.30951092327e+17,https://twitter.com/wongmelissa/status/530951092327424000,upper thomson mrt station,upper thomson
Jethrotay,2014-11-08 13:12:00,0.0,0.0,I'm at Bishan MRT Interchange (NS17/CC15) - @smrt_singapore in Singapore https://www. swarmapp.com/c/ec1q6oRcUQi,,@smrt_singapore,,5.3095088041e+17,https://twitter.com/Jethrotay/status/530950880410230785,bishan mrt station,bishan
FdoubleE,2014-11-08 13:12:00,0.0,2.0,Time check 1310. Location Lakeside. ETA to Tampines : 1325. Lets go pic.twitter.com/XwnU6loBbH,,,,5.3095085654e+17,https://twitter.com/FdoubleE/status/530950856540041216,tampines mrt station,tampines
SScholezz,2014-11-08 13:13:00,0.0,1.0,"the extension route of 858, 969 and 168 to Punggol Rd is not needed lah seriously....waste of time.",,,,5.30951138448e+17,https://twitter.com/SScholezz/status/530951138447597570,punggol mrt station,punggol
JenksTerry,2014-11-08 13:14:00,0.0,0.0,Boys Water Polo Regionals at Rogers Kentridge 15 Auburn Riverside 10 Final,,,,5.30951385727e+17,https://twitter.com/JenksTerry/status/530951385727369216,kent ridge mrt station,kent ridge
LTAsg,2014-11-08 13:14:00,0.0,0.0,Accident on PIE (towards Changi Airport ) after Adam Rd with congestion till Eng Neo Ave. Avoid lane 1,,,,5.30951510717e+17,https://twitter.com/LTAsg/status/530951510717251584,changi airport mrt station,changi airport
rentatsingapore,2014-11-08 13:15:00,0.0,0.0,3Rm HDB For Rent Near Pasir Ris MRT Blk 537 Pasir Ris Street 51 - http://www. rentatsingapore.com/ads/3rm-hdb-fo r-rent-near-pasir-ris-mrt-blk-537-pasir-ris-street-51/ … pic.twitter.com/vwZHFOt9T3,,,,5.30951815148e+17,https://twitter.com/rentatsingapore/status/530951815148232705,pasir ris mrt station,pasir ris
SingaporePolice,2014-11-08 13:15:00,53.0,1.0,#sgpoliceappeal 50-year-old Malay woman missing since 07/11/14 @1100hrs. Last seen at Blk 212A Pasir Ris Street 21. pic.twitter.com/kUVaPtBA9E,,@1100hrs,#sgpoliceappeal,5.30951824946e+17,https://twitter.com/SingaporePolice/status/530951824946118656,pasir ris mrt station,pasir ris
smpitrnal,2014-11-08 13:15:00,0.0,0.0,@pizzakohh_ serangoon v far ok,,@pizzakohh_,,5.3095178419e+17,https://twitter.com/smpitrnal/status/530951784190070784,serangoon mrt station,serangoon
Yapyesno,2014-11-08 13:15:00,0.0,0.0,I'm at Singapore Changi Airport (SIN) - @fansofchangi in Singapore https://www. swarmapp.com/c/3m1KeNehL53,,@fansofchangi,,5.30951819213e+17,https://twitter.com/Yapyesno/status/530951819212886016,changi airport mrt station,changi airport
AiniElectrogirl,2014-11-08 13:17:00,0.0,0.0,Off to Jemputan @Toa Payoh & than to self study/shopping.,,@Toa,,5.30952248227e+17,https://twitter.com/AiniElectrogirl/status/530952248226881536,toa payoh mrt station,toa payoh
mnyungi93,2014-11-08 13:17:00,0.0,0.0,@Kimjongwoon__ kan gua ngantuk-__- ya kali aje hyung minyak wangi buset-- es batu lagi sekalian aja tanah merah sekalian gua di kubur,,@Kimjongwoon__,,5.30952269488e+17,https://twitter.com/mnyungi93/status/530952269487808512,tanah merah mrt station,tanah merah
labellejoo,2014-11-08 13:18:00,0.0,0.0,I'm at Yew Tee Point in Singapore https://www. swarmapp.com/c/kdxkMeeQxGI,,,,5.3095244096e+17,https://twitter.com/labellejoo/status/530952440959762433,yew tee mrt station,yew tee
SaltyBearr,2014-11-08 13:18:00,0.0,1.0,Mark is lost in Singapore. He can see newton mrt and Tampines safra from where he is. Therefore Mark is a super eagle.,,,,5.30952481678e+17,https://twitter.com/SaltyBearr/status/530952481677643776,newton mrt station,newton mrt
TheAmazingFatty,2014-11-08 13:18:00,0.0,1.0,can someone who lives in Bishan / AMK please help me print my NS medical questionnaire?,,,,5.30952570521e+17,https://twitter.com/TheAmazingFatty/status/530952570521415680,bishan mrt station,bishan
Cheongkun,2014-11-08 13:19:00,0.0,0.0,@SuperKnees I going joo koon,,@SuperKnees,,5.30952804685e+17,https://twitter.com/Cheongkun/status/530952804685205504,joo koon mrt station,joo koon
duffydukes,2014-11-08 13:19:00,0.0,0.0,Only one stop to novena from orchard then overshot to bishan . Fuck,,,,5.30952725245e+17,https://twitter.com/duffydukes/status/530952725245091840,bishan mrt station,bishan
