username,date,retweets,favorites,text,geo,mentions,hashtags,id,permalink,place,key
amoyebadii,2014-09-19 19:23:00,0.0,0.0,"Jayapura, MAJALAH SELANGKAH -- Ketua Umum Barisan Merah Putih Republik Indonesia (BMP-RI) di Tanah Papua, Ramses... http:// fb.me/4qkUpHJnb",,,,5.12925054121e+17,https://twitter.com/amoyebadii/status/512925054121021440,tanah merah mrt station,tanah merah
amoyebadii,2014-09-19 19:23:00,0.0,0.0,"Jayapura, MAJALAH SELANGKAH -- Ketua Umum Barisan Merah Putih Republik Indonesia (BMP-RI) di Tanah Papua, Ramses... http:// fb.me/1l864JqSV",,,,5.1292504944e+17,https://twitter.com/amoyebadii/status/512925049440198656,tanah merah mrt station,tanah merah
amoyebadii,2014-09-19 19:23:00,0.0,0.0,"Jayapura, MAJALAH SELANGKAH -- Ketua Umum Barisan Merah Putih Republik Indonesia (BMP-RI) di Tanah Papua, Ramses... http:// fb.me/1DYEwsdjW",,,,5.12925039605e+17,https://twitter.com/amoyebadii/status/512925039604559872,tanah merah mrt station,tanah merah
amoyebadii,2014-09-19 19:23:00,0.0,0.0,"Jayapura, MAJALAH SELANGKAH -- Ketua Umum Barisan Merah Putih Republik Indonesia (BMP-RI) di Tanah Papua, Ramses... http:// fb.me/1qkb2Ape6",,,,5.12925043081e+17,https://twitter.com/amoyebadii/status/512925043081236480,tanah merah mrt station,tanah merah
amoyebadii,2014-09-19 19:23:00,0.0,0.0,"Jayapura, MAJALAH SELANGKAH -- Ketua Umum Barisan Merah Putih Republik Indonesia (BMP-RI) di Tanah Papua, Ramses... http:// fb.me/6Whj3FkBG",,,,5.12925044319e+17,https://twitter.com/amoyebadii/status/512925044318957568,tanah merah mrt station,tanah merah
amoyebadii,2014-09-19 19:23:00,0.0,0.0,"Jayapura, MAJALAH SELANGKAH -- Ketua Umum Barisan Merah Putih Republik Indonesia (BMP-RI) di Tanah Papua, Ramses... http:// fb.me/6Nf1pHguW",,,,5.12925047028e+17,https://twitter.com/amoyebadii/status/512925047028469760,tanah merah mrt station,tanah merah
campustutors_sg,2014-09-19 19:23:00,0.0,0.0,"Kindergarten 1 English and Maths. Yishun St22, BLK260. Twice a week, 1.5hrs. $20/hr. http://www. campustutors.com.sg",,,,5.1292504996e+17,https://twitter.com/campustutors_sg/status/512925049959874560,yishun mrt station,yishun
alvxnn_,2014-09-19 19:23:00,0.0,0.0,Otw to tampines .,,,,5.1292491375e+17,https://twitter.com/alvxnn_/status/512924913749856256,tampines mrt station,tampines
amoyebadii,2014-09-19 19:23:00,0.0,0.0,"Jayapura, MAJALAH SELANGKAH -- Ketua Umum Barisan Merah Putih Republik Indonesia (BMP-RI) di Tanah Papua, Ramses... http:// fb.me/1DZq6rnQK",,,,5.12925037122e+17,https://twitter.com/amoyebadii/status/512925037121527808,tanah merah mrt station,tanah merah
amoyebadii,2014-09-19 19:23:00,0.0,0.0,"Jayapura, MAJALAH SELANGKAH -- Ketua Umum Barisan Merah Putih Republik Indonesia (BMP-RI) di Tanah Papua, Ramses... http:// fb.me/1E7JlcZTX",,,,5.12925057003e+17,https://twitter.com/amoyebadii/status/512925057002536960,tanah merah mrt station,tanah merah
amoyebadii,2014-09-19 19:23:00,0.0,0.0,"Jayapura, MAJALAH SELANGKAH -- Ketua Umum Barisan Merah Putih Republik Indonesia (BMP-RI) di Tanah Papua, Ramses... http:// fb.me/75JqTW19P",,,,5.12925059431e+17,https://twitter.com/amoyebadii/status/512925059431026689,tanah merah mrt station,tanah merah
MissNeverland_,2014-09-19 19:24:00,0.0,0.0,YES AT BISHAN LIAO,,,,5.12925282551e+17,https://twitter.com/MissNeverland_/status/512925282550812672,bishan mrt station,bishan
WrathOfSins,2014-09-19 19:25:00,4.0,0.0,White sand is now the most boring place in pasir ris,,,,5.12925356836e+17,https://twitter.com/WrathOfSins/status/512925356836139009,pasir ris mrt station,pasir ris
zaaaachary,2014-09-19 19:25:00,0.0,0.0,Why in the world am I at yishun ...,,,,5.12925458854e+17,https://twitter.com/zaaaachary/status/512925458854191106,yishun mrt station,yishun
BrianEmma2,2014-09-19 19:25:00,0.0,0.0,Outdoor oval parce que kids near preschool punggol : MBsBNlGRp,,,,5.12925532234e+17,https://twitter.com/BrianEmma2/status/512925532233535489,punggol mrt station,punggol
HendrixVansGene,2014-09-19 19:26:00,0.0,0.0,"No joke, taking 154 from boon lay to tpy I bet it's like an 1hr plus journey .",,,,5.12925708868e+17,https://twitter.com/HendrixVansGene/status/512925708868276224,boon lay mrt station,boon lay
Zecline_Lin,2014-09-19 19:26:00,0.0,0.0,@ourEXOboysSG hi~ is the collection venue at Bishan Mrt Stn?,,@ourEXOboysSG,,5.12925580863e+17,https://twitter.com/Zecline_Lin/status/512925580862689280,bishan mrt station,bishan
twointhenight,2014-09-19 19:26:00,0.0,0.0,Lonely ride from Joo Koon to Pasir Ris,,,,5.12925582427e+17,https://twitter.com/twointhenight/status/512925582426771456,joo koon mrt station,joo koon
campustutors_sg,2014-09-19 19:26:00,0.0,0.0,"Assignment Code: E9J2 Subject: Kindergarten 1 English and Maths Location: Yishun St22, BLK260 Lesson frequency:... http:// fb.me/7JmvsR9kc",,,,5.12925670046e+17,https://twitter.com/campustutors_sg/status/512925670045782016,yishun mrt station,yishun
KazuyaXiang,2014-09-19 19:27:00,0.0,0.0,Boring. x.x its been a long time but who wanna come pasir ris slack? ;),,,,5.12925994656e+17,https://twitter.com/KazuyaXiang/status/512925994655956992,pasir ris mrt station,pasir ris
FCUKTHATMOFO,2014-09-19 19:27:00,0.0,0.0,I'm at Jurong East MRT Interchange (NS1/EW24) - @smrt_singapore in Singapore https://www. swarmapp.com/fcukthatmofo/c heckin/541c1330498e0a3759c4328c?s=DbSjJVK-kg8bv4PTq0hmzz-Dhlw&ref=tw …,,@smrt_singapore,,5.12926007205e+17,https://twitter.com/FCUKTHATMOFO/status/512926007205298176,jurong east mrt station,jurong east
JT4Z,2014-09-19 19:28:00,0.0,0.0,Dinner with love at Tampines Martttttt triple yay,,,,5.12926251397e+17,https://twitter.com/JT4Z/status/512926251397292033,tampines mrt station,tampines
hanndouken,2014-09-19 19:28:00,0.0,0.0,Ikr! Haha and i didnt even know she lived really close like in bedok too lol,,,,5.12926226307e+17,https://twitter.com/hanndouken/status/512926226306977792,bedok mrt station,bedok
aman_singhhh,2014-09-19 19:28:00,1.0,1.0,will miss hougang ;),,,,5.12926272562e+17,https://twitter.com/aman_singhhh/status/512926272561754112,hougang mrt station,hougang
kateardio,2014-09-19 19:28:00,0.0,0.0,Dinner time! with kuya Chad. @Swensen's at Changi Airport Terminal 2 http:// instagram.com/p/tIBpt7PyzJ/,,@Swensen,,5.12926106719e+17,https://twitter.com/kateardio/status/512926106718961665,changi airport mrt station,changi airport
StarTutor,2014-09-19 19:28:00,0.0,0.0,P1 CL tuition @288G Bukit Batok St 25. 4x1hrs/month. Preferred Gender: f. http:// startutor.sg/r:29281,,@288G,,5.12926149543e+17,https://twitter.com/StarTutor/status/512926149542813698,bukit batok mrt station,bukit batok
mingkeatsng,2014-09-19 19:29:00,0.0,0.0,Upper Serangoon Road @1915 hrs. #Singapore #highway pic.twitter.com/MGq90kXC3t,,@1915,#Singapore #highway,5.12926357861e+17,https://twitter.com/mingkeatsng/status/512926357861322752,serangoon mrt station,serangoon
UltrasEaglesSG,2014-09-19 19:30:00,0.0,0.0,We are kicking off here at Bedok Stadium. Adult ticket purchase will get u a free Cathay movie ticket. #GeylangBoleh,,,#GeylangBoleh,5.12926705846e+17,https://twitter.com/UltrasEaglesSG/status/512926705846329344,bedok mrt station,bedok
Kaiyeelky,2014-09-19 19:30:00,0.0,0.0,Yay next off day going karaoke and simpang bedok for dinz with bffl,,,,5.12926727375e+17,https://twitter.com/Kaiyeelky/status/512926727375298560,bedok mrt station,bedok
thekellytan,2014-09-19 19:30:00,0.0,0.0,ultra late for work darns (@Pasir Ris Sports & Recreation Centre in Singapore) https://www. swarmapp.com/ohitskellyyyyy /checkin/541c13c7498e2222d98d524b?s=zT86FKYY6BVj5FZlahqHsxxOcYI&ref=tw …,,@Pasir,,5.12926639836e+17,https://twitter.com/thekellytan/status/512926639836385280,pasir ris mrt station,pasir ris
MPT_Sg,2014-09-19 19:30:00,0.0,0.0,Required a Malay Tutor in Tampines - St 45 Singapore. Register soon @bit .ly/1qih7Xl http:// fb.me/4eHsl7Mxu,,@bit,,5.12926594257e+17,https://twitter.com/MPT_Sg/status/512926594256875521,tampines mrt station,tampines
Tehgami,2014-09-19 19:31:00,0.0,0.0,@DeSeuMeon uhhh.. the start of the year maybe? no leh I went down to orange coms there at serangoon .. my retailer paste sticker to go there,,@DeSeuMeon,,5.12927031362e+17,https://twitter.com/Tehgami/status/512927031361671168,serangoon mrt station,serangoon
efghisaac,2014-09-19 19:31:00,0.0,0.0,yishun park swing funz,,,,5.12926849187e+17,https://twitter.com/efghisaac/status/512926849186660353,yishun mrt station,yishun
irfannarlovski,2014-09-19 19:32:00,0.0,0.0,@ryxnxidil gy mane? kirim nasi lemak boonlay dok,,@ryxnxidil,,5.12927269552e+17,https://twitter.com/irfannarlovski/status/512927269551996928,boon lay mrt station,boon lay
itsCharmian,2014-09-19 19:33:00,0.0,0.0,@__sAiFuL__ 28 sept at punggol but the specific place I not too sure,,@__sAiFuL__,,5.12927391074e+17,https://twitter.com/itsCharmian/status/512927391073587200,punggol mrt station,punggol
nabilahilah2010,2014-09-19 19:33:00,0.0,0.0,What is the most important thing that you should do today? — Going out dinner with my mum at Tampines mall =D http:// ask.fm/a/b6egbon0,,,,5.12927351157e+17,https://twitter.com/nabilahilah2010/status/512927351156776960,tampines mrt station,tampines
fiddianyChandra,2014-09-19 19:34:00,0.0,0.0,"@fiitriaaaN kk, kirimkan foto kita yg waktu di tanah merah selesai upacara PMI tu kk. Ada kah sama kk? Klau ada kirimin.",,@fiitriaaaN,,5.12927704938e+17,https://twitter.com/fiddianyChandra/status/512927704937541632,tanah merah mrt station,tanah merah
LimpeiLongJun,2014-09-19 19:35:00,0.0,0.0,@JonathanTeoooo i going jogging also. meet pasir ris gimme 2 hours i jogging there now,,@JonathanTeoooo,,5.12927853726e+17,https://twitter.com/LimpeiLongJun/status/512927853726285824,pasir ris mrt station,pasir ris
Voxsports,2014-09-19 19:35:00,0.0,0.0,#SLeague : Woodlands Wellington 0-3 Hougang United FC match report http:// goo.gl/R9dWqN pic.twitter.com/rE5RUxzyms,,,#SLeague,5.12927874119e+17,https://twitter.com/Voxsports/status/512927874118975488,hougang mrt station,hougang
pratiwiirachman,2014-09-19 19:35:00,0.0,0.0,Having a good time with my best girlfriend! (with @indiramega at Gardens By The Bay ) [pic] — https:// path.com/p/4sJoUN,,@indiramega,,5.1292796537e+17,https://twitter.com/pratiwiirachman/status/512927965370277888,gardens by the bay mrt station,gardens by the bay
ayoifaiz,2014-09-19 19:35:00,0.0,0.0,I'm at Secret Recipe Tanah Merah https://www. swarmapp.com/ayoifaiz/check in/541c1519498e77def2f883e1?s=YVctZWOV4l6Zas51Chvb5dvUi0Q&ref=tw …,,,,5.12928059302e+17,https://twitter.com/ayoifaiz/status/512928059302109184,tanah merah mrt station,tanah merah
ALLER1A,2014-09-19 19:35:00,0.0,0.0,@GaoZeSong I AT KALLANG BUT WHO THERE,,@GaoZeSong,,5.12927910618e+17,https://twitter.com/ALLER1A/status/512927910617808896,kallang mrt station,kallang
Kangjeon_min,2014-09-19 19:36:00,0.0,0.0,At sembawang doin nothing.,,,,5.12928289707e+17,https://twitter.com/Kangjeon_min/status/512928289707397123,sembawang mrt station,sembawang
TheStarTipStar,2014-09-19 19:37:00,0.0,0.0,Lets go for a nice £10 challenge 10 to 15 Geylang International vs Tanjong Pagar United OVER 0.5 GOALS,,,,5.12928430284e+17,https://twitter.com/TheStarTipStar/status/512928430284079104,tanjong pagar mrt station,tanjong pagar
AzanFreeAllTheT,2014-09-19 19:37:00,0.0,0.0,futsal at tampines . sigh why so jauh,,,,5.12928366304e+17,https://twitter.com/AzanFreeAllTheT/status/512928366303776768,tampines mrt station,tampines
BetAdvisor,2014-09-19 19:37:00,0.0,0.0,#betadvisor #football #Soccer #Livescore @ScoresPro : (SIN-D1) Geylang International FC vs Tanjong Pagar UTD FC: 0-0,,@ScoresPro,#betadvisor #football #Soccer #Livescore,5.1292841521e+17,https://twitter.com/BetAdvisor/status/512928415209783296,tanjong pagar mrt station,tanjong pagar
tuanflurry,2014-09-19 19:38:00,0.0,0.0,@squishykaisoo guangyang secondary haha it's in bishan . Yours is punggol right?,,@squishykaisoo,,5.12928801786e+17,https://twitter.com/tuanflurry/status/512928801785774081,bishan mrt station,bishan
Jeremaestro,2014-09-19 19:38:00,0.0,0.0,All the way to Bedok Mac to studyyyy,,,,5.12928737588e+17,https://twitter.com/Jeremaestro/status/512928737587757056,bedok mrt station,bedok
Jok3r_06,2014-09-19 19:39:00,0.0,0.0,"For those who are gg..All the best.."" @ElisyaEslin : 1. Prom at Yishun 2. KPOP theme i dont want to go anymore"" I got no time for PROM",,@ElisyaEslin,,5.12928880781e+17,https://twitter.com/Jok3r_06/status/512928880781316096,yishun mrt station,yishun
snakeater_7,2014-09-19 19:39:00,0.0,0.0,Earlier on... With @ktm_ bishan http:// instagram.com/p/tIC8XyMMHw/,,@ktm_,,5.12928944871e+17,https://twitter.com/snakeater_7/status/512928944870653952,bishan mrt station,bishan
ikhsan_myid,2014-09-19 19:39:00,0.0,0.0,#Soccer #Livescore @ScoresPro : (SIN-D1) Geylang International FC vs Tanjong Pagar UTD FC: 0-0: Kick Off http:// bit.ly/1tvBarh #Bola,,@ScoresPro,#Soccer #Livescore #Bola,5.12928978836e+17,https://twitter.com/ikhsan_myid/status/512928978835763201,tanjong pagar mrt station,tanjong pagar
sgBikeZ,2014-09-19 19:41:00,0.0,0.0,Yamaha FINO 115 for Sale COE: 24 Aug 2019 Road Tax: 24 Feb 2015 Mileage: 34k Viewing: Yishun http:// fb.me/3wmDTA2Du,,,,5.12929391002e+17,https://twitter.com/sgBikeZ/status/512929391002021889,yishun mrt station,yishun
goalpostsuk,2014-09-19 19:41:00,0.0,0.0,(*FT*) #Soccer #Livescore @ScoresPro : (SIN-D1) Geylang International FC vs Tanjong Pagar UTD FC: 0-0 http:// dlvr.it/6y5c9j #ResultsBPL,,@ScoresPro,#Soccer #Livescore #ResultsBPL,5.12929375634e+17,https://twitter.com/goalpostsuk/status/512929375633698816,tanjong pagar mrt station,tanjong pagar
TheFootyResults,2014-09-19 19:41:00,0.0,0.0,#Soccer #Livescore @ScoresPro : (SIN-D1) Geylang International FC vs Tanjong Pagar UTD FC: 0-0 http:// dlvr.it/6y5c9v,,@ScoresPro,#Soccer #Livescore,5.12929376183e+17,https://twitter.com/TheFootyResults/status/512929376183152641,tanjong pagar mrt station,tanjong pagar
NECDC,2014-09-19 19:41:00,0.0,0.0,We are now in Punggol as part of our ongoing efforts to share about the Pioneer Generation Package… http:// instagram.com/p/tIDKILASsE/,,,,5.12929418848e+17,https://twitter.com/NECDC/status/512929418847612928,punggol mrt station,punggol
Botakbernard,2014-09-19 19:41:00,0.0,0.0,@Kaphiophobia hahahaha tampines ar tonight?,,@Kaphiophobia,,5.12929547269e+17,https://twitter.com/Botakbernard/status/512929547268796416,tampines mrt station,tampines
apzapzap,2014-09-19 19:42:00,0.0,0.0,SHIOK @West Coz Cafe At Yew Tee Point http:// instagram.com/p/tIDR8TEmhN/,,@West,,5.12929685975e+17,https://twitter.com/apzapzap/status/512929685974831104,yew tee mrt station,yew tee
LUNIAZARIFFIN,2014-09-19 19:42:00,0.0,0.0,@syaf__ okay otw. Bukit panjang eh? Ke bukit merah ?,,@syaf__,,5.129297524e+17,https://twitter.com/LUNIAZARIFFIN/status/512929752399630338,bukit panjang mrt station,bukit panjang
elitefootcm,2014-09-19 19:43:00,0.0,0.0,#Soccer #Livescore @ScoresPro : (SIN-D1) Geylang International FC vs Tanjong Pagar UTD FC: 0-0 http:// dlvr.it/6y5fKB,,@ScoresPro,#Soccer #Livescore,5.12929866686e+17,https://twitter.com/elitefootcm/status/512929866686033920,tanjong pagar mrt station,tanjong pagar
HuiyiVegas,2014-09-19 19:46:00,0.0,0.0,I'm at Singapore Changi Airport (SIN) - @fansofchangi in Singapore https://www. swarmapp.com/huiyivegas/che ckin/541c17a8498e79074b06561e?s=CCe15clrk0oJvtspDCa_px4WTBo&ref=tw …,,@fansofchangi,,5.12930806051e+17,https://twitter.com/HuiyiVegas/status/512930806051119105,changi airport mrt station,changi airport
GlennNg,2014-09-19 19:46:00,0.0,0.0,"Wa siao liao.... Im on NEL train. Going home, sengkang... How can i thought im suppose to alight at serangoon ?!",,,,5.1293064173e+17,https://twitter.com/GlennNg/status/512930641730498561,serangoon mrt station,serangoon
Marcus1712,2014-09-19 19:46:00,3.0,0.0,Somebody not happy with lorong 5 toa payoh pic.twitter.com/tbp5ywPJT3,,,,5.12930768902e+17,https://twitter.com/Marcus1712/status/512930768901787648,toa payoh mrt station,toa payoh
gifcsg,2014-09-19 19:47:00,0.0,1.0,13' Ridhuan tricks his way past two Tanjong Pagar players and is fouled! Aliff Shafaein with the... http:// fb.me/1CLDyLTH3,,,,5.12930978726e+17,https://twitter.com/gifcsg/status/512930978726445056,tanjong pagar mrt station,tanjong pagar
MGFletcher,2014-09-19 19:47:00,1.0,0.0,I'm at Singapore Changi Airport (SIN) - @fansofchangi in Singapore https://www. swarmapp.com/mgfletcher/che ckin/541c17eb498e39959215d858?s=yaABZReP8rt1LzTNQtnW5ScrcGk&ref=tw …,,@fansofchangi,,5.12931086654e+17,https://twitter.com/MGFletcher/status/512931086654259200,changi airport mrt station,changi airport
byungjoospi,2014-09-19 19:47:00,4.0,0.0,"suga: "" **runs to gardens by the bay and becomes one with the plants** """,,,,5.12931078135e+17,https://twitter.com/byungjoospi/status/512931078135218176,gardens by the bay mrt station,gardens by the bay
dilawnapinsel,2014-09-19 19:47:00,0.0,0.0,"Milo Godzilla...scary,he,he!!!#firsttime#sarap#@Blk 136 Bedok Reservior Rd Enak Rasa Thai Seafood… http:// instagram.com/p/tID3G2pCBL/",,@Blk,#firsttime #sarap #,5.12930962876e+17,https://twitter.com/dilawnapinsel/status/512930962876141568,bedok mrt station,bedok
WeiiiZhen,2014-09-19 19:48:00,0.0,0.0,Lost in punggol waterway,,,,5.1293128811e+17,https://twitter.com/WeiiiZhen/status/512931288110473217,punggol mrt station,punggol
daryllimyq,2014-09-19 19:48:00,0.0,1.0,"You want to achieve something, you don't just achieve it. You Overachieve. @Tampines Sports Complex Gym http:// instagram.com/p/tID8T_AY1f/",,@Tampines,,5.12931141558e+17,https://twitter.com/daryllimyq/status/512931141557702656,tampines mrt station,tampines
There_Sama,2014-09-19 19:48:00,1.0,0.0,"Plg berkesan, liat wakil Indonesia turun bawa bendera Merah Putih, dan di lap. ada orang2 yg siap nangkap bendera supaya ngga nyentuh tanah",,,,5.12931129968e+17,https://twitter.com/There_Sama/status/512931129968443392,tanah merah mrt station,tanah merah
IRFANKEEPCALM,2014-09-19 19:50:00,0.0,0.0,list some people from bedok south you follow on instagram but you dont know them — dk ? as in what http:// ask.fm/a/bbpqbfdj,,,,5.12931633692e+17,https://twitter.com/IRFANKEEPCALM/status/512931633692151808,bedok mrt station,bedok
aizeecom,2014-09-19 19:51:00,0.0,0.0,#Soccer #Livescore @ScoresPro : (SIN-D1) Geylang International FC vs Tanjong Pagar UTD FC: 0-0: Kick Off http:// bit.ly/1tvBarh,,@ScoresPro,#Soccer #Livescore,5.12931947707e+17,https://twitter.com/aizeecom/status/512931947706716161,tanjong pagar mrt station,tanjong pagar
inplay_betting,2014-09-19 19:51:00,0.0,0.0,#Soccer #Livescore @ScoresPro : (SIN-D1) Geylang International FC vs Tanjong Pagar UTD FC: 0-0: Kick Off http:// bit.ly/1wvudWC,,@ScoresPro,#Soccer #Livescore,5.12931949343e+17,https://twitter.com/inplay_betting/status/512931949342507008,tanjong pagar mrt station,tanjong pagar
inplay_betting,2014-09-19 19:51:00,0.0,0.0,#Soccer #Livescore @ScoresPro : (SIN-D1) Geylang International FC vs Tanjong Pagar UTD FC: 0-0: Kick Off http:// bit.ly/1tvBarh,,@ScoresPro,#Soccer #Livescore,5.12931950731e+17,https://twitter.com/inplay_betting/status/512931950730821632,tanjong pagar mrt station,tanjong pagar
CILEDUGFLAMES,2014-09-19 19:51:00,0.0,0.0,#Soccer #Livescore @ScoresPro : (SIN-D1) Geylang International FC vs Tanjong Pagar UTD FC: 0-0 http:// bit.ly/1wvudWC #CF,,@ScoresPro,#Soccer #Livescore #CF,5.12931963423e+17,https://twitter.com/CILEDUGFLAMES/status/512931963422797824,tanjong pagar mrt station,tanjong pagar
rusdi_perkasa,2014-09-19 19:51:00,0.0,0.0,#Soccer #Livescore @ScoresPro : (SIN-D1) Geylang International FC vs Tanjong Pagar UTD FC: 0-0 http:// bit.ly/1tvBarh,,@ScoresPro,#Soccer #Livescore,5.12931966468e+17,https://twitter.com/rusdi_perkasa/status/512931966467846144,tanjong pagar mrt station,tanjong pagar
nakhon224,2014-09-19 19:51:00,0.0,0.0,#Soccer #Livescore @ScoresPro : (SIN-D1) Geylang International FC vs Tanjong Pagar UTD FC: 0-0: Kick Off http:// bit.ly/1wvudWC,,@ScoresPro,#Soccer #Livescore,5.12931975993e+17,https://twitter.com/nakhon224/status/512931975993106432,tanjong pagar mrt station,tanjong pagar
parinhya2013,2014-09-19 19:51:00,0.0,0.0,#กีฬา #ฟุตบอล #Soccer #Livescore @ScoresPro : (SIN-D1) Geylang International FC vs Tanjong Pagar UTD FC: 0-0 http:// goo.gl/MqVbrZ,,@ScoresPro,# # #Soccer #Livescore,5.12931940207e+17,https://twitter.com/parinhya2013/status/512931940207312896,tanjong pagar mrt station,tanjong pagar
sportsontheline,2014-09-19 19:51:00,0.0,0.0,#Soccer #Livescore @ScoresPro : (SIN-D1) Geylang International FC vs Tanjong Pagar UTD FC: 0-0: Kick Off http:// bit.ly/1wvudWC #score #goal,,@ScoresPro,#Soccer #Livescore #score #goal,5.12931954405e+17,https://twitter.com/sportsontheline/status/512931954405023745,tanjong pagar mrt station,tanjong pagar
SVAnandKumar,2014-09-19 19:51:00,0.0,0.0,Presenting the 180 degree Virtual Aerodrome Lab ( Changi Airport Control Tower Simulator). This vainpot… http:// instagram.com/p/tIEVUmvDuZ/,,,,5.12932001998e+17,https://twitter.com/SVAnandKumar/status/512932001997799424,changi airport mrt station,changi airport
GirlFromThePast,2014-09-19 19:52:00,0.0,0.0,Rippling Hearts Lantern! @Gardens by the Bay http:// instagram.com/p/tIEZB2RAXa/,,@Gardens,,5.12932128238e+17,https://twitter.com/GirlFromThePast/status/512932128238366720,gardens by the bay mrt station,gardens by the bay
Sengetkaki,2014-09-19 19:52:00,0.0,0.0,Kallang . Credits : @runningbell http:// instagram.com/p/tIEcm4MlF0/,,@runningbell,,5.12932250867e+17,https://twitter.com/Sengetkaki/status/512932250867220481,kallang mrt station,kallang
hrwxn_,2014-09-19 19:52:00,0.0,0.0,this buyer sanggup sia dari pasir ris dtg jurong haha,,,,5.12932150631e+17,https://twitter.com/hrwxn_/status/512932150631333888,pasir ris mrt station,pasir ris
syty6,2014-09-19 19:53:00,0.0,0.0,**In-Play** 21'(0-0) gaylang international v tanjong pagar united Over 0.5 HT 8/11,,,,5.12932615247e+17,https://twitter.com/syty6/status/512932615247376385,tanjong pagar mrt station,tanjong pagar
amoyebadii,2014-09-19 19:53:00,0.0,0.0,"Jayapura, MAJALAH SELANGKAH -- Ketua Umum Barisan Merah Putih Republik Indonesia (BMP-RI) di Tanah Papua, Ramses... http:// fb.me/3h8RbIIJr",,,,5.12932457612e+17,https://twitter.com/amoyebadii/status/512932457612451841,tanah merah mrt station,tanah merah
lesterbongbong,2014-09-19 19:53:00,0.0,0.0,"@TorofRandominit From Tampines to Kemangan (no idea how to spell that), East Coast Park, Marina barrage, Marina Bay. And back.",,@TorofRandominit,,5.12932487258e+17,https://twitter.com/lesterbongbong/status/512932487257808897,tampines mrt station,tampines
Voxsports,2014-09-19 19:53:00,0.0,0.0,Stay tuned for our match report when @gifcsg vs @TgPagarUtdFC finishes at Bedok Stadium tonight!,,@gifcsg @TgPagarUtdFC,,5.12932413673e+17,https://twitter.com/Voxsports/status/512932413672939520,bedok mrt station,bedok
amoyebadii,2014-09-19 19:53:00,0.0,0.0,"Jayapura, MAJALAH SELANGKAH -- Ketua Umum Barisan Merah Putih Republik Indonesia (BMP-RI) di Tanah Papua, Ramses... http:// fb.me/71EWcIFhF",,,,5.12932459227e+17,https://twitter.com/amoyebadii/status/512932459227258880,tanah merah mrt station,tanah merah
jcxe__,2014-09-19 19:54:00,0.0,0.0,I'm at Blk 623A Punggol Spectra https://www. swarmapp.com/jothamsosleepy /checkin/541c1987498e79920140bb02?s=guElnvTMTIHt7UoONhqAE5YGNjQ&ref=tw …,,,,5.12932815337e+17,https://twitter.com/jcxe__/status/512932815336660993,punggol mrt station,punggol
Coozie009,2014-09-19 19:54:00,0.0,0.0,Nasib ade org antar gy yishun mrt,,,,5.129327997e+17,https://twitter.com/Coozie009/status/512932799699881985,yishun mrt station,yishun
snekmuslim,2014-09-19 19:56:00,0.0,0.0,"Lubuk Hartanah: Lot banglo di 65 x 134 kaki @RM 95K, Siap tambak tanah merah . http:// fb.me/2EQ8AU7la",,@RM,,5.12933331257e+17,https://twitter.com/snekmuslim/status/512933331257004032,tanah merah mrt station,tanah merah
graceleett,2014-09-19 19:57:00,0.0,0.0,Took me 34 minutes to get from bishan to jurong on clear road conditions! Going at 60km/hr suckssss,,,,5.12933437486e+17,https://twitter.com/graceleett/status/512933437485768704,bishan mrt station,bishan
TongDingJie,2014-09-19 19:57:00,0.0,0.0,@hongliangg Bedok camp near for you,,@hongliangg,,5.12933601437e+17,https://twitter.com/TongDingJie/status/512933601436921856,bedok mrt station,bedok
berriehship,2014-09-19 19:58:00,0.0,1.0,"well, it was hard finding sembawang park x'D",,,,5.12933833873e+17,https://twitter.com/berriehship/status/512933833872650240,sembawang mrt station,sembawang
veldiraannisya1,2014-09-19 19:58:00,0.0,0.0,Tanah merah ni udah marok maleng ku tengok,,,,5.12933779171e+17,https://twitter.com/veldiraannisya1/status/512933779170553856,tanah merah mrt station,tanah merah
Mulikaeimastika,2014-09-19 19:59:00,0.0,0.0,At changi airport http:// fb.me/3avdvSrWB,,,,5.12933924491e+17,https://twitter.com/Mulikaeimastika/status/512933924490977280,changi airport mrt station,changi airport
Wesifer,2014-09-19 20:00:00,0.0,0.0,I'm at Nicoll Highway MRT Station (CC5) - @smrt_singapore in Singapore https://www. swarmapp.com/wesifer/checki n/541c1acb498e0166aa7d435e?s=qzuUuqYY1l42FJOWn3BGzpITW0Q&ref=tw …,,@smrt_singapore,,5.12934176355e+17,https://twitter.com/Wesifer/status/512934176354762752,nicoll highway mrt station,nicoll highway
theAsianparent,2014-09-19 20:00:00,0.0,0.0,Discover 4 amazing destinations at Changi Airport ! http:// fb.me/6OlTQ1H2F,,,,5.12934132495e+17,https://twitter.com/theAsianparent/status/512934132494913536,changi airport mrt station,changi airport
uhmello,2014-09-19 20:00:00,1.0,2.0,@athenaaliim @cuinaxo_ @curstsoulx amelia too lazy to go to yio chu kang lol,,@athenaaliim @cuinaxo_ @curstsoulx,,5.12934341937e+17,https://twitter.com/uhmello/status/512934341937082370,yio chu kang mrt station,yio chu kang
kidlandersg,2014-09-19 20:00:00,0.0,0.0,"This September, go on a Great Adventure with your whole family at Changi Airport ! Want to find out more? Click... http:// fb.me/6Hcw3a7sg",,,,5.1293413218e+17,https://twitter.com/kidlandersg/status/512934132180340736,changi airport mrt station,changi airport
