username,date,retweets,favorites,text,geo,mentions,hashtags,id,permalink,place,key
valerieczq,2014-10-08 10:32:00,0.0,0.0,I'm at Ang Mo Kio @PublicLibrarySg in Singapore https://www. swarmapp.com/c/8PlZKXpHThu,,@PublicLibrarySg,,5.19676744174e+17,https://twitter.com/valerieczq/status/519676744173748226,ang mo kio mrt station,ang mo kio
loungebuddy,2014-10-08 10:34:00,0.0,1.0,@SingaporeAir offers an impressive array of lounges at Changi Airport . Read about them here - http:// bit.ly/ZcMBb8 pic.twitter.com/vzUdy33n45,,@SingaporeAir,,5.19677125784e+17,https://twitter.com/loungebuddy/status/519677125784125441,changi airport mrt station,changi airport
RyieAmiinIIxo,2014-10-08 10:34:00,0.0,0.0,@AqimMarrs dari poly nk cari bus g bedok poly: (,,@AqimMarrs,,5.19677280592e+17,https://twitter.com/RyieAmiinIIxo/status/519677280591683584,bedok mrt station,bedok
BarneyBlues,2014-10-08 10:35:00,0.0,0.0,On the way to Tampines Bus Interchange.,,,,5.19677311076e+17,https://twitter.com/BarneyBlues/status/519677311075893248,tampines mrt station,tampines
ZRDIKD,2014-10-08 10:36:00,1.0,0.0,pasir ris park tu...,,,,5.19677591872e+17,https://twitter.com/ZRDIKD/status/519677591871975424,pasir ris mrt station,pasir ris
simei_takk_2,2014-10-08 10:37:00,0.0,0.0,モンストやってたら部屋にじじーが来て、掃除始めたと思ったら俺の方に屁して無言で立ち去っていった。,,,,5.19677918499e+17,https://twitter.com/simei_takk_2/status/519677918499180544,simei mrt station,simei
RyieAmiinIIxo,2014-10-08 10:37:00,0.0,0.0,Nw sini apa bus g bedok inter??,,,,5.19677833804e+17,https://twitter.com/RyieAmiinIIxo/status/519677833803624448,bedok mrt station,bedok
tyasndoet,2014-10-08 10:38:00,0.0,0.0,With Fauzan at Gardens By The Bay [pic] — https:// path.com/p/2wtXgQ,,,,5.1967813339e+17,https://twitter.com/tyasndoet/status/519678133390159872,gardens by the bay mrt station,gardens by the bay
AqimMarrs,2014-10-08 10:39:00,0.0,0.0,"@RyieAmiinII tadi kat library sana ada bustop, naik 168 pergi bedok inter.",,@RyieAmiinII,,5.196784706e+17,https://twitter.com/AqimMarrs/status/519678470599622656,bedok mrt station,bedok
Pastor_Equila,2014-10-08 10:39:00,0.0,0.0,"2nd Day Photos, am ready Lord for the Third Day of Reinhard Bonnke School of Evangelism. — at Paya Lebar ... http:// fb.me/1wcv2MjL1",,,,5.19678490917e+17,https://twitter.com/Pastor_Equila/status/519678490916831234,paya lebar mrt station,paya lebar
Snyba,2014-10-08 10:39:00,0.0,0.0,"""@RyieAmiinII: Nw sini apa bus g bedok inter??"" Bus 30 HAHAHAH",,@RyieAmiinII,,5.19678427776e+17,https://twitter.com/Snyba/status/519678427775791105,bedok mrt station,bedok
RyieAmiinIIxo,2014-10-08 10:40:00,0.0,0.0,""" @AqimMarrs : @RyieAmiinII tadi kat library sana ada bustop, naik 168 pergi bedok inter.""skrg baru cakap dh sampai tamp inter",,@AqimMarrs @RyieAmiinII,,5.19678675873e+17,https://twitter.com/RyieAmiinIIxo/status/519678675873050625,bedok mrt station,bedok
BarneyBlues,2014-10-08 10:40:00,0.0,0.0,"I'm at Tampines Bus Interchange in Singapore, SINGAPORE https://www. swarmapp.com/c/56ta5ZbJuD1",,,,5.19678568272e+17,https://twitter.com/BarneyBlues/status/519678568272392194,tampines mrt station,tampines
mdhazroy,2014-10-08 10:41:00,1.0,1.0,Hahah mak aku ckp tiong bahru plaza da kne conquer ngn bdk madrasah,,,,5.19679034595e+17,https://twitter.com/mdhazroy/status/519679034595106817,tiong bahru mrt station,tiong bahru
xmxlxeczx,2014-10-08 10:41:00,0.0,0.0,and kadang kadang ..... aku just feel left out . same old shit happens at ite simei too,,,,5.1967889901e+17,https://twitter.com/xmxlxeczx/status/519678899010015232,simei mrt station,simei
SGManyTutors,2014-10-08 10:41:00,0.0,0.0,"Teaching Position @Paya Lebar MRT / Tuition Centre: by besttuition2005 (Posted Wed Oct 08, 2014 10:34 am)Tuit... http:// bit.ly/1pOgtSr",,@Paya,,5.1967906924e+17,https://twitter.com/SGManyTutors/status/519679069240037378,paya lebar mrt station,paya lebar
fatinn76,2014-10-08 10:42:00,0.0,0.0,"Balik raya di kg my hubby Tanah Merah ,Kelantan http:// fb.me/77m0VRe6p",,,,5.19679095371e+17,https://twitter.com/fatinn76/status/519679095370559490,tanah merah mrt station,tanah merah
rachelannmorris,2014-10-08 10:43:00,1.0,0.0,I'm at Singapore Changi Airport (SIN) - @fansofchangi in Singapore https://www. swarmapp.com/c/1kUc1gisZGH,,@fansofchangi,,5.19679490675e+17,https://twitter.com/rachelannmorris/status/519679490675322884,changi airport mrt station,changi airport
leeyaofeng,2014-10-08 10:44:00,0.0,0.0,after dnt paper going to jurong east swimming complex. ^^,,,,5.1967977801e+17,https://twitter.com/leeyaofeng/status/519679778010320896,jurong east mrt station,jurong east
imanlahchia,2014-10-08 10:46:00,0.0,0.0,"""@Vanguardthz: Today whole day at Tampines North CC."" Fuhh ni abg Riwayat ke?",,@Vanguardthz,,5.19680169976e+17,https://twitter.com/imanlahchia/status/519680169976406018,tampines mrt station,tampines
stompsingapore,2014-10-08 10:49:00,1.0,1.0,Students in uniform brazenly smoke at Punggol Central http:// bit.ly/1pOhBFx pic.twitter.com/nwqigeTb8U,,,,5.19681080275e+17,https://twitter.com/stompsingapore/status/519681080274599936,punggol mrt station,punggol
reneriamanzano,2014-10-08 10:49:00,1.0,0.0,"Tampines GARCIAandOINEZA for MyPhone JoshAne Too Many Walls FourDaysToGo JOSHANE GT""",,,,5.19680922116e+17,https://twitter.com/reneriamanzano/status/519680922115792896,tampines mrt station,tampines
oojoglobal,2014-10-08 10:50:00,0.0,5.0,Mesmerizing Kinetic Rain at Changi Airport : http:// youtu.be/HGss5RWYJLA via @YouTube,,@YouTube,,5.1968132833e+17,https://twitter.com/oojoglobal/status/519681328329932801,changi airport mrt station,changi airport
hanwitwicky,2014-10-08 10:50:00,0.0,0.0,Another angle @HendersonWaves #hendersonroad #hendersonwaves #telokblangah #telokblangahhillpark … http:// instagram.com/p/t4BfPvLBcF/,,@HendersonWaves,#hendersonroad #hendersonwaves #telokblangah #telokblangahhillpark,5.19681145177e+17,https://twitter.com/hanwitwicky/status/519681145177268224,telok blangah mrt station,telok blangah
hannaniyusof,2014-10-08 10:50:00,0.0,0.0,"Omg what, i didn't know there's cotton on at bedok mall",,,,5.19681110562e+17,https://twitter.com/hannaniyusof/status/519681110561652738,bedok mrt station,bedok
Raman13Alexis,2014-10-08 10:50:00,0.0,0.0,First to Momoji @Yishun for awesome Japanese food and then to TTSH for medical...,,@Yishun,,5.19681123686e+17,https://twitter.com/Raman13Alexis/status/519681123685650433,yishun mrt station,yishun
TimotheusLee,2014-10-08 10:51:00,0.0,0.0,Mesmerizing Kinetic Rain at Changi Airport : http:// youtu.be/HGss5RWYJLA via @YouTube,,@YouTube,,5.19681455442e+17,https://twitter.com/TimotheusLee/status/519681455442497536,changi airport mrt station,changi airport
TimotheusLee,2014-10-08 10:52:00,0.0,0.0,Mesmerizing Kinetic Rain at Changi Airport http:// pinterest.com/pin/2162432195 83793475/ …,,,,5.19681709609e+17,https://twitter.com/TimotheusLee/status/519681709608955905,changi airport mrt station,changi airport
LoyLoy_96,2014-10-08 10:52:00,0.0,1.0,"Back day (at @GymmBoxx XL in Singapore, Bishan ) https://www. swarmapp.com/c/3m0v7vD6MZt",,@GymmBoxx,,5.19681703267e+17,https://twitter.com/LoyLoy_96/status/519681703267164160,bishan mrt station,bishan
ewknees,2014-10-08 10:52:00,0.0,0.0,"@Jonathan_RE_Kaw What were you doin' in Bedok , sir?",,@Jonathan_RE_Kaw,,5.19681667658e+17,https://twitter.com/ewknees/status/519681667657523203,bedok mrt station,bedok
RynDnl,2014-10-08 10:52:00,0.0,0.0,@_mdsyakir AKU MASIH KAT SEMBAWANG 9MINS SEMPAT TAK HAHA,,@_mdsyakir,,5.19681769709e+17,https://twitter.com/RynDnl/status/519681769709125632,sembawang mrt station,sembawang
_afysatria,2014-10-08 10:53:00,0.0,1.0,Heading down to tamp soon . Then later to payalebar .,,,,5.19681909547e+17,https://twitter.com/_afysatria/status/519681909547225088,paya lebar mrt station,paya lebar
reverseg,2014-10-08 10:55:00,0.0,0.0,It's... It's a flower speaker. #teamrodrigo #singapore @Changi Airport http:// instagram.com/p/t4CChTG0We/,,@Changi,#teamrodrigo #singapore,5.19682357205e+17,https://twitter.com/reverseg/status/519682357205295105,changi airport mrt station,changi airport
JREALYZ_,2014-10-08 10:55:00,0.0,0.0,workkkk (@Hougang Mall in Singapore) https://www. swarmapp.com/c/aPDRKlRGT6i,,@Hougang,,5.19682505658e+17,https://twitter.com/JREALYZ_/status/519682505658486786,hougang mrt station,hougang
frdhzr_,2014-10-08 10:56:00,1.0,1.0,@Chantally keyi keyi from bedok to japan can also deliver this food to you. Limpeh steady one HAHAHAHA pic.twitter.com/ZR1RGvs1Tg,,@Chantally,,5.19682613385e+17,https://twitter.com/frdhzr_/status/519682613384990722,bedok mrt station,bedok
itsCharmian,2014-10-08 10:58:00,0.0,0.0,Where are u attached to for your internship? — Manulife @bras basah :) http:// ask.fm/a/baal5aol,,@bras,,5.1968312392e+17,https://twitter.com/itsCharmian/status/519683123919859713,bras basah mrt station,bras basah
BrianEmma2,2014-10-08 10:59:00,0.0,0.0,Outdoor playroom so kids at preschool punggol : WnMTUdVPE,,,,5.19683501906e+17,https://twitter.com/BrianEmma2/status/519683501906358273,punggol mrt station,punggol
TODAYonline,2014-10-08 11:00:00,5.0,1.0,"Alleged Jurong East loanshark harasser caught just 8 minutes after commiting crime, thanks to police cameras in area http:// tdy.sg/1s5PhDc",,,,5.19683665098e+17,https://twitter.com/TODAYonline/status/519683665098338305,jurong east mrt station,jurong east
renonation_sg,2014-10-08 11:01:00,0.0,0.0,"ARTISAN SPACE OPEN HOUSE [11th-12th Oct 2014] DBSS Centrale 8 - Tampines central 8, Tampines , Singapore 521519... http:// fb.me/6PRsStLMo",,,,5.19683993789e+17,https://twitter.com/renonation_sg/status/519683993789157377,tampines mrt station,tampines
Kxrl_,2014-10-08 11:02:00,0.0,1.0,"Journey to the north east. Serangoon , here i come",,,,5.1968428198e+17,https://twitter.com/Kxrl_/status/519684281979768836,serangoon mrt station,serangoon
PropnexInt,2014-10-08 11:03:00,0.0,0.0,"The Santorini Condo is a brand new condominium launch, located at Tampines Street 86. http://www. propnexinternational.com/projects/santo rini.html/ …",,,,5.19684429603e+17,https://twitter.com/PropnexInt/status/519684429602516992,tampines mrt station,tampines
nqbmr_,2014-10-08 11:03:00,0.0,0.0,off to changi airport w syaz and sat,,,,5.19684519927e+17,https://twitter.com/nqbmr_/status/519684519926853635,changi airport mrt station,changi airport
Marcus1712,2014-10-08 11:04:00,0.0,0.0,@Wanton_Warrior kallang wave there Weston corp,,@Wanton_Warrior,,5.19684649061e+17,https://twitter.com/Marcus1712/status/519684649061068800,kallang mrt station,kallang
purlandarizki,2014-10-08 11:05:00,0.0,0.0,Anyone can teman me to kallang wave?:(,,,,5.19684907267e+17,https://twitter.com/purlandarizki/status/519684907266625536,kallang mrt station,kallang
dcslimousines,2014-10-08 11:06:00,0.0,0.0,Driving to Serangoon . ETA 11:20 AM using @waze - Social GPS.,,@waze,,5.19685188851e+17,https://twitter.com/dcslimousines/status/519685188851224580,serangoon mrt station,serangoon
AmericanVolley1,2014-10-08 11:07:00,0.0,0.0,OPEN GYM ON SUNDAY AT UWCSEA East Campus in Tampines from 2-5pm. Go to this link to reserve your spot!... http:// fb.me/1NgoSXiNN,,,,5.19685515504e+17,https://twitter.com/AmericanVolley1/status/519685515503603712,tampines mrt station,tampines
chijiburger,2014-10-08 11:08:00,0.0,1.0,"everyone's immediately going to mac, mrt go kallang wave all to go party i go home and watch naruto #life",,,#life,5.19685801643e+17,https://twitter.com/chijiburger/status/519685801643241473,kallang mrt station,kallang
prafsdgr8,2014-10-08 11:08:00,0.0,0.0,@SingTelSupport how to get duplicate payment receipt for Hi Cards purchased at #ChangiAirport ? @FansofChangi,,@SingTelSupport @FansofChangi,#ChangiAirport,5.19685687558e+17,https://twitter.com/prafsdgr8/status/519685687558172673,changi airport mrt station,changi airport
fatahbunehneh,2014-10-08 11:08:00,0.0,0.0,I'm at Hougang Mall in Singapore https://www. swarmapp.com/c/21w8Nt4Tpe4,,,,5.19685707938e+17,https://twitter.com/fatahbunehneh/status/519685707938283521,hougang mrt station,hougang
jovan_2102,2014-10-08 11:12:00,0.0,0.0,@LimCelina near siglap ahhh?,,@LimCelina,,5.19686743176e+17,https://twitter.com/jovan_2102/status/519686743176384512,siglap mrt station,siglap
yvonnegracec,2014-10-08 11:15:00,0.0,0.0,@BaoQiang_09 already saw that at Punggol Waterway a few weeks ago,,@BaoQiang_09,,5.19687388483e+17,https://twitter.com/yvonnegracec/status/519687388482658305,punggol mrt station,punggol
SGManyTutors,2014-10-08 11:16:00,0.0,0.0,"Teaching Position @Paya Lebar MRT / Tuition Centre: by besttuition2005 (Posted Wed Oct 08, 2014 10:53 am)Tuit... http:// bit.ly/10N8KhF",,@Paya,,5.19687734391e+17,https://twitter.com/SGManyTutors/status/519687734391107584,paya lebar mrt station,paya lebar
BarneyBlues,2014-10-08 11:16:00,0.0,0.0,. @FadhliEricsson's crib. (@Blk 105 Bedok North Ave 4) https://www. swarmapp.com/c/1lz2Tg2kn11,,@FadhliEricsson @Blk,,5.196877693e+17,https://twitter.com/BarneyBlues/status/519687769300279298,bedok mrt station,bedok
SGManyTutors,2014-10-08 11:16:00,0.0,0.0,"JC2 Maths & Biology - Marsiling : by yuyisg (Posted Wed Oct 08, 2014 10:53 am)Ref:2017Level/Subject: JC2 Maths ... http:// bit.ly/10N8Ju0",,,,5.19687735268e+17,https://twitter.com/SGManyTutors/status/519687735267713024,marsiling mrt station,marsiling
SGManyTutors,2014-10-08 11:16:00,0.0,0.0,"PUNGGOL - P1 english: by besttuition2005 (Posted Wed Oct 08, 2014 11:06 am)Location: Punggol , edgedale plainsL... http:// bit.ly/1tymdkt",,,,5.19687736002e+17,https://twitter.com/SGManyTutors/status/519687736001720320,punggol mrt station,punggol
SGManyTutors,2014-10-08 11:16:00,0.0,0.0,"HOUGANG - P6 Eng, Sci Homework Helper: by besttuition2005 (Posted Wed Oct 08, 2014 10:51 am)Location: Hougang ... http:// bit.ly/1tymbcl",,,,5.19687733733e+17,https://twitter.com/SGManyTutors/status/519687733732585474,hougang mrt station,hougang
celineztay,2014-10-08 11:16:00,0.0,0.0,I'm at Kallang Wave - @sgsportshub in Singapore https://www. swarmapp.com/c/23sB8NbzCps,,@sgsportshub,,5.19687783276e+17,https://twitter.com/celineztay/status/519687783275708416,kallang mrt station,kallang
jcxe__,2014-10-08 11:16:00,0.0,0.0,I'm at Leisure Park Kallang in Singapore https://www. swarmapp.com/c/8N4eRbtK0lC,,,,5.19687787663e+17,https://twitter.com/jcxe__/status/519687787662934017,kallang mrt station,kallang
badboykiu,2014-10-08 11:17:00,0.0,0.0,I'm at Eunos MRT Station (EW7) - @smrt_singapore in Singapore https://www. swarmapp.com/c/20010sRhlPq,,@smrt_singapore,,5.19687977355e+17,https://twitter.com/badboykiu/status/519687977354543105,eunos mrt station,eunos mrt
KennyTheGiant,2014-10-08 11:20:00,2.0,2.0,I'm at Blk 172 Bishan Street 13 in Singapore https://www. swarmapp.com/c/2FFi3ZaxByv,,,,5.19688860394e+17,https://twitter.com/KennyTheGiant/status/519688860393955328,bishan mrt station,bishan
nattywz,2014-10-08 11:20:00,0.0,1.0,Pasir Ris Recreational Centre Dance studio quite small eh,,,,5.19688764856e+17,https://twitter.com/nattywz/status/519688764856086528,pasir ris mrt station,pasir ris
Thongggg,2014-10-08 11:22:00,0.0,0.0,@jnvie tiong bahru want come ah?,,@jnvie,,5.19689298413e+17,https://twitter.com/Thongggg/status/519689298413490177,tiong bahru mrt station,tiong bahru
wxnlin,2014-10-08 11:25:00,0.0,1.0,@chloekuanqx HAHAHA I SAWW BTW THERE WAS ONCE I saw u AT THE KALLANG WAVE THEN I WAS LIKE SO AWK,,@chloekuanqx,,5.19690063887e+17,https://twitter.com/wxnlin/status/519690063886577665,kallang mrt station,kallang
BrandonxTan,2014-10-08 11:25:00,0.0,0.0,Sukiya @Bedok Point!!!,,@Bedok,,5.19689973558e+17,https://twitter.com/BrandonxTan/status/519689973558018048,bedok mrt station,bedok
sweetcharms_mj,2014-10-08 11:28:00,0.0,0.0,#quoteoftheday Good morning! #positivemind @307 Jurong East Street 32 http:// instagram.com/p/t4F6ASsRvQ/,,@307,#quoteoftheday #positivemind,5.19690860435e+17,https://twitter.com/sweetcharms_mj/status/519690860435210243,jurong east mrt station,jurong east
babes_mentionz,2014-10-08 11:28:00,0.0,0.0,"#Nowplaying #Psycroptic #HMPlaylist ♫ ""Psycrology"" by Psycroptic (@Tampines Central Park) http:// sdtk.fm/1nYXTvT",,@Tampines,#Nowplaying #Psycroptic #HMPlaylist,5.19690667317e+17,https://twitter.com/babes_mentionz/status/519690667316899840,tampines mrt station,tampines
audreyychua,2014-10-08 11:28:00,0.0,0.0,Hahaha cabbing to tampines to watch movie hahaha,,,,5.19690760988e+17,https://twitter.com/audreyychua/status/519690760988270594,tampines mrt station,tampines
_xFOREVERSHORTx,2014-10-08 11:31:00,0.0,0.0,Work out ! (@Hougang ClubFITT Gym in Singapore) https://www. swarmapp.com/c/2cINcRtkJ6I,,@Hougang,,5.19691570422e+17,https://twitter.com/_xFOREVERSHORTx/status/519691570421837824,hougang mrt station,hougang
Weilong321,2014-10-08 11:32:00,0.0,0.0,"@alyssiaweex come yishun lol, I can study here",,@alyssiaweex,,5.19691880771e+17,https://twitter.com/Weilong321/status/519691880770977792,yishun mrt station,yishun
Wnsyima,2014-10-08 11:32:00,0.0,0.0,"Shopping kopok before balik kl (@Pasar Besar Tanah Merah in Tanah Merah , Kelantan) https://www. swarmapp.com/c/6aaQzY0rqxh",,@Pasar,,5.19691668598e+17,https://twitter.com/Wnsyima/status/519691668597915648,tanah merah mrt station,tanah merah
hikippiki,2014-10-08 11:33:00,0.0,0.0,@rikk5927 omg AHAHA when you're reaching kent ridge tell me!! I bring you in,,@rikk5927,,5.19691917815e+17,https://twitter.com/hikippiki/status/519691917815062528,kent ridge mrt station,kent ridge
woshiwenyi,2014-10-08 11:33:00,0.0,0.0,Omw to bukit batok .,,,,5.19692015576e+17,https://twitter.com/woshiwenyi/status/519692015575891968,bukit batok mrt station,bukit batok
VELCHEWx,2014-10-08 11:34:00,0.0,0.0,I'm at Yishun Bus Interchange - @smrt_singapore in Singapore https://www. swarmapp.com/c/iVMdwLEiTlE,,@smrt_singapore,,5.19692378492e+17,https://twitter.com/VELCHEWx/status/519692378492243968,yishun mrt station,yishun
wahidbuangii,2014-10-08 11:35:00,0.0,0.0,I'm at Bedok New Town in Bedok New Town https://www. swarmapp.com/c/ejSwg36JrcJ,,,,5.19692447489e+17,https://twitter.com/wahidbuangii/status/519692447488557057,bedok mrt station,bedok
FizIskandar_,2014-10-08 11:35:00,0.0,2.0,Off to yew tee,,,,5.19692565747e+17,https://twitter.com/FizIskandar_/status/519692565746946049,yew tee mrt station,yew tee
theorawrus,2014-10-08 11:36:00,0.0,0.0,@kissonyou it's at Yew Tee point!!! The shop that sells balloons and toys.,,@kissonyou,,5.19692837731e+17,https://twitter.com/theorawrus/status/519692837730799616,yew tee mrt station,yew tee
ttzhhhh,2014-10-08 11:36:00,0.0,0.0,Thought of goin jurong collect stuff. Instead now go punggol eat then go jurong,,,,5.1969279942e+17,https://twitter.com/ttzhhhh/status/519692799420018688,punggol mrt station,punggol
rainnabe,2014-10-08 11:37:00,0.0,0.0,"@goldigger79 last time I see her was when I met her at tampines mall, I called her but she didn't stop to chat cos her husband was with her.",,@goldigger79,,5.19692994363e+17,https://twitter.com/rainnabe/status/519692994362884096,tampines mrt station,tampines
alyssiaweex,2014-10-08 11:40:00,0.0,0.0,@Weilong321 shut up eddyzZz I DONT LIKE YISHUN IT BRINGS BACK BAD MEMORIES OF MY PAST,,@Weilong321,,5.19693678072e+17,https://twitter.com/alyssiaweex/status/519693678072193026,yishun mrt station,yishun
Weilong321,2014-10-08 11:40:00,0.0,0.0,@alyssiaweex then go differen parts of yishun lorh :3 hehe,,@alyssiaweex,,5.19693834386e+17,https://twitter.com/Weilong321/status/519693834385510400,yishun mrt station,yishun
LeandroNgTianYi,2014-10-08 11:41:00,0.0,0.0,8 days in trip in taiwan #taiwan @Changi AIRPORT Teminal 1 Departure http:// instagram.com/p/t4HT8tB6Nc/,,@Changi,#taiwan,5.19693950798e+17,https://twitter.com/LeandroNgTianYi/status/519693950798422016,changi airport mrt station,changi airport
NGYONGJIA_,2014-10-08 11:41:00,0.0,0.0,Shit this is so fun . Using the Hougang Mall Library computer HAHAHAH,,,,5.19693973515e+17,https://twitter.com/NGYONGJIA_/status/519693973514764288,hougang mrt station,hougang
99HORSES,2014-10-08 11:44:00,0.0,0.0,@beaniscute @yeediot I'm only at Bishan :(,,@beaniscute @yeediot,,5.1969473109e+17,https://twitter.com/99HORSES/status/519694731089952768,bishan mrt station,bishan
BrandonLimWH,2014-10-08 11:45:00,0.0,0.0,I'm at Singapore Changi Airport (SIN) - @fansofchangi in Singapore w/ @fattyahqi https://www. swarmapp.com/c/kKWpJcgm27N,,@fansofchangi @fattyahqi,,5.19695143109e+17,https://twitter.com/BrandonLimWH/status/519695143109017600,changi airport mrt station,changi airport
isr_sg,2014-10-08 11:46:00,0.0,0.0,woodsville 28 beside potong pasir mrt in #singapore for rent $3800/mth 2 bedrooms http:// bit.ly/1tQPMAi pic.twitter.com/EFdgqRZUUF,,,#singapore,5.19695233299e+17,https://twitter.com/isr_sg/status/519695233299128320,potong pasir mrt station,potong pasir
amsyrf,2014-10-08 11:49:00,0.0,0.0,Miss Moment @SMT Tanah Merah http:// instagram.com/p/t4ITV_K6W4/,,@SMT,,5.19696129148e+17,https://twitter.com/amsyrf/status/519696129147953152,tanah merah mrt station,tanah merah
FarhaniIsMyName,2014-10-08 11:49:00,0.0,0.0,Off to Serangoon Nex to watch Annabelle with the awesome ~ !,,,,5.19696119363e+17,https://twitter.com/FarhaniIsMyName/status/519696119362646016,serangoon mrt station,serangoon
Angga_AAT,2014-10-08 11:50:00,0.0,0.0,Smile!!! (at Blk 498G Tampines Street 45) [pic] — https:// path.com/p/3Sm6fk,,,,5.19696189462e+17,https://twitter.com/Angga_AAT/status/519696189462032384,tampines mrt station,tampines
shxkxnxh,2014-10-08 11:51:00,0.0,0.0,I is at boon lay,,,,5.19696605449e+17,https://twitter.com/shxkxnxh/status/519696605448900609,boon lay mrt station,boon lay
EdaEdorxle,2014-10-08 11:51:00,0.0,0.0,Abeh Kalau Dari yishun pergi skola da dekat tapi tetap lambat mcm mane tu,,,,5.19696460913e+17,https://twitter.com/EdaEdorxle/status/519696460913209344,yishun mrt station,yishun
PerkPietrek,2014-10-08 11:52:00,0.0,0.0,Yup — playing soccer at Changi Airport http:// fb.me/6Yj6OjGXP,,,,5.19696926221e+17,https://twitter.com/PerkPietrek/status/519696926220886016,changi airport mrt station,changi airport
audreyychua,2014-10-08 11:52:00,0.0,0.0,@SillyIsMe @Rixiee3 hahah come tampines !!!,,@SillyIsMe @Rixiee3,,5.19696711191e+17,https://twitter.com/audreyychua/status/519696711191494656,tampines mrt station,tampines
narakqin,2014-10-08 11:53:00,0.0,0.0,I'm at Yew Tee Point in Singapore https://www. swarmapp.com/c/7Lif8GHvM8l,,,,5.19697016671e+17,https://twitter.com/narakqin/status/519697016671055872,yew tee mrt station,yew tee
HolisticWaySG,2014-10-08 11:53:00,0.0,0.0,"John Little @Jurong Point, Marina Square, Plaza Singapura, Tiong Bahru Plaza “Health & Beauty Fair” 13/10/2014... http:// fb.me/3hWVo8nj7",,@Jurong,,5.19696972824e+17,https://twitter.com/HolisticWaySG/status/519696972823801856,tiong bahru mrt station,tiong bahru
deesuriaddy,2014-10-08 11:55:00,0.0,0.0,@NinjaAn buzz boon lay inter ah. Eh tkde movie best best eh,,@NinjaAn,,5.19697574748e+17,https://twitter.com/deesuriaddy/status/519697574748381184,boon lay mrt station,boon lay
_xFOREVERSHORTx,2014-10-08 11:56:00,0.0,0.0,Gym today. @Hougang Gym http:// instagram.com/p/t4JBfPD21e/,,@Hougang,,5.19697714549e+17,https://twitter.com/_xFOREVERSHORTx/status/519697714548727809,hougang mrt station,hougang
Ruok,2014-10-08 11:56:00,0.0,0.0,Passed @Vicom Inspection Centre @Bukit Batok http:// instagram.com/p/t4JCh8O42X/,,@Vicom @Bukit,,5.1969775067e+17,https://twitter.com/Ruok/status/519697750670065664,bukit batok mrt station,bukit batok
seito__simei,2014-10-08 11:56:00,0.0,0.0,最近こっちで全然呟いてなかったな,,,,5.19697875325e+17,https://twitter.com/seito__simei/status/519697875324780544,simei mrt station,simei
YOURH1GHNE5S,2014-10-08 11:56:00,0.0,1.0,hooooly shit exam at 2pm all the way at tiong bahru fucking shit,,,,5.19697933974e+17,https://twitter.com/YOURH1GHNE5S/status/519697933973716992,tiong bahru mrt station,tiong bahru
aetenotnk,2014-10-08 11:57:00,0.0,0.0,@seito__ simei おひさ！,,@seito__,,5.1969817921e+17,https://twitter.com/aetenotnk/status/519698179210489859,simei mrt station,simei
LTAsg,2014-10-08 11:58:00,0.0,0.0,Accident on CTE (towards SLE) at Ang Mo Kio Ave 1 Entrance,,,,5.19698277231e+17,https://twitter.com/LTAsg/status/519698277231370240,ang mo kio mrt station,ang mo kio
seito__simei,2014-10-08 11:58:00,1.0,1.0,@aetenotnk おっぱい！,,@aetenotnk,,5.19698277881e+17,https://twitter.com/seito__simei/status/519698277881491458,simei mrt station,simei
seito__simei,2014-10-08 11:58:00,0.0,0.0,今日は大学にいきやんす。,,,,5.19698385176e+17,https://twitter.com/seito__simei/status/519698385175990273,simei mrt station,simei
aishah_ashburn,2014-10-08 11:58:00,0.0,0.0,"I'm at Hill City Café 山城 in Clarke Quay , Singapore https://www. swarmapp.com/c/cKqUdeTHmFc",,,,5.19698304985e+17,https://twitter.com/aishah_ashburn/status/519698304985100289,clarke quay mrt station,clarke quay
seito__simei,2014-10-08 11:59:00,0.0,0.0,ラインよりこっちのがやっぱり気楽だな！,,,,5.19698504147e+17,https://twitter.com/seito__simei/status/519698504147415044,simei mrt station,simei
seito__simei,2014-10-08 11:59:00,0.0,0.0,あ^〜めんどくさいんじゃー^〜,,,,5.19698646393e+17,https://twitter.com/seito__simei/status/519698646393028610,simei mrt station,simei
ruiqi923,2014-10-08 12:00:00,0.0,0.0,Ages since I went to hougang . Think the last time was with @xangelinezhangx,,@xangelinezhangx,,5.19698739217e+17,https://twitter.com/ruiqi923/status/519698739217174529,hougang mrt station,hougang
deesuriaddy,2014-10-08 12:00:00,0.0,0.0,@NinjaAn okok cepat Ady da tengah jalan gi boon lay inter hahahah,,@NinjaAn,,5.19698942452e+17,https://twitter.com/deesuriaddy/status/519698942452187137,boon lay mrt station,boon lay
