username,date,retweets,favorites,text,geo,mentions,hashtags,id,permalink,place,key
billnguyenvn,2014-10-04 20:04:00,0.0,0.0,#ayam #panggang #grilled #chicken #indonesianfood @Foodjunction @Bishan Junction8 http:// instagram.com/p/tutr4PDsiS/,,@Foodjunction @Bishan,#ayam #panggang #grilled #chicken #indonesianfood,5.18370960413e+17,https://twitter.com/billnguyenvn/status/518370960412774400,bishan mrt station,bishan
karinakittysari,2014-10-04 20:05:00,0.0,0.0,"Ftm adm to marsiling , then frm marsiling to wdls. Good.",,,,5.18371442896e+17,https://twitter.com/karinakittysari/status/518371442895773696,marsiling mrt station,marsiling
LzJouren,2014-10-04 20:05:00,0.0,0.0,"Saw a guy lying on the ground, drunk, crying so loudly, in the centre of music deafening clarke quay . What happen?",,,,5.18371304765e+17,https://twitter.com/LzJouren/status/518371304764735488,clarke quay mrt station,clarke quay
linhlam,2014-10-04 20:05:00,0.0,0.0,PA launches Water-Venture Committee in Pasir Ris http:// dlvr.it/75sQRk,,,,5.18371277565e+17,https://twitter.com/linhlam/status/518371277564686336,pasir ris mrt station,pasir ris
coolcoolinfo,2014-10-04 20:05:00,0.0,0.0,PA launches Water-Venture Committee in Pasir Ris http:// dlvr.it/75sQRp,,,,5.18371278248e+17,https://twitter.com/coolcoolinfo/status/518371278248361985,pasir ris mrt station,pasir ris
212wee,2014-10-04 20:05:00,0.0,0.0,PA launches Water-Venture Committee in Pasir Ris http:// dlvr.it/75sQWN,,,,5.18371291003e+17,https://twitter.com/212wee/status/518371291003244544,pasir ris mrt station,pasir ris
chuhaizhou,2014-10-04 20:05:00,0.0,0.0,PA launches Water-Venture Committee in Pasir Ris http:// ift.tt/ZFglyH,,,,5.18371333941e+17,https://twitter.com/chuhaizhou/status/518371333940723712,pasir ris mrt station,pasir ris
chuhaizhou,2014-10-04 20:05:00,0.0,0.0,dlvr - PA launches Water-Venture Committee in Pasir Ris http:// bit.ly/1EcKyVt,,,,5.18371389783e+17,https://twitter.com/chuhaizhou/status/518371389783281664,pasir ris mrt station,pasir ris
sleaguepipebomb,2014-10-04 20:06:00,0.0,0.0,Highlight of hougang v hm b was when the vendor had finished preparing the free pop corn n the crowd including me were stirred #sleague,,,#sleague,5.18371566972e+17,https://twitter.com/sleaguepipebomb/status/518371566971658240,hougang mrt station,hougang
kakakawaiikaka,2014-10-04 20:06:00,0.0,0.0,等媽媽下班。我的人生真精彩 #hkgirl #selca #DumbDumbTakingSelfie @Changi Airport http:// instagram.com/p/tuuA98mamn/,,@Changi,#hkgirl #selca #DumbDumbTakingSelfie,5.18371685972e+17,https://twitter.com/kakakawaiikaka/status/518371685972463616,changi airport mrt station,changi airport
Se_bas_ti_en,2014-10-04 20:07:00,0.0,0.0,@Weitinqsim pasir ris,,@Weitinqsim,,5.18371916097e+17,https://twitter.com/Se_bas_ti_en/status/518371916097142786,pasir ris mrt station,pasir ris
Sohighlow,2014-10-04 20:07:00,0.0,0.0,Pendekar Senduk sesat di Punggol ... Yok masak yok! @Punggol Walk http:// instagram.com/p/tuuHGrIJgK/,,@Punggol,,5.18371896372e+17,https://twitter.com/Sohighlow/status/518371896371736576,punggol mrt station,punggol
spxmz,2014-10-04 20:07:00,0.0,0.0,I'm at Bishan MRT Interchange (NS17/CC15) - @smrt_singapore in Singapore https://www. swarmapp.com/c/k6lvvvPaa8q,,@smrt_singapore,,5.1837186931e+17,https://twitter.com/spxmz/status/518371869310083072,bishan mrt station,bishan
Se_bas_ti_en,2014-10-04 20:07:00,0.0,0.0,@Weitinqsim Tampines,,@Weitinqsim,,5.18371726171e+17,https://twitter.com/Se_bas_ti_en/status/518371726170664960,tampines mrt station,tampines
muhd4zli,2014-10-04 20:07:00,0.0,0.0,Kimak causeway link nye queue da cover 3/4 of the jurong east interchange,,,,5.18371746958e+17,https://twitter.com/muhd4zli/status/518371746957647872,jurong east mrt station,jurong east
Safuannnn,2014-10-04 20:08:00,0.0,0.0,2-0 to Tanjong Pagar against CYL.,,,,5.18372161091e+17,https://twitter.com/Safuannnn/status/518372161090637824,tanjong pagar mrt station,tanjong pagar
AkuKanIrfan,2014-10-04 20:08:00,0.0,0.0,@zyannthy tampines afghan there,,@zyannthy,,5.1837200104e+17,https://twitter.com/AkuKanIrfan/status/518372001040195584,tampines mrt station,tampines
Alicegwt,2014-10-04 20:08:00,0.0,1.0,I'm at Hougang Mall in Singapore https://www. swarmapp.com/c/bxkkrjObFbE,,,,5.18372008385e+17,https://twitter.com/Alicegwt/status/518372008384798721,hougang mrt station,hougang
TRUKLAYNE71,2014-10-04 20:08:00,0.0,0.0,"Via: Asia One Cisco police officer found dead with single-gun shot wound at Changi Airport toilet Saturday,... http:// fb.me/3rEb6ycVn",,,,5.18372106288e+17,https://twitter.com/TRUKLAYNE71/status/518372106288242688,changi airport mrt station,changi airport
LianaaCliquers,2014-10-04 20:08:00,0.0,0.0,@nedya_archuleta Doraemon agik jage bedok idang takbiran mlm ne,,@nedya_archuleta,,5.1837206916e+17,https://twitter.com/LianaaCliquers/status/518372069160259584,bedok mrt station,bedok
rei_yang,2014-10-04 20:08:00,0.0,0.0,#ice #jelly #honey #lime #爱玉冰 #cool #iced #cold #dessert #drink #dessertblogger #desserts #serangoon … http:// instagram.com/p/tuuJQzOkgN/,,,#ice #jelly #honey #lime # #cool #iced #cold #dessert #drink #dessertblogger #desserts #serangoon,5.18371970363e+17,https://twitter.com/rei_yang/status/518371970363432960,serangoon mrt station,serangoon
Aiman_11_,2014-10-04 20:08:00,0.0,3.0,Paya lebar intercon team vs Paya lebar youth team was fun just now..,,,,5.18372041121e+17,https://twitter.com/Aiman_11_/status/518372041120968704,paya lebar mrt station,paya lebar
NorainiAris,2014-10-04 20:09:00,0.0,0.0,Tonight... We Go check out #Badoque — at Badoque Cafe at Upper Thomson Road http:// fb.me/MRpoxXtx,,,#Badoque,5.18372263671e+17,https://twitter.com/NorainiAris/status/518372263671119872,upper thomson mrt station,upper thomson
Voxsports,2014-10-04 20:09:00,0.0,0.0,GOAL! Tanjong Pagar 2 (Monsef Zerka 34') Courts Young Lions #SLeague,,,#SLeague,5.18372345917e+17,https://twitter.com/Voxsports/status/518372345916821506,tanjong pagar mrt station,tanjong pagar
NewsInSG,2014-10-04 20:10:00,0.0,0.0,NewsInSG: Cisco police officer found dead with single-gun shot wound at Changi Airport toilet: SING... http:// bit.ly/Zcvpmt #Singapore,,,#Singapore,5.18372535948e+17,https://twitter.com/NewsInSG/status/518372535948173312,changi airport mrt station,changi airport
Akiternally629,2014-10-04 20:10:00,0.0,0.0,Haagen Daz at Tampines Mall? :D @Yuuupyon_,,@Yuuupyon_,,5.18372497923e+17,https://twitter.com/Akiternally629/status/518372497922609152,tampines mrt station,tampines
757LiveSG,2014-10-04 20:10:00,0.0,0.0,#Cisco police officer found dead with single-gun shot wound at Changi Airport toilet - AsiaOne http:// 757l.tk/1n2Ex8f,,,#Cisco,5.18372544459e+17,https://twitter.com/757LiveSG/status/518372544458801152,changi airport mrt station,changi airport
YahooSG,2014-10-04 20:10:00,1752.0,199.0,Cisco security officer found dead at #ChangiAirport toilet with single gunshot to the head http:// bit.ly/ZFhwxU pic.twitter.com/SOohDsTyI5,,,#ChangiAirport,5.18372697764e+17,https://twitter.com/YahooSG/status/518372697764421633,changi airport mrt station,changi airport
missysiti,2014-10-04 20:10:00,0.0,0.0,Let's go on a fieldtrip to Tampines ! This Tampines New Town is actually a nice topic to study. Potential dissertation topic uh.,,,,5.18372649148e+17,https://twitter.com/missysiti/status/518372649148239875,tampines mrt station,tampines
sleaguepipebomb,2014-10-04 20:10:00,0.0,0.0,Seen more action in the living dead series than hougang v harimau muda b #sleague,,,#sleague,5.18372675296e+17,https://twitter.com/sleaguepipebomb/status/518372675295531008,hougang mrt station,hougang
fxckattachments,2014-10-04 20:11:00,0.0,0.0,I'm at Blk 278 Bishan Street 24 https://www. swarmapp.com/c/enqacz63efe,,,,5.18372950782e+17,https://twitter.com/fxckattachments/status/518372950782001152,bishan mrt station,bishan
Yolan31,2014-10-04 20:11:00,1.0,0.0,sang merah putih berkibar dengan gagah di tanah gingseng #Bendera Indonesia,,,#Bendera,5.18372850341e+17,https://twitter.com/Yolan31/status/518372850341007360,tanah merah mrt station,tanah merah
aePiots,2014-10-04 20:11:00,0.0,0.0,Cisco police officer found dead with single-gun shot wound at Changi Airport toilet – AsiaOne http:// ow.ly/2OBkRW,,,,5.18372824663e+17,https://twitter.com/aePiots/status/518372824663465984,changi airport mrt station,changi airport
YongsukHur,2014-10-04 20:11:00,0.0,0.0,I'm at Tampines Mall in Singapore http:// 4sq.com/1EcLOHX,,,,5.18372900857e+17,https://twitter.com/YongsukHur/status/518372900857208832,tampines mrt station,tampines
SGnews,2014-10-04 20:12:00,1.0,0.0,[Y!] Cisco officer found dead in Changi Airport toilet cubicle http:// bit.ly/1umdnua,,,,5.1837306386e+17,https://twitter.com/SGnews/status/518373063860453377,changi airport mrt station,changi airport
Narahts,2014-10-04 20:12:00,0.0,0.0,Chompchomp nums. (@Serangoon Garden Market & Food Centre in Singapore) https://www. swarmapp.com/c/1AA7sGxkmt3 pic.twitter.com/0hw4Df6cUN,,@Serangoon,,5.18373056567e+17,https://twitter.com/Narahts/status/518373056566554624,serangoon mrt station,serangoon
ikhsan_myid,2014-10-04 20:12:00,0.0,0.0,#Soccer #Livescore @ScoresPro : (SIN-D1) Tanjong Pagar UTD FC vs Courts Young Lions: 1-0: Goal for Tanjon... http:// bit.ly/1rUyaEb #Bola,,@ScoresPro,#Soccer #Livescore #Bola,5.18372972336e+17,https://twitter.com/ikhsan_myid/status/518372972336119808,tanjong pagar mrt station,tanjong pagar
spxmz,2014-10-04 20:12:00,0.0,0.0,I'm at Toa Payoh MRT Station (NS19) - @smrt_singapore in Singapore https://www. swarmapp.com/c/6JKxHzJoV2w,,@smrt_singapore,,5.18373115077e+17,https://twitter.com/spxmz/status/518373115077087232,toa payoh mrt station,toa payoh
aePiots,2014-10-04 20:13:00,0.0,0.0,Cisco police officer found dead with single-gun shot wound at Changi Airport toilet – As... http:// ow.ly/CeLZU pic.twitter.com/AkEMfVqKMr,,,,5.18373345961e+17,https://twitter.com/aePiots/status/518373345960951808,changi airport mrt station,changi airport
aePiots,2014-10-04 20:13:00,0.0,0.0,Cisco police officer found dead with single-gun shot wound at Changi Airport toilet – As... http:// ow.ly/CeLZU pic.twitter.com/yRvySU5MWt,,,,5.18373289304e+17,https://twitter.com/aePiots/status/518373289304289281,changi airport mrt station,changi airport
aksuperdance,2014-10-04 20:13:00,0.0,0.0,Japan Railway company taken over SMRT? 新幹線at YEW TEE 駅 http:// fb.me/1M3ZCz7QQ,,,,5.18373319105e+17,https://twitter.com/aksuperdance/status/518373319104798720,yew tee mrt station,yew tee
Twt_Larkin,2014-10-04 20:14:00,1.0,0.0,#SLeague update : Hougang United 0-0 Harimau Muda B - Hougang Stadium #SayaTeamMalaysia,,,#SLeague #SayaTeamMalaysia,5.18373702829e+17,https://twitter.com/Twt_Larkin/status/518373702828691456,hougang mrt station,hougang
linustjm,2014-10-04 20:14:00,0.0,0.0,At the restaurant in boon lay !!,,,,5.18373518514e+17,https://twitter.com/linustjm/status/518373518514196480,boon lay mrt station,boon lay
sphasiaone,2014-10-04 20:15:00,3.0,0.0,Cisco police officer found dead with single-gun shot wound at Changi Airport toilet http:// fb.me/6Mjv1kJi9,,,,5.18373731053e+17,https://twitter.com/sphasiaone/status/518373731052584960,changi airport mrt station,changi airport
jsontkw,2014-10-04 20:15:00,0.0,0.0,#throwback to supper day after long hours at work @Bedok Blk 85 Hawker Food Centre http:// instagram.com/p/tuvA19vrGu/,,@Bedok,#throwback,5.18373879615e+17,https://twitter.com/jsontkw/status/518373879614816256,bedok mrt station,bedok
mode138,2014-10-04 20:15:00,1.0,0.0,I was Changi airport for 5 hours today saying good bye to a friend and didn't notice a security officer was killed with a shot to the head.,,,,5.18373807112e+17,https://twitter.com/mode138/status/518373807111675904,changi airport mrt station,changi airport
Itsnatteo,2014-10-04 20:15:00,0.0,0.0,AIYO sec 4 already still judging your juniors for not... — HAHAHAHA thank you lorong Chuan study hard for s... http:// ask.fm/a/bbmj49db,,,,5.1837377029e+17,https://twitter.com/Itsnatteo/status/518373770290270208,lorong chuan mrt station,lorong chuan
yo_itsshumin,2014-10-04 20:15:00,0.0,0.0,I'm at Dhoby Ghaut MRT Interchange (CC1/NE6/NS24) - @smrt_singapore in Singapore https://www. swarmapp.com/c/21jEFvYameW,,@smrt_singapore,,5.18373725663e+17,https://twitter.com/yo_itsshumin/status/518373725662896128,dhoby ghaut mrt station,dhoby ghaut
DianaBr44562703,2014-10-04 20:16:00,0.0,0.0,PA launches Water-Venture Committee in Pasir Ris http:// cur.lv/dznig,,,,5.18374182192e+17,https://twitter.com/DianaBr44562703/status/518374182191517696,pasir ris mrt station,pasir ris
_meilinggz,2014-10-04 20:16:00,0.0,0.0,Going home. Out to bedok 85 for dinner later.,,,,5.18374009093e+17,https://twitter.com/_meilinggz/status/518374009092579329,bedok mrt station,bedok
gabetan13,2014-10-04 20:16:00,0.0,0.0,HALFTIME at the Hougang Stadium - Hougang United 0-0 Harimau Muda! #SLeague,,,#SLeague,5.18374122884e+17,https://twitter.com/gabetan13/status/518374122884046848,hougang mrt station,hougang
gabetan13,2014-10-04 20:16:00,0.0,0.0,45' Best chance of the half falls to Hougang as Erwan flicks the ball up and volleys it towards goal - saved by Ilham! #SLeague,,,#SLeague,5.18374008598e+17,https://twitter.com/gabetan13/status/518374008597647361,hougang mrt station,hougang
NikkiMullerFLY,2014-10-04 20:17:00,0.0,2.0,I'm a happy camper having cycled to Changi Airport and back today! 41km in total with a few scenic routes thrown... http:// fb.me/3PsUfcQCe,,,,5.18374284382e+17,https://twitter.com/NikkiMullerFLY/status/518374284381941761,changi airport mrt station,changi airport
ShahrinMathers,2014-10-04 20:17:00,0.0,0.0,Thanks stranger. For coming all the way from tiong bahru tu meet me. Lol,,,,5.18374444e+17,https://twitter.com/ShahrinMathers/status/518374443999965187,tiong bahru mrt station,tiong bahru
Kid_Shank,2014-10-04 20:17:00,0.0,1.0,In the mrt heading back to hougang,,,,5.18374338765e+17,https://twitter.com/Kid_Shank/status/518374338764869632,hougang mrt station,hougang
Candycoconut,2014-10-04 20:17:00,0.0,0.0,I'm at @ClarkeQuay in Singapore https://www. swarmapp.com/c/enLqL0QTjFp,,@ClarkeQuay,,5.18374357912e+17,https://twitter.com/Candycoconut/status/518374357912285185,clarke quay mrt station,clarke quay
Iariefsantosa,2014-10-04 20:17:00,0.0,0.0,Buy ticket | Gardens by the Bay | Singapore http://www. kiostix.com/tuk_kiostixevt /gardens-by-the-bay/ …,,,,5.18374456717e+17,https://twitter.com/Iariefsantosa/status/518374456717094916,gardens by the bay mrt station,gardens by the bay
ngyongen,2014-10-04 20:17:00,0.0,0.0,@paoloacero work at pasir ris pond fishing ah,,@paoloacero,,5.1837439517e+17,https://twitter.com/ngyongen/status/518374395169865730,pasir ris mrt station,pasir ris
xox_hun,2014-10-04 20:17:00,0.0,0.0,PA launches Water-Venture Committee in Pasir Ris http:// dlvr.it/75sgDJ,,,,5.18374307668e+17,https://twitter.com/xox_hun/status/518374307668299777,pasir ris mrt station,pasir ris
aaronYMF,2014-10-04 20:18:00,0.0,0.0,Going home alone from Bukit Batok is really no joke,,,,5.18374667426e+17,https://twitter.com/aaronYMF/status/518374667426332673,bukit batok mrt station,bukit batok
missfae_,2014-10-04 20:18:00,1.0,0.0,"Tmr Raya Haji, we didnt cook rendang. We'll visit you tmr at Yishun Singapore bcs you cant celebrate with us. Get well soon, iloveyou",,,,5.18374556437e+17,https://twitter.com/missfae_/status/518374556436684802,yishun mrt station,yishun
G_xi_,2014-10-04 20:18:00,0.0,0.0,ur time sheet write 8. ltr they go down yishun then ltr ask why u never inform leyh. how ?? @yining_leh,,@yining_leh,,5.18374587441e+17,https://twitter.com/G_xi_/status/518374587440984064,yishun mrt station,yishun
Twt_Larkin,2014-10-04 20:18:00,1.0,1.0,HALFTIME at the Hougang Stadium - Hougang United 0-0 Harimau Muda B! #SLeague,,,#SLeague,5.18374515425e+17,https://twitter.com/Twt_Larkin/status/518374515424755713,hougang mrt station,hougang
josiengg,2014-10-04 20:19:00,0.0,0.0,boonlay to west coast in 5mins yep but i still wanna live,,,,5.18374823371e+17,https://twitter.com/josiengg/status/518374823370571776,boon lay mrt station,boon lay
UltrasEaglesSG,2014-10-04 20:19:00,0.0,0.0,Look!! Who's here to support the Eagles last night at the Jalan Besar Stadium !? Our new signing for next... http:// fb.me/7lsWVbGPg,,,,5.18374904774e+17,https://twitter.com/UltrasEaglesSG/status/518374904773632000,jalan besar mrt station,jalan besar
dabianfoo,2014-10-04 20:19:00,0.0,0.0,Where got ppl so stupid .. Go bedok from my house of cos is use pie la miss the turn then kpkb,,,,5.18374795923e+17,https://twitter.com/dabianfoo/status/518374795923038208,bedok mrt station,bedok
AsiaPacNews,2014-10-04 20:19:00,0.0,0.0,Asia #Business ~ PA launches Water-Venture Committee in Pasir Ris - Channel News Asia http:// dlvr.it/75sjY8 #Pacific,,,#Business #Pacific,5.18374785764e+17,https://twitter.com/AsiaPacNews/status/518374785764454400,pasir ris mrt station,pasir ris
J_OCELYNNNNN,2014-10-04 20:19:00,0.0,0.0,8 scoops for 4. @The Meadow Gardens By The Bay http:// instagram.com/p/tuvbt6IhFw/,,@The,,5.18374803398e+17,https://twitter.com/J_OCELYNNNNN/status/518374803397705728,gardens by the bay mrt station,gardens by the bay
IkmalSyafeeq,2014-10-04 20:19:00,0.0,1.0,@halalSG is curry times at Changi Airport now Halal?,,@halalSG,,5.18374765829e+17,https://twitter.com/IkmalSyafeeq/status/518374765828911106,changi airport mrt station,changi airport
AkuKanIrfan,2014-10-04 20:20:00,0.0,1.0,@zyannthy to be exact ? Tampines st 21 blk 201D,,@zyannthy,,5.18375004732e+17,https://twitter.com/AkuKanIrfan/status/518375004732272641,tampines mrt station,tampines
SingaporeAdv,2014-10-04 20:20:00,0.0,0.0,Cisco police officer found dead with single-gun shot wound at Changi Airport toilet - AsiaOne http:// dlvr.it/75skWP,,,,5.18375003759e+17,https://twitter.com/SingaporeAdv/status/518375003759194112,changi airport mrt station,changi airport
macho_______man,2014-10-04 20:20:00,0.0,0.0,@NekoNoKoutei kat bukit batok ada satu,,@NekoNoKoutei,,5.18375051927e+17,https://twitter.com/macho_______man/status/518375051926585346,bukit batok mrt station,bukit batok
religiousred,2014-10-04 20:20:00,0.0,0.0,"@PeteOfIdiot @vinnymchugh Odds a bit tight on the Hougang goal haha, would like to think they will though",,@PeteOfIdiot @vinnymchugh,,5.18375158748e+17,https://twitter.com/religiousred/status/518375158747500544,hougang mrt station,hougang
TTK1236,2014-10-04 20:21:00,0.0,0.0,なぜ Cisco security officer found dead at #ChangiAirport toilet with single gunshot to the head http:// bit.ly/ZFhwxU pic.twitter.com/rkUfnIFgqt ”,,,#ChangiAirport,5.18375381976e+17,https://twitter.com/TTK1236/status/518375381976367105,changi airport mrt station,changi airport
TodayIndiaJobs,2014-10-04 20:21:00,0.0,0.0,#Game Gadget Tester – $8 per hour Location: Chai Chee ( Bedok ) Duration: 3 months Requirement: Minimum Diploma in... http:// ift.tt/ZFjn65,,,#Game,5.18375253744e+17,https://twitter.com/TodayIndiaJobs/status/518375253744291841,bedok mrt station,bedok
SuryaElyna,2014-10-04 20:21:00,0.0,0.0,@wiewiebontot jauhnya you! Ish. I still hougang baby. Meet mummy soon,,@wiewiebontot,,5.18375439996e+17,https://twitter.com/SuryaElyna/status/518375439996170241,hougang mrt station,hougang
M0veShakeDr0p,2014-10-04 20:21:00,0.0,0.0,Heading back down under (@Singapore Changi Airport (SIN) - @fansofchangi in Singapore) https://www. swarmapp.com/c/ly3W9NNaYny,,@Singapore @fansofchangi,,5.18375292856e+17,https://twitter.com/M0veShakeDr0p/status/518375292856188928,changi airport mrt station,changi airport
yeowminseah,2014-10-04 20:22:00,0.0,0.0,I whish I could go back to tampines,,,,5.18375535899e+17,https://twitter.com/yeowminseah/status/518375535898943490,tampines mrt station,tampines
yglions,2014-10-04 20:22:00,0.0,0.0,Score at half-time stands at Tanjong Pagar United 2 Courts Young Lions 0. #ThisIsOurQuest,,,#ThisIsOurQuest,5.18375659996e+17,https://twitter.com/yglions/status/518375659995791360,tanjong pagar mrt station,tanjong pagar
timo_ng36,2014-10-04 20:23:00,0.0,0.0,"FRIK, fire in sembawang",,,,5.18375750949e+17,https://twitter.com/timo_ng36/status/518375750949273600,sembawang mrt station,sembawang
hannaniyusof,2014-10-04 20:23:00,0.0,0.0,Where were you 3 hours ago? — Bedok lib hahahah http:// ask.fm/a/bd5eggai,,,,5.18375778326e+17,https://twitter.com/hannaniyusof/status/518375778325893120,bedok mrt station,bedok
ekinRuhand,2014-10-04 20:24:00,0.0,1.0,Nasi je yg arab ayam x arab.. ayam merah dari tanah merah .. hahaha,,,,5.18376087886e+17,https://twitter.com/ekinRuhand/status/518376087886110720,tanah merah mrt station,tanah merah
yo_itsshumin,2014-10-04 20:24:00,0.0,0.0,I'm at Somerset MRT Station (NS23) - @smrt_singapore in Singapore https://www. swarmapp.com/c/drbHXeTg0z6,,@smrt_singapore,,5.18376002931e+17,https://twitter.com/yo_itsshumin/status/518376002930900992,somerset mrt station,somerset mrt
FootballSLEAGUE,2014-10-04 20:25:00,0.0,0.0,Congratulations to the lucky winners in Hougang Stadium,,,,5.18376312491e+17,https://twitter.com/FootballSLEAGUE/status/518376312491491328,hougang mrt station,hougang
Truxt_Nxbxdy,2014-10-04 20:25:00,0.0,1.0,Anyone want to ton at sembawang ?,,,,5.18376368888e+17,https://twitter.com/Truxt_Nxbxdy/status/518376368887721985,sembawang mrt station,sembawang
hidayatrafii,2014-10-04 20:25:00,0.0,0.0,Gonna miss being a bedoktowner/bedoktownian/ student of bedok town sec,,,,5.18376405538e+17,https://twitter.com/hidayatrafii/status/518376405537533952,bedok mrt station,bedok
curiosityxkills,2014-10-04 20:26:00,0.0,0.0,Being dragged to jurong east by H without any brows.,,,,5.1837659731e+17,https://twitter.com/curiosityxkills/status/518376597309509634,jurong east mrt station,jurong east
Ary_Novianto,2014-10-04 20:26:00,0.0,0.0,"Next station, Harbourfront #MRT #Singapore #NorthSouthLine #Public #Transportation #Latepost … http:// instagram.com/p/tuwN4XQO6K/",,,#MRT #Singapore #NorthSouthLine #Public #Transportation #Latepost,5.18376527294e+17,https://twitter.com/Ary_Novianto/status/518376527294394368,harbourfront mrt station,harborfront mrt
sgpressrelease,2014-10-04 20:26:00,0.0,0.0,PA launches Water-Venture Committee in Pasir Ris http:// ift.tt/ZFglyH,,,,5.1837668271e+17,https://twitter.com/sgpressrelease/status/518376682710138880,pasir ris mrt station,pasir ris
SGnews,2014-10-04 20:26:00,0.0,0.0,[CNA] PA launches Water-Venture Committee in Pasir Ris http:// bit.ly/1vwyNCR,,,,5.18376732648e+17,https://twitter.com/SGnews/status/518376732647518208,pasir ris mrt station,pasir ris
MarcusRockz,2014-10-04 20:26:00,0.0,0.0,what did you do today(: — Went to bishan then thomson to study. http:// ask.fm/a/bajiq09b,,,,5.18376674842e+17,https://twitter.com/MarcusRockz/status/518376674841600000,bishan mrt station,bishan
singapore_buzz,2014-10-04 20:27:00,0.0,0.0,PA launches Water-Venture Committee in Pasir Ris : The newly-formed committee comprises of grassroots leaders and… http:// dlvr.it/75stRq,,,,5.18376909961e+17,https://twitter.com/singapore_buzz/status/518376909961326592,pasir ris mrt station,pasir ris
thejanicewee,2014-10-04 20:27:00,0.0,0.0,Just posted a photo @Changi Airport http:// instagram.com/p/tuwXUHpdgF/,,@Changi,,5.18376851233e+17,https://twitter.com/thejanicewee/status/518376851233071104,changi airport mrt station,changi airport
syznsayyn,2014-10-04 20:28:00,0.0,1.0,I miss my cats huhu can i raya at punggol tomorrow,,,,5.18377016279e+17,https://twitter.com/syznsayyn/status/518377016278515713,punggol mrt station,punggol
MattLlh,2014-10-04 20:29:00,0.0,0.0,I'm at Singapore Changi Airport (SIN) - @fansofchangi in Singapore https://www. swarmapp.com/c/17eR2k0HkRG,,@fansofchangi,,5.1837731022e+17,https://twitter.com/MattLlh/status/518377310219935745,changi airport mrt station,changi airport
_sxrf_,2014-10-04 20:30:00,0.0,0.0,When will I ever be pretty. Haiss #nofilter #nursarfina @103 Bedok Reservoir Road http:// instagram.com/p/tuwv_PxfnQ/,,@103,#nofilter #nursarfina,5.18377699212e+17,https://twitter.com/_sxrf_/status/518377699212267520,bedok mrt station,bedok
anchoredveins,2014-10-04 20:30:00,0.0,0.0,Coffee time! (@Tiong Bahru Bakery in Singapore) https://www. swarmapp.com/c/4QMV37TlXfQ,,@Tiong,,5.1837750138e+17,https://twitter.com/anchoredveins/status/518377501379555328,tiong bahru mrt station,tiong bahru
justwimbelle,2014-10-04 20:30:00,0.0,0.0,nadine nasa sembawang na,,,,5.18377589116e+17,https://twitter.com/justwimbelle/status/518377589115592707,sembawang mrt station,sembawang
riseabovehatred,2014-10-04 20:31:00,0.0,0.0,@Cookiezxchelle_ go Bedok for,,@Cookiezxchelle_,,5.18377808012e+17,https://twitter.com/riseabovehatred/status/518377808012136449,bedok mrt station,bedok
weijie_lorh,2014-10-04 20:31:00,1.0,0.0,Woah so a fire just broke out in sembawang ?,,,,5.18377792879e+17,https://twitter.com/weijie_lorh/status/518377792879075328,sembawang mrt station,sembawang
asyxx__,2014-10-04 20:31:00,0.0,1.0,Heading to bedok,,,,5.18377866699e+17,https://twitter.com/asyxx__/status/518377866698825729,bedok mrt station,bedok
mdasilva482,2014-10-04 20:32:00,0.0,0.0,MyBagEmpire Luxury Branded Handbags Sale @Bedok Point 6 – 12 Oct 2014 http:// ift.tt/1xOAK2j,,@Bedok,,5.18378211446e+17,https://twitter.com/mdasilva482/status/518378211445866496,bedok mrt station,bedok
goalpostsuk,2014-10-04 20:33:00,0.0,0.0,(*FT*) #Soccer #Livescore @ScoresPro : (SIN-D1) Tanjong Pagar UTD FC vs Courts Young Lions: 2-0 http:// dlvr.it/75sznP #ResultsBPL,,@ScoresPro,#Soccer #Livescore #ResultsBPL,5.18378354723e+17,https://twitter.com/goalpostsuk/status/518378354722865152,tanjong pagar mrt station,tanjong pagar
endidaa,2014-10-04 20:33:00,0.0,0.0,"I'm at Restoran Nasi Lemak Tok Wan Ali in Tanah Merah , Kelantan https://www. swarmapp.com/c/iB3gBeU8XEU",,,,5.1837830052e+17,https://twitter.com/endidaa/status/518378300520292352,tanah merah mrt station,tanah merah
