username,date,retweets,favorites,text,geo,mentions,hashtags,id,permalink,place,key
lijunntoh,2014-10-08 19:36:00,0.0,0.0,Why is he holding an iPhone and asking for directions to Jalan Besar stadium?,,,,5.19813706487e+17,https://twitter.com/lijunntoh/status/519813706486538240,jalan besar mrt station,jalan besar
gheihyuk,2014-10-08 19:36:00,0.0,0.0,finally at kallang wave and I cannot imagine a concert here omg,,,,5.1981363148e+17,https://twitter.com/gheihyuk/status/519813631479803905,kallang mrt station,kallang
LekLekJe_,2014-10-08 19:38:00,0.0,0.0,Melarat siak nak g Yishun,,,,5.19814017331e+17,https://twitter.com/LekLekJe_/status/519814017330606082,yishun mrt station,yishun
ohitsdanneh,2014-10-08 19:38:00,0.0,0.0,im so going far away from tamp amd pasir ris tmr hahahaha spend time with siblings better sia,,,,5.19814018056e+17,https://twitter.com/ohitsdanneh/status/519814018056204290,pasir ris mrt station,pasir ris
Zulhilmi_Afiq,2014-10-08 19:38:00,0.0,0.0,Off to meet Ahmad and Irfan at Tampines,,,,5.198141587e+17,https://twitter.com/Zulhilmi_Afiq/status/519814158699622400,tampines mrt station,tampines
hongwei_k,2014-10-08 19:41:00,0.0,0.0,"@DingXiangNg fuck you, haha shag siah, now going yishun without specs, can't see a thing",,@DingXiangNg,,5.19814931831e+17,https://twitter.com/hongwei_k/status/519814931831476224,yishun mrt station,yishun
darylpan,2014-10-08 19:41:00,0.0,0.0,Midweek #sin .. New outlet along tanjong pagar road #friedchicken (@Kko Kko Nara 꼬꼬나라 in Singapore) https://www. swarmapp.com/c/1Mq7TpYIfvS,,@Kko,#sin #friedchicken,5.19814727342e+17,https://twitter.com/darylpan/status/519814727342379010,tanjong pagar mrt station,tanjong pagar
Geografi_HM,2014-10-08 19:42:00,1.0,0.0,Tanah mediteran merah kuning di daerah topografi karst disebut ”Terra Rossa”.,,,,5.1981520254e+17,https://twitter.com/Geografi_HM/status/519815202540232704,tanah merah mrt station,tanah merah
NLuvsHockey,2014-10-08 19:42:00,0.0,0.0,"Were you at bishan ? Haha — i didn't go bishan just now , you saw someone that look like me? http:// ask.fm/a/b88fli9h",,,,5.19815155522e+17,https://twitter.com/NLuvsHockey/status/519815155522498560,bishan mrt station,bishan
stompsingapore,2014-10-08 19:44:00,1.0,0.0,Primary school boys spotted climbing on top of portable toilet at Bukit Batok St 52 http:// bit.ly/1yLSz3o http:// twitpic.com/eciwus,,,,5.19815675586e+17,https://twitter.com/stompsingapore/status/519815675586416640,bukit batok mrt station,bukit batok
movinbala,2014-10-08 19:44:00,0.0,1.0,Changi Airport 's toilet rly bo beh zao la. Sleep here sua.,,,,5.19815483622e+17,https://twitter.com/movinbala/status/519815483621527553,changi airport mrt station,changi airport
LTAsg,2014-10-08 19:45:00,1.0,0.0,Accident on AYE (towards Tuas) after Buona Vista exit. Avoid lane 1,,,,5.19815832571e+17,https://twitter.com/LTAsg/status/519815832570843138,buona vista mrt station,buona vista
i291191,2014-10-08 19:46:00,0.0,0.0,Lets go punggol end tomorrow... and make some music... with this old guitar hahahaiiss...,,,,5.19816091192e+17,https://twitter.com/i291191/status/519816091191635968,punggol mrt station,punggol
BroccoliPancake,2014-10-08 19:46:00,0.0,0.0,Layout of Bukit batok service centre club is so freaking messy cant wait to gtfo from here,,,,5.19816075287e+17,https://twitter.com/BroccoliPancake/status/519816075286831105,bukit batok mrt station,bukit batok
BadBackPack,2014-10-08 19:48:00,0.0,0.0,KALLANG RIVER SINGAPORE http:// dld.bz/djnUU pic.twitter.com/widH80wkLJ,,,,5.19816680592e+17,https://twitter.com/BadBackPack/status/519816680592375808,kallang mrt station,kallang
shoeshuu,2014-10-08 19:48:00,0.0,0.0,@shatiqailiana holy cow creamery at yishun !! Near the mosque there heh,,@shatiqailiana,,5.19816721994e+17,https://twitter.com/shoeshuu/status/519816721993973760,yishun mrt station,yishun
hxcnid,2014-10-08 19:50:00,0.0,0.0,PLS LET ME REACH PAYA LEBAR BEFORE 755.,,,,5.19817075729e+17,https://twitter.com/hxcnid/status/519817075728990208,paya lebar mrt station,paya lebar
ElRestorant,2014-10-08 19:50:00,0.0,0.0,"Boon Lay Raja Restaurant is closing down, owners to sell shop for $15m: SINGAPORE - The sun is setting on a po... http:// bit.ly/1se55UN",,,,5.19817010365e+17,https://twitter.com/ElRestorant/status/519817010364964865,boon lay mrt station,boon lay
xrlrosanne,2014-10-08 19:50:00,0.0,0.0,Holiday list: Movie + dessert day!! Finally caught the maze runner :D @Golden Village Tampines http:// instagram.com/p/t4_Vtlht0E/,,@Golden,,5.19817156029e+17,https://twitter.com/xrlrosanne/status/519817156029345792,tampines mrt station,tampines
LekLekJe_,2014-10-08 19:52:00,0.0,0.0,Yishun rn.,,,,5.19817560884e+17,https://twitter.com/LekLekJe_/status/519817560884133888,yishun mrt station,yishun
FassyyN,2014-10-08 19:52:00,0.0,1.0,Pa takut pah duk dapur sbb tukang teman die pakai bedok sejuk mcm hantu katenye hahaha,,,,5.19817505188e+17,https://twitter.com/FassyyN/status/519817505187954688,bedok mrt station,bedok
svfqhxll,2014-10-08 19:52:00,4.0,1.0,“@FearlessDeathh: Pasir ris beach. is this singapore?? pic.twitter.com/VGtAxdY22A ” so beautiful damnnn,,@FearlessDeathh,,5.19817487735e+17,https://twitter.com/svfqhxll/status/519817487735459840,pasir ris mrt station,pasir ris
meNmyclones,2014-10-08 19:52:00,0.0,0.0,Tampines mrt station tak sesak langsung???? That's a first.,,,,5.19817517804e+17,https://twitter.com/meNmyclones/status/519817517804421121,tampines mrt station,tampines
_bubblezxc,2014-10-08 19:52:00,0.0,0.0,"Merah merah , tanah merah tanah merah @JokerToHero",,@JokerToHero,,5.19817702895e+17,https://twitter.com/_bubblezxc/status/519817702894886912,tanah merah mrt station,tanah merah
Xyliayxy,2014-10-08 19:53:00,0.0,1.0,At pasir ris for dinerzzzz,,,,5.19817821875e+17,https://twitter.com/Xyliayxy/status/519817821874700288,pasir ris mrt station,pasir ris
Amirul_Kaiser,2014-10-08 19:53:00,0.0,0.0,"JAGA-JAGA Exclusinga , Singa 12 , Singamania , Singa Jalan Besar , JBS , dan sewaktu dengannya… http:// instagram.com/p/t4_sIRx80X/",,,,5.19817928167e+17,https://twitter.com/Amirul_Kaiser/status/519817928166764544,jalan besar mrt station,jalan besar
BriPyon,2014-10-08 19:53:00,0.0,0.0,@kuumined outram. Kinda inbetween Chinatown and outram MRT .,,@kuumined,,5.19817876224e+17,https://twitter.com/BriPyon/status/519817876224483329,chinatown mrt station,chinatown mrt
EAT_withus,2014-10-08 19:53:00,0.0,0.0,Tiong Bahru Wanton Mee @Golden Shoe Food Centre The first time I saw my tantalising bowl of Tiong… http:// instagram.com/p/oiyMuzuc3y/,,@Golden,,5.19817840049e+17,https://twitter.com/EAT_withus/status/519817840048607232,tiong bahru mrt station,tiong bahru
naturepedal,2014-10-08 19:54:00,0.0,0.0,from jw to pasir ris . fml.,,,,5.19818118492e+17,https://twitter.com/naturepedal/status/519818118491680768,pasir ris mrt station,pasir ris
ynaoblivious,2014-10-08 19:55:00,0.0,0.0,Head hurts! But team dinner at clarke quay ! With margaritas! Yay! Haha,,,,5.19818412147e+17,https://twitter.com/ynaoblivious/status/519818412147482624,clarke quay mrt station,clarke quay
natnedla,2014-10-08 19:56:00,0.0,0.0,I'm at Punggol Billiards in Singapore https://www. swarmapp.com/c/2PcERyXmOPK,,,,5.19818628121e+17,https://twitter.com/natnedla/status/519818628120604673,punggol mrt station,punggol
anonflail,2014-10-08 19:58:00,0.0,0.0,Wahhh the haze is obscuring tampines mall D:,,,,5.19819101557e+17,https://twitter.com/anonflail/status/519819101557239808,tampines mrt station,tampines
BrianEmma2,2014-10-08 19:58:00,0.0,0.0,Outdoor skating rink since kids on preschool punggol : iJhTucgiy,,,,5.19819075737e+17,https://twitter.com/BrianEmma2/status/519819075736715264,punggol mrt station,punggol
NABILANATASHAA,2014-10-08 19:58:00,2.0,0.0,I need more friends..... living in pasir ris,,,,5.19819001284e+17,https://twitter.com/NABILANATASHAA/status/519819001283624960,pasir ris mrt station,pasir ris
melvin_zxcv,2014-10-08 19:59:00,0.0,0.0,I'm at Punggol MRT/LRT Interchange (NE17/PTC) in Singapore https://www. swarmapp.com/c/dd4QpZvEjlb,,,,5.19819450628e+17,https://twitter.com/melvin_zxcv/status/519819450627784706,punggol mrt station,punggol
ahmdfaruq,2014-10-08 20:00:00,0.0,0.0,@adiafrO @HamkaHasse @mohamad_akid @shmrnxprmn esok yishun dam!,,@adiafrO @HamkaHasse @mohamad_akid @shmrnxprmn,,5.19819524557e+17,https://twitter.com/ahmdfaruq/status/519819524556599296,yishun mrt station,yishun
rajbirs1,2014-10-08 20:00:00,0.0,2.0,Jatt 25 aa pinda da Patwari ni gal sun bishan kaure,,,,5.19819506664e+17,https://twitter.com/rajbirs1/status/519819506663686145,bishan mrt station,bishan
MastercardSG,2014-10-08 20:00:00,0.0,0.0,Enjoy personalized travel service at #ChangiAirport 's JetQuay CIP Terminal with #MasterCard . http:// mstr.cd/1vwlXWp pic.twitter.com/NfO28X59Sn,,,#ChangiAirport #MasterCard,5.19819745966e+17,https://twitter.com/MastercardSG/status/519819745965535232,changi airport mrt station,changi airport
_DylanAng_,2014-10-08 20:01:00,0.0,0.0,Oh wow potong pasir KFC renovated,,,,5.19819940724e+17,https://twitter.com/_DylanAng_/status/519819940723830784,potong pasir mrt station,potong pasir
KyanKoh,2014-10-08 20:01:00,0.0,0.0,Yishun finally!!,,,,5.19819940686e+17,https://twitter.com/KyanKoh/status/519819940686090240,yishun mrt station,yishun
FloralTown,2014-10-08 20:01:00,0.0,0.0,@qtmonkeyjpg SENGKANG MRT ?,,@qtmonkeyjpg,,5.19819959846e+17,https://twitter.com/FloralTown/status/519819959845654528,sengkang mrt station,sengkang mrt
wheres_ley,2014-10-08 20:01:00,0.0,1.0,@ManUpMarc were you at bedok macs!!,,@ManUpMarc,,5.19819875884e+17,https://twitter.com/wheres_ley/status/519819875884085248,bedok mrt station,bedok
AhGirl_,2014-10-08 20:02:00,0.0,0.0,I'm at Blk 165 Yishun Ring Rd https://www. swarmapp.com/c/5sJcdKSeods,,,,5.19820238066e+17,https://twitter.com/AhGirl_/status/519820238066442240,yishun mrt station,yishun
Chemist_Sim,2014-10-08 20:02:00,0.0,0.0,I'm at Hougang Street 91 in Singapore https://www. swarmapp.com/c/hFoHSbdNX8s,,,,5.19820060937e+17,https://twitter.com/Chemist_Sim/status/519820060936769537,hougang mrt station,hougang
shaherawr,2014-10-08 20:02:00,0.0,0.0,@Jaegerjaquezx haha singapore? At boon lay !,,@Jaegerjaquezx,,5.19820219687e+17,https://twitter.com/shaherawr/status/519820219686989824,boon lay mrt station,boon lay
BlancoUnicornio,2014-10-08 20:03:00,0.0,0.0,I'm at Boon Lay Place Market & Food Centre in Singapore https://www. swarmapp.com/c/8TVVPqQEF1X,,,,5.19820320518e+17,https://twitter.com/BlancoUnicornio/status/519820320518074370,boon lay mrt station,boon lay
zejiun,2014-10-08 20:03:00,0.0,0.0,But too bad I get off at Yishun but she not.,,,,5.19820382854e+17,https://twitter.com/zejiun/status/519820382853791746,yishun mrt station,yishun
LeadsGenSupport,2014-10-08 20:03:00,0.0,0.0,Wendy Wong & Partners: 24 Raffles Place #20-05 CLIFFORD CENTRE Singapore 048621 Average rating of 4 of 5 http:// bit.ly/1BRf0Av,,,#20,5.19820449556e+17,https://twitter.com/LeadsGenSupport/status/519820449555808256,raffles place mrt station,raffles place
JxvanCxy,2014-10-08 20:03:00,0.0,0.0,I'm at Blk 289C Punggol Place https://www. swarmapp.com/c/lh58om3k6Jf,,,,5.19820287031e+17,https://twitter.com/JxvanCxy/status/519820287030730754,punggol mrt station,punggol
BarneyBlues,2014-10-08 20:03:00,0.0,0.0,I'm at Kallang Wave - @sgsportshub in Singapore https://www. swarmapp.com/c/7PW7bq37VlW,,@sgsportshub,,5.19820337715e+17,https://twitter.com/BarneyBlues/status/519820337714692096,kallang mrt station,kallang
Jaegerjaquezx,2014-10-08 20:03:00,0.0,0.0,@shaherawr Woah I can't see it over in Sembawang :(,,@shaherawr,,5.19820349878e+17,https://twitter.com/Jaegerjaquezx/status/519820349878202368,sembawang mrt station,sembawang
ahhhzuuuu,2014-10-08 20:03:00,0.0,0.0,#vscocam @Changi Airport http:// instagram.com/p/t5AwScwHrA/,,@Changi,#vscocam,5.19820268949e+17,https://twitter.com/ahhhzuuuu/status/519820268949106688,changi airport mrt station,changi airport
Chemist_Sim,2014-10-08 20:04:00,0.0,0.0,I'm at Hougang 1 in Singapore https://www. swarmapp.com/c/5rC1bmh4My5,,,,5.19820687205e+17,https://twitter.com/Chemist_Sim/status/519820687205076993,hougang mrt station,hougang
inftsevens,2014-10-08 20:05:00,0.0,0.0,WHY AM I NOT AT BUKIT PANJANG RIGHT NOW,,,,5.1982093477e+17,https://twitter.com/inftsevens/status/519820934769676289,bukit panjang mrt station,bukit panjang
jane_guda,2014-10-08 20:06:00,0.0,0.0,Just posted a video @Simei Rd http:// instagram.com/p/t5BKBJTeOg/,,@Simei,,5.19821152597e+17,https://twitter.com/jane_guda/status/519821152596672514,simei mrt station,simei
naqibnoor_,2014-10-08 20:07:00,0.0,0.0,@shafiqli otw bedok,,@shafiqli,,5.19821462363e+17,https://twitter.com/naqibnoor_/status/519821462362812416,bedok mrt station,bedok
TeochewOpera_sg,2014-10-08 20:07:00,0.0,0.0,The Filming performances @Tiong Bahru Hawker Centre,,@Tiong,,5.19821264157e+17,https://twitter.com/TeochewOpera_sg/status/519821264157151232,tiong bahru mrt station,tiong bahru
MdNazmi_,2014-10-08 20:07:00,0.0,0.0,@rmsani_ serangoon Eh?,,@rmsani_,,5.19821287603e+17,https://twitter.com/MdNazmi_/status/519821287602917376,serangoon mrt station,serangoon
_mdsani,2014-10-08 20:08:00,0.0,0.0,@MdNazmi_ kallang bro,,@MdNazmi_,,5.19821709911e+17,https://twitter.com/_mdsani/status/519821709910618112,kallang mrt station,kallang
_yonggie,2014-10-08 20:08:00,0.0,0.0,@Pyqo_ come yishun ah,,@Pyqo_,,5.1982157102e+17,https://twitter.com/_yonggie/status/519821571020451841,yishun mrt station,yishun
amirasyafiqah_,2014-10-08 20:09:00,0.0,0.0,Was on the escalator going up at bedok mrt then heard some guy callling me. Thought some random ahpek skali my sup from nea hahaha,,,,5.19821944116e+17,https://twitter.com/amirasyafiqah_/status/519821944116371456,bedok mrt station,bedok
ohitsdanneh,2014-10-08 20:09:00,0.0,0.0,hmm meet this person first then go to aljunied or nah,,,,5.19821803511e+17,https://twitter.com/ohitsdanneh/status/519821803510710272,aljunied mrt station,aljunied
AlexThngiiee,2014-10-08 20:09:00,0.0,0.0,@fyeahbunny HAHAHAH wah bugis further than you coming to hougang eh !!!,,@fyeahbunny,,5.19821955537e+17,https://twitter.com/AlexThngiiee/status/519821955537465344,hougang mrt station,hougang
shuai_dennis,2014-10-08 20:10:00,0.0,0.0,@Yang_MehMeh LOLOLOLOL I hope going to tampines is fun,,@Yang_MehMeh,,5.19822054842e+17,https://twitter.com/shuai_dennis/status/519822054841782272,tampines mrt station,tampines
losertoVICTOR,2014-10-08 20:10:00,0.0,1.0,Do you live in the east? Cus you make my heart go bedok bedok bedok . #facepalm,,,#facepalm,5.19822063314e+17,https://twitter.com/losertoVICTOR/status/519822063314288641,bedok mrt station,bedok
naturepedal,2014-10-08 20:10:00,0.0,0.0,@Vanettatanxq ecp not at pasir ris uh? AHAHAHAH.,,@Vanettatanxq,,5.19822078238e+17,https://twitter.com/naturepedal/status/519822078237630465,pasir ris mrt station,pasir ris
_memyselfandpie,2014-10-08 20:11:00,0.0,0.0,@Rainbowsparklx @no_more_please_ Cna ah but my sch at marsiling eh,,@Rainbowsparklx @no_more_please_,,5.19822430157e+17,https://twitter.com/_memyselfandpie/status/519822430156509184,marsiling mrt station,marsiling
ladybxxss_,2014-10-08 20:11:00,0.0,0.0,So lazy to go back to yishun,,,,5.19822290646e+17,https://twitter.com/ladybxxss_/status/519822290645553152,yishun mrt station,yishun
MatJan16,2014-10-08 20:12:00,0.0,0.0,Pekerja kfc tanah merah ni juboq pon dh macam ayam,,,,5.1982253558e+17,https://twitter.com/MatJan16/status/519822535580327937,tanah merah mrt station,tanah merah
naturepedal,2014-10-08 20:12:00,0.0,0.0,@Vanettatanxq not at pasir ris uh? then where sia? AHAHAHAHAH.,,@Vanettatanxq,,5.19822712844e+17,https://twitter.com/naturepedal/status/519822712844197888,pasir ris mrt station,pasir ris
arruumii,2014-10-08 20:13:00,0.0,2.0,@rxsicano blk 201D tampines st 21 #01-1771 gitu hahaha,,@rxsicano,#01,5.19822773611e+17,https://twitter.com/arruumii/status/519822773611278336,tampines mrt station,tampines
arruumii,2014-10-08 20:13:00,1.0,0.0,@sorrijilleo blk 201D tampines st 21 #01-something2 haha yg penting dia dekat ngan al-azhar!,,@sorrijilleo,#01,5.1982296462e+17,https://twitter.com/arruumii/status/519822964619874305,tampines mrt station,tampines
apit_beron,2014-10-08 20:14:00,0.0,0.0,@MatJan16 awek cun kot kt kfc tanah merah,,@MatJan16,,5.19823116009e+17,https://twitter.com/apit_beron/status/519823116009099264,tanah merah mrt station,tanah merah
DavidAnanth,2014-10-08 20:15:00,0.0,0.0,"Forest by day, BROTHEL by night - SINGAPORE - The dense forest along Sembawang Drive looked innocent enough in the... http:// ow.ly/2OKMPj",,,,5.19823362895e+17,https://twitter.com/DavidAnanth/status/519823362894598145,sembawang mrt station,sembawang
KotaBalikpapan,2014-10-08 20:15:00,0.0,0.0,""" Tanah di @KotaBalikpapan berjenis tanah podsolik merah kunin yg bersifat topsoil tipis, struktur tanahnya mudah tererosi #KnowBPN """,,@KotaBalikpapan,#KnowBPN,5.19823368851e+17,https://twitter.com/KotaBalikpapan/status/519823368850538496,tanah merah mrt station,tanah merah
naturepedal,2014-10-08 20:15:00,0.0,0.0,@Vanettatanxq i know. but not at pasir ris uh? edgar jn say at pasir ris sia. ahahahahahah,,@Vanettatanxq,,5.19823341491e+17,https://twitter.com/naturepedal/status/519823341490692096,pasir ris mrt station,pasir ris
semilirangin6,2014-10-08 20:16:00,0.0,0.0,"Seperti ada yang patah, pada hati yang lemah, matanya yang merah mencair getah berceceran ke tanah . Perihal cinta yang tabah.",,,,5.19823525977e+17,https://twitter.com/semilirangin6/status/519823525977141248,tanah merah mrt station,tanah merah
VRAlcazar,2014-10-08 20:16:00,0.0,0.0,Oooooh Ice Cream! #3rd #anniv #8thofthemonth #blessed #ustime #singapore #sg #holycowcreamery #yishun … http:// instagram.com/p/t5CR20OBYr/,,,#3rd #anniv #8thofthemonth #blessed #ustime #singapore #sg #holycowcreamery #yishun,5.19823621863e+17,https://twitter.com/VRAlcazar/status/519823621863124992,yishun mrt station,yishun
ohmym3l,2014-10-08 20:18:00,0.0,0.0,The feel to walk to siglap to buy macs buttt.....,,,,5.19824177726e+17,https://twitter.com/ohmym3l/status/519824177725833217,siglap mrt station,siglap
extinctz,2014-10-08 20:18:00,0.0,0.0,@ChxFt Wait for me go yishun find you HAHHAAH,,@ChxFt,,5.19824090203e+17,https://twitter.com/extinctz/status/519824090203299840,yishun mrt station,yishun
_bintHussain,2014-10-08 20:18:00,0.0,1.0,Bedok 's swimming pool for adults is empty lah seh graaaah so tempted for night swim,,,,5.19824183929e+17,https://twitter.com/_bintHussain/status/519824183929233408,bedok mrt station,bedok
sufiaf2015,2014-10-08 20:18:00,5.0,10.0,So hungry.. Whats good at tampines ?,,,,5.19824210811e+17,https://twitter.com/sufiaf2015/status/519824210810507265,tampines mrt station,tampines
weijunadamng,2014-10-08 20:18:00,0.0,1.0,@Come2Papa_ I end class at 1pm at simei,,@Come2Papa_,,5.19824232818e+17,https://twitter.com/weijunadamng/status/519824232818032640,simei mrt station,simei
CapresRI1,2014-10-08 20:19:00,0.0,0.0,"#IndonesiaSATU | Dradjad: Jatah Ketua Komisi dari KMP Jika PPP Kembali Gabung: JAKARTA, (PRLM).- Koalisi Merah Putih m... | Tanah Air Ku",,,#IndonesiaSATU,5.19824403841e+17,https://twitter.com/CapresRI1/status/519824403840782337,tanah merah mrt station,tanah merah
Angryjie,2014-10-08 20:19:00,0.0,0.0,I'm at Hougang Green Shopping Mall in Singapore https://www. swarmapp.com/c/8DbVFWjtwe0,,,,5.19824291899e+17,https://twitter.com/Angryjie/status/519824291898990592,hougang mrt station,hougang
17Ziq,2014-10-08 20:21:00,0.0,0.0,Faaaaaak why did i alight at serangoon,,,,5.19824841554e+17,https://twitter.com/17Ziq/status/519824841554161664,serangoon mrt station,serangoon
ItsJustBott,2014-10-08 20:21:00,1.0,0.0,Tmrw cross country at bedok reservoir . Zzzzzz . 10 km zzzzzzz,,,,5.19824910693e+17,https://twitter.com/ItsJustBott/status/519824910693044224,bedok mrt station,bedok
ItsReito,2014-10-08 20:22:00,0.0,0.0,I live in tampines nao,,,,5.19825237442e+17,https://twitter.com/ItsReito/status/519825237441912832,tampines mrt station,tampines
javozx,2014-10-08 20:23:00,0.0,0.0,@Rishi_Akari21 Walao Hougang so many people how to bo lang ?!,,@Rishi_Akari21,,5.1982530552e+17,https://twitter.com/javozx/status/519825305519665153,hougang mrt station,hougang
artonez201,2014-10-08 20:23:00,0.0,0.0,[Idea for a national flag] #artonez #bacchanalia #bras basah #singapore #tile #mosaic #flag #amazing … http:// instagram.com/p/t5DIwnm6gC/,,,#artonez #bacchanalia #bras #singapore #tile #mosaic #flag #amazing,5.19825508289e+17,https://twitter.com/artonez201/status/519825508289085442,bras basah mrt station,bras basah
ameliaongkq,2014-10-08 20:23:00,0.0,0.0,when will you come bedok to find me . i always waiting you . korkor .,,,,5.19825394124e+17,https://twitter.com/ameliaongkq/status/519825394124341248,bedok mrt station,bedok
PGQuantum,2014-10-08 20:24:00,0.0,0.0,"Taxi queue, back in Singapore #singapore #changi #home @Changi Airport Terminal 3 http:// instagram.com/p/t5DN2-nc_5/",,@Changi,#singapore #changi #home,5.19825682559e+17,https://twitter.com/PGQuantum/status/519825682558631936,changi airport mrt station,changi airport
javozx,2014-10-08 20:24:00,0.0,0.0,@Rishi_Akari21 yishun leh ! No joke',,@Rishi_Akari21,,5.19825668797e+17,https://twitter.com/javozx/status/519825668796739584,yishun mrt station,yishun
aqfptr,2014-10-08 20:25:00,0.0,0.0,balik bedok kasi aku stress. balik amk kasi aku stress.,,,,5.19825999505e+17,https://twitter.com/aqfptr/status/519825999505006594,bedok mrt station,bedok
retsevlys,2014-10-08 20:26:00,1.0,0.0,On the way to bedok mall now wee,,,,5.19826113179e+17,https://twitter.com/retsevlys/status/519826113179045888,bedok mrt station,bedok
javozx,2014-10-08 20:27:00,0.0,0.0,@Rishi_Akari21 I stay yishun now . You're not up to date !,,@Rishi_Akari21,,5.19826412468e+17,https://twitter.com/javozx/status/519826412467781632,yishun mrt station,yishun
neginIwani_,2014-10-08 20:27:00,0.0,0.0,idk see how next time :) I might transfer to hai xing or pasir ris sec anyw — Ohh http:// ask.fm/a/b97o3gi4,,,,5.19826295086e+17,https://twitter.com/neginIwani_/status/519826295086411776,pasir ris mrt station,pasir ris
lostminded_,2014-10-08 20:28:00,0.0,0.0,” @Genevieveeee : Shuai finals at chua chu kang https://twitter.com/Genevieveeee/status/519810884374237184/photo/1 pic.twitter.com/2r1B8wnedv ”,,@Genevieveeee,,5.1982663313e+17,https://twitter.com/lostminded_/status/519826633130135553,choa chu kang mrt station,chua chu kang
aldytjandra,2014-10-08 20:28:00,0.0,0.0,At Changi Airport — https:// path.com/p/2Wf9Vy,,,,5.198267442e+17,https://twitter.com/aldytjandra/status/519826744199507970,changi airport mrt station,changi airport
rachelsugarrush,2014-10-08 20:28:00,0.0,0.0,Weechel adventures part 2 @IKEA Tampines http:// instagram.com/p/t5DtuokBU1/,,@IKEA,,5.1982677757e+17,https://twitter.com/rachelsugarrush/status/519826777569755136,tampines mrt station,tampines
giovannatayy,2014-10-08 20:28:00,0.0,0.0,"wts just now at somerset the train going jurong east, now at bishan suddenly the train ending at ang mo kio ughhhhh",,,,5.19826600243e+17,https://twitter.com/giovannatayy/status/519826600242593792,ang mo kio mrt station,ang mo kio
reformingroy,2014-10-08 20:29:00,0.0,0.0,Play is serious business. ;) @IKEA Tampines http:// instagram.com/p/t5Dy33O0Yd/,,@IKEA,,5.19826954884e+17,https://twitter.com/reformingroy/status/519826954883956736,tampines mrt station,tampines
czxseraphina,2014-10-08 20:29:00,0.0,0.0,Pasir ris sports complex bc tennis again after like forever,,,,5.19826906888e+17,https://twitter.com/czxseraphina/status/519826906888167425,pasir ris mrt station,pasir ris
winstonseph,2014-10-08 20:31:00,0.0,0.0,To celebrate dre's bday! @infinitryz jhannea @Holiday Inn Express Singapore Clarke Quay http:// instagram.com/p/t5D0e9mJYq/,,@infinitryz @Holiday,,5.19827480346e+17,https://twitter.com/winstonseph/status/519827480345993216,clarke quay mrt station,clarke quay
_ShytHappens,2014-10-08 20:31:00,0.0,0.0,I'm at 34 Telok Blangah Way in Singapore https://www. swarmapp.com/c/jSPTPd3kdpY,,,,5.19827480472e+17,https://twitter.com/_ShytHappens/status/519827480471826432,telok blangah mrt station,telok blangah
AlexThngiiee,2014-10-08 20:31:00,0.0,0.0,@fyeahbunny NO !! The difference is you come from bugis to hougang not I gooooo,,@fyeahbunny,,5.19827352491e+17,https://twitter.com/AlexThngiiee/status/519827352491020291,hougang mrt station,hougang
Le_CharlesY,2014-10-08 20:32:00,0.0,0.0,"Charles Allon Yap! I saw you again yishun mrt, why yo... — Haha serious? Lol. Ask my parents lorh. I got the ge... http:// ask.fm/a/ba4njm77",,,,5.19827589642e+17,https://twitter.com/Le_CharlesY/status/519827589641568256,yishun mrt station,yishun
xdrgbvc,2014-10-08 20:34:00,0.0,0.0,Hot Caucasian male spotted at Clementi MRT station,,,,5.19828068173e+17,https://twitter.com/xdrgbvc/status/519828068173488128,clementi mrt station,clementi mrt
shakirrabani,2014-10-08 20:34:00,0.0,0.0,Another reason why I love bukit panjang .,,,,5.19828120753e+17,https://twitter.com/shakirrabani/status/519828120753283073,bukit panjang mrt station,bukit panjang
DelectablyMine,2014-10-08 20:35:00,0.0,0.0,@acapmunchster HAHAHA YA BUT AT PASIR RIS,,@acapmunchster,,5.19828457912e+17,https://twitter.com/DelectablyMine/status/519828457912422400,pasir ris mrt station,pasir ris
TeochewOpera_sg,2014-10-08 20:35:00,0.0,0.0,"I posted 7 photos on Facebook in the album ""The Filming Performance@Tiong Bahru Hawker Centre"" http:// fb.me/3frsbD5aU",,@Tiong,,5.1982839215e+17,https://twitter.com/TeochewOpera_sg/status/519828392150335488,tiong bahru mrt station,tiong bahru
Yasirmcheema,2014-10-08 20:35:00,0.0,0.0,@SingaporePolice the man in Orange shirt punched the man in white shirt at 8.33pm @blk 664 Yishun Ave 4. pic.twitter.com/fLBGkcFjiD,,@SingaporePolice @blk,,5.19828307672e+17,https://twitter.com/Yasirmcheema/status/519828307672457217,yishun mrt station,yishun
