username,date,retweets,favorites,text,geo,mentions,hashtags,id,permalink,place,key
Amy_reign,2016-02-19 00:02:00,0,0,@ifranbakar ok swee.. Sebelum tahajjud aku nak kau ws aku gambar kau kat simei .. Aku belanja kau mcdonald,,@ifranbakar,,700349573911302144,https://twitter.com/Amy_reign/status/700349573911302144,simei mrt station,simei
ifranbakar,2016-02-19 00:03:00,0,0,@Amy_reign aku dah kat simei sekarang bai. Sembahyang kat tempat mrt track lagi tadi,,@Amy_reign,,700349893383159809,https://twitter.com/ifranbakar/status/700349893383159809,simei mrt station,simei
TheNinthNight,2016-02-19 00:04:00,0,0,I'm at Redhill MRT Station (EW18) - @smrt_singapore in Singapore https://www. swarmapp.com/c/kZR8Ziz4Lpw,,@smrt_singapore,,700350156957425664,https://twitter.com/TheNinthNight/status/700350156957425664,redhill mrt station,redhill mrt
_SyahSantai,2016-02-19 00:06:00,0,0,Wtf im just at tiong bahru,,,,700350715043061760,https://twitter.com/_SyahSantai/status/700350715043061760,tiong bahru mrt station,tiong bahru
rwibi,2016-02-19 00:07:00,0,0,"Just arrived F-GQSY.. Paris nya kapan"" (with Fauzan, Rahmat, and 6 others at @changiairport ) — https:// path.com/p/POdEs",,@changiairport,,700350900657745920,https://twitter.com/rwibi/status/700350900657745920,changi airport mrt station,changi airport
DeeTeezxc,2016-02-19 00:08:00,0,0,I'm at Pasir Ris in Singapore https://www. swarmapp.com/c/fx11vFiP4Hv,,,,700351207878090752,https://twitter.com/DeeTeezxc/status/700351207878090752,pasir ris mrt station,pasir ris
RyanLLY,2016-02-19 00:08:00,0,0,@yanting_O @vvngxh we at pasir ris .,,@yanting_O @vvngxh,,700351150491471872,https://twitter.com/RyanLLY/status/700351150491471872,pasir ris mrt station,pasir ris
_SyahSantai,2016-02-19 00:09:00,0,0,@lilyqddetiamo im at tiong bahru so please by 1 i tak ws you find diana she got my friends number who stay near me my batt left 7%,,@lilyqddetiamo,,700351368301666304,https://twitter.com/_SyahSantai/status/700351368301666304,tiong bahru mrt station,tiong bahru
TheNinthNight,2016-02-19 00:10:00,0,0,I'm at Jurong East MRT Interchange (NS1/EW24) - @smrt_singapore in Singapore https://www. swarmapp.com/c/7ustDPhULav,,@smrt_singapore,,700351803381121024,https://twitter.com/TheNinthNight/status/700351803381121024,jurong east mrt station,jurong east
alice2015wood,2016-02-19 00:12:00,0,0,#sg #jobvacancy Customer Service Manager 40Jap MNC Bedok up to 7K41: Responsibilities Repo... http:// bit.ly/1PIkcjp #career #singapore,,,#sg #jobvacancy #career #singapore,700352176619548672,https://twitter.com/alice2015wood/status/700352176619548672,bedok mrt station,bedok
alice2015wood,2016-02-19 00:12:00,0,0,#sg #jobvacancy 361047hr Tele Marketers 64 Tampines : Appointment Management… http:// bit.ly/1SBLo6Y #career #singapore,,,#sg #jobvacancy #career #singapore,700352175675822080,https://twitter.com/alice2015wood/status/700352175675822080,tampines mrt station,tampines
HougangHOOLs,2016-02-19 00:13:00,0,0,What a goal from Stipe! FT score at Hougang stadium. Hougang United 1- 0 Home United.... http:// fb.me/4m4iVwllN,,,,700352392563462144,https://twitter.com/HougangHOOLs/status/700352392563462144,hougang mrt station,hougang
NurrrAtiqahhh,2016-02-19 00:13:00,0,2,Nak pegi ah flower dome yg dekat gardens by the bay walaupun tk minat bunga tapi tetap nk pegi. Sape nk bwk? Tkde org? Ok.,,,,700352447093432320,https://twitter.com/NurrrAtiqahhh/status/700352447093432320,gardens by the bay mrt station,gardens by the bay
TheNinthNight,2016-02-19 00:16:00,0,0,I'm at Jurong East Temporary Bus Interchange - @sbs_transit in Singapore https://www. swarmapp.com/c/64Y2XubZuiK,,@sbs_transit,,700353239762542592,https://twitter.com/TheNinthNight/status/700353239762542592,jurong east mrt station,jurong east
HappyBoy1998,2016-02-19 00:16:00,0,0,I'm at SAFRA Toa Payoh in Singapore https://www. swarmapp.com/c/kD9cictegHR,,,,700353264445952000,https://twitter.com/HappyBoy1998/status/700353264445952000,toa payoh mrt station,toa payoh
risthaaaa,2016-02-19 00:20:00,0,0,Day @Gardens by the Bay https://www. instagram.com/p/BB7yDReFcNeG TXxRsWwiL2ISi8iPGh9zODvs700/ …,,@Gardens,,700354136596996096,https://twitter.com/risthaaaa/status/700354136596996096,gardens by the bay mrt station,gardens by the bay
y561994,2016-02-19 00:21:00,0,0,I'm at Bedok North Ave 2 https://www. swarmapp.com/c/e2oodZph4il,,,,700354449844396033,https://twitter.com/y561994/status/700354449844396033,bedok mrt station,bedok
IzyanSyazwan,2016-02-19 00:21:00,0,0,Midnight Workout #quickfeet @Tampines North Fitness Park https://www. instagram.com/p/BB7yOsqgfBn/,,@Tampines,#quickfeet,700354552722235393,https://twitter.com/IzyanSyazwan/status/700354552722235393,tampines mrt station,tampines
aMrazing,2016-02-19 00:23:00,1,4,"Sama bengong begok di clarke quay . Menyenangkan. Apalagi kalo malem-malem gini. Sepi, tenang, cantik.",,,,700354941278253056,https://twitter.com/aMrazing/status/700354941278253056,clarke quay mrt station,clarke quay
AdamLambertSG,2016-02-19 00:24:00,1,1,Gardens By The Bay ! https:// twitter.com/adamrossmusic/ status/700306711102361600 … http:// fb.me/79ixbwRQq,,,,700355334485839872,https://twitter.com/AdamLambertSG/status/700355334485839872,gardens by the bay mrt station,gardens by the bay
NorAzri,2016-02-19 00:24:00,0,0,I'm at Ang Mo Kio Ave 4 Blk 612 https://www. swarmapp.com/c/5z72YF0C9Mn,,,,700355123369877504,https://twitter.com/NorAzri/status/700355123369877504,ang mo kio mrt station,ang mo kio
AdamLambertSG,2016-02-19 00:24:00,1,1,Gardens By The Bay ! https:// twitter.com/adamrossmusic/ status/700306711102361600 …,,,,700355260875837440,https://twitter.com/AdamLambertSG/status/700355260875837440,gardens by the bay mrt station,gardens by the bay
vivixlicious,2016-02-19 00:24:00,0,0,"@PRINCESSLAYLA Hahaha you care for me what, of cus won't exclude you! But I'm rly v busy. Btw the new punggol mall damn nice!",,@PRINCESSLAYLA,,700355133062848512,https://twitter.com/vivixlicious/status/700355133062848512,punggol mrt station,punggol
TwistdOlivr,2016-02-19 00:27:00,0,0,@aMrazing lah di situ ada gede banget kan patung/tower titit bbrp biji. lu di Clarke Quay kan?,,@aMrazing,,700355921055100932,https://twitter.com/TwistdOlivr/status/700355921055100932,clarke quay mrt station,clarke quay
tkyjk,2016-02-19 00:27:00,0,0,And I'm off! #JackGoesDownUnder @Singapore Changi Airport Terminal 3 Departure Hall https://www. instagram.com/p/BB7y3vENtC2/,,@Singapore,#JackGoesDownUnder,700355936347627520,https://twitter.com/tkyjk/status/700355936347627520,changi airport mrt station,changi airport
Shoji_Kawahara,2016-02-19 00:29:00,0,0,MRT は走ってるのにバスはもうないという罠。 (@捷運市政府站 MRT Taipei City Hall Station in 台北市) https://www. swarmapp.com/c/4e7WYtB3ovA,,@,,700356587618242560,https://twitter.com/Shoji_Kawahara/status/700356587618242560,city hall mrt station,city hall mrt
_Dxrryl,2016-02-19 00:29:00,0,0,I'm at Blk 349 Yishun Avenue 11 in Singapore https://www. swarmapp.com/c/b0iXi9SaKt3,,,,700356473537355777,https://twitter.com/_Dxrryl/status/700356473537355777,yishun mrt station,yishun
_Dxrryl,2016-02-19 00:29:00,0,0,"I'm at Blk 107 Void Deck in Yishun , Singapore https://www. swarmapp.com/c/eka3lkXdS6S",,,,700356568206962688,https://twitter.com/_Dxrryl/status/700356568206962688,yishun mrt station,yishun
_Dxrryl,2016-02-19 00:30:00,0,0,I'm at Yishun Park in Singapore https://www. swarmapp.com/c/8WH1hhtGgs3,,,,700356610431062016,https://twitter.com/_Dxrryl/status/700356610431062016,yishun mrt station,yishun
afbababj,2016-02-19 00:30:00,0,0,"Macam besar sangat gitu kepala tot kau. Apa, boleh lawan statue burung kat raffles place tu? Beberd betul",,,,700356608665104385,https://twitter.com/afbababj/status/700356608665104385,raffles place mrt station,raffles place
yasirahnaim,2016-02-19 00:30:00,0,0,@lilysulily Haaa tanah merah . Yas bkn tau nama tmpt. Haha. Kt alor star pun bukan ori kan. Kedah semua xori rasanya,,@lilysulily,,700356780350509057,https://twitter.com/yasirahnaim/status/700356780350509057,tanah merah mrt station,tanah merah
playmaker_sg,2016-02-19 00:31:00,0,0,"INDIAN SUPER LEAGUE 2014 6 DECEMBER 2014, PUNE - Current Tampines Rovers winger - Jermaine… https://www. instagram.com/p/BB7zXihPBcZ/",,,,700357047317999616,https://twitter.com/playmaker_sg/status/700357047317999616,tampines mrt station,tampines
ewanyelyah,2016-02-19 00:33:00,0,0,"@RoyMcFlew aku tinggal kat boon lay , kerje kat expo. 8mnths kerje dah cukup uh traveling..leceh sia.",,@RoyMcFlew,,700357582649561094,https://twitter.com/ewanyelyah/status/700357582649561094,boon lay mrt station,boon lay
risthaaaa,2016-02-19 00:35:00,0,0,Waterfall @Gardens by the Bay https://www. instagram.com/p/BB7zx0SFcBOz BRsbJDPxdEYhGFfNs-QSOggElk0/ …,,@Gardens,,700357932244934656,https://twitter.com/risthaaaa/status/700357932244934656,gardens by the bay mrt station,gardens by the bay
risthaaaa,2016-02-19 00:36:00,0,0,Just posted a photo @Gardens by the Bay https://www. instagram.com/p/BB7z3wBlcBcE CxP5AHjQEaPSKoESDyxJLnfPNU0/ …,,@Gardens,,700358135010168832,https://twitter.com/risthaaaa/status/700358135010168832,gardens by the bay mrt station,gardens by the bay
kai_kaenoi,2016-02-19 00:38:00,0,0,"Sembawang to Changi, Changi to Gombak, Gombak to AMK, AMK to Sembawang not sure how that's gonna work out for me tomorrow",,,,700358675873935361,https://twitter.com/kai_kaenoi/status/700358675873935361,sembawang mrt station,sembawang
FirdausHehgh,2016-02-19 00:39:00,0,1,great catching up w bedok people la been ages since we all met up,,,,700359089214214144,https://twitter.com/FirdausHehgh/status/700359089214214144,bedok mrt station,bedok
risthaaaa,2016-02-19 00:40:00,0,0,Just posted a photo @Gardens by the Bay https://www. instagram.com/p/BB70V7zFcCfY opBM4f0pW5OW3mY-tNv66BLtPA0/ …,,@Gardens,,700359172710408192,https://twitter.com/risthaaaa/status/700359172710408192,gardens by the bay mrt station,gardens by the bay
Ponyskinz_,2016-02-19 00:41:00,0,0,又出去了 (@SAFRA Toa Payoh in Singapore) https://www. swarmapp.com/c/gu6pBcOYJtD,,@SAFRA,,700359553968427009,https://twitter.com/Ponyskinz_/status/700359553968427009,toa payoh mrt station,toa payoh
orizaltz,2016-02-19 00:41:00,0,0,Liked Aly Ntl's Postcard of Gardens by the Bay on Gogobot! Here’s their @gogobot postcard: http:// bit.ly/1QolSf2,,@gogobot,,700359416839667712,https://twitter.com/orizaltz/status/700359416839667712,gardens by the bay mrt station,gardens by the bay
qinghjkl,2016-02-19 00:42:00,0,0,@huixuanhuixuan sembawang,,@huixuanhuixuan,,700359643726385152,https://twitter.com/qinghjkl/status/700359643726385152,sembawang mrt station,sembawang
qinghjkl,2016-02-19 00:45:00,0,0,@huixuanhuixuan the Sembawang was SRS de,,@huixuanhuixuan,,700360510563229696,https://twitter.com/qinghjkl/status/700360510563229696,sembawang mrt station,sembawang
Hollock_,2016-02-19 00:46:00,1,0,Great catch up with the bedok people to end my night.,,,,700360774779166722,https://twitter.com/Hollock_/status/700360774779166722,bedok mrt station,bedok
alonkii,2016-02-19 00:49:00,0,0,"@aMrazing di clarke quay ada resto jepang yang enak, Kak. Terus penuh kenangan gitu. Kenangan aku sama dia yang ga jadi. #lah #malahcurhat",,@aMrazing,#lah #malahcurhat,700361410795077635,https://twitter.com/alonkii/status/700361410795077635,clarke quay mrt station,clarke quay
Kazearashi,2016-02-19 00:49:00,0,0,Wheeee~~ (@Singapore @ChangiAirport (SIN) in Singapore) https://www. swarmapp.com/c/bVL0vLCrmJD,,@Singapore @ChangiAirport,,700361464692011009,https://twitter.com/Kazearashi/status/700361464692011009,changi airport mrt station,changi airport
AqsaGautama,2016-02-19 00:49:00,0,0,"Alhamdulillah, Arrived At Singapore. Bring a Good Days! (with pratama and Elisa at @changiairport ) — https:// path.com/p/3LCExT",,@changiairport,,700361411998842886,https://twitter.com/AqsaGautama/status/700361411998842886,changi airport mrt station,changi airport
hasrul501,2016-02-19 00:53:00,0,0,roti canai Cikgu @tanahmerah,,@tanahmerah,,700362592192036865,https://twitter.com/hasrul501/status/700362592192036865,tanah merah mrt station,tanah merah
NWXWillis,2016-02-19 00:55:00,1,0,@HeWhoIsMatt ya I at yishun 's! But if I can't find a charging point I may be going back earlier. You studying also?,,@HeWhoIsMatt,,700363009609199617,https://twitter.com/NWXWillis/status/700363009609199617,yishun mrt station,yishun
0504Traveller,2016-02-19 00:59:00,0,1,@plaza_network debuts transit hotel concept at @ChangiAirport https:// shar.es/14UkBL via @sharethis,,@plaza_network @ChangiAirport @sharethis,,700363945295683585,https://twitter.com/0504Traveller/status/700363945295683585,changi airport mrt station,changi airport
NWXWillis,2016-02-19 01:00:00,1,0,@misskoshka I at yishun eh is it crowded there? You alone ah,,@misskoshka,,700364367246700545,https://twitter.com/NWXWillis/status/700364367246700545,yishun mrt station,yishun
misskoshka,2016-02-19 01:01:00,0,0,@NWXWillis yea i alone. No not crowded. Jauh nya Yishun ?,,@NWXWillis,,700364448440057857,https://twitter.com/misskoshka/status/700364448440057857,yishun mrt station,yishun
_pamelakhoo_,2016-02-19 01:02:00,0,0,@lehkhaaa internship? When's your internship? :) All the best I got thru intern interview so mine would be at Buona Vista instead of Tuas,,@lehkhaaa,,700364862342311937,https://twitter.com/_pamelakhoo_/status/700364862342311937,buona vista mrt station,buona vista
alicianyj,2016-02-19 01:02:00,0,0,[credits: @luciaalin ] @Changi Airport https://www. instagram.com/p/BB722JyrOKP/,,@luciaalin @Changi,,700364679391145984,https://twitter.com/alicianyj/status/700364679391145984,changi airport mrt station,changi airport
badoquecafe,2016-02-19 01:03:00,0,0,"Wishing all our muslim diners ""Jumaah Mubarakah"" Badoque Cafe at #upperthomson & #simpangbedok opens at 230pm on... http:// fb.me/4rUOyux5S",,,#upperthomson #simpangbedok,700365131306442752,https://twitter.com/badoquecafe/status/700365131306442752,upper thomson mrt station,upper thomson
Ismxxl,2016-02-19 01:04:00,0,0,@adilah_sunar kalau dare dah lama campak masuk pasir ris park punya laut biar masuk m'sia skali,,@adilah_sunar,,700365198603874305,https://twitter.com/Ismxxl/status/700365198603874305,pasir ris mrt station,pasir ris
YiyiXing,2016-02-19 01:07:00,0,0,"Chicago airport gua baca ke changi airport ,kaget knp exo tiba2 mncul di changi airport wkwkk",,,,700365976752107520,https://twitter.com/YiyiXing/status/700365976752107520,changi airport mrt station,changi airport
ihengbok,2016-02-19 01:10:00,0,0,"The Pleiades star cluster – also known as the Seven Sisters or M45. Taken at Simei Estate,… https://www. instagram.com/p/BB732FqjB5j/",,,,700366877185462272,https://twitter.com/ihengbok/status/700366877185462272,simei mrt station,simei
Tan_lihan,2016-02-19 01:11:00,0,0,I'm at Chambers LAN shop @Yishun in Singapore https://www. swarmapp.com/c/4vJ3dD255X2,,@Yishun,,700367099148038144,https://twitter.com/Tan_lihan/status/700367099148038144,yishun mrt station,yishun
BrianEmma2,2016-02-19 01:13:00,0,0,Outdoor athletic field in preference to kids at preschool punggol : nVByPDmFV,,,,700367643681824768,https://twitter.com/BrianEmma2/status/700367643681824768,punggol mrt station,punggol
CharlesBrabin,2016-02-19 01:14:00,0,0,"Glasswork (Helen Slater), paintings (Rose-Marie Caldecott ) and photographs (Ben Ramos + Jenny Blyth) in The Magic of the Trees @ArtJericho",,@ArtJericho,,700367764213596163,https://twitter.com/CharlesBrabin/status/700367764213596163,caldescott mrt station,caldescott
lokerdiscuz,2016-02-19 01:15:00,0,0,#singapore #jobs Customer Service Manager 40Jap MNC Bedok up to 7K41: Responsibilities Reporting... http:// bit.ly/1PItDzm #sg #careers,,,#singapore #jobs #sg #careers,700368158683574272,https://twitter.com/lokerdiscuz/status/700368158683574272,bedok mrt station,bedok
lokerdiscuz,2016-02-19 01:15:00,0,0,#singapore #jobs Sales Executive 40Home Appliances Products Bedok up to 3635K43Car Allowance41: J... http:// bit.ly/1SBWPvB #sg #careers,,,#singapore #jobs #sg #careers,700368156473184257,https://twitter.com/lokerdiscuz/status/700368156473184257,bedok mrt station,bedok
bryallebenoza,2016-02-19 01:16:00,0,1,Drunk!!! @Blk 433 Ang Mo Kio Avenue 10 https://www. instagram.com/p/BB74hcpCbb6/,,@Blk,,700368367832723456,https://twitter.com/bryallebenoza/status/700368367832723456,ang mo kio mrt station,ang mo kio
khaigawa,2016-02-19 01:17:00,0,1,@qqilz punggol boh,,@qqilz,,700368445217464320,https://twitter.com/khaigawa/status/700368445217464320,punggol mrt station,punggol
AlvinTWK,2016-02-19 01:18:00,0,0,I'm at Sungei Punggol in Singapore https://www. swarmapp.com/c/ksf6BHlh11T,,,,700368895857856513,https://twitter.com/AlvinTWK/status/700368895857856513,punggol mrt station,punggol
MohdPatrickJane,2016-02-19 01:18:00,0,0,So bored rn being stuck at bedok,,,,700368750583787520,https://twitter.com/MohdPatrickJane/status/700368750583787520,bedok mrt station,bedok
AlvinTWK,2016-02-19 01:19:00,0,0,I'm at Roof Access @Punggol Marina https://www. swarmapp.com/c/0yJ6TW0cg5Y,,@Punggol,,700368989407547392,https://twitter.com/AlvinTWK/status/700368989407547392,punggol mrt station,punggol
chrischansaura,2016-02-19 01:19:00,0,0,1:19 nasa taxi pa lang from Bedok https://www. instagram.com/p/BB744dBJxTz/,,,,700369158102478848,https://twitter.com/chrischansaura/status/700369158102478848,bedok mrt station,bedok
AlvinTWK,2016-02-19 01:19:00,0,0,I'm at Punggol Prawning in Singapore https://www. swarmapp.com/c/6HVKj3C7iwL,,,,700369047062474752,https://twitter.com/AlvinTWK/status/700369047062474752,punggol mrt station,punggol
NWXWillis,2016-02-19 01:20:00,1,0,@lowxuanhao @HeWhoIsMatt I still studying at yishun la HAHHA see how,,@lowxuanhao @HeWhoIsMatt,,700369296342413312,https://twitter.com/NWXWillis/status/700369296342413312,yishun mrt station,yishun
_Mallly,2016-02-19 01:21:00,1,0,"Alhamdulillah, it's raining heavily in Tampines .",,,,700369633530916864,https://twitter.com/_Mallly/status/700369633530916864,tampines mrt station,tampines
hafiz_koston,2016-02-19 01:21:00,0,0,Bedok raining at this timing,,,,700369623959482368,https://twitter.com/hafiz_koston/status/700369623959482368,bedok mrt station,bedok
jerjerxx_,2016-02-19 01:22:00,0,0,I'm at Blk 295 Tampines St 22 https://www. swarmapp.com/c/av5CVJnJZtZ,,,,700369747502878720,https://twitter.com/jerjerxx_/status/700369747502878720,tampines mrt station,tampines
Faizjefree,2016-02-19 01:22:00,1,0,@hisyamismail_ Besok solat pasir ris ngn aku.,,@hisyamismail_,,700369897151270912,https://twitter.com/Faizjefree/status/700369897151270912,pasir ris mrt station,pasir ris
Colin851009,2016-02-19 01:26:00,0,0,Shenton Way 又要添新团队了 pic.twitter.com/TcVMwiVSPH,,,,700370900365942784,https://twitter.com/Colin851009/status/700370900365942784,shenton way mrt station,shenton way
officialFLOREDy,2016-02-19 01:27:00,0,0,@tephLlanesChua in SG right? Gardens by the Bay ?,,@tephLlanesChua,,700370971434156032,https://twitter.com/officialFLOREDy/status/700370971434156032,gardens by the bay mrt station,gardens by the bay
emily_eberts,2016-02-19 01:31:00,0,0,"Via @NPR : 'Last Stop On Market Street' Wins Newbery Medal, 'Finding Winnie' Takes Caldecott http:// n.pr/1l0mLSF",,@NPR,,700372078495543297,https://twitter.com/emily_eberts/status/700372078495543297,caldescott mrt station,caldescott
mervunited,2016-02-19 01:34:00,0,0,"Stipe our Croatian man Get past him if you fkn can! Try a lil' trick, he'll make you look a dick! He's Hougang 's... http:// fb.me/4oAOvZqvH",,,,700372881520377856,https://twitter.com/mervunited/status/700372881520377856,hougang mrt station,hougang
manjerboy,2016-02-19 01:35:00,0,0,sini yishun bile nak hujan sey,,,,700373169601810432,https://twitter.com/manjerboy/status/700373169601810432,yishun mrt station,yishun
PeaceTamy,2016-02-19 01:36:00,1,0,buttergrill's photo https:// instagram.com/p/BB7xnRxAlAT/ #buttergrillsg #tanjongpagar #craftbeers,,,#buttergrillsg #tanjongpagar #craftbeers,700373405019668480,https://twitter.com/PeaceTamy/status/700373405019668480,tanjong pagar mrt station,tanjong pagar
airporthotelssg,2016-02-19 01:37:00,0,0,Airport Hotels in Singapore - Changi Airport Hotel check : https://www. youtube.com/watch?v=NUNj7_ w-Qow … ##airportHotelsinSingapore,,,# #airportHotelsinSingapore,700373679167950848,https://twitter.com/airporthotelssg/status/700373679167950848,changi airport mrt station,changi airport
iamdavidedward,2016-02-19 01:38:00,0,0,"Finally, the last layover.... (@Singapore @ChangiAirport (SIN) in Singapore) https://www. swarmapp.com/c/1dG8lV9nJf0",,@Singapore @ChangiAirport,,700373722151174145,https://twitter.com/iamdavidedward/status/700373722151174145,changi airport mrt station,changi airport
AdmRfi,2016-02-19 01:38:00,0,0,At clementi fire station,,,,700373889554079744,https://twitter.com/AdmRfi/status/700373889554079744,clementi mrt station,clementi station
simei_takk_2,2016-02-19 01:39:00,0,0,【アンタッチャブル】累計討伐数2342体のモンスターを討伐!! [iPhoneアプリ]殺意の国のアリス http:// a1.adstore.jp/app/click?k=yc K6HA … pic.twitter.com/OmtioBqDbu,,,,700374032412114944,https://twitter.com/simei_takk_2/status/700374032412114944,simei mrt station,simei
InstaSingapore,2016-02-19 01:41:00,0,0,.AlvinTWK Nice check-in: I'm at Punggol Prawning in Singapore https://www. swarmapp.com/c/6HVKj3C7iwL,,,,700374483866152961,https://twitter.com/InstaSingapore/status/700374483866152961,punggol mrt station,punggol
InstaSingapore,2016-02-19 01:41:00,0,0,.AlvinTWK Nice check-in: I'm at Sungei Punggol in Singapore https://www. swarmapp.com/c/ksf6BHlh11T,,,,700374482070999041,https://twitter.com/InstaSingapore/status/700374482070999041,punggol mrt station,punggol
InstaSingapore,2016-02-19 01:42:00,0,0,RT AlvinTWK: I'm at Punggol Prawning in Singapore https://www. swarmapp.com/c/6HVKj3C7iwL,,,,700374750258921472,https://twitter.com/InstaSingapore/status/700374750258921472,punggol mrt station,punggol
InstaSingapore,2016-02-19 01:42:00,0,0,RT AlvinTWK: I'm at Sungei Punggol in Singapore https://www. swarmapp.com/c/ksf6BHlh11T,,,,700374748249853953,https://twitter.com/InstaSingapore/status/700374748249853953,punggol mrt station,punggol
GooganVel,2016-02-19 01:43:00,0,0,"travelling to Singapore Changi Airport from Chennai, India http:// fb.me/7FWJ33bq9",,,,700375116656603136,https://twitter.com/GooganVel/status/700375116656603136,changi airport mrt station,changi airport
Kazearashi,2016-02-19 01:44:00,0,0,Scootin away o/ (@Changi Airport Terminal 2 - @fansofchangi in Singapore) https://www. swarmapp.com/c/jsByQXqpeor,,@Changi @fansofchangi,,700375336094212096,https://twitter.com/Kazearashi/status/700375336094212096,changi airport mrt station,changi airport
alicianyj,2016-02-19 01:46:00,0,0,Bye SIN Hello HK #lucalytravelogue @luciaalin @Changi Airport https://www. instagram.com/p/BB779yErODl/,,@luciaalin @Changi,#lucalytravelogue,700375936445841408,https://twitter.com/alicianyj/status/700375936445841408,changi airport mrt station,changi airport
Volante10th,2016-02-19 01:46:00,0,0,Toa payoh raining liao! Finally! Besok consperm panas.,,,,700375874407759872,https://twitter.com/Volante10th/status/700375874407759872,toa payoh mrt station,toa payoh
kechingaling,2016-02-19 01:48:00,0,0,Can so totally understand this. #changi #changiairport #singaporeart #singaporedesigners … https://www. instagram.com/p/BB78KaQDqe3/,,,#changi #changiairport #singaporeart #singaporedesigners,700376380744151041,https://twitter.com/kechingaling/status/700376380744151041,changi airport mrt station,changi airport
InstaSingapore,2016-02-19 01:49:00,0,0,New Instagram by @_ale_dr_ Gardens By The Bay #Singapore pic.twitter.com/0dbfSEPy4n,,@_ale_dr_,#Singapore,700376630959726592,https://twitter.com/InstaSingapore/status/700376630959726592,gardens by the bay mrt station,gardens by the bay
InstaSingapore,2016-02-19 01:49:00,0,0,New Instagram by @ivnlens Gardens By The Bay #Singapore pic.twitter.com/7UxJ2mEvyR,,@ivnlens,#Singapore,700376695346438146,https://twitter.com/InstaSingapore/status/700376695346438146,gardens by the bay mrt station,gardens by the bay
InstaSingapore,2016-02-19 01:49:00,0,0,New Instagram by @fiordaxelmundo Gardens By The Bay #Singapore pic.twitter.com/yEyoql9yiK,,@fiordaxelmundo,#Singapore,700376614274727937,https://twitter.com/InstaSingapore/status/700376614274727937,gardens by the bay mrt station,gardens by the bay
tophedart,2016-02-19 01:54:00,0,0,"I'm at Tanah Merah in Jitra, Kedah https://www. swarmapp.com/c/fRrNgFdHUqO",,,,700377760972324865,https://twitter.com/tophedart/status/700377760972324865,tanah merah mrt station,tanah merah
s4ded,2016-02-19 01:55:00,0,0,I'm at Chambers LAN shop @Yishun in Singapore w/ @tan_lihan https://www. swarmapp.com/c/1xr3ys6kNS0,,@Yishun @tan_lihan,,700378057778003968,https://twitter.com/s4ded/status/700378057778003968,yishun mrt station,yishun
andrewmead73,2016-02-19 01:55:00,1,1,Connecting Daily is out! http:// paper.li/andrewmead73/1 429473295?edition_id=d809c550-d668-11e5-8edf-0cc47a0d15fd … Stories via @nastase_roxana @tampines _tech @teacherdebra,,@nastase_roxana @tampines @teacherdebra,,700378215374786560,https://twitter.com/andrewmead73/status/700378215374786560,tampines mrt station,tampines
ZaenaCarter,2016-02-19 01:56:00,0,0,"Ok, so I was just late night playing my ukelele since its raining here in pasir ris . my dad just BURST into my room telling me to shut up",,,,700378246676770816,https://twitter.com/ZaenaCarter/status/700378246676770816,pasir ris mrt station,pasir ris
tangnorman,2016-02-19 01:56:00,0,0,I'm at Chambers LAN shop @Yishun in Singapore https://www. swarmapp.com/tangnorman/che ckin/56c605d8498e19a66c44d667?s=3l9kRzxo5iD5cbYyMB_KzDhXh8A&ref=tw …,,@Yishun,,700378482338037762,https://twitter.com/tangnorman/status/700378482338037762,yishun mrt station,yishun
