username,date,retweets,favorites,text,geo,mentions,hashtags,id,permalink,place,key
verma_bishan,2016-01-14 18:11:00,0,0,"Kabhi odd, Kabhi even… jo khud ki baat par mukar jaye who kya punjabiyon ko kiye wade nibhayega #AapSeNaHoPayega",,,#AapSeNaHoPayega,687577669186142209,https://twitter.com/verma_bishan/status/687577669186142209,bishan mrt station,bishan
verma_bishan,2016-01-14 18:11:00,0,0,"Delhi ko toh sambhalna seekh le, phir Punjab ke baare mein sochna #AapSeNaHoPayega",,,#AapSeNaHoPayega,687577853135728640,https://twitter.com/verma_bishan/status/687577853135728640,bishan mrt station,bishan
verma_bishan,2016-01-14 18:11:00,0,0,"Dilli ka khazana khalli kar ke, ab yeh Punjab ka khazaana khali karne ki soch raha hai #AapSeNaHoPayega",,,#AapSeNaHoPayega,687577892314812416,https://twitter.com/verma_bishan/status/687577892314812416,bishan mrt station,bishan
iloveyouXD819,2016-01-14 18:11:00,0,0,15 more mins to sengkang station,,,,687577822777376769,https://twitter.com/iloveyouXD819/status/687577822777376769,sengkang mrt station,sengkang station
OwkKaynen,2016-01-14 18:11:00,0,0,"I'm at Cashew Heights in Bukit Panjang , Singapore https://www. swarmapp.com/c/gNk83O5ciKV",,,,687577762379476993,https://twitter.com/OwkKaynen/status/687577762379476993,bukit panjang mrt station,bukit panjang
verma_bishan,2016-01-14 18:11:00,0,0,His only ambition is to accumulate power. Aam Aadmi is just drama! #AapSeNaHoPayega,,,#AapSeNaHoPayega,687577755379044352,https://twitter.com/verma_bishan/status/687577755379044352,bishan mrt station,bishan
supitskikin,2016-01-14 18:12:00,0,0,@_mkbah ite simei . Kau ?,,@_mkbah,,687577976393740289,https://twitter.com/supitskikin/status/687577976393740289,simei mrt station,simei
LTAtrafficnews,2016-01-14 18:12:00,0,0,Accident on PIE (towards Changi Airport ) after Adam Rd,,,,687578142890790912,https://twitter.com/LTAtrafficnews/status/687578142890790912,changi airport mrt station,changi airport
LTAsg,2016-01-14 18:12:00,0,0,Accident on PIE (towards Changi Airport ) after Adam Rd,,,,687578139107573760,https://twitter.com/LTAsg/status/687578139107573760,changi airport mrt station,changi airport
AqisBalqis13,2016-01-14 18:12:00,0,0,@AtykaJamari nampaknya hanya yew tee yg blh diharap :'),,@AtykaJamari,,687578047965335552,https://twitter.com/AqisBalqis13/status/687578047965335552,yew tee mrt station,yew tee
wuyfk,2016-01-14 18:13:00,0,0,@adimansor annoying kan!! Alamak nak jumpa ah nanti! besok noon kak ima dah balik punggol,,@adimansor,,687578345739964416,https://twitter.com/wuyfk/status/687578345739964416,punggol mrt station,punggol
FCUKTHATMOFO,2016-01-14 18:13:00,0,0,I'm at Boon Keng MRT Station (NE9) - @sbs_transit in Singapore w/ @ahnlsr https://www. swarmapp.com/c/dreumLoo4OK,,@sbs_transit @ahnlsr,,687578292602417152,https://twitter.com/FCUKTHATMOFO/status/687578292602417152,boon keng mrt station,boon keng mrt
badoquecafe,2016-01-14 18:13:00,0,0,Beefing Up your Thursday ! #badoquebeefribs #ribeyesteak Tempting you from #upperthomson & #simpangbedok ... http:// fb.me/4619KBf73,,,#badoquebeefribs #ribeyesteak #upperthomson #simpangbedok,687578178479603714,https://twitter.com/badoquecafe/status/687578178479603714,upper thomson mrt station,upper thomson
shannyxx_,2016-01-14 18:14:00,0,1,I'm at Blk 842 Tampines Street 82 in Singapore https://www. swarmapp.com/c/4vsPjN1fohM,,,,687578445128282113,https://twitter.com/shannyxx_/status/687578445128282113,tampines mrt station,tampines
lrhoyabembe,2016-01-14 18:15:00,0,1,where's tampines ? https:// twitter.com/roshyroshrosh/ status/687576602444615680 …,,,,687578716243808256,https://twitter.com/lrhoyabembe/status/687578716243808256,tampines mrt station,tampines
technodium,2016-01-14 18:15:00,0,0,@ToiVillar magisa ka lang? Sa Hougang ka parin ba?,,@ToiVillar,,687578704751427584,https://twitter.com/technodium/status/687578704751427584,hougang mrt station,hougang
JSoccerMagazine,2016-01-14 18:16:00,1,0,Tampines Rovers finally get English winger 29 years after their offer 2 me fell through because of visa restrictions https:// twitter.com/tdysports/stat us/687193278702157824 …,,,,687578950852161536,https://twitter.com/JSoccerMagazine/status/687578950852161536,tampines mrt station,tampines
___Syahrul,2016-01-14 18:16:00,0,0,Balagumaran wanted Kaplan as first Hougang signing for 2016 S.League http://www. espnfc.com/singapore-s-le ague/story/2785218/bala-kaplan-was-first-on-hougangs-sleague-shortlist …,,,,687579036403408896,https://twitter.com/___Syahrul/status/687579036403408896,hougang mrt station,hougang
lonelyboixx_,2016-01-14 18:17:00,0,0,I'm at Blk 842 Tampines Street 82 in Singapore w/ @shannyxx_ https://www. swarmapp.com/c/5IcuxNERUDk,,@shannyxx_,,687579348677881856,https://twitter.com/lonelyboixx_/status/687579348677881856,tampines mrt station,tampines
urlbvrbie,2016-01-14 18:17:00,0,0,I'm at Boon Lay Bus Interchange in Singapore https://www. swarmapp.com/c/03dwdKOwxGt,,,,687579337797795841,https://twitter.com/urlbvrbie/status/687579337797795841,boon lay mrt station,boon lay
lonelyboixx_,2016-01-14 18:17:00,0,0,I'm at Blk 840 Tampines Street 82 in Singapore https://www. swarmapp.com/c/6P3zkPldTFo,,,,687579308991320064,https://twitter.com/lonelyboixx_/status/687579308991320064,tampines mrt station,tampines
lonelyboixx_,2016-01-14 18:17:00,0,0,I'm at Basketball Court @Tampines Blk 840 https://www. swarmapp.com/c/ai2UXdufCPt,,@Tampines,,687579259360178176,https://twitter.com/lonelyboixx_/status/687579259360178176,tampines mrt station,tampines
urnotwelcome,2016-01-14 18:18:00,0,1,"More selfies.. and wefies | #sg #friends @AXA Tower, 8 Shenton Way https://www. instagram.com/p/BAhAyrFJ-XI/",,@AXA,#sg #friends,687579438662455296,https://twitter.com/urnotwelcome/status/687579438662455296,shenton way mrt station,shenton way
syadz1,2016-01-14 18:18:00,2,1,"""I heard Botanic Gardens is a UNESCO World Heritage Site"" 'No la stupid, it's an MRT Station'",,,,687579466868985856,https://twitter.com/syadz1/status/687579466868985856,botanic gardens mrt station,botanic gardens mrt
Dydywazza,2016-01-14 18:19:00,0,0,@rawktheuniverse yio chu Kang (North),,@rawktheuniverse,,687579887834533888,https://twitter.com/Dydywazza/status/687579887834533888,yio chu kang mrt station,yio chu kang
LTAsg,2016-01-14 18:19:00,0,0,Accident on PIE (towards Changi Airport ) at Eng Neo Rd Exit,,,,687579849595072512,https://twitter.com/LTAsg/status/687579849595072512,changi airport mrt station,changi airport
zhengwee77,2016-01-14 18:19:00,0,0,I'm at Pasir Ris @PublicLibrarySg in Singapore w/ @defytheodds__ https://www. swarmapp.com/c/7p5BwEQ0EHd,,@PublicLibrarySg @defytheodds__,,687579905303928832,https://twitter.com/zhengwee77/status/687579905303928832,pasir ris mrt station,pasir ris
LTAtrafficnews,2016-01-14 18:19:00,0,0,Accident on PIE (towards Changi Airport ) at Eng Neo Rd Exit,,,,687579853172772864,https://twitter.com/LTAtrafficnews/status/687579853172772864,changi airport mrt station,changi airport
verma_bishan,2016-01-14 18:22:00,0,0,Arvind Kejriwal hid the letter from Tata power that Tata power also wanted to raise power prices. #AAPSeNaHoPayega,,,#AAPSeNaHoPayega,687580428446781440,https://twitter.com/verma_bishan/status/687580428446781440,bishan mrt station,bishan
ukkrima,2016-01-14 18:22:00,0,0,Parent to Umrah. I is cengeng . My prayers to them. @Changi Airport https://www. instagram.com/p/BAhBVjDRl52/,,@Changi,,687580637369335808,https://twitter.com/ukkrima/status/687580637369335808,changi airport mrt station,changi airport
VampetteBall,2016-01-14 18:23:00,0,1,Ew. Eh shit lah why got mosquito in sembawang one???,,,,687580733037121536,https://twitter.com/VampetteBall/status/687580733037121536,sembawang mrt station,sembawang
drawasmileyface,2016-01-14 18:24:00,0,1,@DrawASmileyFace BUY GONGCHA AT BEDOK MALL,,@DrawASmileyFace,,687580987857879044,https://twitter.com/drawasmileyface/status/687580987857879044,bedok mrt station,bedok
motherbackside,2016-01-14 18:24:00,0,1,@ughjewel u not joining @Button98 and i at bedok jetty ?,,@ughjewel @Button98,,687581090152726528,https://twitter.com/motherbackside/status/687581090152726528,bedok mrt station,bedok
allnews24,2016-01-14 18:24:00,0,0,Football: Jermaine Pennant set to sign for Tampines Rovers http:// bitly.com/1WaatF0,,,,687580934980288512,https://twitter.com/allnews24/status/687580934980288512,tampines mrt station,tampines
krishaquino,2016-01-14 18:25:00,0,0,I'm at Jurong East MRT Interchange (NS1/EW24) - @smrt_singapore in Singapore https://www. swarmapp.com/c/7qL9rHLslpJ,,@smrt_singapore,,687581214841139201,https://twitter.com/krishaquino/status/687581214841139201,jurong east mrt station,jurong east
ashhmdn,2016-01-14 18:25:00,0,0,Kadang kadang kan org naik moto yang nk melintas jalan besar ni sy yg risau keselamatan dia,,,,687581400288002052,https://twitter.com/ashhmdn/status/687581400288002052,jalan besar mrt station,jalan besar
gracechiiaa,2016-01-14 18:26:00,0,0,"Residents in the area stream into Jurong East Sports & Recreation Centre,curious of the ongoing fencing competition. #fencingsingapore #FA2",,,#fencingsingapore #FA2,687581448736382976,https://twitter.com/gracechiiaa/status/687581448736382976,jurong east mrt station,jurong east
stevelimfeng,2016-01-14 18:26:00,0,0,Against Bishan Park tmr. Can leave class early yes ah,,,,687581431590043648,https://twitter.com/stevelimfeng/status/687581431590043648,bishan mrt station,bishan
technodium,2016-01-14 18:27:00,0,0,@ToiVillar Sobrang lapit lang pala natin sa isa't isa. Punggol lang ako eh!,,@ToiVillar,,687581822713122817,https://twitter.com/technodium/status/687581822713122817,punggol mrt station,punggol
S3XYKISSES,2016-01-14 18:27:00,0,0,I'm at Bedok New Town in Singapore https://www. swarmapp.com/c/9uasnWfiqCX,,,,687581909451436033,https://twitter.com/S3XYKISSES/status/687581909451436033,bedok mrt station,bedok
verma_bishan,2016-01-14 18:27:00,0,0,Those Who Posed as Mr Clean Now Exposed as Dishonest' #LootJhootKejriwal#AapSeNaHoPayega,,,#LootJhootKejriwal #AapSeNaHoPayega,687581862760321024,https://twitter.com/verma_bishan/status/687581862760321024,bishan mrt station,bishan
verma_bishan,2016-01-14 18:27:00,0,0,What about that dear lalu hug... Bhool gaye kya... ? #AapSeNaHoPayega,,,#AapSeNaHoPayega,687581698045775872,https://twitter.com/verma_bishan/status/687581698045775872,bishan mrt station,bishan
ddreamdeath,2016-01-14 18:29:00,0,0,I'm at Blk 138 Bedok North St 2 https://www. swarmapp.com/c/5Yfuv03ncIZ,,,,687582220752699393,https://twitter.com/ddreamdeath/status/687582220752699393,bedok mrt station,bedok
grnx_,2016-01-14 18:30:00,0,0,I'm at Ang Mo Kio Central in Singapore https://www. swarmapp.com/c/f9p1gNXTGXi,,,,687582551448399872,https://twitter.com/grnx_/status/687582551448399872,ang mo kio mrt station,ang mo kio
gilainehsm,2016-01-14 18:30:00,0,0,"I'm at Block 742A Coffee Shop in Tampines , Singapore https://www. swarmapp.com/c/kJL2FQ8AyEm",,,,687582674400210944,https://twitter.com/gilainehsm/status/687582674400210944,tampines mrt station,tampines
verma_bishan,2016-01-14 18:31:00,0,0,AAP members claimed tickets were bought with money. #AAPSeNaHoPayega,,,#AAPSeNaHoPayega,687582822098309120,https://twitter.com/verma_bishan/status/687582822098309120,bishan mrt station,bishan
SALLYngketket,2016-01-14 18:31:00,0,0,#offtoPH #powerpuffcorn @Changi Airport https://www. instagram.com/p/BAhCWHaMSYah WvsWDYzySRJcqw63Vr69-IBveE0/ …,,@Changi,#offtoPH #powerpuffcorn,687582859385815040,https://twitter.com/SALLYngketket/status/687582859385815040,changi airport mrt station,changi airport
edgepropsg,2016-01-14 18:32:00,0,1,Food factory in Boon Lay up for sale for $20 million | The Edge Property Singapore http://www. theedgeproperty.com.sg/content/food-f actory-boon-lay-sale-20-million#.Vpd5F1LtqV0.twitter … #BoonLay #factory #sale #price,,,# #BoonLay #factory #sale #price,687583041821147136,https://twitter.com/edgepropsg/status/687583041821147136,boon lay mrt station,boon lay
lateffaalyssa,2016-01-14 18:32:00,0,0,Tinggal di Johor ni bukak la jalan besar mana pun tetap jalan jammed hari-hari .,,,,687583049479897088,https://twitter.com/lateffaalyssa/status/687583049479897088,jalan besar mrt station,jalan besar
CaputoItalo,2016-01-14 18:32:00,0,0,"Best children's books: 2016 Newbery, Caldecott winners - http:// CNN.com http:// edition.cnn.com/2016/01/11/liv ing/newbery-caldecott-youth-media-awards-2016-feat/ …",,,,687583041544425472,https://twitter.com/CaputoItalo/status/687583041544425472,caldescott mrt station,caldescott
BrianEmma2,2016-01-14 18:33:00,0,0,Outdoor court with kid in preschool punggol : zqJUzUdlX,,,,687583302962683904,https://twitter.com/BrianEmma2/status/687583302962683904,punggol mrt station,punggol
LTAtrafficnews,2016-01-14 18:33:00,0,0,Accident on PIE (towards Changi Airport) after Bukit Batok East Ave 3. Avoid lane 3,,,,687583346558255104,https://twitter.com/LTAtrafficnews/status/687583346558255104,bukit batok mrt station,bukit batok
juliaperrez,2016-01-14 18:33:00,12,65,Comik Celebrity @official_mnctv tonight 21:10 @Changi Airport https://www. instagram.com/p/BAhCjHaAFrx/,,@official_mnctv @Changi,,687583305101873152,https://twitter.com/juliaperrez/status/687583305101873152,changi airport mrt station,changi airport
LTAsg,2016-01-14 18:33:00,0,0,Accident on PIE (towards Changi Airport) after Bukit Batok East Ave 3. Avoid lane 3,,,,687583342682750976,https://twitter.com/LTAsg/status/687583342682750976,bukit batok mrt station,bukit batok
_hogang,2016-01-14 18:34:00,0,0,오늘 왜 목욜이지. 넘나 금욜같은 피곤함인데.,,,,687583654680248320,https://twitter.com/_hogang/status/687583654680248320,hougang mrt station,hougang
verma_bishan,2016-01-14 18:34:00,51,1,"Arvind Kejriwal said if Anna will separate himself from AAP party, then he will also separate himself from the party. #AAPSeNaHoPayega",,,#AAPSeNaHoPayega,687583608320602113,https://twitter.com/verma_bishan/status/687583608320602113,bishan mrt station,bishan
0fkgiven,2016-01-14 18:35:00,0,0,I'm at Bedok Mall in Singapore https://www. swarmapp.com/c/9WvC6HxS3X5,,,,687583727359275009,https://twitter.com/0fkgiven/status/687583727359275009,bedok mrt station,bedok
LTAsg,2016-01-14 18:35:00,0,0,Accident on PIE (towards Changi Airport) after Bukit Batok East Ave 3 with congestion till Bukit Batok Rd. Avoid lane 3,,,,687583898591563777,https://twitter.com/LTAsg/status/687583898591563777,bukit batok mrt station,bukit batok
LTAtrafficnews,2016-01-14 18:35:00,0,0,Accident on PIE (towards Changi Airport) after Bukit Batok East Ave 3 with congestion till Bukit Batok Rd. Avoid lane 3,,,,687583902567804929,https://twitter.com/LTAtrafficnews/status/687583902567804929,bukit batok mrt station,bukit batok
MrTohHere,2016-01-14 18:35:00,0,0,I'm at Bedok Mall in Singapore w/ @0fkgiven https://www. swarmapp.com/c/6lYoacmvOOC,,@0fkgiven,,687583881915138048,https://twitter.com/MrTohHere/status/687583881915138048,bedok mrt station,bedok
verma_bishan,2016-01-14 18:36:00,0,0,"Says he is a common man and is available for everyone but you have to pay Rs. 10,000+ to meet Arvind Kejriwal. #AAPSeNaHoPayega",,,#AAPSeNaHoPayega,687583952614232064,https://twitter.com/verma_bishan/status/687583952614232064,bishan mrt station,bishan
syafinasishak,2016-01-14 18:36:00,0,2,"Vacation (@Stesen Bas Tanah Merah in Jitra, Kedah) https://www. swarmapp.com/c/gLnuSp1Hymf pic.twitter.com/0b7Gmeb2vb",,@Stesen,,687584100186722304,https://twitter.com/syafinasishak/status/687584100186722304,tanah merah mrt station,tanah merah
VELCHEWx,2016-01-14 18:36:00,0,0,I'm at Hougang Mall in Singapore https://www. swarmapp.com/c/5bw6iiJGiom,,,,687583954258522116,https://twitter.com/VELCHEWx/status/687583954258522116,hougang mrt station,hougang
abdullah_wan,2016-01-14 18:37:00,0,0,Hahahaha Just posting @Blk 122 paya Lebar way https://www. instagram.com/p/BAhDB7DSKLnx JrIHWll7SyiUBxSHkVvYCxaK440/ …,,@Blk,,687584361630273536,https://twitter.com/abdullah_wan/status/687584361630273536,paya lebar mrt station,paya lebar
verma_bishan,2016-01-14 18:37:00,0,0,#AapSeNaHoPayega This is a sheer shame.,,,#AapSeNaHoPayega,687584439501598720,https://twitter.com/verma_bishan/status/687584439501598720,bishan mrt station,bishan
verma_bishan,2016-01-14 18:37:00,0,0,This is #AapSeNaHoPayega for their selfish political interests.,,,#AapSeNaHoPayega,687584343766638593,https://twitter.com/verma_bishan/status/687584343766638593,bishan mrt station,bishan
frhdbadva,2016-01-14 18:37:00,0,0,@naufal_4113 yg aku confirm kat 1KM n Kallang Wave,,@naufal_4113,,687584275588251648,https://twitter.com/frhdbadva/status/687584275588251648,kallang mrt station,kallang
verma_bishan,2016-01-14 18:37:00,0,0,Don't provoke the fire of hatred in Punjba plz. #AapSeNaHoPayega,,,#AapSeNaHoPayega,687584398527475713,https://twitter.com/verma_bishan/status/687584398527475713,bishan mrt station,bishan
chong_wei,2016-01-14 18:38:00,0,0,"After dinner coffee and dessert with the family #familylife #yummy @Chocolate Origin, Kallang … https://www. instagram.com/p/BAhDJyxqvXi/",,@Chocolate,#familylife #yummy,687584638215127040,https://twitter.com/chong_wei/status/687584638215127040,kallang mrt station,kallang
verma_bishan,2016-01-14 18:38:00,0,0,#AapSeNaHoPayega Cheap Politics.,,,#AapSeNaHoPayega,687584691466055680,https://twitter.com/verma_bishan/status/687584691466055680,bishan mrt station,bishan
verma_bishan,2016-01-14 18:38:00,0,0,"HEY, AAP Stop this PAAP. #AapSeNaHoPayega",,,#AapSeNaHoPayega,687584660356923392,https://twitter.com/verma_bishan/status/687584660356923392,bishan mrt station,bishan
verma_bishan,2016-01-14 18:38:00,0,0,They are trying to divide away the Punjab. #AAPTARDS #AapSeNaHoPayega,,,#AAPTARDS #AapSeNaHoPayega,687584631663669248,https://twitter.com/verma_bishan/status/687584631663669248,bishan mrt station,bishan
verma_bishan,2016-01-14 18:38:00,0,0,Arvind Kejriwal named Gadkari in irrigation scam even though he was not involved. #AAPSeNaHoPayega,,,#AAPSeNaHoPayega,687584590106464256,https://twitter.com/verma_bishan/status/687584590106464256,bishan mrt station,bishan
verma_bishan,2016-01-14 18:38:00,0,0,Heartwrenching to know this truth. #AapSeNaHoPayega,,,#AapSeNaHoPayega,687584567922839552,https://twitter.com/verma_bishan/status/687584567922839552,bishan mrt station,bishan
verma_bishan,2016-01-14 18:38:00,0,0,#AapSeNaHoPayega Keep this dangerous and spooky party at bay.,,,#AapSeNaHoPayega,687584536490737664,https://twitter.com/verma_bishan/status/687584536490737664,bishan mrt station,bishan
verma_bishan,2016-01-14 18:38:00,0,0,#AapSeNaHoPayega CHEAP PPL. CHEAP POLITICS. HATE IT.,,,#AapSeNaHoPayega,687584507977797632,https://twitter.com/verma_bishan/status/687584507977797632,bishan mrt station,bishan
verma_bishan,2016-01-14 18:38:00,0,0,#AapSeNaHoPayega USING CHEAP POLITICS WILL BRING YOU ONLY CUSS.,,,#AapSeNaHoPayega,687584477309059072,https://twitter.com/verma_bishan/status/687584477309059072,bishan mrt station,bishan
fellovesgarf,2016-01-14 18:38:00,0,0,I'm at Blk 423 Pasir Ris Drive 6 in Singapore https://www. swarmapp.com/c/dyJKWzreKlt,,,,687584584251404288,https://twitter.com/fellovesgarf/status/687584584251404288,pasir ris mrt station,pasir ris
verma_bishan,2016-01-14 18:38:00,0,0,#AapSeNaHoPayega If you can't do good stop doing d bad.,,,#AapSeNaHoPayega,687584598759346176,https://twitter.com/verma_bishan/status/687584598759346176,bishan mrt station,bishan
verma_bishan,2016-01-14 18:39:00,0,0,#AapSeNaHoPayega They are responsible to disturb the communal harmony in d state.,,,#AapSeNaHoPayega,687584813981671425,https://twitter.com/verma_bishan/status/687584813981671425,bishan mrt station,bishan
faizselamat,2016-01-14 18:39:00,0,0,Going yewtee pasar malam again,,,,687584780326539264,https://twitter.com/faizselamat/status/687584780326539264,yew tee mrt station,yew tee
verma_bishan,2016-01-14 18:39:00,0,0,Stop using these filthy tricks! #AapSeNaHoPayega,,,#AapSeNaHoPayega,687584722629734400,https://twitter.com/verma_bishan/status/687584722629734400,bishan mrt station,bishan
verma_bishan,2016-01-14 18:39:00,0,0,Dont be selfish yr. #AapSeNaHoPayega,,,#AapSeNaHoPayega,687584752870658048,https://twitter.com/verma_bishan/status/687584752870658048,bishan mrt station,bishan
verma_bishan,2016-01-14 18:39:00,0,0,Don't use public sentiments for your own nasty advantages. #AapSeNaHoPayega,,,#AapSeNaHoPayega,687584785229742080,https://twitter.com/verma_bishan/status/687584785229742080,bishan mrt station,bishan
verma_bishan,2016-01-14 18:39:00,0,0,What a shameless act. #AapSeNaHoPayega,,,#AapSeNaHoPayega,687584866423058432,https://twitter.com/verma_bishan/status/687584866423058432,bishan mrt station,bishan
verma_bishan,2016-01-14 18:39:00,0,0,#AapSeNaHoPayega .. Really bad!,,,#AapSeNaHoPayega,687584891358203905,https://twitter.com/verma_bishan/status/687584891358203905,bishan mrt station,bishan
verma_bishan,2016-01-14 18:39:00,0,0,Feeling pathos on you ppl. #AapSeNaHoPayega,,,#AapSeNaHoPayega,687584917346107392,https://twitter.com/verma_bishan/status/687584917346107392,bishan mrt station,bishan
verma_bishan,2016-01-14 18:39:00,0,0,Such a shame!! #AapSeNaHoPayega,,,#AapSeNaHoPayega,687584842817515520,https://twitter.com/verma_bishan/status/687584842817515520,bishan mrt station,bishan
verma_bishan,2016-01-14 18:40:00,0,0,Hurting sentiments. Hurting Punjab #AapSeNaHoPayega,,,#AapSeNaHoPayega,687585066755596288,https://twitter.com/verma_bishan/status/687585066755596288,bishan mrt station,bishan
verma_bishan,2016-01-14 18:40:00,0,0,Dont use fake trends for ur black benefits. #AapSeNaHoPayega,,,#AapSeNaHoPayega,687585103543836672,https://twitter.com/verma_bishan/status/687585103543836672,bishan mrt station,bishan
JOIELIMJT,2016-01-14 18:40:00,0,1,I'm at Hougang Mall in Singapore w/ @velchewx https://www. swarmapp.com/c/lhBXR3fm6bx,,@velchewx,,687584966222442496,https://twitter.com/JOIELIMJT/status/687584966222442496,hougang mrt station,hougang
verma_bishan,2016-01-14 18:40:00,0,0,"Arvind Kejriwal had written a letter to Delhi Auto-walas and promised many measures, #AAPSeNaHoPayega",,,#AAPSeNaHoPayega,687584950657269760,https://twitter.com/verma_bishan/status/687584950657269760,bishan mrt station,bishan
verma_bishan,2016-01-14 18:40:00,0,0,Your game is over. #AapSeNaHoPayega,,,#AapSeNaHoPayega,687584982882095104,https://twitter.com/verma_bishan/status/687584982882095104,bishan mrt station,bishan
verma_bishan,2016-01-14 18:40:00,0,0,You have devastated the things. #AapSeNaHoPayega,,,#AapSeNaHoPayega,687585005057409024,https://twitter.com/verma_bishan/status/687585005057409024,bishan mrt station,bishan
verma_bishan,2016-01-14 18:40:00,0,0,Sad to hear about this cheap tactics. #AapSeNaHoPayega,,,#AapSeNaHoPayega,687585033016614912,https://twitter.com/verma_bishan/status/687585033016614912,bishan mrt station,bishan
verma_bishan,2016-01-14 18:40:00,0,0,"Says he is a common man and is available for everyone but you have to pay Rs. 10,000+ to meet #AAPSeNaHoPayega",,,#AAPSeNaHoPayega,687585091271278593,https://twitter.com/verma_bishan/status/687585091271278593,bishan mrt station,bishan
alanlyl,2016-01-14 18:40:00,0,0,I'm at City Hall MRT Interchange (EW13/NS25) - @smrt_singapore in Singapore https://www. swarmapp.com/c/fMNVHOw2aWn,,@smrt_singapore,,687584944298835968,https://twitter.com/alanlyl/status/687584944298835968,city hall mrt station,city hall mrt
Kaihuiii,2016-01-14 18:41:00,0,0,I'm at Jurong East in Singapore https://www. swarmapp.com/c/g7mtnXbfH6S,,,,687585423057620992,https://twitter.com/Kaihuiii/status/687585423057620992,jurong east mrt station,jurong east
verma_bishan,2016-01-14 18:41:00,0,0,"- He said ""you cannot remove corruption by taking support of congress."" But readily accepted. #AAPSeNaHoPayega",,,#AAPSeNaHoPayega,687585340484222977,https://twitter.com/verma_bishan/status/687585340484222977,bishan mrt station,bishan
verma_bishan,2016-01-14 18:41:00,0,0,Such a hapless act!! #AapSeNaHoPayega,,,#AapSeNaHoPayega,687585262126276608,https://twitter.com/verma_bishan/status/687585262126276608,bishan mrt station,bishan
_yokeling,2016-01-14 18:41:00,0,0,"Me: Oh, this job looks interesting. Address: Boon Lay Me: *close tab*",,,,687585381068500992,https://twitter.com/_yokeling/status/687585381068500992,boon lay mrt station,boon lay
JuliaPerez_ID,2016-01-14 18:41:00,0,0,Comik Celebrity official_mnctv tonight 21:10 @Changi Airport https://www. instagram.com/p/BAhCjHaAFrx/,,@Changi,,687585405126979584,https://twitter.com/JuliaPerez_ID/status/687585405126979584,changi airport mrt station,changi airport
verma_bishan,2016-01-14 18:41:00,0,0,We want to stay in peace and harmony. Stop it. #AapSeNaHoPayega,,,#AapSeNaHoPayega,687585238713679872,https://twitter.com/verma_bishan/status/687585238713679872,bishan mrt station,bishan
verma_bishan,2016-01-14 18:42:00,0,0,People of Punjab beware of him. He has already spoiled Delhi. #AAPSeNaHoPayega,,,#AAPSeNaHoPayega,687585543635378176,https://twitter.com/verma_bishan/status/687585543635378176,bishan mrt station,bishan
TheAngsty,2016-01-14 18:43:00,0,0,I'm at Sembawang MRT Station (NS11) - @smrt_singapore in Singapore w/ @k1mberl3e https://www. swarmapp.com/c/6ZyNwDh59da,,@smrt_singapore @k1mberl3e,,687585800440135680,https://twitter.com/TheAngsty/status/687585800440135680,sembawang mrt station,sembawang
verma_bishan,2016-01-14 18:43:00,0,0,- This guy has no job but to blabber his mouth! #AAPSeNaHoPayega,,,#AAPSeNaHoPayega,687585728738414593,https://twitter.com/verma_bishan/status/687585728738414593,bishan mrt station,bishan
Syukri_Chiki,2016-01-14 18:43:00,0,2,Lepak tampines skatepark ni confirm,,,,687585738276261889,https://twitter.com/Syukri_Chiki/status/687585738276261889,tampines mrt station,tampines
wyTayloreece,2016-01-14 18:43:00,0,0,Waitingggggg (@Singapore Changi Airport (SIN) - @fansofchangi in Singapore) https://www. swarmapp.com/c/dKcHnrs3wyG,,@Singapore @fansofchangi,,687585752411172864,https://twitter.com/wyTayloreece/status/687585752411172864,changi airport mrt station,changi airport
