username,date,retweets,favorites,text,geo,mentions,hashtags,id,permalink,place,key
_skull_heart_,2016-01-04 15:45:00,0,1,"Homed (@Blk 442, Ang Mo Kio Ave 10) https://www. swarmapp.com/c/3yazJndDG2i",,@Blk,,683917145563074561,https://twitter.com/_skull_heart_/status/683917145563074561,ang mo kio mrt station,ang mo kio
samchadh1209,2016-01-04 15:46:00,0,0,#boatquay #marinabaysands #view #boysnightout #skylines #rafflesplace #superb #colonial #heritage #singapore pic.twitter.com/uYEddrriFC,,,#boatquay #marinabaysands #view #boysnightout #skylines #rafflesplace #superb #colonial #heritage #singapore,683917520756064256,https://twitter.com/samchadh1209/status/683917520756064256,raffles place mrt station,raffles place
aunqun,2016-01-04 15:47:00,0,0,I'm at Singapore Changi Airport (SIN) in Singapore https://www. swarmapp.com/c/1wcD63Il9cg,,,,683917641640185856,https://twitter.com/aunqun/status/683917641640185856,changi airport mrt station,changi airport
BrianEmma2,2016-01-04 15:47:00,0,0,Outdoor oval remedial of kid behind preschool punggol : GYtqvSjye,,,,683917595502772224,https://twitter.com/BrianEmma2/status/683917595502772224,punggol mrt station,punggol
DamienLZH,2016-01-04 15:47:00,0,0,I'm at Bukit Batok Driving Centre (BBDC) in Singapore https://www. swarmapp.com/c/5QtdkMHnBW8,,,,683917537483075584,https://twitter.com/DamienLZH/status/683917537483075584,bukit batok mrt station,bukit batok
kiullerwhale,2016-01-04 15:48:00,0,0,@nicshields Oh you should see the massive poster on one of the pillars at Dhoby Ghaut MRT.,,@nicshields,,683917952698064896,https://twitter.com/kiullerwhale/status/683917952698064896,dhoby ghaut mrt station,dhoby ghaut
dalnimandhae,2016-01-04 15:48:00,0,0,Travel from Pasir Ris to yishun just to get a passport cover #TeamSuperJunior,,,#TeamSuperJunior,683917891691884544,https://twitter.com/dalnimandhae/status/683917891691884544,pasir ris mrt station,pasir ris
alice2015wood,2016-01-04 15:49:00,0,0,RT @arestdesign : #singapore #career Singapore Jobs Customer service 6 months Up to 2200 Aljunied : About ... http:// buff.ly/1OCKekr #job #…,,@arestdesign,#singapore #career #job #,683918039193137152,https://twitter.com/alice2015wood/status/683918039193137152,aljunied mrt station,aljunied
pio_durjana,2016-01-04 15:51:00,0,0,I'm at Hougang Central Bus Interchange - @sbs_transit in Singapore https://www. swarmapp.com/c/0HWkopGbMkL,,@sbs_transit,,683918645450399744,https://twitter.com/pio_durjana/status/683918645450399744,hougang mrt station,hougang
VELCHEWx,2016-01-04 15:51:00,0,0,I'm at Sembawang in Singapore https://www. swarmapp.com/c/0yYTmeUdR5h,,,,683918652589109248,https://twitter.com/VELCHEWx/status/683918652589109248,sembawang mrt station,sembawang
wtffirdaus,2016-01-04 15:51:00,0,0,zzz my school siglap merge idk what schhh,,,,683918697447034880,https://twitter.com/wtffirdaus/status/683918697447034880,siglap mrt station,siglap
syaakiirahh,2016-01-04 15:51:00,0,0,"The moment i took so i can hand over to the control station once I reach Tampines , i got all the stare in the train",,,,683918548297617408,https://twitter.com/syaakiirahh/status/683918548297617408,tampines mrt station,tampines
samchadh1209,2016-01-04 15:52:00,0,1,#friendsforever #work #afterwork #sg #clubstreet #telokayer #realestate #events #digitalmarketing #data -analysis pic.twitter.com/UX5bOCBH3F,,,#friendsforever #work #afterwork #sg #clubstreet #telokayer #realestate #events #digitalmarketing #data,683918840586047492,https://twitter.com/samchadh1209/status/683918840586047492,telok ayer mrt station,telok ayer
wtffirdaus,2016-01-04 15:52:00,2,0,at school all my friends using seluar siglap and im here using raffles coz no stock,,,,683918935016620032,https://twitter.com/wtffirdaus/status/683918935016620032,siglap mrt station,siglap
SAFRAsg,2016-01-04 15:52:00,0,0,Have you tried your hands on idartssingapore at our SAFRA Mount Faber and SAFRA Tampines … https://www. instagram.com/p/BAHAOIiR_u0/,,,,683919012120498176,https://twitter.com/SAFRAsg/status/683919012120498176,tampines mrt station,tampines
vernonkoo,2016-01-04 15:53:00,0,0,anybody wanna come hougang find me fuck,,,,683919097277448193,https://twitter.com/vernonkoo/status/683919097277448193,hougang mrt station,hougang
leonntyler,2016-01-04 15:54:00,0,0,going to pasir ris ???,,,,683919517102178304,https://twitter.com/leonntyler/status/683919517102178304,pasir ris mrt station,pasir ris
subhramit,2016-01-04 15:54:00,0,0,"@ChangiAirport Hi trying since today morning on 65974500 to report an item I left behind in MI487 today, the line is permanently engaged",,@ChangiAirport,,683919460374151169,https://twitter.com/subhramit/status/683919460374151169,changi airport mrt station,changi airport
LTAsg,2016-01-04 15:54:00,1,0,Accident on PIE (towards Tuas) after KPE Exit with congestion till Paya Lebar Rd. Avoid lane 1,,,,683919331852353537,https://twitter.com/LTAsg/status/683919331852353537,paya lebar mrt station,paya lebar
LTAtrafficnews,2016-01-04 15:54:00,0,0,Accident on PIE (towards Tuas) after KPE Exit with congestion till Paya Lebar Rd. Avoid lane 1,,,,683919335706902529,https://twitter.com/LTAtrafficnews/status/683919335706902529,paya lebar mrt station,paya lebar
diondimiceli,2016-01-04 15:54:00,0,1,Singapores @ChangiAirport is so awesome that families hang out there when not flying. No seriosly. Makes @HeathrowAirport look pedestrian.,,@ChangiAirport @HeathrowAirport,,683919514921091072,https://twitter.com/diondimiceli/status/683919514921091072,changi airport mrt station,changi airport
LSdontgiveadamn,2016-01-04 15:55:00,0,0,Paya lebar sq the bank here machiam hospital. Waited fucking hours,,,,683919671058239489,https://twitter.com/LSdontgiveadamn/status/683919671058239489,paya lebar mrt station,paya lebar
_Clxraa,2016-01-04 15:55:00,0,0,"I'm at New Changi Eating House in Bedok , Singapore https://www. swarmapp.com/c/4iWGrFn6imI",,,,683919581979766784,https://twitter.com/_Clxraa/status/683919581979766784,bedok mrt station,bedok
GDMFSOTB,2016-01-04 15:57:00,1,0,@vernonkoo anybody wanna come hougang find me fuck,,@vernonkoo,,683920170687963136,https://twitter.com/GDMFSOTB/status/683920170687963136,hougang mrt station,hougang
InstaSingapore,2016-01-04 15:58:00,0,0,New Instagram by @toshinx Gardens By The Bay #Singapore pic.twitter.com/rxVqzPWYX1,,@toshinx,#Singapore,683920540252372992,https://twitter.com/InstaSingapore/status/683920540252372992,gardens by the bay mrt station,gardens by the bay
InstaSingapore,2016-01-04 15:58:00,0,0,New Instagram by @anzebercic Gardens By The Bay #Singapore pic.twitter.com/1RCQdtvftN,,@anzebercic,#Singapore,683920528407683072,https://twitter.com/InstaSingapore/status/683920528407683072,gardens by the bay mrt station,gardens by the bay
InstaSingapore,2016-01-04 15:58:00,0,0,New Instagram by @aimiancient Gardens By The Bay #Singapore pic.twitter.com/Ht8jUiBI18,,@aimiancient,#Singapore,683920499357933568,https://twitter.com/InstaSingapore/status/683920499357933568,gardens by the bay mrt station,gardens by the bay
InstaSingapore,2016-01-04 15:58:00,1,1,New Instagram by @michihito1105 Gardens By The Bay #Singapore pic.twitter.com/Eg5dUEQCgM,,@michihito1105,#Singapore,683920483990007808,https://twitter.com/InstaSingapore/status/683920483990007808,gardens by the bay mrt station,gardens by the bay
InstaSingapore,2016-01-04 15:59:00,0,0,New Instagram by @hafreezeislands Gardens By The Bay #Singapore pic.twitter.com/sXfDvqLnIU,,@hafreezeislands,#Singapore,683920581809598464,https://twitter.com/InstaSingapore/status/683920581809598464,gardens by the bay mrt station,gardens by the bay
InstaSingapore,2016-01-04 15:59:00,0,0,New Instagram by @rbooboo Gardens By The Bay #Singapore pic.twitter.com/22HCDjDiCq,,@rbooboo,#Singapore,683920566148042752,https://twitter.com/InstaSingapore/status/683920566148042752,gardens by the bay mrt station,gardens by the bay
InstaSingapore,2016-01-04 15:59:00,0,0,New Instagram by @kassie_hormell Gardens By The Bay #Singapore pic.twitter.com/F2GtsJRxVF,,@kassie_hormell,#Singapore,683920559319724033,https://twitter.com/InstaSingapore/status/683920559319724033,gardens by the bay mrt station,gardens by the bay
InstaSingapore,2016-01-04 15:59:00,0,0,New Instagram by @alyssailves Gardens By The Bay #Singapore pic.twitter.com/odXnB3OJ1X,,@alyssailves,#Singapore,683920553615425536,https://twitter.com/InstaSingapore/status/683920553615425536,gardens by the bay mrt station,gardens by the bay
SAFRAsg,2016-01-04 16:00:00,0,0,"@wilswong Hi, members can look forward to swimming pools with exclusive access to facilities at Punggol Regional Sports Centre in 2019.",,@wilswong,,683920948458733568,https://twitter.com/SAFRAsg/status/683920948458733568,punggol mrt station,punggol
zaaaachary,2016-01-04 16:02:00,0,0,Although I doubt I will ever have to use it because who goes to bishan anyway,,,,683921443747311616,https://twitter.com/zaaaachary/status/683921443747311616,bishan mrt station,bishan
grnx_,2016-01-04 16:03:00,0,0,I'm at Blk 219 Bishan Street 23 in Singapore https://www. swarmapp.com/c/gtVYwuzv11E,,,,683921556435800064,https://twitter.com/grnx_/status/683921556435800064,bishan mrt station,bishan
cocoaevenings,2016-01-04 16:04:00,0,0,3.59pm Havelock Road. Cross over to Stop 06159 to take Bus 51 to Clarke Quay MRT. #monoSG,,,#monoSG,683921941493723140,https://twitter.com/cocoaevenings/status/683921941493723140,clarke quay mrt station,clarke quay
Bishan__m,2016-01-04 16:05:00,1,0,مو شرط انتقم بنفس اللحظه ، بس صدقني اعرف اختار الوقت اللي اضربها صح وتوجعك.,,,,683922229114068992,https://twitter.com/Bishan__m/status/683922229114068992,bishan mrt station,bishan
farosa13,2016-01-04 16:06:00,0,0,Transit di Changi Airport http:// dlvr.it/D9rC3n pic.twitter.com/2bixe3Dn3A,,,,683922361305796609,https://twitter.com/farosa13/status/683922361305796609,changi airport mrt station,changi airport
PropertyHomeSG,2016-01-04 16:06:00,0,0,"JTC launches sale of 2 confirmed list industrial sites at Tampines , Tuas pic.twitter.com/Aghin3NJGu",,,,683922358290247680,https://twitter.com/PropertyHomeSG/status/683922358290247680,tampines mrt station,tampines
leonntyler,2016-01-04 16:06:00,0,0,to tampines FUCKING TAMPINES,,,,683922458827603968,https://twitter.com/leonntyler/status/683922458827603968,tampines mrt station,tampines
RoomwithAircon,2016-01-04 16:07:00,0,0,BLK 121 ANG MO KIO AVE 3 COMMON ROOM FOR RENT - http:// roomwithaircon.com/ads/blk-121-an g-mo-kio-ave-3-common-room-for-rent/ …,,,,683922693129777153,https://twitter.com/RoomwithAircon/status/683922693129777153,ang mo kio mrt station,ang mo kio
FlyWithStyle,2016-01-04 16:08:00,0,0,Nearly lost my way while finding the downtown line from bukit panjang,,,,683922899594428416,https://twitter.com/FlyWithStyle/status/683922899594428416,bukit panjang mrt station,bukit panjang
lonelyboixx_,2016-01-04 16:09:00,0,0,I'm at Blk 842 Tampines Street 82 in Singapore w/ @allyouare @shannyxx_ https://www. swarmapp.com/c/kNN5c9gN8MZ,,@allyouare @shannyxx_,,683923186291965952,https://twitter.com/lonelyboixx_/status/683923186291965952,tampines mrt station,tampines
lonelyboixx_,2016-01-04 16:09:00,0,0,I'm at Blk 840 Tampines Street 82 in Singapore https://www. swarmapp.com/c/hS64XtBX6rY,,,,683923230952914944,https://twitter.com/lonelyboixx_/status/683923230952914944,tampines mrt station,tampines
acorusto1,2016-01-04 16:09:00,0,0,#fliiby Christmas At Gardens by the Bay - MyQute https:// fliiby.com/file/x9nqfe4uc d5/ …,,,#fliiby,683923077923643392,https://twitter.com/acorusto1/status/683923077923643392,gardens by the bay mrt station,gardens by the bay
lonelyboixx_,2016-01-04 16:09:00,0,0,I'm at Basketball Court @Tampines Blk 840 https://www. swarmapp.com/c/bTZQ5q8OEyG,,@Tampines,,683923300549062656,https://twitter.com/lonelyboixx_/status/683923300549062656,tampines mrt station,tampines
KangLimP,2016-01-04 16:10:00,0,0,I'm at Admiralty MRT Station (NS10) - @smrt_singapore in Singapore https://www. swarmapp.com/c/04y0aqNIAwJ,,@smrt_singapore,,683923440080916480,https://twitter.com/KangLimP/status/683923440080916480,admiralty mrt station,admiralty mrt
aaassliem,2016-01-04 16:11:00,0,0,I'm at Tampines Mall in Singapore w/ @yamjiajia https://www. swarmapp.com/c/3q2Kz96qoP9,,@yamjiajia,,683923745942155265,https://twitter.com/aaassliem/status/683923745942155265,tampines mrt station,tampines
InstaSingapore,2016-01-04 16:11:00,0,0,#Singapore #Changi Instagram by @cinthiadanny - Back to jakarta.bandara changi airport . Dpt pengalaman bru disingap… pic.twitter.com/Dx8kbHWuSa,,@cinthiadanny,#Singapore #Changi,683923585157742592,https://twitter.com/InstaSingapore/status/683923585157742592,changi airport mrt station,changi airport
yusri3461,2016-01-04 16:12:00,0,0,"Lunch (@Restoran Selera Tepi Sungai in Tanah Merah , Kelantan) https://www. swarmapp.com/c/6C5AsjizNIK pic.twitter.com/jK6vKFCo7z",,@Restoran,,683923902414876672,https://twitter.com/yusri3461/status/683923902414876672,tanah merah mrt station,tanah merah
cocoaevenings,2016-01-04 16:14:00,0,0,4.12pm arrived at Clarke Quay MRT $1.40 cash,,,,683924477143416832,https://twitter.com/cocoaevenings/status/683924477143416832,clarke quay mrt station,clarke quay
lionsxii360,2016-01-04 16:14:00,0,0,@pennant83 @camferg1888 Not Tampines ?,,@pennant83 @camferg1888,,683924473083334656,https://twitter.com/lionsxii360/status/683924473083334656,tampines mrt station,tampines
lionsxii360,2016-01-04 16:15:00,0,0,@blinkhorm @rlowe20 @yanicw33 @pennant83 Heard that he's going for trial in S.League (Singapore) Tampines Rovers!,,@blinkhorm @rlowe20 @yanicw33 @pennant83,,683924620785758208,https://twitter.com/lionsxii360/status/683924620785758208,tampines mrt station,tampines
Brandon_Chungg,2016-01-04 16:17:00,0,0,"I'm at Bishan in Singapore, singapore https://www. swarmapp.com/c/jDejvfCPHQY",,,,683925191811022848,https://twitter.com/Brandon_Chungg/status/683925191811022848,bishan mrt station,bishan
aidahburne,2016-01-04 16:18:00,0,0,Or open a Nasi Lemak stall at Pasir Ris with my grandmother's extremely classified recipe. https:// twitter.com/sqzul/status/6 83924948587446272 …,,,,683925443628548096,https://twitter.com/aidahburne/status/683925443628548096,pasir ris mrt station,pasir ris
TheWeirdSoul,2016-01-04 16:18:00,0,0,wah shiok ahh tompang from bukit batok,,,,683925568023203840,https://twitter.com/TheWeirdSoul/status/683925568023203840,bukit batok mrt station,bukit batok
lisauyenx,2016-01-04 16:19:00,0,0,I'm at Blk 348 Ang Mo Kio Ave 3 w/ @lukaslwz @gxrlin https://www. swarmapp.com/c/gviqWsYLQFN,,@lukaslwz @gxrlin,,683925644128980992,https://twitter.com/lisauyenx/status/683925644128980992,ang mo kio mrt station,ang mo kio
cocoaevenings,2016-01-04 16:19:00,0,0,4.18pm Purple Line from Clarke Quay to Serangoon. Aim to use Circle Line to Ang Mo Kio and Coke down to Braddell. Cover Thomson. #MonoSG,,,#MonoSG,683925700307374080,https://twitter.com/cocoaevenings/status/683925700307374080,ang mo kio mrt station,ang mo kio
coolbeanskenya,2016-01-04 16:19:00,0,0,"Handbag ~ kes. 4000. Find us at Bishan plaza, westlands. Mpaka rd. Call or whatsapp 0721444924 http:// fb.me/3F5WVAAIE",,,,683925731466985472,https://twitter.com/coolbeanskenya/status/683925731466985472,bishan mrt station,bishan
TGIFBazaars,2016-01-04 16:20:00,0,0,"Happening this week from tomorrow till sat, TGIF Bazaars at Clarke Quay !",,,,683925909565407232,https://twitter.com/TGIFBazaars/status/683925909565407232,clarke quay mrt station,clarke quay
mrai_R,2016-01-04 16:23:00,86,1,Hi guys. Please help RT. Found this POSB Nets card at woodlands MRT Top-up machine. The owner's name is Corliss. pic.twitter.com/OiEBhnRESE,,,,683926694424494080,https://twitter.com/mrai_R/status/683926694424494080,woodlands mrt station,woodlands mrt
vamos32,2016-01-04 16:24:00,0,0,"@HermyRahim Masuk spore kalau ada kacau kau, kau sebut kau member vamos budak simpang bedok .",,@HermyRahim,,683926849475362816,https://twitter.com/vamos32/status/683926849475362816,bedok mrt station,bedok
cocoaevenings,2016-01-04 16:24:00,0,0,4.24pm Arrived Little India Station . $0.80 #MonoSG,,,#MonoSG,683927026265280513,https://twitter.com/cocoaevenings/status/683927026265280513,little india mrt station,little india station
dianeleow,2016-01-04 16:24:00,0,0,Tried and tested: Journey to Choa Chu Kang from Orchard was definitely shorter via DTL compared to NSL pic.twitter.com/PbgzuHhE1u,,,,683926843573927936,https://twitter.com/dianeleow/status/683926843573927936,choa chu kang mrt station,choa chu kang
fourGoTwiThu,2016-01-04 16:27:00,0,0,I'm at Tampines Tree Park Bus Stop in Singapore w/ @warongs https://www. swarmapp.com/c/eYaJtj3i4s6 pic.twitter.com/D3nZIdTEtk,,@warongs,,683927812072431616,https://twitter.com/fourGoTwiThu/status/683927812072431616,tampines mrt station,tampines
KopTalk,2016-01-04 16:28:00,1,0,Tampines Rovers hand Jermaine Pennant a trial - KopTalk - Liverpool FC News http:// fb.me/3vrOUUMc7,,,,683928007506030592,https://twitter.com/KopTalk/status/683928007506030592,tampines mrt station,tampines
aaassliem,2016-01-04 16:28:00,0,0,"I'm at Tampines Bus Interchange in Singapore, SINGAPORE https://www. swarmapp.com/c/aY1q3wqMe9B",,,,683927929911390208,https://twitter.com/aaassliem/status/683927929911390208,tampines mrt station,tampines
_muhdazhar,2016-01-04 16:29:00,0,0,Spent a total of 3 hours sitting in 4 buses going literally nowhere and ended up heading home. School → Tamp → Kent Ridge → Bedok → Home.,,,,683928129161670656,https://twitter.com/_muhdazhar/status/683928129161670656,bedok mrt station,bedok
jxfflxw,2016-01-04 16:30:00,0,0,I'm at Dhoby Ghaut MRT Interchange (CC1/NE6/NS24) - @smrt_singapore in Singapore https://www. swarmapp.com/c/0BcwMjSQYmj,,@smrt_singapore,,683928538177757188,https://twitter.com/jxfflxw/status/683928538177757188,dhoby ghaut mrt station,dhoby ghaut
wm_azri,2016-01-04 16:30:00,0,0,@vamos32 @HermyRahim kakakaka geram juga aku dengar simpang bedok ni kakakaka,,@vamos32 @HermyRahim,,683928470850650112,https://twitter.com/wm_azri/status/683928470850650112,bedok mrt station,bedok
benzmer_c,2016-01-04 16:30:00,0,0,I'm at Marina South Pier in Singapore https://www. swarmapp.com/c/2OdbxVMsquH,,,,683928512827408384,https://twitter.com/benzmer_c/status/683928512827408384,marina south pier mrt station,marina south pier
BlueMatrixxfrm,2016-01-04 16:31:00,0,0,@Changi Airport,,@Changi,,683928769451565057,https://twitter.com/BlueMatrixxfrm/status/683928769451565057,changi airport mrt station,changi airport
Jackson_love_97,2016-01-04 16:32:00,0,0,Car crashes near Roti Prata House along Upper Thomson Road; 4 injured http:// fb.me/7Istmg3VY,,,,683929086469746688,https://twitter.com/Jackson_love_97/status/683929086469746688,upper thomson mrt station,upper thomson
samleong86,2016-01-04 16:33:00,0,0,Just posted a photo @Gardens by the Bay https://www. instagram.com/p/BAHE0O5TKtj/,,@Gardens,,683929115615858688,https://twitter.com/samleong86/status/683929115615858688,gardens by the bay mrt station,gardens by the bay
Smollaichee,2016-01-04 16:35:00,0,0,"I'm at Bus Stop 84221 (Blk 109) in Bedok , SG https://www. swarmapp.com/c/ch1btDTcWr0",,,,683929786499072000,https://twitter.com/Smollaichee/status/683929786499072000,bedok mrt station,bedok
PropertyHomeSG,2016-01-04 16:35:00,0,0,Yio Chu Kang exec condo site up for tender pic.twitter.com/QkIcMEEKqp,,,,683929746372202496,https://twitter.com/PropertyHomeSG/status/683929746372202496,yio chu kang mrt station,yio chu kang
HermyRahim,2016-01-04 16:37:00,0,0,@vamos32 aku risau lagi dia bedok aku,,@vamos32,,683930297214189568,https://twitter.com/HermyRahim/status/683930297214189568,bedok mrt station,bedok
vanxxsa,2016-01-04 16:38:00,0,0,I'm at Kallang MRT Station (EW10) - @smrt_singapore in Singapore https://www. swarmapp.com/c/lMDNXHTjNLS,,@smrt_singapore,,683930484892643328,https://twitter.com/vanxxsa/status/683930484892643328,kallang mrt station,kallang
selinalxr,2016-01-04 16:38:00,0,0,I'm at Sengkang MRT /LRT Interchange (NE16/STC) in Singapore https://www. swarmapp.com/c/k0G8nvgg3s1,,,,683930582049488896,https://twitter.com/selinalxr/status/683930582049488896,sengkang mrt station,sengkang mrt
meta_guide_sg,2016-01-04 16:40:00,0,0,cactusgarden changiairport terminal1 singapore travel southeastasia airasia @Changi Airport http:// dlvr.it/D9s4XF,,@Changi,,683931007196606464,https://twitter.com/meta_guide_sg/status/683931007196606464,changi airport mrt station,changi airport
101DEGREE,2016-01-04 16:41:00,0,1,I'm at Punggol Plaza - @punggollatest in Singapore w/ @jasmicorn https://www. swarmapp.com/c/fi3n6DjQw33,,@punggollatest @jasmicorn,,683931178299211776,https://twitter.com/101DEGREE/status/683931178299211776,punggol mrt station,punggol
_JEONGCOOKIE,2016-01-04 16:41:00,0,0,"@baekbeans I'll be there around 6 plus going 7 tho , i'm travelling back from boonlay",,@baekbeans,,683931222842605568,https://twitter.com/_JEONGCOOKIE/status/683931222842605568,boon lay mrt station,boon lay
AniseCurtiss,2016-01-04 16:42:00,0,0,"Day 6 of holiday: Gardens By The Bay , Dragonfly Bridge~Entrance pic.twitter.com/bUfqAj9NDy",,,,683931613814636544,https://twitter.com/AniseCurtiss/status/683931613814636544,gardens by the bay mrt station,gardens by the bay
amitielgs,2016-01-04 16:42:00,0,0,"1Cr 8.21: Adaías, Beraías e Sinrate, filhos de Simei . http:// ler.la/lvmx",,,,683931478544281600,https://twitter.com/amitielgs/status/683931478544281600,simei mrt station,simei
Stevenstevanus2,2016-01-04 16:42:00,0,0,"""Mengapa kau mencariku""? Hitam. Kering. Pinang. Tanah . Merah . Rumah. Belanga. Kayu. Pagar. Batu. Batu. Batu. Lurus. Sirih. Keriput. Bayi.",,,,683931610878623744,https://twitter.com/Stevenstevanus2/status/683931610878623744,tanah merah mrt station,tanah merah
dabidlim_,2016-01-04 16:43:00,0,0,I'm at Potong Pasir in Singapore https://www. swarmapp.com/c/ln9XNHBWUA1,,,,683931692264984576,https://twitter.com/dabidlim_/status/683931692264984576,potong pasir mrt station,potong pasir
sweetzzxx__,2016-01-04 16:43:00,0,0,Perks of working at gbtb @Gardens by the Bay https://www. instagram.com/p/BAHF9npzKed/,,@Gardens,,683931633645391873,https://twitter.com/sweetzzxx__/status/683931633645391873,gardens by the bay mrt station,gardens by the bay
hrnhkm_,2016-01-04 16:43:00,0,0,omw to paya lebar,,,,683931743947104256,https://twitter.com/hrnhkm_/status/683931743947104256,paya lebar mrt station,paya lebar
Zachery_TWZ,2016-01-04 16:44:00,0,0,I'm at Ang Mo Kio Bus Interchange in Singapore https://www. swarmapp.com/c/e7Y0VrHkD36,,,,683932027272429568,https://twitter.com/Zachery_TWZ/status/683932027272429568,ang mo kio mrt station,ang mo kio
Agustin_Galan,2016-01-04 16:44:00,1,1,El ex del Arsenal Pennant está a prueba en el Tampines Rovers de Singapur. Me pregunto si su Ferrari seguirá abandonado en Zaragoza.,,,,683931880069140480,https://twitter.com/Agustin_Galan/status/683931880069140480,tampines mrt station,tampines
talkSPORT,2016-01-04 16:44:00,11,16,"Former #AFC , #LFC and #SCFC winger Jermaine Pennant set for trial with Tampines Rovers http:// tlks.pt/jHORyX pic.twitter.com/YMNVknf6fy",,,#AFC #LFC #SCFC,683932012516884481,https://twitter.com/talkSPORT/status/683932012516884481,tampines mrt station,tampines
LiFEs_EASY,2016-01-04 16:45:00,0,0,"Rachel's Nail Palace is a full service nail salon located at Ang Mo Kio Ave 4 specialising in manicures,... http:// fb.me/7E2YQdmWa",,,,683932131811172353,https://twitter.com/LiFEs_EASY/status/683932131811172353,ang mo kio mrt station,ang mo kio
AniseCurtiss,2016-01-04 16:46:00,0,1,"Day 6 of holiday: Gardens By The Bay , those tower tree thingies pic.twitter.com/HzU1IwNJsE",,,,683932518026842112,https://twitter.com/AniseCurtiss/status/683932518026842112,gardens by the bay mrt station,gardens by the bay
dyntsh,2016-01-04 16:46:00,0,0,"I'm at Chua Chu Kang Ave 2 in Chua Chu Kang , Singapore https://www. swarmapp.com/c/0qFbYLDW5Px",,,,683932588470341632,https://twitter.com/dyntsh/status/683932588470341632,choa chu kang mrt station,chua chu kang
atxzn,2016-01-04 16:47:00,1,3,Singapore. Changi airport adventures pic.twitter.com/5TCMuYZIyk,,,,683932852002533376,https://twitter.com/atxzn/status/683932852002533376,changi airport mrt station,changi airport
AniseCurtiss,2016-01-04 16:49:00,0,0,"Day 6 of holiday: Gardens By The Bay , Flora Clock, I think? pic.twitter.com/QIS7JpyqRG",,,,683933308548296704,https://twitter.com/AniseCurtiss/status/683933308548296704,gardens by the bay mrt station,gardens by the bay
ShaunShaunny,2016-01-04 16:50:00,0,0,I'm at Pasir Ris MRT Station (EW1) - @smrt_singapore in Singapore https://www. swarmapp.com/c/lCAF63OUKGy,,@smrt_singapore,,683933388152135680,https://twitter.com/ShaunShaunny/status/683933388152135680,pasir ris mrt station,pasir ris
Ketambaru,2016-01-04 16:50:00,1,0,"@WanZamora hais sume da berubah. Ingat, aku the first person yang kau bebual kt bedok camp tau. Tkde aku ku tkde kawan. HAHAHA",,@WanZamora,,683933518422904832,https://twitter.com/Ketambaru/status/683933518422904832,bedok mrt station,bedok
ezrizam,2016-01-04 16:51:00,0,0,"I'm at http:// indra.net Tm in Tanah Merah , Kelantan https://www. swarmapp.com/c/kCVzR8b0rgL",,,,683933742155624448,https://twitter.com/ezrizam/status/683933742155624448,tanah merah mrt station,tanah merah
ibelongtojongup,2016-01-04 16:51:00,0,0,@rchl_than I live in punggol >< greendale sec ^^ this year is n'levels...and I'm scared that B.A.P will hold LOE in SG ;A;,,@rchl_than,,683933825915686914,https://twitter.com/ibelongtojongup/status/683933825915686914,punggol mrt station,punggol
n_sengheng,2016-01-04 16:52:00,0,0,I'm at Food View (Blk 65 Telok Blangah Drive) in Singapore https://www. swarmapp.com/c/98QhKxFnEoN,,,,683933921189490688,https://twitter.com/n_sengheng/status/683933921189490688,telok blangah mrt station,telok blangah
