username,date,retweets,favorites,text,geo,mentions,hashtags,id,permalink,place,key
FootballSLEAGUE,2016-02-19 19:35:00,3,0,10 minutes away from kick-off here at Jalan Besar Stadium (NOT Bishan Stadium). Pennant will make his first start for The Stags. #WARTAM,,,#WARTAM,700644881589350400,https://twitter.com/FootballSLEAGUE/status/700644881589350400,bishan mrt station,bishan
WarriorsSAF,2016-02-19 19:36:00,0,3,TGIF...!!! Warriors FC vs Tampines Rovers FC Kicking off soon @Jalan Besar Stadium Come join us...!!!!,,@Jalan,,700645155888431104,https://twitter.com/WarriorsSAF/status/700645155888431104,jalan besar mrt station,jalan besar
yazbanz,2016-02-19 19:36:00,0,1,Steamed Sea Bass Teochew Style Reward myself for #2Kerja Oldest restaurant left in Siglap . pic.twitter.com/4cDCxg5z5s,,,#2Kerja,700645237937418240,https://twitter.com/yazbanz/status/700645237937418240,siglap mrt station,siglap
prancingthrough,2016-02-19 19:36:00,0,0,( Boon Lay ) Tains just resumed now but gantry opened at intervals as platform is too crowded @SMRT_Singapore,,@SMRT_Singapore,,700645134682095616,https://twitter.com/prancingthrough/status/700645134682095616,boon lay mrt station,boon lay
FIONAATAN,2016-02-19 19:36:00,0,0,white sands / pasir ris interchange can still do better on their sheltered drop off point,,,,700645058995826688,https://twitter.com/FIONAATAN/status/700645058995826688,pasir ris mrt station,pasir ris
weherlee,2016-02-19 19:36:00,0,0,"Helped nearby drivers by reporting a stand still traffic jam on Keppel Rd, Tanjong Pagar on @waze - Drive Social. https:// goo.gl/jKf8d2",,@waze,,700645166521004034,https://twitter.com/weherlee/status/700645166521004034,tanjong pagar mrt station,tanjong pagar
joshua57ng,2016-02-19 19:36:00,0,0,I'm at Paya Lebar MRT Interchange (EW8/CC9) - @smrt_singapore in Singapore https://www. swarmapp.com/c/5kdHAsghmSr,,@smrt_singapore,,700645118659809282,https://twitter.com/joshua57ng/status/700645118659809282,paya lebar mrt station,paya lebar
fionnlim,2016-02-19 19:37:00,0,2,@ElaineSmileMore i stay at pasir ris xiaohong...,,@ElaineSmileMore,,700645398197641216,https://twitter.com/fionnlim/status/700645398197641216,pasir ris mrt station,pasir ris
InstaSingapore,2016-02-19 19:37:00,0,0,New Instagram by @neleloorents Gardens By The Bay #Singapore pic.twitter.com/FGcd1stFH8,,@neleloorents,#Singapore,700645454065696768,https://twitter.com/InstaSingapore/status/700645454065696768,gardens by the bay mrt station,gardens by the bay
luluchins,2016-02-19 19:37:00,0,0,And i still have to walk from boon lay to pioneer,,,,700645325346721792,https://twitter.com/luluchins/status/700645325346721792,boon lay mrt station,boon lay
dragonztoh,2016-02-19 19:37:00,1,0,I'm at Bugis MRT Interchange (EW12/DT14) - @smrt_singapore in Singapore w/ @mauricelai https://www. swarmapp.com/c/4OsiEFEhtl5,,@smrt_singapore @mauricelai,,700645434600005634,https://twitter.com/dragonztoh/status/700645434600005634,bugis mrt station,bugis mrt
InstaSingapore,2016-02-19 19:37:00,0,0,New Instagram by @nickigrau Gardens By The Bay #Singapore pic.twitter.com/j2HcF184PE,,@nickigrau,#Singapore,700645438844641280,https://twitter.com/InstaSingapore/status/700645438844641280,gardens by the bay mrt station,gardens by the bay
InstaSingapore,2016-02-19 19:37:00,0,0,New Instagram by @theluxeaffair Gardens By The Bay #Singapore pic.twitter.com/fb3xUvRQGs,,@theluxeaffair,#Singapore,700645418573500417,https://twitter.com/InstaSingapore/status/700645418573500417,gardens by the bay mrt station,gardens by the bay
InstaSingapore,2016-02-19 19:37:00,0,0,New Instagram by @gyuuuuujeong Gardens By The Bay #Singapore pic.twitter.com/mL4GeYsdve,,@gyuuuuujeong,#Singapore,700645467063918592,https://twitter.com/InstaSingapore/status/700645467063918592,gardens by the bay mrt station,gardens by the bay
InstaSingapore,2016-02-19 19:37:00,0,0,New Instagram by @kittymint Gardens By The Bay #Singapore pic.twitter.com/oymOmEYobW,,@kittymint,#Singapore,700645483790794752,https://twitter.com/InstaSingapore/status/700645483790794752,gardens by the bay mrt station,gardens by the bay
_glennCT,2016-02-19 19:38:00,0,0,I'm at @ClarkeQuay in Singapore https://www. swarmapp.com/c/cN7lICCnIbY,,@ClarkeQuay,,700645544666877952,https://twitter.com/_glennCT/status/700645544666877952,clarke quay mrt station,clarke quay
KWRMcDermott,2016-02-19 19:39:00,0,0,Damp evening #clarkequay #singapore beer wet! pic.twitter.com/VAyclBk49j,,,#clarkequay #singapore,700645954165145600,https://twitter.com/KWRMcDermott/status/700645954165145600,clarke quay mrt station,clarke quay
Kuro_eeeeeK,2016-02-19 19:39:00,0,0,Its been 2hours and im still trying to get from JE to boonlay :( #lyfe,,,#lyfe,700645765320867840,https://twitter.com/Kuro_eeeeeK/status/700645765320867840,boon lay mrt station,boon lay
joshua57ng,2016-02-19 19:40:00,0,0,I'm at Paya Lebar Square in Singapore https://www. swarmapp.com/c/hunGGNSH6NW,,,,700646210898538496,https://twitter.com/joshua57ng/status/700646210898538496,paya lebar mrt station,paya lebar
SexyKiss3s_,2016-02-19 19:40:00,0,0,I'm at Changi Airport Terminal 1 - @fansofchangi in Singapore https://www. swarmapp.com/c/7UYlIV1HtNv,,@fansofchangi,,700646188630962178,https://twitter.com/SexyKiss3s_/status/700646188630962178,changi airport mrt station,changi airport
Kuro_eeeeeK,2016-02-19 19:41:00,0,0,@tingke Jurong East dear. Hahahahaha! Is this like fangirls 职业病?,,@tingke,,700646463710187520,https://twitter.com/Kuro_eeeeeK/status/700646463710187520,jurong east mrt station,jurong east
eliyah_yani,2016-02-19 19:42:00,0,0,off to bedok,,,,700646660859297793,https://twitter.com/eliyah_yani/status/700646660859297793,bedok mrt station,bedok
Fleebird33,2016-02-19 19:42:00,0,0,Helped nearby drivers by reporting a heavy traffic jam on Exit 15: Rochor Rd on @waze - Drive Social. https:// goo.gl/z3R9el,,@waze,,700646679108714498,https://twitter.com/Fleebird33/status/700646679108714498,rochor mrt station,rochor
JayfJeffJayf,2016-02-19 19:42:00,0,0,@SmokyFantasies I FINALLY FOUND TOA PAYOH MRT OMG MY CARD HAD NO MINE AND I ONLY HAVE NOTES FML,,@SmokyFantasies,,700646617695715328,https://twitter.com/JayfJeffJayf/status/700646617695715328,toa payoh mrt station,toa payoh
hellotaetae30,2016-02-19 19:43:00,0,1,@vweemin omg i live near there ! i might just bump into you at woodlands MRT haha :),,@vweemin,,700646814647648259,https://twitter.com/hellotaetae30/status/700646814647648259,woodlands mrt station,woodlands mrt
jeanxslx,2016-02-19 19:43:00,0,0,I'm at Toa Payoh Lorong 8 Market & Food Centre in Singapore https://www. swarmapp.com/c/2DeqOfTM6dl,,,,700646798042378242,https://twitter.com/jeanxslx/status/700646798042378242,toa payoh mrt station,toa payoh
Fleebird33,2016-02-19 19:43:00,0,0,"Helped nearby drivers by reporting a stand still traffic jam on Rochor Rd, Marina Bay on @waze - Drive Social. https:// goo.gl/rSqAvH",,@waze,,700646894481965057,https://twitter.com/Fleebird33/status/700646894481965057,rochor mrt station,rochor
FootballSLEAGUE,2016-02-19 19:44:00,0,0,KICK-OFF at Jalan Besar Stadium – Warriors FC v Tampines Rovers,,,,700647175940747264,https://twitter.com/FootballSLEAGUE/status/700647175940747264,jalan besar mrt station,jalan besar
_glennCT,2016-02-19 19:44:00,0,0,Rain! #SnapChat : Glnnt @Clarke Quay https://www. instagram.com/p/BB93Rywi4jH/,,@Clarke,#SnapChat,700647103425458176,https://twitter.com/_glennCT/status/700647103425458176,clarke quay mrt station,clarke quay
nigelchin,2016-02-19 19:45:00,0,0,"1' Straight from kick-off, Tampines gets a chance but Fazrul was unable to force the ball into goal before Fukuda clears! #SLeague",,,#SLeague,700647500974153730,https://twitter.com/nigelchin/status/700647500974153730,tampines mrt station,tampines
gabetan13,2016-02-19 19:45:00,0,0,Kickoff at the Jalan Besar Stadium - Warriors FC 0-0 Tampines Rovers! #SLeague #WARTAM,,,#SLeague #WARTAM,700647265094934529,https://twitter.com/gabetan13/status/700647265094934529,jalan besar mrt station,jalan besar
nigelchin,2016-02-19 19:45:00,0,0,Kick-off! Warriors FC vs Tampines Rovers! #Sleague,,,#Sleague,700647322917580804,https://twitter.com/nigelchin/status/700647322917580804,tampines mrt station,tampines
Soccermasterseu,2016-02-19 19:45:00,0,0,#Sleague : Singapore - Tampines Rovers has just been started! #SinTam http:// soccermasters.eu/f/635751,,,#Sleague #SinTam,700647440861409281,https://twitter.com/Soccermasterseu/status/700647440861409281,tampines mrt station,tampines
gilbertneo88,2016-02-19 19:45:00,0,0,Train breakdown between Jurong east and Joo Koon ? #smrt,,,#smrt,700647275328991232,https://twitter.com/gilbertneo88/status/700647275328991232,joo koon mrt station,joo koon
hASHbrownLEY,2016-02-19 19:45:00,0,0,Can one basker at MRT platforms? Cuz the lady i seen playing Gu zheng at Serangoon MRT is now playing at Bugis EW platform.,,,,700647497857806337,https://twitter.com/hASHbrownLEY/status/700647497857806337,bugis mrt station,bugis mrt
evelynlyx,2016-02-19 19:46:00,0,0,"@kiyuIking it was at west artrium, near Esplanade MRT there. You were like 10mins walk away",,@kiyuIking,,700647726430625793,https://twitter.com/evelynlyx/status/700647726430625793,esplanade mrt station,esplanade mrt
SingaporeReddit,2016-02-19 19:47:00,0,0,No train service between Jurong East and Joo Koon : submitted by /u/Whiskerfield [link] [comments] http:// bit.ly/1PKvcgh,,,,700647928755425280,https://twitter.com/SingaporeReddit/status/700647928755425280,joo koon mrt station,joo koon
sahadanskor,2016-02-19 19:47:00,0,0,Maç başladı! Armed Forces ile Tampines Rovers karşılaşıyor,,,,700647780889407489,https://twitter.com/sahadanskor/status/700647780889407489,tampines mrt station,tampines
SMRT_Singapore,2016-02-19 19:47:00,20,23,[EWL] Services between #JurongEast and #JooKoon have resumed. Free shuttle bus and bus services have ceased.,,,#JurongEast #JooKoon,700647972296495104,https://twitter.com/SMRT_Singapore/status/700647972296495104,joo koon mrt station,joo koon
MuhdIsmail10,2016-02-19 19:48:00,0,0,Warriors FC vs Tampines rovers pic.twitter.com/c6NYjBIBQb,,,,700648029498380288,https://twitter.com/MuhdIsmail10/status/700648029498380288,tampines mrt station,tampines
Aireys_TipzVIP,2016-02-19 19:48:00,0,3,#Inplay now Warriors FC vs tampines rovers Over 2.5 match goals £20 returns £32.30,,,#Inplay,700648049278742528,https://twitter.com/Aireys_TipzVIP/status/700648049278742528,tampines mrt station,tampines
SpadeZ_SVR,2016-02-19 19:49:00,0,0,whr do u live — bukit batok https:// l.ask.fm/igoto/45DKECPW 7B667HQMHN2IG6NMZSMTZKI7XDA5FOX7D7SLNZN62UYY2Z2MFFG44QRTK26P6FIEJQUH4DB7YEV7M2VONS5LPBR5UUARBEY3C53DWGP5B6MTGOHPZS2PFWD7SCSMUBQC2TTHDFMILWLAES3NVXGHNYUKYTFGLYDTQOPPYP7SFZZWHX6M6NPKJ47XTQI72VY= …,,,,700648472727277570,https://twitter.com/SpadeZ_SVR/status/700648472727277570,bukit batok mrt station,bukit batok
janicekoh,2016-02-19 19:49:00,0,0,‘Less intimidating approach’ should have been taken in investigation of Yishun teen: Law Society... http:// fb.me/7U9A9ZFHf,,,,700648301025099777,https://twitter.com/janicekoh/status/700648301025099777,yishun mrt station,yishun
badoquecafe,2016-02-19 19:49:00,0,0,Working hands #upperthomson & #simpangbedok #halalsg #badoquecafe #badoquekakis #singapore #makanpuas ... http:// fb.me/4DqJ0k1Nk,,,#upperthomson #simpangbedok #halalsg #badoquecafe #badoquekakis #singapore #makanpuas,700648356058521600,https://twitter.com/badoquecafe/status/700648356058521600,upper thomson mrt station,upper thomson
HenryMLCowen,2016-02-19 19:49:00,1,2,RIGHT SAID TRED. JUDGE JOHN TRED. TREDITTERANEAN. BISHAN TREDI. THE HUNT FOR TRED OCTOBER. https:// twitter.com/AllOutCricket/ status/700647316621889538 …,,,,700648449885114369,https://twitter.com/HenryMLCowen/status/700648449885114369,bishan mrt station,bishan
Kirthanala,2016-02-19 19:49:00,0,2,Dhoby ghaut kinda day !!,,,,700648445116174337,https://twitter.com/Kirthanala/status/700648445116174337,dhoby ghaut mrt station,dhoby ghaut
AdvancedAcca,2016-02-19 19:50:00,1,3,Inplay Roller #1 Tampines Rovers To score 1st goal £10 > £15.71 100% Deposit Bonus > http:// bit.ly/FREE200BET365,,,#1,700648574149795840,https://twitter.com/AdvancedAcca/status/700648574149795840,tampines mrt station,tampines
Ivantan22,2016-02-19 19:50:00,0,0,I don't know if tampines goal first I unlucky,,,,700648554025463808,https://twitter.com/Ivantan22/status/700648554025463808,tampines mrt station,tampines
NasriSuhaimi,2016-02-19 19:50:00,0,1,@Khairulzaki Hahaha aku tadi dari chinese garden jln kaki sia. Naseb 1 station je,,@Khairulzaki,,700648661756215296,https://twitter.com/NasriSuhaimi/status/700648661756215296,chinese garden mrt station,chinese garden station
chillipadi84,2016-02-19 19:50:00,0,0,百力果的八宝盒！ #BerriesWorld #socreative #ilikethatredpacket (@Berries World Bukit Batok ) https://www. swarmapp.com/c/hBupMgzdEEG pic.twitter.com/MdKh05bJJM,,@Berries,#BerriesWorld #socreative #ilikethatredpacket,700648709705478145,https://twitter.com/chillipadi84/status/700648709705478145,bukit batok mrt station,bukit batok
refaaxox,2016-02-19 19:51:00,0,0,"I was right, if I had took the train from raffles place I won't get any seat. Thumbs up to my instinct",,,,700648785240653824,https://twitter.com/refaaxox/status/700648785240653824,raffles place mrt station,raffles place
daanielalfian,2016-02-19 19:51:00,0,0,Watching tampines vs warriors now,,,,700648846926282752,https://twitter.com/daanielalfian/status/700648846926282752,tampines mrt station,tampines
gabetan13,2016-02-19 19:51:00,0,0,@shamsulilham MY IDOL JUST ARRIVED AT JALAN BESAR,,@shamsulilham,,700648914823720960,https://twitter.com/gabetan13/status/700648914823720960,jalan besar mrt station,jalan besar
WayneMughni,2016-02-19 19:51:00,0,0,Watching tampines vs warriors now,,,,700648975724982276,https://twitter.com/WayneMughni/status/700648975724982276,tampines mrt station,tampines
tengkiat,2016-02-19 19:51:00,0,0,Tampines appearing to adjust to this bogged pitch better than Warriors. #SLeague,,,#SLeague,700648960516427777,https://twitter.com/tengkiat/status/700648960516427777,tampines mrt station,tampines
JogaSportivo,2016-02-19 19:51:00,0,2,Funbet Tampines R. 0-2 C. Score at HT Odds 12.75 #IHBinplay,,,#IHBinplay,700648978786877440,https://twitter.com/JogaSportivo/status/700648978786877440,tampines mrt station,tampines
xashlleeyyx,2016-02-19 19:51:00,0,0,I'm at Ang Mo Kio Avenue 6 in Singapore https://www. swarmapp.com/c/2GzJD3vZSV0,,,,700648874407387139,https://twitter.com/xashlleeyyx/status/700648874407387139,ang mo kio mrt station,ang mo kio
_sil3ntr3b3l_,2016-02-19 19:51:00,0,0,I fucking condemn Jurong east mrt now. Sure got some shit happens. Fuck SMRT,,,,700648886340157441,https://twitter.com/_sil3ntr3b3l_/status/700648886340157441,jurong east mrt station,jurong east
BennoftheTrippi,2016-02-19 19:51:00,0,0,Tanjong Pagar buay pai leh~,,,,700648931009523712,https://twitter.com/BennoftheTrippi/status/700648931009523712,tanjong pagar mrt station,tanjong pagar
Iqramgallagher,2016-02-19 19:51:00,0,0,#Sleague #TRFCvWFC @Jalan Besar Stadium https://www. instagram.com/p/BB94G_-hEbf/,,@Jalan,#Sleague #TRFCvWFC,700648949091213313,https://twitter.com/Iqramgallagher/status/700648949091213313,jalan besar mrt station,jalan besar
jihrishsardido,2016-02-19 19:51:00,0,0,And she's here. #SGtravels #jubjubganggoestoSG @bajihjih @Changi Airport https://www. instagram.com/p/BB94FImueP3/,,@bajihjih @Changi,#SGtravels #jubjubganggoestoSG,700648870582181889,https://twitter.com/jihrishsardido/status/700648870582181889,changi airport mrt station,changi airport
daanielalfian,2016-02-19 19:52:00,0,0,Go tampines !,,,,700649047414079488,https://twitter.com/daanielalfian/status/700649047414079488,tampines mrt station,tampines
rasoolrashford,2016-02-19 19:52:00,0,0,pity the warriors & tampines rovers players... playing in such a wet field where the ball cant even bounce,,,,700649205845487616,https://twitter.com/rasoolrashford/status/700649205845487616,tampines mrt station,tampines
ermakovep,2016-02-19 19:52:00,0,0,Singapore Changi Airport . Singapore. @Singapore Changi International Airport Terminal 2 https://www. instagram.com/p/BB94N5sxJNB/,,@Singapore,,700649169241804800,https://twitter.com/ermakovep/status/700649169241804800,changi airport mrt station,changi airport
SilverRhythmz,2016-02-19 19:52:00,0,0,im going to scream it took me so long just to get to paya lebar,,,,700649135192444932,https://twitter.com/SilverRhythmz/status/700649135192444932,paya lebar mrt station,paya lebar
ronncjj,2016-02-19 19:52:00,0,0,Weather sucks when I'm going out ); (@Bus Stop 65199 (Aft Punggol Rd) - @ltasg in Singapore) https://www. swarmapp.com/c/4JwQIS8RFQX,,@Bus @ltasg,,700649033187000323,https://twitter.com/ronncjj/status/700649033187000323,punggol mrt station,punggol
ShotsMadness,2016-02-19 19:53:00,0,0,The Indian train service crew at bugis station is damn cheerful!!,,,,700649485169348608,https://twitter.com/ShotsMadness/status/700649485169348608,bugis mrt station,bugis station
evo_joe,2016-02-19 19:54:00,0,1,"Long week, home home, back home! #singaporeairlines #singapore #changiairport #starwars http:// ift.tt/1Q56use pic.twitter.com/Dnpnk892Ab",,,#singaporeairlines #singapore #changiairport #starwars,700649662923935744,https://twitter.com/evo_joe/status/700649662923935744,changi airport mrt station,changi airport
candytango,2016-02-19 19:54:00,0,0,I'm at Tampines Regional Library - @publiclibrarysg in Singapore https://www. swarmapp.com/c/9HuMuhihuH7,,@publiclibrarysg,,700649734373974016,https://twitter.com/candytango/status/700649734373974016,tampines mrt station,tampines
nigelchin,2016-02-19 19:54:00,0,1,10'All Tampines so far in the opening ten minutes. Warriors hardly getting a sniff of the ball. #SLeague,,,#SLeague,700649769568350208,https://twitter.com/nigelchin/status/700649769568350208,tampines mrt station,tampines
nueljoelmom,2016-02-19 19:54:00,0,0,Hujan....nggak bawa payung — feeling blah at Kallang MRT Station http:// fb.me/7d6CSkkFK,,,,700649641050681344,https://twitter.com/nueljoelmom/status/700649641050681344,kallang mrt station,kallang
SuprBettingBros,2016-02-19 19:55:00,0,2,#SuperInPlay Warriors FC v Tampines Rovers Tampines Rovers Over 1.5 Goals Odds - 4/5,,,#SuperInPlay,700649894243995650,https://twitter.com/SuprBettingBros/status/700649894243995650,tampines mrt station,tampines
idgafif_,2016-02-19 19:55:00,0,0,I'm at Tuas Checkpoint (Second Link ) in Singapore https://www. swarmapp.com/c/2lmPtn1qBtT,,,,700649998032064513,https://twitter.com/idgafif_/status/700649998032064513,tuas link mrt station,tuas link
RaphaelxLiu,2016-02-19 19:55:00,0,0,I'm at HomeTeamNS @Bukit Batok in Singapore https://www. swarmapp.com/c/ba8dJR555lx,,@Bukit,,700650006848516097,https://twitter.com/RaphaelxLiu/status/700650006848516097,bukit batok mrt station,bukit batok
refaaxox,2016-02-19 19:55:00,0,0,Won't mind traveling all they way to marina bay station just to get a seat,,,,700649931221049344,https://twitter.com/refaaxox/status/700649931221049344,marina bay mrt station,marina bay station
stompsingapore,2016-02-19 19:56:00,1,0,Dead rat at Bedok North void deck was due to routine rodent treatment: Town Council http:// bit.ly/1RTipdY pic.twitter.com/Q9gXbwcYnN,,,,700650178634604544,https://twitter.com/stompsingapore/status/700650178634604544,bedok mrt station,bedok
DahliaSapari,2016-02-19 19:56:00,1,2,lowkey wanna stay in tampines,,,,700650157323345920,https://twitter.com/DahliaSapari/status/700650157323345920,tampines mrt station,tampines
STsportsdesk,2016-02-19 19:56:00,9,10,And we're underway at Jalan Besar Stadium. Big crowd and a heavy rain the scene of @WarriorsSAF v @MightyStags . pic.twitter.com/Pt6xOkWovw,,@WarriorsSAF @MightyStags,,700650211547348993,https://twitter.com/STsportsdesk/status/700650211547348993,jalan besar mrt station,jalan besar
kkkash_,2016-02-19 19:56:00,0,0,Siapa kat yishun,,,,700650242262183937,https://twitter.com/kkkash_/status/700650242262183937,yishun mrt station,yishun
richardricardo_,2016-02-19 19:56:00,0,0,At @changiairport — https:// path.com/p/2k1gnz,,@changiairport,,700650049231949825,https://twitter.com/richardricardo_/status/700650049231949825,changi airport mrt station,changi airport
tengkiat,2016-02-19 19:57:00,0,0,Warriors vs Tampines match has been halted temporarily after 12 minutes due to the heavy rain. #SLeague,,,#SLeague,700650333916147712,https://twitter.com/tengkiat/status/700650333916147712,tampines mrt station,tampines
Simrettt,2016-02-19 19:57:00,0,0,@raveenjedan_ i reaching toa payoh ald,,@raveenjedan_,,700650512304074752,https://twitter.com/Simrettt/status/700650512304074752,toa payoh mrt station,toa payoh
sgbroadcast,2016-02-19 19:58:00,0,0,[TODAY] Train service temporarily suspended between Jurong East and Joo Koon due to train fault: SI... http:// bit.ly/24e3lfV #singapore,,,#singapore,700650712997363712,https://twitter.com/sgbroadcast/status/700650712997363712,joo koon mrt station,joo koon
nicolechan90,2016-02-19 19:58:00,0,0,Train service temporarily suspended between Jurong East and Joo Koon due to train fault: SINGAPORE ... http:// bit.ly/24e3lg7 #singapore,,,#singapore,700650716835123200,https://twitter.com/nicolechan90/status/700650716835123200,joo koon mrt station,joo koon
shutterday,2016-02-19 19:58:00,0,0,I'm at Singapore @ChangiAirport (SIN) in Singapore https://www. swarmapp.com/c/6J9dkByub3r,,@ChangiAirport,,700650747906527235,https://twitter.com/shutterday/status/700650747906527235,changi airport mrt station,changi airport
szeshyann,2016-02-19 19:59:00,0,0,primary school?? — yew tee pri & SSIS https:// l.ask.fm/igoto/45DKECPW 7B667HQMHN2IG6NM5SJTRPQSTPZ6VR5RCD43F55J2RWZGZKJFBH46RJUKSYPYFIOAYUWOPQT3UY7C65IGTZ3JGBAUUIAPR2ICZXQSK7VB2KC6IF7QKUP5UTXTXXJSBY343NHHGMVJSPAYQR66HBWXZUY2PTVL6DKWHX6AUXIDJXGDZXP5VB2JYXAWJQOC=== …,,,,700650924818083840,https://twitter.com/szeshyann/status/700650924818083840,yew tee mrt station,yew tee
elbuenob,2016-02-19 19:59:00,0,0,Taking a weather day. So sad #Chingay Parade is such a rainy mess. Maybe tomorrow... (@Tiong Bahru in Singapore) https://www. swarmapp.com/c/9dvzRjeawms,,@Tiong,#Chingay,700650825798934528,https://twitter.com/elbuenob/status/700650825798934528,tiong bahru mrt station,tiong bahru
ermakovep,2016-02-19 19:59:00,0,0,Singapore Changi Airport . Singapore. @Singapore Changi International Airport Terminal 2 https://www. instagram.com/p/BB95CSLRJOa/,,@Singapore,,700650968715649024,https://twitter.com/ermakovep/status/700650968715649024,changi airport mrt station,changi airport
ahhlongzxc,2016-02-19 19:59:00,0,0,no wonder you came all the way down to yewtee,,,,700650987845910528,https://twitter.com/ahhlongzxc/status/700650987845910528,yew tee mrt station,yew tee
eisen,2016-02-19 20:01:00,1,0,"Here with @kuekj @psy_lsh @singnoname @CSExodus . If you're in Dhoby Ghaut and not swimming outside in the ponds, drop by! @hellofrmSG",,@kuekj @psy_lsh @singnoname @CSExodus @hellofrmSG,,700651529875779584,https://twitter.com/eisen/status/700651529875779584,dhoby ghaut mrt station,dhoby ghaut
xfadhilahx,2016-02-19 20:01:00,0,0,@aaangelicax no la HAHHAHA not the one u saw at yew tee,,@aaangelicax,,700651331036418048,https://twitter.com/xfadhilahx/status/700651331036418048,yew tee mrt station,yew tee
ynaoblivious,2016-02-19 20:01:00,0,0,It's been a while... I kinda miss Bon Chon too! @4 Fingers at Changi Airport https://www. instagram.com/p/BB95Ro0JEW6/,,@4,,700651496006750208,https://twitter.com/ynaoblivious/status/700651496006750208,changi airport mrt station,changi airport
FootballSLEAGUE,2016-02-19 20:02:00,7,4,Rain is still coming down hard here at Jalan Besar Stadium so this could be a long night for everyone here!! #WARTAM,,,#WARTAM,700651605314531328,https://twitter.com/FootballSLEAGUE/status/700651605314531328,jalan besar mrt station,jalan besar
cccarleen,2016-02-19 20:02:00,0,0,I'm at Changi Airport Terminal 2 in Singapore https://www. swarmapp.com/c/dILvOkd5ZzI,,,,700651719827456002,https://twitter.com/cccarleen/status/700651719827456002,changi airport mrt station,changi airport
SGCrawlers,2016-02-19 20:02:00,0,0,Check out the RC Offroad fun at Tampines Quarry! http:// youtu.be/xinKxTwAIlE?a,,,,700651589015441408,https://twitter.com/SGCrawlers/status/700651589015441408,tampines mrt station,tampines
coolbeanskenya,2016-02-19 20:02:00,0,0,"Full sweats ~ kes. 4000. Hoodies ~ kes. 2500 & sweatpants ~ kes. 1500. Find us at Bishan plaza, westlands. Mpaka... http:// fb.me/2wZh6BRFR",,,,700651662487064576,https://twitter.com/coolbeanskenya/status/700651662487064576,bishan mrt station,bishan
Mooccho,2016-02-19 20:02:00,0,0,First time being such a long line to taxi at Changi Airport .,,,,700651702169374721,https://twitter.com/Mooccho/status/700651702169374721,changi airport mrt station,changi airport
elisa_tjt_,2016-02-19 20:03:00,0,1,Omg stuck at Yew Tee Point without an umbrella well done me,,,,700651914241798144,https://twitter.com/elisa_tjt_/status/700651914241798144,yew tee mrt station,yew tee
thatlass_rhizza,2016-02-19 20:03:00,0,0,My date @Mof @Tampines 1 https://www. instagram.com/p/BB95an-pYZk/,,@Mof @Tampines,,700651814727737345,https://twitter.com/thatlass_rhizza/status/700651814727737345,tampines mrt station,tampines
badoquecafe,2016-02-19 20:04:00,0,0,Dinner shot from #upperthomson #halalsg #badoquecafe #badoquekakis #singapore #makanpuas #makanbesar ... http:// fb.me/4qSl7ce1T,,,#upperthomson #halalsg #badoquecafe #badoquekakis #singapore #makanpuas #makanbesar,700652297915793408,https://twitter.com/badoquecafe/status/700652297915793408,upper thomson mrt station,upper thomson
LilithErebus,2016-02-19 20:04:00,0,0,Feel like heading out. Like spend the night at pasir ris park...or changi...hmmm,,,,700652093921583105,https://twitter.com/LilithErebus/status/700652093921583105,pasir ris mrt station,pasir ris
