username,date,retweets,favorites,text,geo,mentions,hashtags,id,permalink,place,key
InstaSingapore,2016-01-04 09:58:00,0,0,New Instagram by @ketto_and_guppies Gardens By The Bay #Singapore pic.twitter.com/2z3LGevhtB,,@ketto_and_guppies,#Singapore,683829942174486532,https://twitter.com/InstaSingapore/status/683829942174486532,gardens by the bay mrt station,gardens by the bay
InstaSingapore,2016-01-04 09:58:00,0,0,New Instagram by @kechingaling Gardens By The Bay #Singapore pic.twitter.com/Bvfj0Ke5JZ,,@kechingaling,#Singapore,683829905549836288,https://twitter.com/InstaSingapore/status/683829905549836288,gardens by the bay mrt station,gardens by the bay
InstaSingapore,2016-01-04 09:58:00,0,0,New Instagram by @ketto_and_guppies Gardens By The Bay #Singapore pic.twitter.com/57JvFhnb00,,@ketto_and_guppies,#Singapore,683829925636386817,https://twitter.com/InstaSingapore/status/683829925636386817,gardens by the bay mrt station,gardens by the bay
InstaSingapore,2016-01-04 09:58:00,0,0,New Instagram by @denniceaulia Gardens By The Bay #Singapore pic.twitter.com/9bJpV3TThf,,@denniceaulia,#Singapore,683829912122322944,https://twitter.com/InstaSingapore/status/683829912122322944,gardens by the bay mrt station,gardens by the bay
InstaSingapore,2016-01-04 09:59:00,0,0,New Instagram by @jjingo_gaijin Gardens By The Bay #Singapore pic.twitter.com/DgyCLQrZj6,,@jjingo_gaijin,#Singapore,683829953268428802,https://twitter.com/InstaSingapore/status/683829953268428802,gardens by the bay mrt station,gardens by the bay
InstaSingapore,2016-01-04 09:59:00,0,0,New Instagram by @annekatrinebank Gardens By The Bay #Singapore pic.twitter.com/9Bbn8xdfDw,,@annekatrinebank,#Singapore,683829961854173185,https://twitter.com/InstaSingapore/status/683829961854173185,gardens by the bay mrt station,gardens by the bay
IsaacLim_,2016-01-04 09:59:00,0,0,Took cab from simei to cgh cuz the shutter bus wasn't coming. Turns out it was 300m away?? Crey,,,,683830046184718336,https://twitter.com/IsaacLim_/status/683830046184718336,simei mrt station,simei
InstaSingapore,2016-01-04 09:59:00,0,0,New Instagram by @jjingo_gaijin Gardens By The Bay #Singapore pic.twitter.com/NOqfrDPmAy,,@jjingo_gaijin,#Singapore,683829967503896576,https://twitter.com/InstaSingapore/status/683829967503896576,gardens by the bay mrt station,gardens by the bay
PropertyBang,2016-01-04 10:00:00,0,0,"JTC launches sale of 2 confirmed list industrial sites at Tampines , Tuas",,,,683830218612604929,https://twitter.com/PropertyBang/status/683830218612604929,tampines mrt station,tampines
mylastg_oodbye,2016-01-04 10:04:00,0,0,@rachaelyong @Linography rochor,,@rachaelyong @Linography,,683831346976833537,https://twitter.com/mylastg_oodbye/status/683831346976833537,rochor mrt station,rochor
addyrdh,2016-01-04 10:05:00,0,0,Goooodbyeeee @Terminal 1 - Changi Airport https://www. instagram.com/p/BAGYevaOGh3p JkuoFsG-nB_lTNxx65-H7DEp4U0/ …,,@Terminal,,683831616393875456,https://twitter.com/addyrdh/status/683831616393875456,changi airport mrt station,changi airport
newsSG,2016-01-04 10:09:00,0,0,ST | Car crashes near Roti Prata House along Upper Thomson Road; 4 injured http:// scoo.ps/1ODVpJA pic.twitter.com/R1CzPEdbHF,,,,683832487194144768,https://twitter.com/newsSG/status/683832487194144768,upper thomson mrt station,upper thomson
scoopsg,2016-01-04 10:09:00,0,0,ST | Car crashes near Roti Prata House along Upper Thomson Road; 4 injured http:// scoo.ps/1ODVpJA pic.twitter.com/2dEkKw6g0f,,,,683832492789350400,https://twitter.com/scoopsg/status/683832492789350400,upper thomson mrt station,upper thomson
scoo_ps,2016-01-04 10:09:00,0,0,ST | Car crashes near Roti Prata House along Upper Thomson Road; 4 injured http:// scoo.ps/1ODVpJA #sgnews pic.twitter.com/V2ETQsLKzm,,,#sgnews,683832492516741120,https://twitter.com/scoo_ps/status/683832492516741120,upper thomson mrt station,upper thomson
ChannelNewsAsia,2016-01-04 10:10:00,7,4,"First BTO exercise will be in February; will offer 4,150 units in Bidadari, Bukit Batok , Sengkang http:// bit.ly/1NZq3zY",,,,683832745273905152,https://twitter.com/ChannelNewsAsia/status/683832745273905152,bukit batok mrt station,bukit batok
iyliaaa,2016-01-04 10:11:00,0,0,I'm at Kranji MRT Station (NS7) - @smrt_singapore in Singapore https://www. swarmapp.com/c/2mwtodJlNnF,,@smrt_singapore,,683833106869137408,https://twitter.com/iyliaaa/status/683833106869137408,kranji mrt station,kranji mrt
JM_RubiCruz,2016-01-04 10:13:00,0,0,Bras Basah graffiti https://www. instagram.com/p/BAGZYhMRssKQ yYdcBiopN1eBW1LUZtHl5Y4_z80/ …,,,,683833610240012293,https://twitter.com/JM_RubiCruz/status/683833610240012293,bras basah mrt station,bras basah
mdzulfadhli,2016-01-04 10:15:00,0,0,Ade straight bus from bukitpanjang to yewtee WOW,,,,683834227628965889,https://twitter.com/mdzulfadhli/status/683834227628965889,bukit panjang mrt station,bukit panjang
dariusfankeijoe,2016-01-04 10:15:00,0,0,I'm at Changi Airport Terminal 3 - @fansofchangi in Singapore https://www. swarmapp.com/c/bAiy1MwJjzu,,@fansofchangi,,683834212772900864,https://twitter.com/dariusfankeijoe/status/683834212772900864,changi airport mrt station,changi airport
AirAsiaSupport,2016-01-04 10:16:00,0,0,"@sbaranwal9 Hi,sorry for the inconvenience. Please go to the Lost and Found counter in Changi Airport and file a report for updates and help",,@sbaranwal9,,683834391131500544,https://twitter.com/AirAsiaSupport/status/683834391131500544,changi airport mrt station,changi airport
iyliaaa,2016-01-04 10:16:00,0,0,that long queue..... (@Bus Stop 45139 ( Kranji Station ) in Singapore) https://www. swarmapp.com/c/7gUoUm1Pa1W,,@Bus,,683834381140623360,https://twitter.com/iyliaaa/status/683834381140623360,kranji mrt station,kranji station
MasudRanafx2,2016-01-04 10:18:00,0,0,"ChannelNewsAsia: First BTO exercise will be in February; will offer 4,150 units in Bidadari, Bukit Batok , Sengkang http:// bit.ly/1NZq3zY",,,,683834974810836992,https://twitter.com/MasudRanafx2/status/683834974810836992,bukit batok mrt station,bukit batok
Bam_Rafael,2016-01-04 10:19:00,0,0,"Rezki pada hari pertama. Plus, lunch out ngan boss besar nanti kat simpang bedok . pic.twitter.com/znHz1GXGaZ",,,,683835091139694592,https://twitter.com/Bam_Rafael/status/683835091139694592,bedok mrt station,bedok
arifyoes,2016-01-04 10:20:00,0,0,goodbye pasir ris @Pasir Ris St 21 Blk 252 https://www. instagram.com/p/BAGaMLTGk7O/,,@Pasir,,683835377002659841,https://twitter.com/arifyoes/status/683835377002659841,pasir ris mrt station,pasir ris
LeadsGenSupport,2016-01-04 10:22:00,0,0,Five Laundry & Dryclean Services: 682 Hougang Ave 4 #01-348 Singapore 530682 Average rating of 1 of 5 http:// bit.ly/1Z0FakX,,,#01,683835742347378689,https://twitter.com/LeadsGenSupport/status/683835742347378689,hougang mrt station,hougang
itsmicolymz,2016-01-04 10:23:00,1,1,I'm at Punggol Secondary School in Singapore w/ @christineeyeo_ @celestetkl https://www. swarmapp.com/c/8gp1QhNqzgh,,@christineeyeo_ @celestetkl,,683836005477158913,https://twitter.com/itsmicolymz/status/683836005477158913,punggol mrt station,punggol
ChampionTutor5,2016-01-04 10:23:00,0,0,PreSch English tuition @36 Bedok South Ave 2. 4 x 1.5hrs/month http:// bit.ly/1RYyFLc,,@36,,683836159386976256,https://twitter.com/ChampionTutor5/status/683836159386976256,bedok mrt station,bedok
BrianEmma2,2016-01-04 10:24:00,0,0,Outdoor turf since kids by preschool punggol : ZunUSWEpC,,,,683836376131829760,https://twitter.com/BrianEmma2/status/683836376131829760,punggol mrt station,punggol
STcom,2016-01-04 10:27:00,62,9,Car crashes near Roti Prata House along Upper Thomson Road on Sunday; 4 injured http:// str.sg/ZrED pic.twitter.com/AgtjmnjnN9,,,,683837091596251136,https://twitter.com/STcom/status/683837091596251136,upper thomson mrt station,upper thomson
HougangUnited,2016-01-04 10:30:00,1,0,HUZAIFA AZIZ PENS AGREEMENT WITH CHEETAHS Hougang United are pleased to have acquired young blooded & former... http:// fb.me/7QFpPVfZc,,,,683837982038716416,https://twitter.com/HougangUnited/status/683837982038716416,hougang mrt station,hougang
DuncanCZC_,2016-01-04 10:31:00,0,0,I'm at Tai Seng MRT Station (CC11) - @smrt_singapore in Singapore https://www. swarmapp.com/c/gnMGOHHeunL,,@smrt_singapore,,683838215485296641,https://twitter.com/DuncanCZC_/status/683838215485296641,tai seng mrt station,tai seng mrt
zufie,2016-01-04 10:31:00,2,13,I want to get lost in Tiong Bahru and Tanjong Pagar . All them good bookstores are there.,,,,683838203309080576,https://twitter.com/zufie/status/683838203309080576,tanjong pagar mrt station,tanjong pagar
PermataTM,2016-01-04 10:34:00,16,4,Majlis Sumbangan Awal Semester PERMATA 2016 DUN: Bukit Panau Tarikh: 7/2/15 Masa: 9 pagi Tempat: SMK Tanah Merah 1 pic.twitter.com/GyDfPGphaZ,,,,683838914730135552,https://twitter.com/PermataTM/status/683838914730135552,tanah merah mrt station,tanah merah
MarcSylvain1,2016-01-04 10:34:00,0,0,"Last day in Singapore @Flower Dome, Gardens by the Bay https://www. instagram.com/p/BAGbvl5Cakda MMoQVYagVn__KPcIOT9xlC8GfY0/ …",,@Flower,,683838794701889536,https://twitter.com/MarcSylvain1/status/683838794701889536,gardens by the bay mrt station,gardens by the bay
_stephanieJY,2016-01-04 10:35:00,0,0,Wow this year hougang .,,,,683839100802056192,https://twitter.com/_stephanieJY/status/683839100802056192,hougang mrt station,hougang
tiara__bh,2016-01-04 10:37:00,0,0,whAT am i gg to do at aljunied alone!!,,,,683839603145457664,https://twitter.com/tiara__bh/status/683839603145457664,aljunied mrt station,aljunied
MarcSylvain1,2016-01-04 10:37:00,0,0,"Just posted a photo @Flower Dome, Gardens by the Bay https://www. instagram.com/p/BAGcLOICalHG mkFVuJEqT6amjj0mKhB0kDVLEg0/ …",,@Flower,,683839742270685184,https://twitter.com/MarcSylvain1/status/683839742270685184,gardens by the bay mrt station,gardens by the bay
zuhailyyy,2016-01-04 10:37:00,0,0,@nyantasm @beekay_bx idk HAHA i think he went back to sleep but i'll probably go to bedok or tamp,,@nyantasm @beekay_bx,,683839696703627264,https://twitter.com/zuhailyyy/status/683839696703627264,bedok mrt station,bedok
cocoirodouce,2016-01-04 10:37:00,0,0,Just posted a photo @Rochor Centre https://www. instagram.com/p/BAGb-_KGLoC/,,@Rochor,,683839648477523969,https://twitter.com/cocoirodouce/status/683839648477523969,rochor mrt station,rochor
LeMiseraple,2016-01-04 10:38:00,0,0,@monmink ที่เพิ่งไปมาก็ดี ไม่ใหม่แต่กว้างและอยู่ตรงสถานีที่มันไปได้สามสาย ถูกด้วย fort canning lodge,,@monmink,,683839912685125632,https://twitter.com/LeMiseraple/status/683839912685125632,fort canning mrt station,fort canning
nyantasm,2016-01-04 10:38:00,0,1,@zuhailyyy @beekay_bx probably pasir ris ah,,@zuhailyyy @beekay_bx,,683839975075401728,https://twitter.com/nyantasm/status/683839975075401728,pasir ris mrt station,pasir ris
furryphotos,2016-01-04 10:39:00,0,0,@lynnylchan bras basah also got mah,,@lynnylchan,,683840095170908160,https://twitter.com/furryphotos/status/683840095170908160,bras basah mrt station,bras basah
LeBearPolarr,2016-01-04 10:39:00,0,2,With the new Downtown Line 2 to Rochor ... Sim Lim Square is even nearer... the temptation for salted egg chicken is stronger *0*,,,,683840142667202560,https://twitter.com/LeBearPolarr/status/683840142667202560,rochor mrt station,rochor
Suqilovesyou,2016-01-04 10:40:00,0,0,I'm at Outram Park MRT Interchange (EW16/NE3) - @smrt_singapore in Singapore https://www. swarmapp.com/c/6tvTwEx7Rnp,,@smrt_singapore,,683840401875316736,https://twitter.com/Suqilovesyou/status/683840401875316736,outram park mrt station,outram park
_firedup,2016-01-04 10:41:00,0,0,@RaisedbyChild but I at punggol HAHAH I SEE HOA,,@RaisedbyChild,,683840769543680000,https://twitter.com/_firedup/status/683840769543680000,punggol mrt station,punggol
gonzylla,2016-01-04 10:42:00,0,0,Changi Airport T1,,,,683840970442444800,https://twitter.com/gonzylla/status/683840970442444800,changi airport mrt station,changi airport
coco_kendall,2016-01-04 10:42:00,0,0,Gardens by the Bay . | #gardensbythebay #singapore #singapura #supertree #MBS #SG #jcwwt … https://www. instagram.com/p/BAGcvO9vuS7/,,,#gardensbythebay #singapore #singapura #supertree #MBS #SG #jcwwt,683840982178205696,https://twitter.com/coco_kendall/status/683840982178205696,gardens by the bay mrt station,gardens by the bay
estherjulee,2016-01-04 10:42:00,0,0,What are YOUR must see spots in Singapore? We heard the gardens by the bay were great for… https://www. instagram.com/p/BAGcsjHFSp1/,,,,683840891350564865,https://twitter.com/estherjulee/status/683840891350564865,gardens by the bay mrt station,gardens by the bay
carlosboii2000,2016-01-04 10:42:00,0,0,I have two dive meets then an all day dive meet in Kentridge which I'm hella nervous about,,,,683841014331641856,https://twitter.com/carlosboii2000/status/683841014331641856,kent ridge mrt station,kent ridge
Icemanzzzz,2016-01-04 10:44:00,0,0,@zufie You might want to double confirm the book store in Tiong Bahru . I think close or move to other location.,,@zufie,,683841319123337218,https://twitter.com/Icemanzzzz/status/683841319123337218,tiong bahru mrt station,tiong bahru
lynnylchan,2016-01-04 10:45:00,0,0,@furryphotos I got ride at Bras Basah before. And Promenade became the deepest MRT when DTL2 opened. Basement 7 leh.,,@furryphotos,,683841654483099649,https://twitter.com/lynnylchan/status/683841654483099649,bras basah mrt station,bras basah
erislimx,2016-01-04 10:48:00,0,0,I'm at Edgefield Secondary Canteen in 36 Punggol Field https://www. swarmapp.com/c/6H8rSL5GAzi,,,,683842322103177216,https://twitter.com/erislimx/status/683842322103177216,punggol mrt station,punggol
azurahan,2016-01-04 10:48:00,0,0,Yesterday night kakak got over excited. Welcome home Zakhran Khan @Changi Airport Terminal 3… https://www. instagram.com/p/BAGdX1Lugnx/,,@Changi,,683842374699749376,https://twitter.com/azurahan/status/683842374699749376,changi airport mrt station,changi airport
BreewSG,2016-01-04 10:48:00,1,0,breew SG news is out! http:// paper.li/BreewSG/135256 5942?edition_id=a5046650-b28d-11e5-b5fd-002590a5ba2d … Stories via @ChangiAirport @RichardRobinson @mtvasia,,@ChangiAirport @RichardRobinson @mtvasia,,683842429519265792,https://twitter.com/BreewSG/status/683842429519265792,changi airport mrt station,changi airport
jamesong1313,2016-01-04 10:48:00,0,0,WE HAVE MOVED to 2 Kallang Avenue #09-04 CT Hub Singapore 339407 with effect from 1st January 2015. All contact numbers remain the same.,,,#09,683842300443815936,https://twitter.com/jamesong1313/status/683842300443815936,kallang mrt station,kallang
Suqilovesyou,2016-01-04 10:48:00,0,1,I'm at Raffles Place MRT Interchange (EW14/NS26) - @smrt_singapore in Singapore https://www. swarmapp.com/c/jZ0locnKrxV,,@smrt_singapore,,683842505650089986,https://twitter.com/Suqilovesyou/status/683842505650089986,raffles place mrt station,raffles place
StarHubCares,2016-01-04 10:48:00,0,0,"@dinishak_ Hi there, do you experience this only at Tampines , please share your postal code with us to that we can monitor the location. -JL",,@dinishak_,,683842351328931840,https://twitter.com/StarHubCares/status/683842351328931840,tampines mrt station,tampines
sglatestnews,2016-01-04 10:50:00,0,0,"#latest #news Car crashes near Roti Prata House along Upper Thomson Road; 4 injured: January 04, 20... http:// bit.ly/1R9Q4ki #singapore",,,#latest #news #singapore,683842856612564992,https://twitter.com/sglatestnews/status/683842856612564992,upper thomson mrt station,upper thomson
dailysingapore,2016-01-04 10:50:00,1,1,[News] Car crashes near Roti Prata House along Upper Thomson Road; 4 injured http:// bit.ly/1R9Q4kd,,,,683842846927945728,https://twitter.com/dailysingapore/status/683842846927945728,upper thomson mrt station,upper thomson
Chee_Sheng,2016-01-04 10:50:00,0,0,"I'm at Bishan Neighbourhood Police Centre in Bishan , Singapore https://www. swarmapp.com/c/gLac5TUdiyC",,,,683842863885627395,https://twitter.com/Chee_Sheng/status/683842863885627395,bishan mrt station,bishan
SHANNN_SHINE,2016-01-04 10:50:00,0,0,I N S T A G R A M T R E E 、到此一遊 #instagramtree @Punggol Waterway Park https://www. instagram.com/p/BAGdpJigfEI/,,@Punggol,#instagramtree,683842982965972992,https://twitter.com/SHANNN_SHINE/status/683842982965972992,punggol mrt station,punggol
Nccz97,2016-01-04 10:50:00,0,0,I'm at Changi Airport Terminal 2 - @fansofchangi in Singapore https://www. swarmapp.com/c/kkWsQU3WT1Y,,@fansofchangi,,683842962988625921,https://twitter.com/Nccz97/status/683842962988625921,changi airport mrt station,changi airport
Nccz97,2016-01-04 10:50:00,0,0,I'm at Singapore Changi Airport (SIN) - @fansofchangi in Singapore w/ @iamncm https://www. swarmapp.com/c/0AQQZY1qw28,,@fansofchangi @iamncm,,683842918684213248,https://twitter.com/Nccz97/status/683842918684213248,changi airport mrt station,changi airport
Kifishiakellyz,2016-01-04 10:51:00,0,0,Need to reach expo in 5 min & I'm only at bedok . Wlaoo,,,,683843190319808512,https://twitter.com/Kifishiakellyz/status/683843190319808512,bedok mrt station,bedok
_jlyj,2016-01-04 10:52:00,0,0,I'm at Dhoby Ghaut MRT Interchange (CC1/NE6/NS24) - @smrt_singapore in Singapore https://www. swarmapp.com/c/eBWeH9fjkvL,,@smrt_singapore,,683843500723552256,https://twitter.com/_jlyj/status/683843500723552256,dhoby ghaut mrt station,dhoby ghaut
dawn787,2016-01-04 10:55:00,0,0,"Journey for 2016 begins 󾌸󾌧󾬐Pray for journey mercies 󾍛 󾍛 󾍛 — traveling to Taipei, Taiwan from Changi Airport http:// fb.me/7AuuvWd9F",,,,683844204326469632,https://twitter.com/dawn787/status/683844204326469632,changi airport mrt station,changi airport
cocoaevenings,2016-01-04 10:56:00,0,0,10.40am Boarded Bus 2. Still on the way to Bedok MRT.,,,,683844461562970112,https://twitter.com/cocoaevenings/status/683844461562970112,bedok mrt station,bedok
h_mampat,2016-01-04 10:57:00,0,0,Hospital Tanah Merah ..,,,,683844599404720128,https://twitter.com/h_mampat/status/683844599404720128,tanah merah mrt station,tanah merah
InstaSingapore,2016-01-04 10:58:00,0,0,New Instagram by @flynn_ys Gardens By The Bay #Singapore pic.twitter.com/6XJjahkItX,,@flynn_ys,#Singapore,683844992457158656,https://twitter.com/InstaSingapore/status/683844992457158656,gardens by the bay mrt station,gardens by the bay
InstaSingapore,2016-01-04 10:58:00,0,0,New Instagram by @flynn_ys Gardens By The Bay #Singapore pic.twitter.com/WQgc5kG7CW,,@flynn_ys,#Singapore,683844981359001601,https://twitter.com/InstaSingapore/status/683844981359001601,gardens by the bay mrt station,gardens by the bay
_jlyj,2016-01-04 10:58:00,0,0,I'm at City Hall MRT Interchange (EW13/NS25) - @smrt_singapore in Singapore w/ @itisshanhere_ https://www. swarmapp.com/c/0asoBuEOzeJ,,@smrt_singapore @itisshanhere_,,683844952464429056,https://twitter.com/_jlyj/status/683844952464429056,city hall mrt station,city hall mrt
InstaSingapore,2016-01-04 10:58:00,0,0,New Instagram by @tickboom113 Gardens By The Bay #Singapore pic.twitter.com/c08AxgXklT,,@tickboom113,#Singapore,683844963302506498,https://twitter.com/InstaSingapore/status/683844963302506498,gardens by the bay mrt station,gardens by the bay
InstaSingapore,2016-01-04 10:58:00,0,0,New Instagram by @warbyb Gardens By The Bay #Singapore pic.twitter.com/9mDXrHVZmS,,@warbyb,#Singapore,683845025843818497,https://twitter.com/InstaSingapore/status/683845025843818497,gardens by the bay mrt station,gardens by the bay
InstaSingapore,2016-01-04 10:58:00,0,0,New Instagram by @megchills Gardens By The Bay #Singapore pic.twitter.com/yQwatS6Ry5,,@megchills,#Singapore,683845032349167616,https://twitter.com/InstaSingapore/status/683845032349167616,gardens by the bay mrt station,gardens by the bay
InstaSingapore,2016-01-04 10:58:00,0,0,New Instagram by @kandi_zohn Gardens By The Bay #Singapore pic.twitter.com/IM6KGLOx7K,,@kandi_zohn,#Singapore,683845043036225536,https://twitter.com/InstaSingapore/status/683845043036225536,gardens by the bay mrt station,gardens by the bay
YoHobbySin,2016-01-04 11:00:00,0,0,Sports — Tuesday Touch@Kallang Track Field 2016-01-05 10:45:00 http:// yohobby.com/e/289739 pic.twitter.com/beRplKjgUD,,@Kallang,,683845398746804224,https://twitter.com/YoHobbySin/status/683845398746804224,kallang mrt station,kallang
compit_ruban,2016-01-04 11:00:00,0,0,"Software QA Engineer - Ang Mo Kio , Singapore http:// citcpl.catsone.com/careers/index. php?m=portal&a=details&jobOrderID=6764400 …",,,,683845373157314561,https://twitter.com/compit_ruban/status/683845373157314561,ang mo kio mrt station,ang mo kio
BooDieMe,2016-01-04 11:03:00,0,0,I'm at Punggol MRT/LRT Interchange (NE17/PTC) in Singapore https://www. swarmapp.com/c/eJyUg4FOpDQ,,,,683846263880716289,https://twitter.com/BooDieMe/status/683846263880716289,punggol mrt station,punggol
_arieyudhistira,2016-01-04 11:03:00,0,1,Soccer at Kallang cage later on,,,,683846275779829760,https://twitter.com/_arieyudhistira/status/683846275779829760,kallang mrt station,kallang
bensoncxhhhhh_,2016-01-04 11:04:00,0,0,I'm at Changi Airport Terminal 2 - @fansofchangi in Singapore https://www. swarmapp.com/c/bfFlIRO0lE5,,@fansofchangi,,683846322827427840,https://twitter.com/bensoncxhhhhh_/status/683846322827427840,changi airport mrt station,changi airport
Stanielhck_,2016-01-04 11:04:00,0,0,I'm at Changi Airport Terminal 2 - @fansofchangi in Singapore w/ @bensoncxhhhhh_ https://www. swarmapp.com/c/fnRbYvZyCCi,,@fansofchangi @bensoncxhhhhh_,,683846440519626752,https://twitter.com/Stanielhck_/status/683846440519626752,changi airport mrt station,changi airport
LeaderandReader,2016-01-04 11:05:00,0,0,"This is awesome! Mock Caldecott : I thought it would just be fun, but boy was I wrong! http:// wp.me/p4I1aM-j7 via JessLif",,,,683846789821140992,https://twitter.com/LeaderandReader/status/683846789821140992,caldescott mrt station,caldescott
itsmicolymz,2016-01-04 11:07:00,0,0,I'm at Punggol Secondary School Canteen w/ @meganljn https://www. swarmapp.com/c/2nyXU8Pf2aP,,@meganljn,,683847159616266240,https://twitter.com/itsmicolymz/status/683847159616266240,punggol mrt station,punggol
PermataTM,2016-01-04 11:07:00,0,2,Rezeki rakyat Tanah Merah blako ni. https:// twitter.com/VOLUNTEERKelat e/status/683846455505731586 …,,,,683847255451828224,https://twitter.com/PermataTM/status/683847255451828224,tanah merah mrt station,tanah merah
muzzyIrfan,2016-01-04 11:08:00,0,0,Take care becky @Changi Airport T3 Departure https://www. instagram.com/p/BAGfqKLwYLN/,,@Changi,,683847410595065857,https://twitter.com/muzzyIrfan/status/683847410595065857,changi airport mrt station,changi airport
jxfflxw,2016-01-04 11:09:00,0,0,I'm at Choa Chu Kang Bus Interchange - @smrt_singapore in Singapore https://www. swarmapp.com/c/i0xFv0AOHd9,,@smrt_singapore,,683847633203519488,https://twitter.com/jxfflxw/status/683847633203519488,choa chu kang mrt station,choa chu kang
cocoaevenings,2016-01-04 11:10:00,0,0,11.08am Reached Bedok MRT Station.,,,,683847878813454336,https://twitter.com/cocoaevenings/status/683847878813454336,bedok mrt station,bedok
elsoboleva20733,2016-01-04 11:11:00,0,0,"RT PornForFree_ru Now online  Nurashikinbahruddin, 24, Tanah Merah : hai http:// bit.ly/1Rkb1Hn  #flirt #dating",,,#flirt #dating,683848242271023104,https://twitter.com/elsoboleva20733/status/683848242271023104,tanah merah mrt station,tanah merah
delvischia,2016-01-04 11:14:00,0,0,Going bedok just for work fk,,,,683848893080047617,https://twitter.com/delvischia/status/683848893080047617,bedok mrt station,bedok
Iovestroye,2016-01-04 11:17:00,0,0,@TAKEGGOMEZ KKKKKKKKKKKKKKKKKKKKKKKKK KE VENENO BISHAN,,@TAKEGGOMEZ,,683849636679970816,https://twitter.com/Iovestroye/status/683849636679970816,bishan mrt station,bishan
CikIkaa,2016-01-04 11:17:00,0,0,"I'm at Pasaraya Adam in Tanah merah , kelantan / Malaysia https://www. swarmapp.com/c/hzfCQaGR8Rw",,,,683849816720433152,https://twitter.com/CikIkaa/status/683849816720433152,tanah merah mrt station,tanah merah
muellerspace,2016-01-04 11:18:00,0,2,@bookslover oh nice! Our mock Caldecott ends on Thursday.,,@bookslover,,683850049382555648,https://twitter.com/muellerspace/status/683850049382555648,caldescott mrt station,caldescott
InstaSingapore,2016-01-04 11:18:00,0,0,#Merlion by @estherjulee - What are YOUR must see spots in Singapore? We heard the gardens by the bay were great fo… pic.twitter.com/yq9ydnkAB7,,@estherjulee,#Merlion,683849833573138432,https://twitter.com/InstaSingapore/status/683849833573138432,gardens by the bay mrt station,gardens by the bay
eugenewsp,2016-01-04 11:18:00,0,0,มาแบบงงๆ (@Singapore Changi Airport (SIN) - @fansofchangi in Singapore) https://www. swarmapp.com/c/e6y20R85pM0,,@Singapore @fansofchangi,,683849848525815808,https://twitter.com/eugenewsp/status/683849848525815808,changi airport mrt station,changi airport
eugenewsp,2016-01-04 11:19:00,0,0,I'm at Changi Airport Terminal 2 - @fansofchangi in Singapore https://www. swarmapp.com/c/aG10JAAtSjH,,@fansofchangi,,683850230882775040,https://twitter.com/eugenewsp/status/683850230882775040,changi airport mrt station,changi airport
achaapp,2016-01-04 11:19:00,0,0,why is the escalator at buona vista forever have problem,,,,683850234070306816,https://twitter.com/achaapp/status/683850234070306816,buona vista mrt station,buona vista
K_NNETHLOH,2016-01-04 11:20:00,0,0,I'm at Sembawang MRT Station (NS11) - @smrt_singapore in Singapore https://www. swarmapp.com/c/1dL6pH0Mn5n,,@smrt_singapore,,683850581254008833,https://twitter.com/K_NNETHLOH/status/683850581254008833,sembawang mrt station,sembawang
juxakxttn,2016-01-04 11:22:00,0,0,@ryannlukas yazzzz bedok is the shittttzzz hahaha,,@ryannlukas,,683850879607296000,https://twitter.com/juxakxttn/status/683850879607296000,bedok mrt station,bedok
