username,date,retweets,favorites,text,geo,mentions,hashtags,id,permalink,place,key
weigeetan,2016-02-19 17:42:00,0,0,@schan_jing_yi red line. Outram to joo koon,,@schan_jing_yi,,700616371684544512,https://twitter.com/weigeetan/status/700616371684544512,joo koon mrt station,joo koon
_ellyem,2016-02-19 17:42:00,0,0,Why does it feel like the whole of Tampines population here ALL THE DAMNED TIME????,,,,700616393859829760,https://twitter.com/_ellyem/status/700616393859829760,tampines mrt station,tampines
SMRT_Singapore,2016-02-19 17:43:00,57,10,[EWL]: Estimate 15 mins additional travelling time from #JurongEast to #JooKoon towards Joo Koon due to train fault.,,,#JurongEast #JooKoon,700616657333387265,https://twitter.com/SMRT_Singapore/status/700616657333387265,joo koon mrt station,joo koon
jayhalia,2016-02-19 17:43:00,2,0,"Mumbai's airport is really stepping up its game, @ChangiAirport https:// twitter.com/ngtindia/statu s/700613349604589568 …",,@ChangiAirport,,700616706150965249,https://twitter.com/jayhalia/status/700616706150965249,changi airport mrt station,changi airport
hafizrazmusic,2016-02-19 17:43:00,0,0,Why is it so much faster from pasir ris to woodlands than it is from bedok to woodlands wtf,,,,700616680519573504,https://twitter.com/hafizrazmusic/status/700616680519573504,bedok mrt station,bedok
Chhota_Bhim,2016-02-19 17:43:00,0,0,Trains stopped in Bihar seeking Kanhaiya's release: The Sampark Kranti Express was halted at Darbhanga station ... http:// bit.ly/1RT7wJg,,,,700616707002400768,https://twitter.com/Chhota_Bhim/status/700616707002400768,kranji mrt station,kranji station
udin_dinn,2016-02-19 17:44:00,0,0,Train fault during peak hours. Now im stuck at Raffles Place .,,,,700616940209831937,https://twitter.com/udin_dinn/status/700616940209831937,raffles place mrt station,raffles place
stompsingapore,2016-02-19 17:44:00,2,1,7 war relics found at construction site near Changi Airport Terminal 2 http:// goo.gl/mxCJUB pic.twitter.com/eyCb8ZfRDg,,,,700617040873172992,https://twitter.com/stompsingapore/status/700617040873172992,changi airport mrt station,changi airport
DamnFriendly_WJ,2016-02-19 17:44:00,0,0,"LATEST! Due to train fault , pls expect additional 15MINS travelling time from Jurong East to Joo Koon on the East West Line",,,,700616986724737024,https://twitter.com/DamnFriendly_WJ/status/700616986724737024,joo koon mrt station,joo koon
sanzochan,2016-02-19 17:44:00,0,0,Train stuck at Tanjong Pagar . Estimated waiting time: 15 mins.,,,,700616932274212864,https://twitter.com/sanzochan/status/700616932274212864,tanjong pagar mrt station,tanjong pagar
KhooKangLe,2016-02-19 17:44:00,0,0,Stick at lakeside mrt I need help legit guys,,,,700616987672641536,https://twitter.com/KhooKangLe/status/700616987672641536,lakeside mrt station,lakeside mrt
JustAFluffyBear,2016-02-19 17:44:00,0,0,Astronaut in Peril @Buona Vista MRT Station https://www. instagram.com/p/BB9pk_CiRUY/,,@Buona,,700616975391784960,https://twitter.com/JustAFluffyBear/status/700616975391784960,buona vista mrt station,buona vista
dopeypoppy,2016-02-19 17:45:00,0,0,I'm at Sengkang MRT /LRT Interchange (NE16/STC) in Singapore https://www. swarmapp.com/c/h5HKdgGZk5i,,,,700617136977350656,https://twitter.com/dopeypoppy/status/700617136977350656,sengkang mrt station,sengkang mrt
ptwebsgwp,2016-02-19 17:45:00,0,0,Travelling from #JurongEast to #JooKoon ? Expect 15min additional travelling time: train fault https:// twitter.com/SMRT_Singapore /status/700616657333387265 …,,,#JurongEast #JooKoon,700617173669007360,https://twitter.com/ptwebsgwp/status/700617173669007360,joo koon mrt station,joo koon
petitejo_,2016-02-19 17:45:00,0,0,I'm at Blk 204 toa payoh in Singapore https://www. swarmapp.com/c/5kLVxS2Ytv2,,,,700617158582259712,https://twitter.com/petitejo_/status/700617158582259712,toa payoh mrt station,toa payoh
TiaraAtyra,2016-02-19 17:45:00,0,0,RT @SMRT_Singapore : [EWL]: Estimate 15 mins additional travelling time from #JurongEast to #JooKoon towards Joo Koon due to train fault.,,@SMRT_Singapore,#JurongEast #JooKoon,700617155599949825,https://twitter.com/TiaraAtyra/status/700617155599949825,joo koon mrt station,joo koon
SMRT_Singapore,2016-02-19 17:46:00,17,9,[EWL] UPDATE: Free bus service are available at affected stations from #JurongEast towards #JooKoon .,,,#JurongEast #JooKoon,700617388589363200,https://twitter.com/SMRT_Singapore/status/700617388589363200,joo koon mrt station,joo koon
sbrnghzl,2016-02-19 17:46:00,0,2,i wanna move out of bedok to tampines can,,,,700617498522071040,https://twitter.com/sbrnghzl/status/700617498522071040,bedok mrt station,bedok
bhattedehatti,2016-02-19 17:46:00,0,0,Trains stopped in Bihar seeking Kanhaiya's release - The Sampark Kranti Express was halted at Darbhanga station ... http:// ow.ly/3bv0T4,,,,700617427416125440,https://twitter.com/bhattedehatti/status/700617427416125440,kranji mrt station,kranji station
TiaraEmily,2016-02-19 17:46:00,0,0,off to sembawang,,,,700617366854459392,https://twitter.com/TiaraEmily/status/700617366854459392,sembawang mrt station,sembawang
guanxin31,2016-02-19 17:47:00,0,0,"I'm at Blk 525 Hougang Avenue 6 in Singapre, Singapore https://www. swarmapp.com/c/bBFGcbrx4w6",,,,700617719176110080,https://twitter.com/guanxin31/status/700617719176110080,hougang mrt station,hougang
shileiyeo,2016-02-19 17:47:00,0,0,I'm at Tanah Merah MRT Interchange (EW4) - @smrt_singapore in Singapore https://www. swarmapp.com/c/hdYbVdc8dXW,,@smrt_singapore,,700617726700683264,https://twitter.com/shileiyeo/status/700617726700683264,tanah merah mrt station,tanah merah
ptwebsgwp,2016-02-19 17:47:00,0,0,Free bus svc@#JurongEast to #JooKoon stns affected by train fault https:// twitter.com/SMRT_Singapore /status/700617388589363200 …,,@,#JurongEast #JooKoon,700617615312494592,https://twitter.com/ptwebsgwp/status/700617615312494592,joo koon mrt station,joo koon
jEapUN,2016-02-19 17:48:00,0,0,ดอกไม้ ดอกไม้จะบาน.... @Gardens by the Bay https://www. instagram.com/p/BB9qBArxtExu touOKdC-eZnN1R1nxiy0CG1Fzw0/ …,,@Gardens,,700617954157658113,https://twitter.com/jEapUN/status/700617954157658113,gardens by the bay mrt station,gardens by the bay
rss_collection,2016-02-19 17:49:00,0,0,Maps ≠ NZ: The Flower Dome at Gardens by the Bay in... http:// bit.ly/1PKgPIT,,,,700618089709187072,https://twitter.com/rss_collection/status/700618089709187072,gardens by the bay mrt station,gardens by the bay
DamnFriendly_WJ,2016-02-19 17:49:00,0,0,LATEST! Free passing by buses are available between Jurong East & Joo Koon on East West Line due to train fault,,,,700618220969947139,https://twitter.com/DamnFriendly_WJ/status/700618220969947139,joo koon mrt station,joo koon
ssarahvoss,2016-02-19 17:49:00,0,0,miss clarke quay,,,,700618280717807616,https://twitter.com/ssarahvoss/status/700618280717807616,clarke quay mrt station,clarke quay
jefflacs,2016-02-19 17:49:00,0,0,Pautangin niyo ko... :( @Singapore Changi Airport T3 Departure Hall https://www. instagram.com/p/BB9qImZmCDi/,,@Singapore,,700618203039461376,https://twitter.com/jefflacs/status/700618203039461376,changi airport mrt station,changi airport
sun_wenhao,2016-02-19 17:50:00,0,0,Waiting for the train to move is longer than my journey to Jurong east lol,,,,700618357062529024,https://twitter.com/sun_wenhao/status/700618357062529024,jurong east mrt station,jurong east
Tiangmoobies,2016-02-19 17:50:00,0,0,I'm at Changi Airport Terminal 2 - @fansofchangi in Singapore w/ @feliciamemo https://www. swarmapp.com/c/eCYYtjoRaCg,,@fansofchangi @feliciamemo,,700618406983311360,https://twitter.com/Tiangmoobies/status/700618406983311360,changi airport mrt station,changi airport
sgtrains,2016-02-19 17:50:00,2,0,[5.46pm update] SMRT: [EWL]: Estimate 15 minutes additional travelling time from Jurong East to Joo Koon towards... http:// fb.me/5eBumB5pt,,,,700618485496463360,https://twitter.com/sgtrains/status/700618485496463360,joo koon mrt station,joo koon
Feliciamemo,2016-02-19 17:50:00,0,0,I'm at Changi Airport Terminal 2 - @fansofchangi in Singapore https://www. swarmapp.com/c/bwn2WfX8VlF,,@fansofchangi,,700618372770353153,https://twitter.com/Feliciamemo/status/700618372770353153,changi airport mrt station,changi airport
niteshsNBT,2016-02-19 17:51:00,0,0,Gzb sahibabad stn par ruki bihar sampark kranti exp. बम hone ki suchana par roki gaye. @NBTDilli,,@NBTDilli,,700618606862663680,https://twitter.com/niteshsNBT/status/700618606862663680,kranji mrt station,kranji stn
RAAZILLANUR,2016-02-19 17:51:00,0,0,@88nurlaila98 you are if you're going jurong east from lakeside..,,@88nurlaila98,,700618714077474818,https://twitter.com/RAAZILLANUR/status/700618714077474818,jurong east mrt station,jurong east
PG888X,2016-02-19 17:51:00,0,0,Extended 25minutes Travelling Time from Jurong East > Joo Koon Free Shuttle available,,,,700618694079066112,https://twitter.com/PG888X/status/700618694079066112,joo koon mrt station,joo koon
glendachua_,2016-02-19 17:51:00,0,0,TWENTY MRT STOPS TO STADIUM FROM GOMABK WTF SHOULD I JUST CAB ZZZZ,,,,700618604279037952,https://twitter.com/glendachua_/status/700618604279037952,stadium mrt station,stadium mrt
SMRT_Singapore,2016-02-19 17:52:00,65,19,[EWL]: Estimate 25 mins additional travelling time from #JurongEast to #JooKoon towards Joo Koon due to train fault.,,,#JurongEast #JooKoon,700618970756349952,https://twitter.com/SMRT_Singapore/status/700618970756349952,joo koon mrt station,joo koon
pam_s,2016-02-19 17:52:00,0,0,#streetartsg WIP(?) - #wonderwoman #godzilla #graffiti @Tanjong Pagar https://www. instagram.com/p/BB9qgQDpsJ9/,,@Tanjong,#streetartsg #wonderwoman #godzilla #graffiti,700619024309223424,https://twitter.com/pam_s/status/700619024309223424,tanjong pagar mrt station,tanjong pagar
ujfaluch,2016-02-19 17:52:00,0,0,Kakak aku kahwin rumah dekat bukit panjang . Majlis dekat woodlands cc hahahah mak ai,,,,700619015559913473,https://twitter.com/ujfaluch/status/700619015559913473,bukit panjang mrt station,bukit panjang
SuperbJr,2016-02-19 17:52:00,0,1,I made it from Buona to Jurong East to Bukit Batok in the same train????,,,,700619051307958272,https://twitter.com/SuperbJr/status/700619051307958272,bukit batok mrt station,bukit batok
InstaSingapore,2016-02-19 17:53:00,0,0,.petitejo_ Nice check-in: I'm at Blk 204 toa payoh in Singapore https://www. swarmapp.com/c/5kLVxS2Ytv2,,,,700619174062772224,https://twitter.com/InstaSingapore/status/700619174062772224,toa payoh mrt station,toa payoh
InstaSingapore,2016-02-19 17:53:00,0,0,RT shileiyeo: I'm at Tanah Merah MRT Interchange (EW4) - smrt_singapore in Singapore https://www. swarmapp.com/c/hdYbVdc8dXW,,,,700619192320581633,https://twitter.com/InstaSingapore/status/700619192320581633,tanah merah mrt station,tanah merah
InstaSingapore,2016-02-19 17:53:00,0,0,RT petitejo_: I'm at Blk 204 toa payoh in Singapore https://www. swarmapp.com/c/5kLVxS2Ytv2,,,,700619186708545536,https://twitter.com/InstaSingapore/status/700619186708545536,toa payoh mrt station,toa payoh
ptwebsgwp,2016-02-19 17:53:00,0,1,Travelling time from #JurongEast to #JooKoon increased to 25 mins due to a train fault: @SMRT_Singapore https:// twitter.com/SMRT_Singapore /status/700618970756349952 …,,@SMRT_Singapore,#JurongEast #JooKoon,700619273077522432,https://twitter.com/ptwebsgwp/status/700619273077522432,joo koon mrt station,joo koon
InstaSingapore,2016-02-19 17:53:00,0,0,.Tiangmoobies Nice check-in: I'm at Changi Airport Terminal 2 - fansofchangi in Singapore w/ feliciamemo https://www. swarmapp.com/c/eCYYtjoRaCg,,,,700619186389852161,https://twitter.com/InstaSingapore/status/700619186389852161,changi airport mrt station,changi airport
InstaSingapore,2016-02-19 17:53:00,0,0,.Feliciamemo Nice check-in: I'm at Changi Airport Terminal 2 - fansofchangi in Singapore https://www. swarmapp.com/c/bwn2WfX8VlF,,,,700619184682770432,https://twitter.com/InstaSingapore/status/700619184682770432,changi airport mrt station,changi airport
kfvith,2016-02-19 17:53:00,0,0,@HafizRazz what time u come yew tee,,@HafizRazz,,700619234892603392,https://twitter.com/kfvith/status/700619234892603392,yew tee mrt station,yew tee
InstaSingapore,2016-02-19 17:53:00,0,0,RT Tiangmoobies: I'm at Changi Airport Terminal 2 - fansofchangi in Singapore w/ feliciamemo https://www. swarmapp.com/c/eCYYtjoRaCg,,,,700619198322581504,https://twitter.com/InstaSingapore/status/700619198322581504,changi airport mrt station,changi airport
InstaSingapore,2016-02-19 17:53:00,0,0,"RT guanxin31: I'm at Blk 525 Hougang Avenue 6 in Singapre, Singapore https://www. swarmapp.com/c/bBFGcbrx4w6",,,,700619191456501760,https://twitter.com/InstaSingapore/status/700619191456501760,hougang mrt station,hougang
InstaSingapore,2016-02-19 17:53:00,0,0,".guanxin31 Nice check-in: I'm at Blk 525 Hougang Avenue 6 in Singapre, Singapore https://www. swarmapp.com/c/bBFGcbrx4w6",,,,700619179318231040,https://twitter.com/InstaSingapore/status/700619179318231040,hougang mrt station,hougang
InstaSingapore,2016-02-19 17:53:00,0,0,RT Feliciamemo: I'm at Changi Airport Terminal 2 - fansofchangi in Singapore https://www. swarmapp.com/c/bwn2WfX8VlF,,,,700619196011585536,https://twitter.com/InstaSingapore/status/700619196011585536,changi airport mrt station,changi airport
InstaSingapore,2016-02-19 17:53:00,0,0,.Huiifanggg Nice check-in: I'm at Tampines Mall in Singapore w/ janexlle janellelyq https://www. swarmapp.com/c/2G8gD745aRs,,,,700619191196524544,https://twitter.com/InstaSingapore/status/700619191196524544,tampines mrt station,tampines
InstaSingapore,2016-02-19 17:53:00,0,0,RT y1ngji3: I'm at Sengkang MRT /LRT Interchange (NE16/STC) in Singapore https://www. swarmapp.com/c/h5HKdgGZk5i,,,,700619185865498628,https://twitter.com/InstaSingapore/status/700619185865498628,sengkang mrt station,sengkang mrt
InstaSingapore,2016-02-19 17:53:00,0,0,.y1ngji3 Nice check-in: I'm at Sengkang MRT /LRT Interchange (NE16/STC) in Singapore https://www. swarmapp.com/c/h5HKdgGZk5i,,,,700619173131644928,https://twitter.com/InstaSingapore/status/700619173131644928,sengkang mrt station,sengkang mrt
InstaSingapore,2016-02-19 17:53:00,0,1,RT Huiifanggg: I'm at Tampines Mall in Singapore w/ janexlle janellelyq https://www. swarmapp.com/c/2G8gD745aRs,,,,700619203271901185,https://twitter.com/InstaSingapore/status/700619203271901185,tampines mrt station,tampines
InstaSingapore,2016-02-19 17:53:00,0,0,.shileiyeo Nice check-in: I'm at Tanah Merah MRT Interchange (EW4) - smrt_singapore in Singapore https://www. swarmapp.com/c/hdYbVdc8dXW,,,,700619180496781312,https://twitter.com/InstaSingapore/status/700619180496781312,tanah merah mrt station,tanah merah
k_inlove123,2016-02-19 17:54:00,0,0,Cutie pie ㅋㅋㅋㅋ @Blk 133 Yishun https://www. instagram.com/p/BB9qps_iuzGt COxHRZEYUBjBBeCQUwDSQQbwi00/ …,,@Blk,,700619352328908800,https://twitter.com/k_inlove123/status/700619352328908800,yishun mrt station,yishun
JiSongMKK,2016-02-19 17:54:00,0,0,6th (@Bloodbank @Dhoby Ghaut in Singapore) https://www. swarmapp.com/c/jOJHv4KLNVm,,@Bloodbank @Dhoby,,700619513293885440,https://twitter.com/JiSongMKK/status/700619513293885440,dhoby ghaut mrt station,dhoby ghaut
seanwooden,2016-02-19 17:55:00,0,0,Home (@Singapore @ChangiAirport (SIN) in Singapore) https://www. swarmapp.com/c/53HGikCkaUK,,@Singapore @ChangiAirport,,700619819704516608,https://twitter.com/seanwooden/status/700619819704516608,changi airport mrt station,changi airport
SasandoBoy,2016-02-19 17:55:00,0,0,Late post in Changi airport pic.twitter.com/TgtGuR9thZ,,,,700619711864672258,https://twitter.com/SasandoBoy/status/700619711864672258,changi airport mrt station,changi airport
MuvintheranK,2016-02-19 17:55:00,0,0,Train service down at Boon Lay and have to wait for 25 mins.,,,,700619736204218368,https://twitter.com/MuvintheranK/status/700619736204218368,boon lay mrt station,boon lay
dailysingapore,2016-02-19 17:55:00,0,0,"[News] Mechanised carparks come online at Changi Village, Bukit Panjang and Yishun http:// bit.ly/21cVi0x",,,,700619614015729664,https://twitter.com/dailysingapore/status/700619614015729664,bukit panjang mrt station,bukit panjang
KhooKangLe,2016-02-19 17:55:00,0,0,@juliachuppies lakeside la fuck???the mrt breakdown!!!,,@juliachuppies,,700619727094226944,https://twitter.com/KhooKangLe/status/700619727094226944,lakeside mrt station,lakeside mrt
sglatestnews,2016-02-19 17:55:00,0,0,"#latest #news Mechanised carparks come online at Changi Village, Bukit Panjang and Yishun: February... http:// bit.ly/1owzMG8 #singapore",,,#latest #news #singapore,700619632219041792,https://twitter.com/sglatestnews/status/700619632219041792,bukit panjang mrt station,bukit panjang
janseahsl,2016-02-19 17:56:00,0,0,@SMRT_Singapore @ChannelNewsAsia from Outram to Joo Koon too ;),,@SMRT_Singapore @ChannelNewsAsia,,700619930362732547,https://twitter.com/janseahsl/status/700619930362732547,joo koon mrt station,joo koon
estheryeungx,2016-02-19 17:56:00,0,0,"I'm at Tampines Bus Interchange in Singapore, SINGAPORE https://www. swarmapp.com/c/7zNg5nhUhw2",,,,700619982829461504,https://twitter.com/estheryeungx/status/700619982829461504,tampines mrt station,tampines
zksprk,2016-02-19 17:56:00,0,0,So it's going to be 10 mins since we have stopped in the tunnel between Raffles Place and Tanjong Pagar. Is EW line down?,,,,700619858254262272,https://twitter.com/zksprk/status/700619858254262272,raffles place mrt station,raffles place
RussianToad,2016-02-19 17:56:00,0,0,MRT breakdown at lakeside ? And at time like this...really?,,,,700619927967780864,https://twitter.com/RussianToad/status/700619927967780864,lakeside mrt station,lakeside mrt
austin_babby,2016-02-19 17:56:00,0,0,Wondering around kallang wave like a retard,,,,700620035346141184,https://twitter.com/austin_babby/status/700620035346141184,kallang mrt station,kallang
pam_s,2016-02-19 17:56:00,0,0,I wonder where Tanjong Pagar starts and Chinatown ends...,,,,700620071392006144,https://twitter.com/pam_s/status/700620071392006144,tanjong pagar mrt station,tanjong pagar
johnyeungx,2016-02-19 17:56:00,1,2,"I'm at Tampines Bus Interchange in Singapore, SINGAPORE w/ @ameliaongkq @estheryeungx https://www. swarmapp.com/c/iVnzXzWQnWm",,@ameliaongkq @estheryeungx,,700620037204348928,https://twitter.com/johnyeungx/status/700620037204348928,tampines mrt station,tampines
dorkkvader,2016-02-19 17:57:00,0,0,"Heads up to anyone going out, if you live between joo koon and jurong east ur screwed",,,,700620233212448769,https://twitter.com/dorkkvader/status/700620233212448769,joo koon mrt station,joo koon
nauraem,2016-02-19 17:58:00,0,0,Green line towards Joo Koon is disrupted! Time to take the downtown line!,,,,700620550662586368,https://twitter.com/nauraem/status/700620550662586368,joo koon mrt station,joo koon
dlSingapore,2016-02-19 17:58:00,0,0,World’s first Aerotel opens at Changi Airport : Record-breaking passenger traffic at HKIA in 2014/15 Airport Au... http:// bit.ly/1PKhZ7e,,,,700620556450725888,https://twitter.com/dlSingapore/status/700620556450725888,changi airport mrt station,changi airport
zul_matiin,2016-02-19 17:58:00,0,0,@mr_yomada Kalau kau bookout siang blh jumpa aku kat yishun dulu then jumpa tu debab kat sengkang.....,,@mr_yomada,,700620434752966657,https://twitter.com/zul_matiin/status/700620434752966657,yishun mrt station,yishun
graceysan,2016-02-19 17:59:00,0,0,DON'T TAKE TRAIN TOWARDS JOOKOON .,,,,700620743642513408,https://twitter.com/graceysan/status/700620743642513408,joo koon mrt station,joo koon
InstaSingapore,2016-02-19 17:59:00,0,0,New Instagram by @metallikang Gardens By The Bay #Singapore pic.twitter.com/rPnIGfA7Ew,,@metallikang,#Singapore,700620753268510720,https://twitter.com/InstaSingapore/status/700620753268510720,gardens by the bay mrt station,gardens by the bay
InstaSingapore,2016-02-19 17:59:00,0,0,New Instagram by @joanthegreat Gardens By The Bay #Singapore pic.twitter.com/GwAaXr5ULz,,@joanthegreat,#Singapore,700620739276316672,https://twitter.com/InstaSingapore/status/700620739276316672,gardens by the bay mrt station,gardens by the bay
Stoned_Bazz,2016-02-19 17:59:00,1,0,West bound train delayed for 20 mins . Presently after Redhill MRT and the train is not moving. where is the announcement @SMRT_Singapore ?,,@SMRT_Singapore,,700620591175368704,https://twitter.com/Stoned_Bazz/status/700620591175368704,redhill mrt station,redhill mrt
S3XYKISSES,2016-02-19 17:59:00,1,0,"I'm at Blk 410 Bedok North Ave 2 in Bedok , Singapore w/ @graciangxx @ughpotato_ @junebabesss https://www. swarmapp.com/c/hfSgRq0UwNr",,@graciangxx @ughpotato_ @junebabesss,,700620651867021312,https://twitter.com/S3XYKISSES/status/700620651867021312,bedok mrt station,bedok
InstaSingapore,2016-02-19 17:59:00,0,1,New Instagram by @sip_photography Gardens By The Bay #Singapore pic.twitter.com/OXwe5CmD7k,,@sip_photography,#Singapore,700620747400732672,https://twitter.com/InstaSingapore/status/700620747400732672,gardens by the bay mrt station,gardens by the bay
Naranteran,2016-02-19 17:59:00,0,0,Stuck at tanjong pagar mrt.train not moving.more than 20 mins d #mrt #smrt #channelnewsasia #Singapore,,,#mrt #smrt #channelnewsasia #Singapore,700620821560078337,https://twitter.com/Naranteran/status/700620821560078337,tanjong pagar mrt station,tanjong pagar
InstaSingapore,2016-02-19 17:59:00,0,0,New Instagram by @wongy1989 Gardens By The Bay #Singapore pic.twitter.com/gFNBbHqHNP,,@wongy1989,#Singapore,700620695794032640,https://twitter.com/InstaSingapore/status/700620695794032640,gardens by the bay mrt station,gardens by the bay
InstaSingapore,2016-02-19 17:59:00,0,0,New Instagram by @kenneth .rodrigues Gardens By The Bay #Singapore pic.twitter.com/33ev9qpIMr,,@kenneth,#Singapore,700620700911017984,https://twitter.com/InstaSingapore/status/700620700911017984,gardens by the bay mrt station,gardens by the bay
InstaSingapore,2016-02-19 17:59:00,0,0,New Instagram by @wongy1989 Gardens By The Bay #Singapore pic.twitter.com/Ng1NZjkpr9,,@wongy1989,#Singapore,700620709400186880,https://twitter.com/InstaSingapore/status/700620709400186880,gardens by the bay mrt station,gardens by the bay
InstaSingapore,2016-02-19 17:59:00,0,0,New Instagram by @metallikang Gardens By The Bay #Singapore pic.twitter.com/TBtAYr83QK,,@metallikang,#Singapore,700620714420936704,https://twitter.com/InstaSingapore/status/700620714420936704,gardens by the bay mrt station,gardens by the bay
InstaSingapore,2016-02-19 17:59:00,0,0,New Instagram by @metallikang Gardens By The Bay #Singapore pic.twitter.com/jaG8HH5iYk,,@metallikang,#Singapore,700620719261138944,https://twitter.com/InstaSingapore/status/700620719261138944,gardens by the bay mrt station,gardens by the bay
zarrazlee,2016-02-19 17:59:00,0,0,@SMRT_Singapore What about heading towards #JurongEast ? No train heading that way too? Or extra bus service?,,@SMRT_Singapore,#JurongEast,700620716970881025,https://twitter.com/zarrazlee/status/700620716970881025,jurong east mrt station,jurong east
InstaSingapore,2016-02-19 17:59:00,0,0,New Instagram by @derrickkoo_photo Gardens By The Bay #Singapore pic.twitter.com/d6iNFtHICX,,@derrickkoo_photo,#Singapore,700620723619024896,https://twitter.com/InstaSingapore/status/700620723619024896,gardens by the bay mrt station,gardens by the bay
InstaSingapore,2016-02-19 17:59:00,0,0,New Instagram by @joanthegreat Gardens By The Bay #Singapore pic.twitter.com/zpvkxJtwh8,,@joanthegreat,#Singapore,700620730061471745,https://twitter.com/InstaSingapore/status/700620730061471745,gardens by the bay mrt station,gardens by the bay
Masqueradeswan,2016-02-19 17:59:00,0,0,No train from je to jookoon,,,,700620663506096128,https://twitter.com/Masqueradeswan/status/700620663506096128,joo koon mrt station,joo koon
InstaSingapore,2016-02-19 17:59:00,0,0,New Instagram by @metallikang Gardens By The Bay #Singapore pic.twitter.com/6EfkAtk2ka,,@metallikang,#Singapore,700620734708715520,https://twitter.com/InstaSingapore/status/700620734708715520,gardens by the bay mrt station,gardens by the bay
SMRT_Singapore,2016-02-19 18:00:00,50,17,[EWL]: There is no train service between #JurongEast and #JooKoon due to train fault. Free bus service is still available.,,,#JurongEast #JooKoon,700620967727333376,https://twitter.com/SMRT_Singapore/status/700620967727333376,joo koon mrt station,joo koon
EstherTNewer,2016-02-19 18:00:00,0,0,RT https:// twitter.com/InstaSingapore /status/700620747400732672 … New Instagram by sip_photography Gardens By The Bay #Singapore pic.twitter.com/bYcIzK5oHN,,,#Singapore,700621066482409472,https://twitter.com/EstherTNewer/status/700621066482409472,gardens by the bay mrt station,gardens by the bay
yoojeenn,2016-02-19 18:01:00,0,1,Anybody want eat dinner tgt at bedok,,,,700621193427070978,https://twitter.com/yoojeenn/status/700621193427070978,bedok mrt station,bedok
SMRT_Singapore,2016-02-19 18:02:00,20,9,[EWL] UPDATE: Train service from #JurongEast to #JooKoon has resumed.,,,#JurongEast #JooKoon,700621588643713024,https://twitter.com/SMRT_Singapore/status/700621588643713024,joo koon mrt station,joo koon
cHaOsSiiN,2016-02-19 18:02:00,0,0,I'm at Bugis MRT Interchange (EW12/DT14) - @smrt_singapore in Singapore https://www. swarmapp.com/c/eznBuQBOeVM,,@smrt_singapore,,700621350545842176,https://twitter.com/cHaOsSiiN/status/700621350545842176,bugis mrt station,bugis mrt
adpipi,2016-02-19 18:03:00,0,0,Going back for now (@Jurong East MRT Interchange (NS1/EW24)) · http:// 4sq.com/61Tyff #swarm,,@Jurong,#swarm,700621786619187200,https://twitter.com/adpipi/status/700621786619187200,jurong east mrt station,jurong east
adpipi,2016-02-19 18:03:00,0,0,(@Clementi MRT Station (EW23)) · http:// 4sq.com/8LVkHx #swarm,,@Clementi,#swarm,700621783498625024,https://twitter.com/adpipi/status/700621783498625024,clementi mrt station,clementi mrt
