username,date,retweets,favorites,text,geo,mentions,hashtags,id,permalink,place,key
stickwityou_,2016-01-14 08:48:00,0,0,To the land of smile! // +66 @Terminal 1 - Changi Airport https://www. instagram.com/p/BAf_kiqot_h/,,@Terminal,,687436015221477377,https://twitter.com/stickwityou_/status/687436015221477377,changi airport mrt station,changi airport
myfatecriesout,2016-01-14 08:49:00,0,1,so fucking late zzz work at 9am and im still at pasir ris mrt at 8.50am LULZ,,,,687436300350177281,https://twitter.com/myfatecriesout/status/687436300350177281,pasir ris mrt station,pasir ris
ReadersGazette,2016-01-14 08:50:00,1,0,Latest Book News... Story of real Winnie-the-Pooh wins Caldecott http:// readersgazette.com/news/day/103125 #books #novels,,,#books #novels,687436473793130496,https://twitter.com/ReadersGazette/status/687436473793130496,caldescott mrt station,caldescott
EINBeverageNews,2016-01-14 08:50:00,0,0,Get fit at new Bedok mixed business park http:// s.einnews.com/jSxpOJ-txo,,,,687436558560002050,https://twitter.com/EINBeverageNews/status/687436558560002050,bedok mrt station,bedok
jhoannagomezmar,2016-01-14 08:52:00,0,0,Jurong Lake Grande Condo is a new launch MCL Condo in Boon Lay Way http://www. lakelife-executive-condo.com/lake-grande-co ndo/ …,,,,687437049792716800,https://twitter.com/jhoannagomezmar/status/687437049792716800,boon lay mrt station,boon lay
yungklaver_,2016-01-14 08:53:00,0,0,I'm at Sembawang MRT Station (NS11) - @smrt_singapore in Singapore https://www. swarmapp.com/c/jRbW252kJC4,,@smrt_singapore,,687437371218989057,https://twitter.com/yungklaver_/status/687437371218989057,sembawang mrt station,sembawang
gweezilla,2016-01-14 08:53:00,0,0,Oh look! It's Bedok EUNOIA Store! http:// fb.me/7JFKKUDP0,,,,687437331939352576,https://twitter.com/gweezilla/status/687437331939352576,bedok mrt station,bedok
Zijieee_ynwa,2016-01-14 08:53:00,0,0,RT @STsportsdesk : BREAKING NEWS: Tampines ( @mightystags ) have agreed terms to sign Jermaine Pennant ... http:// tmi.me/1fbJx9,,@STsportsdesk @mightystags,,687437449149063168,https://twitter.com/Zijieee_ynwa/status/687437449149063168,tampines mrt station,tampines
yungklaver_,2016-01-14 08:53:00,0,0,I'm at Sembawang in Singapore https://www. swarmapp.com/c/4OR6hFkxTGc,,,,687437291900506112,https://twitter.com/yungklaver_/status/687437291900506112,sembawang mrt station,sembawang
affieahmad,2016-01-14 08:54:00,0,0,Congratulation @Tanah Merah New Village Site C https://www. instagram.com/p/BAgARQqDO74/,,@Tanah,,687437553532825600,https://twitter.com/affieahmad/status/687437553532825600,tanah merah mrt station,tanah merah
Franco_Uskell,2016-01-14 08:54:00,0,0,Only at Raffles Place station that people will rush for the escalator up to the concourse level. #smrt #peakhours #singapore #rafflesplace,,,#smrt #peakhours #singapore #rafflesplace,687437608863989760,https://twitter.com/Franco_Uskell/status/687437608863989760,raffles place mrt station,raffles place
_afysatria,2016-01-14 08:55:00,0,0,@boon lay inter now,,@boon,,687437791555276800,https://twitter.com/_afysatria/status/687437791555276800,boon lay mrt station,boon lay
SingaporeTimes,2016-01-14 08:56:00,0,0,Get fit at new Bedok mixed business park http:// dlvr.it/DGX24t #Singapore,,,#Singapore,687438007490736129,https://twitter.com/SingaporeTimes/status/687438007490736129,bedok mrt station,bedok
SgVaMp,2016-01-14 08:57:00,0,0,Breakfast at Bedok lab xD pic.twitter.com/apWGwVfSyL,,,,687438246804996096,https://twitter.com/SgVaMp/status/687438246804996096,bedok mrt station,bedok
FaiZzalMaiZzal,2016-01-14 08:57:00,0,0,Woah.. Tampines just signed a former Liverpool and premier league player. Woah!! Jermaine freaking Pennant!,,,,687438278530887680,https://twitter.com/FaiZzalMaiZzal/status/687438278530887680,tampines mrt station,tampines
cursedroses_,2016-01-14 08:58:00,0,0,I'm at Jurong East MRT Interchange (NS1/EW24) - @smrt_singapore in Singapore https://www. swarmapp.com/c/34L1oF6sQXi,,@smrt_singapore,,687438709898276864,https://twitter.com/cursedroses_/status/687438709898276864,jurong east mrt station,jurong east
arshavin23,2016-01-14 08:58:00,0,0,Get fit at new Bedok mixed business park http:// dlvr.it/DGWvp5,,,,687438621394112512,https://twitter.com/arshavin23/status/687438621394112512,bedok mrt station,bedok
jojokattie,2016-01-14 08:58:00,0,0,"Wilkinson Eyre's award-winning cooled conservatories at Gardens by the Bay , Singapore http:// youtu.be/9txqE4SjWqU",,,,687438653191262208,https://twitter.com/jojokattie/status/687438653191262208,gardens by the bay mrt station,gardens by the bay
edbsgp,2016-01-14 09:00:00,3,0,"Steve Lee, #CIO @ChangiAirport vision's ""I value strength in diversity."" on @LinkedInPulse https://www. linkedin.com/pulse/what-cio s-thinking-4-steve-lee-cio-changi-airport-eduardo-de-barros …",,@ChangiAirport @LinkedInPulse,#CIO,687439062047719424,https://twitter.com/edbsgp/status/687439062047719424,changi airport mrt station,changi airport
RonaldVining,2016-01-14 09:00:00,1,1,Tanjong Pagar plans are astounding! #Singapore such an amazing country w/futurist vision to create the ideal city. https:// twitter.com/channelnewsasi a/status/687433188407406593 …,,,#Singapore,687439070146899968,https://twitter.com/RonaldVining/status/687439070146899968,tanjong pagar mrt station,tanjong pagar
sgpressrelease,2016-01-14 09:00:00,0,0,The changing face of Tanjong Pagar http:// ift.tt/1RNJVIS,,,,687439097338675202,https://twitter.com/sgpressrelease/status/687439097338675202,tanjong pagar mrt station,tanjong pagar
sglandedgroup,2016-01-14 09:01:00,0,0,*** TUAS VIEW CRESCENT *** -Detached B2 Big Factory @D22. *JTC Tenure: 30 + 30 years w.e.f 1 Dec 1999 (balance 45 … pic.twitter.com/0C9H3B257f,,@D22,,687439351517700097,https://twitter.com/sglandedgroup/status/687439351517700097,tuas crescent mrt station,tuas crescent
JerryLowjerry9,2016-01-14 09:01:00,0,0,*** TUAS VIEW CRESCENT *** -Detached B2 Big Factory @D22. *JTC Tenure: 30 + 30 years w.e.f 1 Dec 1999 (balance... http:// fb.me/2ktEt8rhW,,@D22,,687439259045859330,https://twitter.com/JerryLowjerry9/status/687439259045859330,tuas crescent mrt station,tuas crescent
JerryLowjerry9,2016-01-14 09:01:00,0,0,*** TUAS VIEW CRESCENT *** -Detached B2 Big Factory @D22. *JTC Tenure: 30 + 30 years w.e.f 1 Dec 1999 (balance... http:// fb.me/2Eb2GM3K1,,@D22,,687439265710510081,https://twitter.com/JerryLowjerry9/status/687439265710510081,tuas crescent mrt station,tuas crescent
DemocraAsia,2016-01-14 09:02:00,0,0,Sing CNA: The changing face of Tanjong Pagar - The Government is looking to transform the Tanjong Pagar area in... http:// ow.ly/3a4aMo,,,,687439557617414145,https://twitter.com/DemocraAsia/status/687439557617414145,tanjong pagar mrt station,tanjong pagar
esct1999,2016-01-14 09:02:00,0,0,The changing face of Tanjong Pagar http://www. channelnewsasia.com/news/singapore /the-changing-face-of/2424048.html …,,,,687439711644717056,https://twitter.com/esct1999/status/687439711644717056,tanjong pagar mrt station,tanjong pagar
SGnews,2016-01-14 09:02:00,0,0,[CNA] The changing face of Tanjong Pagar http:// bit.ly/1Oj0TfQ #SGnews,,,#SGnews,687439730003296256,https://twitter.com/SGnews/status/687439730003296256,tanjong pagar mrt station,tanjong pagar
AadamCes,2016-01-14 09:03:00,0,0,I'm at Bay East ( Gardens by the Bay ) in Singapore https://www. swarmapp.com/c/aK12W81H8bv,,,,687439746235297792,https://twitter.com/AadamCes/status/687439746235297792,gardens by the bay mrt station,gardens by the bay
linhlam,2016-01-14 09:03:00,0,0,The changing face of Tanjong Pagar http:// dlvr.it/DGWyxY,,,,687439757983367169,https://twitter.com/linhlam/status/687439757983367169,tanjong pagar mrt station,tanjong pagar
sgtastemakers,2016-01-14 09:04:00,0,0,The Government is looking to transform the Tanjong Pagar area into a mixed-use district.,,,,687440043934380033,https://twitter.com/sgtastemakers/status/687440043934380033,tanjong pagar mrt station,tanjong pagar
vernonkoo,2016-01-14 09:06:00,0,0,I'm at HQ SCDF / Paya Lebar Fire Station in Singapore https://www. swarmapp.com/c/6Th2pOfcJwY,,,,687440567358337024,https://twitter.com/vernonkoo/status/687440567358337024,paya lebar mrt station,paya lebar
ARFadoptions,2016-01-14 09:06:00,0,1,"Adopted: CALDECOTT , 15-week-old Domestic Short Hair Cat",,,,687440572835958784,https://twitter.com/ARFadoptions/status/687440572835958784,caldescott mrt station,caldescott
scoopsg,2016-01-14 09:07:00,0,0,CNA | The changing face of Tanjong Pagar http:// bit.ly/1PYRgn4 pic.twitter.com/r1wQkdo8NC,,,,687440770886860800,https://twitter.com/scoopsg/status/687440770886860800,tanjong pagar mrt station,tanjong pagar
scoo_ps,2016-01-14 09:07:00,0,0,CNA | The changing face of Tanjong Pagar http:// bit.ly/1PYRgn4 #sgnews pic.twitter.com/JBOAStBr4N,,,#sgnews,687440780370116609,https://twitter.com/scoo_ps/status/687440780370116609,tanjong pagar mrt station,tanjong pagar
newsSG,2016-01-14 09:07:00,0,0,CNA | The changing face of Tanjong Pagar http:// bit.ly/1PYRgn4 pic.twitter.com/MgIY3AbRjW,,,,687440800003702784,https://twitter.com/newsSG/status/687440800003702784,tanjong pagar mrt station,tanjong pagar
accmiranda,2016-01-14 09:08:00,0,0,EMIRATES AIRLINES AIRBUS A380 861 A6 EOA TAKE OFF FROM CHANGI AIRPORT SI... https:// youtu.be/PjVEljV07L0 via @YouTube,,@YouTube,,687441220470202368,https://twitter.com/accmiranda/status/687441220470202368,changi airport mrt station,changi airport
yungklaver_,2016-01-14 09:10:00,0,0,I'm at Yio Chu Kang Bus Interchange - @ltasg in Singapore https://www. swarmapp.com/c/fQGFOzLp1pT,,@ltasg,,687441603519246336,https://twitter.com/yungklaver_/status/687441603519246336,yio chu kang mrt station,yio chu kang
yungklaver_,2016-01-14 09:10:00,0,0,I'm at Ang Mo Kio in Singapore https://www. swarmapp.com/c/aOyNtbzzIbv,,,,687441505540288512,https://twitter.com/yungklaver_/status/687441505540288512,ang mo kio mrt station,ang mo kio
yungklaver_,2016-01-14 09:10:00,0,0,I'm at Yio Chu Kang MRT Station (NS15) - @smrt_singapore in Singapore https://www. swarmapp.com/c/adQRq90D7j4,,@smrt_singapore,,687441550746451969,https://twitter.com/yungklaver_/status/687441550746451969,yio chu kang mrt station,yio chu kang
YongsukHur,2016-01-14 09:10:00,0,0,근하신년 GONG XI FA CAI!! #GongXiFaCai #WaterfrontKey #Bedok #Singapore #べドック #シンガポール #베독 #싱가포르 @… https://www. instagram.com/p/BAgCJPTHMSK/,,@,#GongXiFaCai #WaterfrontKey #Bedok #Singapore # # # #,687441676038725634,https://twitter.com/YongsukHur/status/687441676038725634,bedok mrt station,bedok
wngss_,2016-01-14 09:11:00,0,0,I'm at Bishan MRT Interchange (NS17/CC15) - @smrt_singapore in Singapore https://www. swarmapp.com/c/6bhvUCwQ2W8,,@smrt_singapore,,687441971460313088,https://twitter.com/wngss_/status/687441971460313088,bishan mrt station,bishan
DILNIDHI,2016-01-14 09:11:00,0,1,@thefumusic @ChangiAirport @jacobthefu IF I REMAIN IN THIS PAGE I WILL BE MOTIVATED TO BOOK MY TICKETS TO CHANGI??( AS DID IN AUG14,,@thefumusic @ChangiAirport @jacobthefu,,687441839272542209,https://twitter.com/DILNIDHI/status/687441839272542209,changi airport mrt station,changi airport
cursedroses_,2016-01-14 09:12:00,0,0,I'm at Choa Chu Kang MRT/LRT Interchange (NS4/BP1) - @smrt_singapore in Singapore https://www. swarmapp.com/c/i3ruZvZiAXa,,@smrt_singapore,,687442046815174656,https://twitter.com/cursedroses_/status/687442046815174656,choa chu kang mrt station,choa chu kang
Devanmonkey,2016-01-14 09:12:00,0,0,"@RainingPoodles ohh heard about it before, Bukit batok sec",,@RainingPoodles,,687442194026770432,https://twitter.com/Devanmonkey/status/687442194026770432,bukit batok mrt station,bukit batok
AsiaPacNews,2016-01-14 09:13:00,0,1,Asia #Business ~ Get fit at new Bedok mixed business park - AsiaOne http:// dlvr.it/DGX845 #Pacific,,,#Business #Pacific,687442291284295680,https://twitter.com/AsiaPacNews/status/687442291284295680,bedok mrt station,bedok
AsiaPacNews,2016-01-14 09:13:00,0,0,Asia #Business ~ The changing face of Tanjong Pagar - Channel News Asia http:// dlvr.it/DGX3ln #Pacific,,,#Business #Pacific,687442289086480385,https://twitter.com/AsiaPacNews/status/687442289086480385,tanjong pagar mrt station,tanjong pagar
chuhaizhou,2016-01-14 09:15:00,0,0,The changing face of Tanjong Pagar http:// ift.tt/1RNJVIS,,,,687442971768303616,https://twitter.com/chuhaizhou/status/687442971768303616,tanjong pagar mrt station,tanjong pagar
InstantNewsFeed,2016-01-14 09:15:00,0,0,The changing face of Tanjong Pagar http:// bit.ly/1l7RZqZ,,,,687442759217614848,https://twitter.com/InstantNewsFeed/status/687442759217614848,tanjong pagar mrt station,tanjong pagar
_bingsoon,2016-01-14 09:16:00,0,0,I'm at NUH Medical Centre (One@KentRidge ) in Singapore https://www. swarmapp.com/c/7zA66jpvff1,,@KentRidge,,687443010032939009,https://twitter.com/_bingsoon/status/687443010032939009,kent ridge mrt station,kent ridge
JanaTheTeacher,2016-01-14 09:16:00,0,1,@studiocastillo @bookpage @AmazonPub @Caldecott April is going to be so awesome!,,@studiocastillo @bookpage @AmazonPub @Caldecott,,687443045286043648,https://twitter.com/JanaTheTeacher/status/687443045286043648,caldescott mrt station,caldescott
Tvt_photography,2016-01-14 09:18:00,0,0,Tanjong Pagar Centre: New tallest building in Singapore after 20 years http:// fb.me/BsfraF5D,,,,687443716471033857,https://twitter.com/Tvt_photography/status/687443716471033857,tanjong pagar mrt station,tanjong pagar
FCPAsecondGrade,2016-01-14 09:19:00,0,0,"And the Medal Goes To ... Celebrating the 2016 Newbery, Caldecott , and King Awards http://www. readbrightly.com/celebrating-th e-2016-newbery-caldecott-coretta-scott-king-awards … via readbrightly",,,,687443853150826499,https://twitter.com/FCPAsecondGrade/status/687443853150826499,caldescott mrt station,caldescott
SAFRAsg,2016-01-14 09:19:00,0,0,"President SAFRA, Mr Ong Ye Kung, viewing the SAFRA Punggol clubhouse model which will come to reality this Apr 2016. pic.twitter.com/LsMOJ9h0lH",,,,687443788042645505,https://twitter.com/SAFRAsg/status/687443788042645505,punggol mrt station,punggol
Person12_,2016-01-14 09:20:00,0,1,@b2tchw0man nem me digan bishan Como q tão as coisa?,,@b2tchw0man,,687444153035304961,https://twitter.com/Person12_/status/687444153035304961,bishan mrt station,bishan
cdjpshop,2016-01-14 09:20:00,1,2,"【SALE】ONE OK ROCK 2016 ""35xxxv"" LIVE IN SINGAPORE Ticket is 2,300฿ [S$90]. Event date Sat, 23 Jan 2016 8:00 pm. at Fort Canning Park.",,,,687444217354825730,https://twitter.com/cdjpshop/status/687444217354825730,fort canning mrt station,fort canning
naifasyaviera,2016-01-14 09:21:00,0,0,reached bishan .,,,,687444459580084224,https://twitter.com/naifasyaviera/status/687444459580084224,bishan mrt station,bishan
InstaSingapore,2016-01-14 09:21:00,0,1,.Fyq_x Nice check-in: I'm at Paya Lebar MRT Interchange (EW8/CC9) - smrt_singapore in Singapore https://www. swarmapp.com/c/5meCmKAW729,,,,687444468270669824,https://twitter.com/InstaSingapore/status/687444468270669824,paya lebar mrt station,paya lebar
YongsukHur,2016-01-14 09:21:00,0,1,I'm at Bedok Bus Interchange - @sbs_transit in Singapore https://www. swarmapp.com/c/avmF09XzUI8,,@sbs_transit,,687444372527386627,https://twitter.com/YongsukHur/status/687444372527386627,bedok mrt station,bedok
YongsukHur,2016-01-14 09:21:00,0,1,I'm at Bedok MRT Station (EW5) - @smrt_singapore in Singapore https://www. swarmapp.com/c/jsBBPIQ52tu,,@smrt_singapore,,687444425434333184,https://twitter.com/YongsukHur/status/687444425434333184,bedok mrt station,bedok
YongsukHur,2016-01-14 09:22:00,0,1,I'm at Expo MRT Station (CG1/DT35) - @smrt_singapore in Singapore https://www. swarmapp.com/c/j5whZgBsLOL,,@smrt_singapore,,687444616199692288,https://twitter.com/YongsukHur/status/687444616199692288,expo mrt station,expo mrt
darrenLTA,2016-01-14 09:22:00,0,0,I'm at Tampines MRT Station (EW2/DT32) - @smrt_singapore in Singapore https://www. swarmapp.com/c/bWIp9Aqh7Rg,,@smrt_singapore,,687444601750335488,https://twitter.com/darrenLTA/status/687444601750335488,tampines mrt station,tampines
darrenLTA,2016-01-14 09:22:00,0,0,I'm at Tampines Mall in Singapore https://www. swarmapp.com/darrenlta/chec kin/5696f85d498e8eeab0ab6259?s=sPLYFtWREQ8BOn4O6_P9vpehEGo&ref=tw …,,,,687444735737368576,https://twitter.com/darrenLTA/status/687444735737368576,tampines mrt station,tampines
podchaporn,2016-01-14 09:22:00,0,1,"【SALE】ONE OK ROCK 2016 ""35xxxv"" LIVE IN SINGAPORE Ticket is 2,300฿ [S$90]. Event date Sat, 23 Jan 2016 8:00 pm. at Fort Canning Park.",,,,687444741982519296,https://twitter.com/podchaporn/status/687444741982519296,fort canning mrt station,fort canning
YongsukHur,2016-01-14 09:22:00,0,1,I'm at Tanah Merah MRT Interchange (EW4) - @smrt_singapore in Singapore https://www. swarmapp.com/c/fu5JROY2QEC,,@smrt_singapore,,687444528073183232,https://twitter.com/YongsukHur/status/687444528073183232,tanah merah mrt station,tanah merah
PhamNguyenly,2016-01-14 09:23:00,0,1,Get fit at new Bedok mixed business park - AsiaOne http:// goo.gl/fb/cZQrgW,,,,687444829878509568,https://twitter.com/PhamNguyenly/status/687444829878509568,bedok mrt station,bedok
amirah_jailani,2016-01-14 09:23:00,0,0,Dari kecik abah bawak makan kt sni. #alone (@gerai no 10 jalan besar kulai) https://www. swarmapp.com/c/j7vbhF9ubZ0,,@gerai,#alone,687444785855107072,https://twitter.com/amirah_jailani/status/687444785855107072,jalan besar mrt station,jalan besar
SAFRAsg,2016-01-14 09:24:00,0,0,"President SAFRA, Mr Ong, is with us this morning to take a tour of our upcoming SAFRA Punggol … https://www. instagram.com/p/BAgDr4sR_oJ/",,,,687445066948935680,https://twitter.com/SAFRAsg/status/687445066948935680,punggol mrt station,punggol
Justissoh,2016-01-14 09:25:00,0,0,I'm at Jalan Besar Town Council w/ @josefwong_ https://www. swarmapp.com/c/feoHJ5hSWU2,,@josefwong_,,687445327406886912,https://twitter.com/Justissoh/status/687445327406886912,jalan besar mrt station,jalan besar
wngss_,2016-01-14 09:26:00,1,2,I'm at Paya Lebar MRT Interchange (EW8/CC9) - @smrt_singapore in Singapore https://www. swarmapp.com/c/hPoE7ebjlQv,,@smrt_singapore,,687445549272952832,https://twitter.com/wngss_/status/687445549272952832,paya lebar mrt station,paya lebar
dumbpen,2016-01-14 09:26:00,0,0,"Don't envy, my weekend starts today. First off, head to Tampines Round Market for breakfast.",,,,687445591794651136,https://twitter.com/dumbpen/status/687445591794651136,tampines mrt station,tampines
hovsjovs,2016-01-14 09:27:00,0,0,THAT'S how you know you're in one-north .,,,,687446002966503425,https://twitter.com/hovsjovs/status/687446002966503425,one-north mrt station,one-north
sinandservice,2016-01-14 09:27:00,0,0,All the best to those competing in #SingaporeCanoeMarathon this weekend! #throwback @Punggol … https://www. instagram.com/p/BAgEGQuLbBG/,,@Punggol,#SingaporeCanoeMarathon #throwback,687445970599198720,https://twitter.com/sinandservice/status/687445970599198720,punggol mrt station,punggol
petitejo_,2016-01-14 09:27:00,0,1,"I'm at Ang Mo Kio Swimming Complex in Ang Mo Kio , Singapore https://www. swarmapp.com/c/a5kRTWbzua0",,,,687445859513032704,https://twitter.com/petitejo_/status/687445859513032704,ang mo kio mrt station,ang mo kio
susanti_ega,2016-01-14 09:27:00,0,0,Bismillah smoga sidang proposalnya berakhir hari ni @Tanah Merah Binjai https://www. instagram.com/p/BAgEA7dG8Gq/,,@Tanah,,687445788851613698,https://twitter.com/susanti_ega/status/687445788851613698,tanah merah mrt station,tanah merah
AlcoholicDays,2016-01-14 09:28:00,0,0,@gnivix you go back simei ??,,@gnivix,,687446033425534976,https://twitter.com/AlcoholicDays/status/687446033425534976,simei mrt station,simei
electrikrayons,2016-01-14 09:29:00,0,0,"When the train passes from City Hall to Raffles Place , I lost all connectivity.",,,,687446327618191362,https://twitter.com/electrikrayons/status/687446327618191362,raffles place mrt station,raffles place
sexysexylexy,2016-01-14 09:29:00,0,0,Kent ridge why u gotta be so bloody far away,,,,687446391547772928,https://twitter.com/sexysexylexy/status/687446391547772928,kent ridge mrt station,kent ridge
StarTutor,2016-01-14 09:29:00,0,0,O4 AM tuition @553 Choa Chu Kang North 6. 4x2hrs/month. Preferred Gender: m. http:// startutor.sg/r:31179,,@553,,687446430416412673,https://twitter.com/StarTutor/status/687446430416412673,choa chu kang mrt station,choa chu kang
FadhliIssa,2016-01-14 09:29:00,0,0,"I'm at Rumah Sewa Pelajar Dekan in Tanah Merah , Kedah https://www. swarmapp.com/c/gxaQf6nHbIH",,,,687446397554147330,https://twitter.com/FadhliIssa/status/687446397554147330,tanah merah mrt station,tanah merah
mcnallyrobinson,2016-01-14 09:30:00,0,4,"Congrats to Sophie Blackall & Lindsay Mattick, winners of the 2016 Randolph Caldecott Medal for #FindingWinnie ! http://www. ctvnews.ca/entertainment/ children-s-book-on-winnie-the-pooh-wins-caldecott-prize-1.2733526 …",,,#FindingWinnie,687446619487350784,https://twitter.com/mcnallyrobinson/status/687446619487350784,caldescott mrt station,caldescott
AuLacViet,2016-01-14 09:31:00,0,1,The changing face of Tanjong Pagar http:// goo.gl/fb/zaTcY6,,,,687447006869078016,https://twitter.com/AuLacViet/status/687447006869078016,tanjong pagar mrt station,tanjong pagar
GoForLocation,2016-01-14 09:31:00,0,0,"Hey, Koreatown: Get fit at new Bedok mixed business park",,,,687446852778602496,https://twitter.com/GoForLocation/status/687446852778602496,bedok mrt station,bedok
STsportsdesk,2016-01-14 09:32:00,20,6,Jermaine Pennant ( @pennant83 ) to sign for Tampines Rovers ( @mightystags ) in 1-year deal. http:// str.sg/ZH9Z pic.twitter.com/z2auBOn6cZ,,@pennant83 @mightystags,,687447093133225984,https://twitter.com/STsportsdesk/status/687447093133225984,tampines mrt station,tampines
ninianpoetree,2016-01-14 09:32:00,0,1,@mcnallyrobinson @CTVNews my students voted it the winner in our Mock Caldecott this week!,,@mcnallyrobinson @CTVNews,,687447134979788800,https://twitter.com/ninianpoetree/status/687447134979788800,caldescott mrt station,caldescott
Ferrisfrancis,2016-01-14 09:33:00,0,0,STRAIGHT OUTTA BOONLAY,,,,687447391092396032,https://twitter.com/Ferrisfrancis/status/687447391092396032,boon lay mrt station,boon lay
_NURAISA,2016-01-14 09:33:00,0,2,I'm at Choa Chu Kang MRT/LRT Interchange (NS4/BP1) - @smrt_singapore in Singapore https://www. swarmapp.com/c/jNO0S9ck0wW,,@smrt_singapore,,687447388005482500,https://twitter.com/_NURAISA/status/687447388005482500,choa chu kang mrt station,choa chu kang
sdjyx,2016-01-14 09:34:00,0,1,"I'm at Bus Stop 78101 (Opp Downtown East) in Pasir Ris , Singapore https://www. swarmapp.com/c/7SnfM2TyqQ3",,,,687447738280226817,https://twitter.com/sdjyx/status/687447738280226817,pasir ris mrt station,pasir ris
Flavialaughs,2016-01-14 09:34:00,0,0,@jiahan26 @bavane_chand Don't forget Haw Par Villa ! HAHAHAH,,@jiahan26 @bavane_chand,,687447687206047744,https://twitter.com/Flavialaughs/status/687447687206047744,haw par villa mrt station,haw par villa
AlvinTWK,2016-01-14 09:34:00,0,1,I'm at Punggol Flyover in Singapore https://www. swarmapp.com/c/bFkQU6nKfxw,,,,687447731145670656,https://twitter.com/AlvinTWK/status/687447731145670656,punggol mrt station,punggol
scoo_ps,2016-01-14 09:36:00,0,1,ASIAONE | Get fit at new Bedok mixed business park http:// bit.ly/1PYUEhO #sgnews pic.twitter.com/6eNWYuajJU,,,#sgnews,687448098763751425,https://twitter.com/scoo_ps/status/687448098763751425,bedok mrt station,bedok
scoopsg,2016-01-14 09:36:00,0,1,ASIAONE | Get fit at new Bedok mixed business park http:// bit.ly/1PYUEhO pic.twitter.com/pEwZveQlsN,,,,687448073694396416,https://twitter.com/scoopsg/status/687448073694396416,bedok mrt station,bedok
newsSG,2016-01-14 09:36:00,0,1,ASIAONE | Get fit at new Bedok mixed business park http:// bit.ly/1PYUEhO pic.twitter.com/nXJh7cDsgz,,,,687448073430159360,https://twitter.com/newsSG/status/687448073430159360,bedok mrt station,bedok
dcslimousines,2016-01-14 09:37:00,0,0,"Driving to Bedok , sharing real-time road info with wazers in my area. ETA 9:59 AM using @waze - Drive Social.",,@waze,,687448514796892161,https://twitter.com/dcslimousines/status/687448514796892161,bedok mrt station,bedok
dlSingapore,2016-01-14 09:37:00,0,1,"Get fit at new Bedok mixed business park: … of Decathlon Singapore, told My Paper. He noted that Bedok ... http:// bit.ly/1UQbYXw",,,,687448321137377280,https://twitter.com/dlSingapore/status/687448321137377280,bedok mrt station,bedok
wngss_,2016-01-14 09:38:00,0,1,I'm at Tanah Merah MRT Interchange (EW4) - @smrt_singapore in Singapore w/ @xiujinxoxo https://www. swarmapp.com/c/bG5wj9a8ZEV,,@smrt_singapore @xiujinxoxo,,687448628458303490,https://twitter.com/wngss_/status/687448628458303490,tanah merah mrt station,tanah merah
dailysingapore,2016-01-14 09:39:00,0,1,[News] Get fit at new Bedok mixed business park http:// bit.ly/1n0uZfC,,,,687448846050279424,https://twitter.com/dailysingapore/status/687448846050279424,bedok mrt station,bedok
sglatestnews,2016-01-14 09:39:00,0,1,#local #news Get fit at new Bedok mixed business park: BUY a piece of sports equipment and then swe... http:// bit.ly/1n0uZvU #singapore,,,#local #news #singapore,687448851578408960,https://twitter.com/sglatestnews/status/687448851578408960,bedok mrt station,bedok
HexCube,2016-01-14 09:41:00,0,1,想吃laksa结果找到了和前天一样的店家。肯定是那天看到店面等打包的时候被埋下了种子。 (@Tanjong Pagar Plaza Market & Food Centre in Singapore) https://www. swarmapp.com/c/2VLji7dKkxz,,@Tanjong,,687449372829827073,https://twitter.com/HexCube/status/687449372829827073,tanjong pagar mrt station,tanjong pagar
tyahmere,2016-01-14 09:41:00,0,0,"I'm at Taman Al Imran in Tanah Merah , kelantan https://www. swarmapp.com/c/9XJrilhW2Hu",,,,687449332275122176,https://twitter.com/tyahmere/status/687449332275122176,tanah merah mrt station,tanah merah
