username,date,retweets,favorites,text,geo,mentions,hashtags,id,permalink,place,key
husnaazmin,2016-01-14 15:04:00,0,0,Pukul 3 dah sampai tanah merah . Wohooo. cekap dan berkesan betul drebar bas ni,,,,687530759452659712,https://twitter.com/husnaazmin/status/687530759452659712,tanah merah mrt station,tanah merah
verma_bishan,2016-01-14 15:04:00,0,0,"Sometimes odd, sometimes even… this impulsive drama queen is not meant to be a leader! #LootJhootKejriwal",,,#LootJhootKejriwal,687530737516478464,https://twitter.com/verma_bishan/status/687530737516478464,bishan mrt station,bishan
verma_bishan,2016-01-14 15:05:00,0,0,"Delhi ko toh sambhalna seekh le, phir Punjab ke baare mein sochna. #LootJhootKejriwal",,,#LootJhootKejriwal,687530902142894080,https://twitter.com/verma_bishan/status/687530902142894080,bishan mrt station,bishan
HSR_Property,2016-01-14 15:05:00,0,0,GuocoLand tops out the $3.2b Tanjong Pagar Centre http:// fb.me/58vPDsgjq,,,,687530889413324801,https://twitter.com/HSR_Property/status/687530889413324801,tanjong pagar mrt station,tanjong pagar
verma_bishan,2016-01-14 15:06:00,0,0,"Delhi ko toh sambhalna seekh le, phir Punjab ke baare mein sochna. #LootJhootKejriwal",,,#LootJhootKejriwal,687531311037202432,https://twitter.com/verma_bishan/status/687531311037202432,bishan mrt station,bishan
ahpaopao,2016-01-14 15:07:00,0,0,I'm at Yew Tee MRT Station (NS5) - @smrt_singapore in Singapore https://www. swarmapp.com/c/dRCgRhF9MVO,,@smrt_singapore,,687531586175238144,https://twitter.com/ahpaopao/status/687531586175238144,yew tee mrt station,yew tee
verma_bishan,2016-01-14 15:07:00,0,0,"Dilli ka khazana khalli kar ke, ab yeh Punjab ka khazaana khali karne ki soch raha hai. #LootJhootKejriwal",,,#LootJhootKejriwal,687531468839501824,https://twitter.com/verma_bishan/status/687531468839501824,bishan mrt station,bishan
verma_bishan,2016-01-14 15:07:00,0,0,"When his own party leaders like phoolka have left, how does he expect people to support him? #LootJhootKejriwal",,,#LootJhootKejriwal,687531575894884352,https://twitter.com/verma_bishan/status/687531575894884352,bishan mrt station,bishan
_yummiii_,2016-01-14 15:07:00,0,0,"I'm at Blk 101 Ang Mo Kio Ave 3 in Ang Mo Kio , Singapore https://www. swarmapp.com/c/bsSrryE1un3",,,,687531525445955584,https://twitter.com/_yummiii_/status/687531525445955584,ang mo kio mrt station,ang mo kio
kingjiwontrash,2016-01-14 15:07:00,0,0,Changi Airport ?!?! Isn't in Singapore or idk https:// twitter.com/rememberselu/s tatus/687219770123399168 …,,,,687531388321452032,https://twitter.com/kingjiwontrash/status/687531388321452032,changi airport mrt station,changi airport
hazematefali,2016-01-14 15:07:00,0,0,"احتلّ مطار ""سنغافورة شانغي"" Singapore Changi airport المرتبة الأولى كأفضل مطار في العالم لعام 2015 وذلك للسنة... http:// fb.me/4NqklMbUV",,,,687531539282919424,https://twitter.com/hazematefali/status/687531539282919424,changi airport mrt station,changi airport
erislimx,2016-01-14 15:08:00,0,0,I'm at Punggol Bus Interchange in Singapore https://www. swarmapp.com/c/21Aps1QbueM,,,,687531738877313024,https://twitter.com/erislimx/status/687531738877313024,punggol mrt station,punggol
krystalang,2016-01-14 15:08:00,0,0,Someday I'll try taking 10 directly between tampines and nus... Today is not that day.,,,,687531607180193792,https://twitter.com/krystalang/status/687531607180193792,tampines mrt station,tampines
verma_bishan,2016-01-14 15:08:00,0,0,"CM candidate bhi nahi milla, vote kaise milenge? #LootJhootKejriwal",,,#LootJhootKejriwal,687531640009011201,https://twitter.com/verma_bishan/status/687531640009011201,bishan mrt station,bishan
nxtxlietxn,2016-01-14 15:08:00,0,0,I'm at Boon Lay MRT Station (EW27) - @smrt_singapore in Singapore https://www. swarmapp.com/c/lp7R8Np2t3d,,@smrt_singapore,,687531745659502592,https://twitter.com/nxtxlietxn/status/687531745659502592,boon lay mrt station,boon lay
find_a_nanny,2016-01-14 15:08:00,0,0,Nanny needed in Hougang (From March 2016) http:// fb.me/7Ti5zen6O,,,,687531764055670784,https://twitter.com/find_a_nanny/status/687531764055670784,hougang mrt station,hougang
verma_bishan,2016-01-14 15:08:00,0,0,"If he can ruin the nation’s name by calling our PM a psychopath & coward, how can he build the goodwill of any state? #LootJhootKejriwal",,,#LootJhootKejriwal,687531717909819392,https://twitter.com/verma_bishan/status/687531717909819392,bishan mrt station,bishan
erislimx,2016-01-14 15:08:00,0,0,I'm at Punggol MRT/LRT Interchange (NE17/PTC) in Singapore https://www. swarmapp.com/c/iMrZY6rSocW,,,,687531840048087040,https://twitter.com/erislimx/status/687531840048087040,punggol mrt station,punggol
verma_bishan,2016-01-14 15:08:00,0,0,Punjab mein rahega hee nahi toh kaam kya karega? #LootJhootKejriwal,,,#LootJhootKejriwal,687531804232826882,https://twitter.com/verma_bishan/status/687531804232826882,bishan mrt station,bishan
leonardxia,2016-01-14 15:08:00,0,0,I'm at Bedok MRT Station (EW5) - @smrt_singapore in Singapore https://www. swarmapp.com/c/0B26Q5b4Uwo,,@smrt_singapore,,687531727816908801,https://twitter.com/leonardxia/status/687531727816908801,bedok mrt station,bedok
verma_bishan,2016-01-14 15:09:00,0,0,He’s not looking to administer Punjab but to Loot its wealth. #LootJhootKejriwal,,,#LootJhootKejriwal,687531881974267904,https://twitter.com/verma_bishan/status/687531881974267904,bishan mrt station,bishan
drWilda,2016-01-14 15:09:00,0,0,"'Last Stop On Market Street' Wins Newbery Medal, 'Finding Winnie' Takes Caldecott http:// fb.me/3v10mAZeP",,,,687531906980696064,https://twitter.com/drWilda/status/687531906980696064,caldescott mrt station,caldescott
verma_bishan,2016-01-14 15:09:00,0,0,#LootJhootKejriwal pic.twitter.com/hH2uytKnhs,,,#LootJhootKejriwal,687532037389979648,https://twitter.com/verma_bishan/status/687532037389979648,bishan mrt station,bishan
verma_bishan,2016-01-14 15:10:00,0,0,#LootJhootKejriwal pic.twitter.com/HZXR3LbCaR,,,#LootJhootKejriwal,687532136908197888,https://twitter.com/verma_bishan/status/687532136908197888,bishan mrt station,bishan
verma_bishan,2016-01-14 15:10:00,0,0,#LootJhootKejriwal pic.twitter.com/BU2uwtlM1I,,,#LootJhootKejriwal,687532213731110912,https://twitter.com/verma_bishan/status/687532213731110912,bishan mrt station,bishan
Nezana,2016-01-14 15:10:00,0,0,I'm at Yew Tee Industrial Estate in Singapore https://www. swarmapp.com/c/d2T9RP2jKVQ,,,,687532261391097856,https://twitter.com/Nezana/status/687532261391097856,yew tee mrt station,yew tee
verma_bishan,2016-01-14 15:10:00,0,0,#LootJhootKejriwal pic.twitter.com/ZXtC5GDzse,,,#LootJhootKejriwal,687532286749704192,https://twitter.com/verma_bishan/status/687532286749704192,bishan mrt station,bishan
verma_bishan,2016-01-14 15:11:00,0,0,#LootJhootKejriwal,,,#LootJhootKejriwal,687532503884632064,https://twitter.com/verma_bishan/status/687532503884632064,bishan mrt station,bishan
joel_lwf,2016-01-14 15:11:00,0,0,I'm at Tampines Expressway (TPE) - @ltasg in Singapore https://www. swarmapp.com/c/anKSWExfoFf,,@ltasg,,687532368916262912,https://twitter.com/joel_lwf/status/687532368916262912,tampines mrt station,tampines
verma_bishan,2016-01-14 15:11:00,0,0,#LootJhootKejriwal pic.twitter.com/pnZeSZ3aeH,,,#LootJhootKejriwal,687532350134063104,https://twitter.com/verma_bishan/status/687532350134063104,bishan mrt station,bishan
verma_bishan,2016-01-14 15:11:00,0,0,#LootJhootKejriwal pic.twitter.com/qldGaZzlyV,,,#LootJhootKejriwal,687532488588001280,https://twitter.com/verma_bishan/status/687532488588001280,bishan mrt station,bishan
verma_bishan,2016-01-14 15:11:00,0,0,#LootJhootKejriwal pic.twitter.com/J9Rx77Qlor,,,#LootJhootKejriwal,687532584922841088,https://twitter.com/verma_bishan/status/687532584922841088,bishan mrt station,bishan
verma_bishan,2016-01-14 15:12:00,0,0,Dharne ka raja kahan se Punjab ko raj karne nikla hai #LootJhootKejriwal,,,#LootJhootKejriwal,687532630749757440,https://twitter.com/verma_bishan/status/687532630749757440,bishan mrt station,bishan
daisydcrawford,2016-01-14 15:12:00,0,1,"#sg #jobinfo INSTRUCTORS – $1,800-2,500 / PASSION IN TEACHING / HOUGANG MRT – RecruitPlus ... http:// bit.ly/1W9MXrE #work in #singapore",,,#sg #jobinfo #work #singapore,687532801478934528,https://twitter.com/daisydcrawford/status/687532801478934528,hougang mrt station,hougang
_kcxy,2016-01-14 15:12:00,0,0,I'm at Tampines Mall in Singapore w/ @_jtwh @_skullx https://www. swarmapp.com/c/3RwpCfny71A,,@_jtwh @_skullx,,687532717328699392,https://twitter.com/_kcxy/status/687532717328699392,tampines mrt station,tampines
xchermieee,2016-01-14 15:13:00,0,0,I'm at Admiralty MRT Station (NS10) in Singapore https://www. swarmapp.com/c/9sYyLXuUQGY,,,,687532949693165568,https://twitter.com/xchermieee/status/687532949693165568,admiralty mrt station,admiralty mrt
WhyS_o_Serious,2016-01-14 15:13:00,0,0,@SuhailaHassan ok boonlay near batok,,@SuhailaHassan,,687533025563774977,https://twitter.com/WhyS_o_Serious/status/687533025563774977,boon lay mrt station,boon lay
erislimx,2016-01-14 15:13:00,0,0,I'm at Blk 207C Punggol Place in Singapore https://www. swarmapp.com/c/bVIAjzlHZ05,,,,687532904772153344,https://twitter.com/erislimx/status/687532904772153344,punggol mrt station,punggol
verma_bishan,2016-01-14 15:14:00,0,0,"Aam banne ka dhong ab or nhi chalega, aam aadmi ko lutna aur bewakoof bnana bandh karo #LootJhootKejriwal",,,#LootJhootKejriwal,687533102747418624,https://twitter.com/verma_bishan/status/687533102747418624,bishan mrt station,bishan
ThePoorTraveler,2016-01-14 15:14:00,0,0,"Tanjong Rhu Beach: Missing the Blues in Langkawi, Malaysia http:// bit.ly/VUUxpr",,,,687533130102616064,https://twitter.com/ThePoorTraveler/status/687533130102616064,tanjong rhu mrt station,tanjong rhu
Aicilefthm,2016-01-14 15:15:00,0,0,I'm at Edgefield Secondary Canteen in 36 Punggol Field https://www. swarmapp.com/c/8zhsBwX5Q6S,,,,687533461771563008,https://twitter.com/Aicilefthm/status/687533461771563008,punggol mrt station,punggol
verma_bishan,2016-01-14 15:15:00,0,0,Punjab mein rahega hee nahi toh kaam kya karega? #LootJhootKejriwa,,,#LootJhootKejriwa,687533494960963584,https://twitter.com/verma_bishan/status/687533494960963584,bishan mrt station,bishan
paul_gill15,2016-01-14 15:15:00,0,0,@priscias whereabouts. Nothing here at Pasir Ris … :(,,@priscias,,687533369295425538,https://twitter.com/paul_gill15/status/687533369295425538,pasir ris mrt station,pasir ris
reeenyy_,2016-01-14 15:16:00,0,0,I'm at Tampines Medical Centre in Singapore https://www. swarmapp.com/c/iSZ7Fmj3qZJ,,,,687533609599762433,https://twitter.com/reeenyy_/status/687533609599762433,tampines mrt station,tampines
verma_bishan,2016-01-14 15:16:00,0,0,Punjabiyon ka dil jitney ke liye ‘Dharna’ se jyaada karna padega #LootJhootKejriwal,,,#LootJhootKejriwal,687533825560190976,https://twitter.com/verma_bishan/status/687533825560190976,bishan mrt station,bishan
xchermieee,2016-01-14 15:17:00,0,0,I'm at Sembawang MRT Station (NS11) in Singapore https://www. swarmapp.com/c/1OIM1JvZInO,,,,687534045614452736,https://twitter.com/xchermieee/status/687534045614452736,sembawang mrt station,sembawang
eugenenitic,2016-01-14 15:17:00,0,0,I never expect that tampines has changed so much hmmm,,,,687534034105139200,https://twitter.com/eugenenitic/status/687534034105139200,tampines mrt station,tampines
TheAngsty,2016-01-14 15:17:00,0,1,I'm at Bus Stop 44159 ( Bukit Batok Fire Stn) in Singapore https://www. swarmapp.com/c/brENTlWXKFS,,,,687533880505667585,https://twitter.com/TheAngsty/status/687533880505667585,bukit batok mrt station,bukit batok
GiantRobot7,2016-01-14 15:18:00,0,1,"Singapore's tallest 290 meters TANJONG PAGAR to finish this yr, to be pipped by Thailand's tallest MAHANAKHON 314 m pic.twitter.com/Wf3tTeX4lw",,,,687534267073695744,https://twitter.com/GiantRobot7/status/687534267073695744,tanjong pagar mrt station,tanjong pagar
verma_bishan,2016-01-14 15:18:00,0,0,#LootJhootKejriwal pic.twitter.com/utL9eTUKKr,,,#LootJhootKejriwal,687534116871356416,https://twitter.com/verma_bishan/status/687534116871356416,bishan mrt station,bishan
verma_bishan,2016-01-14 15:18:00,0,0,#LootJhootKejriwal pic.twitter.com/ZTg3eYfudU,,,#LootJhootKejriwal,687534315064799232,https://twitter.com/verma_bishan/status/687534315064799232,bishan mrt station,bishan
JJayLin,2016-01-14 15:18:00,0,0,ooooo hougang mall got manhattan fish market. PLUS THIS GROUPON FOR $6 fish n chips https://www. groupon.sg/deals/singapor e/the-manhattan-fish-market-10-27/721221719 …,,,,687534228142034944,https://twitter.com/JJayLin/status/687534228142034944,hougang mrt station,hougang
verma_bishan,2016-01-14 15:19:00,0,0,"आदमी की औकात तभी पता चल जाती है जब वो कहता है ""मैं अरविन्द केजरीवाल बोल रहा हूँ जी, फोन मत काटना।"" #LootJhootKejriwal",,,#LootJhootKejriwal,687534418580262912,https://twitter.com/verma_bishan/status/687534418580262912,bishan mrt station,bishan
joel_lwf,2016-01-14 15:19:00,0,0,I'm at Pasir Ris in Singapore https://www. swarmapp.com/c/kZrHuEdZYdv,,,,687534487262093312,https://twitter.com/joel_lwf/status/687534487262093312,pasir ris mrt station,pasir ris
verma_bishan,2016-01-14 15:20:00,0,0,Kejriwal ignored proofs of Jarnail singh’s support and demand for khalistan. Don’t break Punjab. Go Away Kejriwal #LootJhootKejriwal,,,#LootJhootKejriwal,687534769320546306,https://twitter.com/verma_bishan/status/687534769320546306,bishan mrt station,bishan
Calchubz,2016-01-14 15:20:00,0,0,On the way to Buona Vista,,,,687534843895255040,https://twitter.com/Calchubz/status/687534843895255040,buona vista mrt station,buona vista
verma_bishan,2016-01-14 15:20:00,0,0,#LootJhootKejriwal : 526 crore advertising budget to tell more lies. Go back Kejriwal. Punjab doesn’t need lies.,,,#LootJhootKejriwal,687534740644073472,https://twitter.com/verma_bishan/status/687534740644073472,bishan mrt station,bishan
verma_bishan,2016-01-14 15:20:00,0,0,#LootJhootKejriwal : 526 crore Ad budget for Delhi. Now their next target is Punjab. Beware Punjab!!,,,#LootJhootKejriwal,687534711053225984,https://twitter.com/verma_bishan/status/687534711053225984,bishan mrt station,bishan
FareedAkel,2016-01-14 15:20:00,0,0,(@Bandar Tanah Merah ) https://www. swarmapp.com/c/7LWmpowhMQz,,@Bandar,,687534839726247936,https://twitter.com/FareedAkel/status/687534839726247936,tanah merah mrt station,tanah merah
TiffanyKAhYing,2016-01-14 15:20:00,0,0,Tonight gonna go Pasir ris fetch my Bbg,,,,687534684457185280,https://twitter.com/TiffanyKAhYing/status/687534684457185280,pasir ris mrt station,pasir ris
ReadersGazette,2016-01-14 15:20:00,9,2,Latest Book News... Story of real Winnie-the-Pooh wins Caldecott http:// readersgazette.com/news/day/103125 #books #novels,,,#books #novels,687534621462888449,https://twitter.com/ReadersGazette/status/687534621462888449,caldescott mrt station,caldescott
urnotwelcome,2016-01-14 15:21:00,0,1,First time taking Downtown line | #solo #trainlines #sg #Singapore @Bugis Station Downtown… https://www. instagram.com/p/BAgsnj9p-RL/,,@Bugis,#solo #trainlines #sg #Singapore,687535076398227456,https://twitter.com/urnotwelcome/status/687535076398227456,bugis mrt station,bugis station
BrunoPornic44,2016-01-14 15:21:00,0,0,Singapour : le parc Gardens by the Bay http:// bc44.eklablog.com/singapour-le-p arc-gardens-by-the-bay-a108929262 …,,,,687534936878874624,https://twitter.com/BrunoPornic44/status/687534936878874624,gardens by the bay mrt station,gardens by the bay
verma_bishan,2016-01-14 15:22:00,0,0,Surinder Singh of AAP convicted for assaulting an NDMC employee. We don’t want criminals in Punjab #LootJhootKejriwal,,,#LootJhootKejriwal,687535267213791232,https://twitter.com/verma_bishan/status/687535267213791232,bishan mrt station,bishan
adorekyu,2016-01-14 15:22:00,0,0,"@ryeowookyy just drop by potong pasir , u can meet me :))",,@ryeowookyy,,687535208883556352,https://twitter.com/adorekyu/status/687535208883556352,potong pasir mrt station,potong pasir
verma_bishan,2016-01-14 15:23:00,0,0,#LootJhootKejriwal Manoj Kumar of AAP convicted for fraud and land grab and they talk of honesty. We don’t want corrupt AAP.,,,#LootJhootKejriwal,687535387766472705,https://twitter.com/verma_bishan/status/687535387766472705,bishan mrt station,bishan
verma_bishan,2016-01-14 15:23:00,0,0,Akhilesh Tripathi of AAP Convicted for rioting and criminal intimidation in 2013. Where is the honesty?? #LootJhootKejriwal,,,#LootJhootKejriwal,687535479068049408,https://twitter.com/verma_bishan/status/687535479068049408,bishan mrt station,bishan
Danielgjax_,2016-01-14 15:23:00,0,0,I'm at Hougang Green Shopping Mall in Singapore https://www. swarmapp.com/c/k32gVUsRzEG,,,,687535382544650240,https://twitter.com/Danielgjax_/status/687535382544650240,hougang mrt station,hougang
STcom,2016-01-14 15:23:00,6,9,"Aljunied MP Pritam Singh recovers from dengue, will attend Parliament on Friday. http:// str.sg/ZH9v pic.twitter.com/aF5eQdZwe5",,,,687535480515067904,https://twitter.com/STcom/status/687535480515067904,aljunied mrt station,aljunied
skyeangchee,2016-01-14 15:24:00,0,0,I'm at Jurong East in Singapore https://www. swarmapp.com/c/4KBOVePVeaQ,,,,687535821264674816,https://twitter.com/skyeangchee/status/687535821264674816,jurong east mrt station,jurong east
verma_bishan,2016-01-14 15:24:00,0,0,AAP protecting the heinous criminals #nirbhaya #ashamed #LootJhootKejriwal,,,#nirbhaya #ashamed #LootJhootKejriwal,687535642608181248,https://twitter.com/verma_bishan/status/687535642608181248,bishan mrt station,bishan
verma_bishan,2016-01-14 15:25:00,0,0,Encouraging criminals by providing financial suport to the rapist of Nirbhaya.We wnt Punjabi women safe.Sty awy Kejriwal. #LootJhootKejriwal,,,#LootJhootKejriwal,687535930618417152,https://twitter.com/verma_bishan/status/687535930618417152,bishan mrt station,bishan
verma_bishan,2016-01-14 15:25:00,0,0,"no base, no orientation, no leadership. Only bunch of morons trying to confuse people . #LootJhootKejriwal",,,#LootJhootKejriwal,687536054673354752,https://twitter.com/verma_bishan/status/687536054673354752,bishan mrt station,bishan
verma_bishan,2016-01-14 15:25:00,0,0,#oddevenmadness what has logic got to do with what kejriwal does? #LootJhootKejriwal,,,#oddevenmadness #LootJhootKejriwal,687536109375508480,https://twitter.com/verma_bishan/status/687536109375508480,bishan mrt station,bishan
StarTutor,2016-01-14 15:26:00,0,0,"O4 EL,CHEM tuition @395 Bukit Batok West Ave 5. 4x2hrs/month. http:// startutor.sg/r:31166",,@395,,687536142409809920,https://twitter.com/StarTutor/status/687536142409809920,bukit batok mrt station,bukit batok
verma_bishan,2016-01-14 15:26:00,0,0,Kejriwal renged. First he calls Modi Psychopath then pleads for his help. #LootJhootKejriwal,,,#LootJhootKejriwal,687536212320452609,https://twitter.com/verma_bishan/status/687536212320452609,bishan mrt station,bishan
kinlian,2016-01-14 15:26:00,0,0,I operate in Midview City which is in Sin Ming. I just learned that there is a Midview Building in Bukit Batok .... http:// fb.me/zZ3k6p89,,,,687536361742675968,https://twitter.com/kinlian/status/687536361742675968,bukit batok mrt station,bukit batok
StarTutor,2016-01-14 15:26:00,0,0,"O4 EL,MA tuition @101 Pasir Ris St 12. 8x1.5hrs/month. Preferred Gender: f. http:// startutor.sg/r:31168",,@101,,687536154288111616,https://twitter.com/StarTutor/status/687536154288111616,pasir ris mrt station,pasir ris
verma_bishan,2016-01-14 15:26:00,0,0,I hope God is not there in Kejriwal’s blame list. #LootJhootKejriwal,,,#LootJhootKejriwal,687536292087767041,https://twitter.com/verma_bishan/status/687536292087767041,bishan mrt station,bishan
ChampionTutor5,2016-01-14 15:27:00,0,0,Intermediate English tuition @294 Choa Chu Kang Ave 2. 8 x 2hrs/month http:// bit.ly/201F61o,,@294,,687536558186954752,https://twitter.com/ChampionTutor5/status/687536558186954752,choa chu kang mrt station,choa chu kang
daphnnnnn,2016-01-14 15:28:00,0,0,I'm at Choa Chu Kang MRT/LRT Interchange (NS4/BP1) - @smrt_singapore in Singapore https://www. swarmapp.com/c/8BsFoU7CD4r,,@smrt_singapore,,687536860990730240,https://twitter.com/daphnnnnn/status/687536860990730240,choa chu kang mrt station,choa chu kang
LEHCHEL,2016-01-14 15:28:00,0,1,I mean seriously who will spend $19 on a 15 min trip from Tampines to Taiseng?! Not me. Daylight robbery prices. Switching to Uber for good.,,,,687536799476928513,https://twitter.com/LEHCHEL/status/687536799476928513,tampines mrt station,tampines
Mediacorp_Suria,2016-01-14 15:28:00,0,1,SAFRA PUNGGOL DIBUKA KEPADA UMUM APRIL INI: Salah satu ciri menarik adalah taman permainan air tertutup Singapura... http:// fb.me/4bqJXlxL6,,,,687536772348116992,https://twitter.com/Mediacorp_Suria/status/687536772348116992,punggol mrt station,punggol
BERITAMediaCorp,2016-01-14 15:28:00,0,0,SAFRA PUNGGOL DIBUKA KEPADA UMUM APRIL INI: Salah satu ciri menarik adalah taman permainan air tertutup Singapura... http:// fb.me/3jfbAgGg6,,,,687536631847366658,https://twitter.com/BERITAMediaCorp/status/687536631847366658,punggol mrt station,punggol
Rethzxc,2016-01-14 15:29:00,0,0,I'm at Hougang Mall in Singapore w/ @handsomefatnick https://www. swarmapp.com/c/0HxFFvNxoL0,,@handsomefatnick,,687537090322673664,https://twitter.com/Rethzxc/status/687537090322673664,hougang mrt station,hougang
Handsomefatnick,2016-01-14 15:29:00,0,0,I'm at Hougang Mall in Singapore https://www. swarmapp.com/c/2pjK7wF54j6,,,,687537024883113984,https://twitter.com/Handsomefatnick/status/687537024883113984,hougang mrt station,hougang
BOL_NEWS1,2016-01-14 15:29:00,0,0,Today in 1977 at Chennai: Bishan Singh Bedi became the first Indian bowler to take 200 Test wickets when he claimed the wicket of Tony Greig,,,,687536933933694978,https://twitter.com/BOL_NEWS1/status/687536933933694978,bishan mrt station,bishan
junjie_96,2016-01-14 15:29:00,0,0,I'm at @ClarkeQuay in Singapore https://www. swarmapp.com/c/a9asAvSEo7J,,@ClarkeQuay,,687537067572723712,https://twitter.com/junjie_96/status/687537067572723712,clarke quay mrt station,clarke quay
badoquecafe,2016-01-14 15:29:00,0,0,"Where exactly are we at #upperthomson ? We're closer to Sin Ming Rd, and on the same stretch as Prata House,... http:// fb.me/7A0vmLtbQ",,,#upperthomson,687537038418141184,https://twitter.com/badoquecafe/status/687537038418141184,upper thomson mrt station,upper thomson
WendyandCharles,2016-01-14 15:30:00,1,0,ReadersGazette: Latest Book News... Story of real Winnie-the-Pooh wins Caldecott http:// readersgazette.com/news/day/103125 #books #novels,,,#books #novels,687537307692482560,https://twitter.com/WendyandCharles/status/687537307692482560,caldescott mrt station,caldescott
tiredclub,2016-01-14 15:30:00,0,0,i'm gonna walk to clementi stn if the bus doesn't get here,,,,687537323685220352,https://twitter.com/tiredclub/status/687537323685220352,clementi mrt station,clementi stn
taufiqfaezah,2016-01-14 15:30:00,0,0,Last day in cr tomorrow. 2 weeks flies so fast. So back to tampines next week onwards.,,,,687537357650698240,https://twitter.com/taufiqfaezah/status/687537357650698240,tampines mrt station,tampines
heismint,2016-01-14 15:31:00,0,0,@sukaihan @senghwal @seokzi_ @chengzii @sugarstrike so meet at jurong east ?,,@sukaihan @senghwal @seokzi_ @chengzii @sugarstrike,,687537440249102337,https://twitter.com/heismint/status/687537440249102337,jurong east mrt station,jurong east
RyanFenix,2016-01-14 15:31:00,0,0,"With Jermaine Pennant signing for Tampines , that AFC Cup match on April 12 vs Schrock's Ceres looks like a must watch live game!",,,,687537614539243521,https://twitter.com/RyanFenix/status/687537614539243521,tampines mrt station,tampines
ahpaopao,2016-01-14 15:32:00,0,0,I'm at Choa Chu Kang ClubFITT Gym in Singapore https://www. swarmapp.com/c/8MJhepwHjqR,,,,687537865329369088,https://twitter.com/ahpaopao/status/687537865329369088,choa chu kang mrt station,choa chu kang
TwtBolaKelate,2016-01-14 15:33:00,6,3,"Khabarnya tiada friendly di Lembah Klang, kerana pada sabtu trw sudah pulang ke KB. Dan dijadual menentang Tampines Rovers pd ahad.",,,,687537914989813760,https://twitter.com/TwtBolaKelate/status/687537914989813760,tampines mrt station,tampines
junjie_96,2016-01-14 15:33:00,0,0,I'm at Clarke Quay Riverside in Singapore https://www. swarmapp.com/c/jb3zo8QNjWU,,,,687537914264305664,https://twitter.com/junjie_96/status/687537914264305664,clarke quay mrt station,clarke quay
PandaCloudCandy,2016-01-14 15:34:00,0,0,I'm at Yew Tee MRT Station (NS5) - @smrt_singapore in Singapore https://www. swarmapp.com/c/kQypNBshRue,,@smrt_singapore,,687538175619772416,https://twitter.com/PandaCloudCandy/status/687538175619772416,yew tee mrt station,yew tee
SBIcampaign,2016-01-14 15:35:00,0,2,The inaugural annual #marketing #Asia #conference will be held on 4th March 2016 at Crowne Plaza Hotel Changi Airport hotel ballroom.,,,#marketing #Asia #conference,687538508651626496,https://twitter.com/SBIcampaign/status/687538508651626496,changi airport mrt station,changi airport
tiffanyliim,2016-01-14 15:35:00,0,0,I'm at Bedok Bus Interchange - @sbs_transit in Singapore https://www. swarmapp.com/c/5oVlf0cGrUy,,@sbs_transit,,687538613882646528,https://twitter.com/tiffanyliim/status/687538613882646528,bedok mrt station,bedok
MadSkeelz,2016-01-14 15:36:00,0,0,@AFIQULnh kat Clarke quay Jon,,@AFIQULnh,,687538783667892225,https://twitter.com/MadSkeelz/status/687538783667892225,clarke quay mrt station,clarke quay
verma_bishan,2016-01-14 15:37:00,1,0,#oddevenmadness what has logic got to do with what kejriwal does? #LootJhootKejriwal #AAPKiDukaan,,,#oddevenmadness #LootJhootKejriwal #AAPKiDukaan,687539103106084864,https://twitter.com/verma_bishan/status/687539103106084864,bishan mrt station,bishan
