username,date,retweets,favorites,text,geo,mentions,hashtags,id,permalink,place,key
wahyuxxi,2015-12-27 11:21:00,0,1,@Icarahim send you kisses from bukit panjang,,@Icarahim,,680951568229781504,https://twitter.com/wahyuxxi/status/680951568229781504,bukit panjang mrt station,bukit panjang
bombiibii,2015-12-27 11:21:00,0,1,I can ji my earpiece in my ear from tamp to Tanah merah and it still won't stay in my ear lol,,,,680951674505007104,https://twitter.com/bombiibii/status/680951674505007104,tanah merah mrt station,tanah merah
ZaFZhafri,2015-12-27 11:22:00,0,0,Sarapan Besar @Blk 85 Bedok North Rd Hawker Centre https://www. instagram.com/p/_x636eE91Y/,,@Blk,,680951760870109185,https://twitter.com/ZaFZhafri/status/680951760870109185,bedok mrt station,bedok
itmaj_,2015-12-27 11:23:00,1,2,"@shabotan takpe kak beberape tahun di Aljunied tu pun dah bermakna, kan?",,@shabotan,,680952197081772033,https://twitter.com/itmaj_/status/680952197081772033,aljunied mrt station,aljunied
crookedxedge,2015-12-27 11:24:00,0,0,bukit panjang wei,,,,680952434206748672,https://twitter.com/crookedxedge/status/680952434206748672,bukit panjang mrt station,bukit panjang
_keiran1001,2015-12-27 11:25:00,0,0,Omg we just locked in marsiling sec,,,,680952660686548993,https://twitter.com/_keiran1001/status/680952660686548993,marsiling mrt station,marsiling
lynnylchan,2015-12-27 11:25:00,0,0,Rochor station has a bright green lift shaft. I thought it was a giant Milo ad.,,,,680952716449849344,https://twitter.com/lynnylchan/status/680952716449849344,rochor mrt station,rochor
Jvyennnnnnnnnn,2015-12-27 11:25:00,0,0,I'm at Changi Airport Terminal 1 - @fansofchangi in Singapore https://www. swarmapp.com/c/2QM04sDWulY,,@fansofchangi,,680952549176901633,https://twitter.com/Jvyennnnnnnnnn/status/680952549176901633,changi airport mrt station,changi airport
TsuyouKk,2015-12-27 11:26:00,0,1,In Gardens by the Bay #goodmorning to my lovely tsufriends!! Have a smile sunday!!xoxo 皆さん♪おはようございます(｡◕ ∀ ... http:// tsu.co/Konomin_K/1047 86833 …,,,#goodmorning,680952922381938689,https://twitter.com/TsuyouKk/status/680952922381938689,gardens by the bay mrt station,gardens by the bay
chriselemos,2015-12-27 11:27:00,0,0,Last night at Gardens by the Bay Christmas Wonderland #singapore #travel #asia @Gardens by the Bay https://www. instagram.com/p/_x7fBUI4WU/,,@Gardens,#singapore #travel #asia,680953107371716609,https://twitter.com/chriselemos/status/680953107371716609,gardens by the bay mrt station,gardens by the bay
itmaj_,2015-12-27 11:27:00,3,8,@arruumii @AmirAmri17boy Ahlan Amir ke madrasah Aljunied !,,@arruumii @AmirAmri17boy,,680953162153332736,https://twitter.com/itmaj_/status/680953162153332736,aljunied mrt station,aljunied
rnxwx,2015-12-27 11:28:00,0,0,I'm at Bedok Mall in Singapore https://www. swarmapp.com/c/9hySh86YwYN,,,,680953456895651841,https://twitter.com/rnxwx/status/680953456895651841,bedok mrt station,bedok
WidyaDF,2015-12-27 11:28:00,0,0,"Dec 14, 2015 - See The Glasshouse Behind? That's The Flower Dome. @Flower Dome, Gardens by the Bay https://www. instagram.com/p/_x7ln-Dlqx/",,@Flower,,680953335269191680,https://twitter.com/WidyaDF/status/680953335269191680,gardens by the bay mrt station,gardens by the bay
BrendenxTan,2015-12-27 11:30:00,0,0,I'm at Bukit Panjang Plaza in Singapore https://www. swarmapp.com/c/bRWU5IywdOi,,,,680953795690520576,https://twitter.com/BrendenxTan/status/680953795690520576,bukit panjang mrt station,bukit panjang
DJStarscreamx,2015-12-27 11:31:00,0,0,I'm at Singapore Changi Airport (SIN) - @fansofchangi in Singapore https://www. swarmapp.com/c/7hTMSpSHokL,,@fansofchangi,,680954114864451588,https://twitter.com/DJStarscreamx/status/680954114864451588,changi airport mrt station,changi airport
OrangIce,2015-12-27 11:31:00,0,0,Flying off in an x-wing fighter. @Singapore Changi Airport Terminal 3 Departure Hall https://www. instagram.com/p/_x77-_vDwD/,,@Singapore,,680954099781746688,https://twitter.com/OrangIce/status/680954099781746688,changi airport mrt station,changi airport
BenjaminTHW,2015-12-27 11:31:00,0,0,I'm at Bukit Panjang Methodist Church in Singapore https://www. swarmapp.com/c/jvijdygPZ1h,,,,680954248520073216,https://twitter.com/BenjaminTHW/status/680954248520073216,bukit panjang mrt station,bukit panjang
seito__simei,2015-12-27 11:32:00,0,0,飲み会にゃー,,,,680954379592019969,https://twitter.com/seito__simei/status/680954379592019969,simei mrt station,simei
seito__simei,2015-12-27 11:32:00,0,0,帰っだらお絵かきしよ,,,,680954453114003457,https://twitter.com/seito__simei/status/680954453114003457,simei mrt station,simei
seito__simei,2015-12-27 11:33:00,0,0,版権絵はやはり伸びやすいね,,,,680954588950745088,https://twitter.com/seito__simei/status/680954588950745088,simei mrt station,simei
seito__simei,2015-12-27 11:33:00,0,0,最近点数もコメントもあって嬉しい,,,,680954538229039104,https://twitter.com/seito__simei/status/680954538229039104,simei mrt station,simei
runningnumber,2015-12-27 11:34:00,0,0,Bedok Reservoir Touch and Go!!! My recent activity! - 9.04 km Running #health #sport #runs … http:// ift.tt/1QTkMNW pic.twitter.com/Ak40mF7eMN,,,#health #sport #runs,680954980052930560,https://twitter.com/runningnumber/status/680954980052930560,bedok mrt station,bedok
OrangIce,2015-12-27 11:34:00,0,0,Going home with a stormtrooper. @Singapore Changi Airport Terminal 3 Departure Hall https://www. instagram.com/p/_x8PqJvDwi/,,@Singapore,,680954775580610560,https://twitter.com/OrangIce/status/680954775580610560,changi airport mrt station,changi airport
RifkaHayati,2015-12-27 11:35:00,0,0,@Singapore Changi Airport https://www. instagram.com/p/_x8Z4sIrWIK8 s1G4a2Mj_w6D0ZhwX5zHz0nSs0/ …,,@Singapore,,680955134659006468,https://twitter.com/RifkaHayati/status/680955134659006468,changi airport mrt station,changi airport
BrianEmma2,2015-12-27 11:36:00,0,0,Outdoor golf links in favor of kids about preschool punggol : MgLOquqwn,,,,680955490243760129,https://twitter.com/BrianEmma2/status/680955490243760129,punggol mrt station,punggol
james_ikrat,2015-12-27 11:36:00,0,0,I'm at Expo MRT Station (CG1/DT35) - @smrt_singapore in Singapore https://www. swarmapp.com/c/2Z5rMmNsQmg,,@smrt_singapore,,680955345703849985,https://twitter.com/james_ikrat/status/680955345703849985,expo mrt station,expo mrt
ElynRay,2015-12-27 11:37:00,0,0,@_sarahidir I transferred to Punggol outlet. No more Bukit Merah.,,@_sarahidir,,680955758704377857,https://twitter.com/ElynRay/status/680955758704377857,punggol mrt station,punggol
Cherylwong86,2015-12-27 11:37:00,0,0,BOWLING TIME AT KALLANG - last minutes decision ( PS wearing dress to play bowling 󾌴󾌱) http:// fb.me/72T69mJvF,,,,680955678299561984,https://twitter.com/Cherylwong86/status/680955678299561984,kallang mrt station,kallang
Harunhaohao,2015-12-27 11:38:00,0,0,@Neilzboi lolololol tampines west got one station next time,,@Neilzboi,,680955982965415937,https://twitter.com/Harunhaohao/status/680955982965415937,tampines mrt station,tampines
Jeejay7,2015-12-27 11:38:00,0,0,@AwangMatSom but ape je kat tanah merah tadi hehehe,,@AwangMatSom,,680956001248391168,https://twitter.com/Jeejay7/status/680956001248391168,tanah merah mrt station,tanah merah
JING_CONG,2015-12-27 11:41:00,0,0,@BaiZiwei Hougang uh? Haha,,@BaiZiwei,,680956538635194368,https://twitter.com/JING_CONG/status/680956538635194368,hougang mrt station,hougang
dhxn_,2015-12-27 11:41:00,0,0,11:40 and I'm still at tanah merah . Mampos,,,,680956638652567553,https://twitter.com/dhxn_/status/680956638652567553,tanah merah mrt station,tanah merah
Miserablekid_,2015-12-27 11:41:00,0,0,I'm at Yew Tee MRT Station (NS5) - @smrt_singapore in Singapore https://www. swarmapp.com/c/db0OjstjrsJ,,@smrt_singapore,,680956630285029376,https://twitter.com/Miserablekid_/status/680956630285029376,yew tee mrt station,yew tee
debsho22,2015-12-27 11:42:00,3,0,Free at 2pm? Join us at Bras Basah McD's for a sinful #sgtweetup !,,,#sgtweetup,680956792528977921,https://twitter.com/debsho22/status/680956792528977921,bras basah mrt station,bras basah
chocolatemuimui,2015-12-27 11:43:00,0,0,Best Chwee Kueh for Breakfast #chweekueh #tiongbahru #tiongbahrumarket #singapore #travel … https://www. instagram.com/p/_x9TLIO5uG/,,,#chweekueh #tiongbahru #tiongbahrumarket #singapore #travel,680957096981053440,https://twitter.com/chocolatemuimui/status/680957096981053440,tiong bahru mrt station,tiong bahru
pratamayudha48,2015-12-27 11:46:00,0,0,With Nizar and fandy at Jl. Raya tanah merah [pic] — https:// path.com/p/1jmirc,,,,680957805835112448,https://twitter.com/pratamayudha48/status/680957805835112448,tanah merah mrt station,tanah merah
ftnsshi,2015-12-27 11:46:00,0,0,"demam xpuas main kat kampung. @Tanah Merah , Kelantan Darul Naim https://www. instagram.com/p/_x9tyFzVS8qh yUo-DzINdw6aLiwtxui4JuDyE0/ …",,@Tanah,,680958011809095680,https://twitter.com/ftnsshi/status/680958011809095680,tanah merah mrt station,tanah merah
itisshanhere_,2015-12-27 11:48:00,0,0,I'm at Bishan MRT Interchange (NS17/CC15) - @smrt_singapore in Singapore https://www. swarmapp.com/c/1k1rPYFRQZL,,@smrt_singapore,,680958335588417536,https://twitter.com/itisshanhere_/status/680958335588417536,bishan mrt station,bishan
EEP_ster,2015-12-27 11:49:00,0,0,@ShafikahEshak Some restaurant near Rochor Centre,,@ShafikahEshak,,680958622638059520,https://twitter.com/EEP_ster/status/680958622638059520,rochor mrt station,rochor
EveLovelle,2015-12-27 11:49:00,0,0,A castle under the stars T'was a magical night last night at Gardens By The Bay . For a moment… https://www. instagram.com/p/_x-BtkQSfo/,,,,680958694461456386,https://twitter.com/EveLovelle/status/680958694461456386,gardens by the bay mrt station,gardens by the bay
stompsingapore,2015-12-27 11:50:00,2,1,Pasir Ris Sec student with liver disorder lives in 'shadow of death' -- but excels in N-levels http:// goo.gl/HZgMtN,,,,680958922912477185,https://twitter.com/stompsingapore/status/680958922912477185,pasir ris mrt station,pasir ris
patrickpang,2015-12-27 11:50:00,0,0,It's looks like Tampines Station on EWL and DTL are not connected to each other. https:// twitter.com/eisen/status/6 80942982560755713 …,,,,680959011777204226,https://twitter.com/patrickpang/status/680959011777204226,tampines mrt station,tampines
OrangIce,2015-12-27 11:51:00,0,0,"Here we come, Jakarta @Changi Airport Terminal 3 Runway https://www. instagram.com/p/_x-Q-iPD0M/",,@Changi,,680959219055652864,https://twitter.com/OrangIce/status/680959219055652864,changi airport mrt station,changi airport
eisen,2015-12-27 11:52:00,1,2,. @fzz87 Quite convenient to walk from Bukit Panjang LRT Station to the MRT station. The passage is straightforward. Short walk of <3 min.,,@fzz87,,680959401054748674,https://twitter.com/eisen/status/680959401054748674,bukit panjang mrt station,bukit panjang
cheeseysheepy,2015-12-27 11:52:00,0,0,Half an hour from bukit panjang to promenade Thank you! Saving me approx 45mins of traveling time from now on,,,,680959462442586112,https://twitter.com/cheeseysheepy/status/680959462442586112,bukit panjang mrt station,bukit panjang
fikroktova,2015-12-27 11:52:00,0,0,Just posted a photo @Gardens by the Bay https://www. instagram.com/p/_x-S-cDUv8/,,@Gardens,,680959294104182784,https://twitter.com/fikroktova/status/680959294104182784,gardens by the bay mrt station,gardens by the bay
semubhatt,2015-12-27 11:55:00,1,2,"3. Btw, Delhi govt had set up the inquiry committee after Kejriwal was approached by Bishan Bedi & KIRTI to look into the matter.",,,,680960082012577792,https://twitter.com/semubhatt/status/680960082012577792,bishan mrt station,bishan
_Annisss,2015-12-27 11:55:00,0,0,"Paya Lebar Dalam (Pelebar), Rembau, Negeri Sembilan",,,,680960117135650817,https://twitter.com/_Annisss/status/680960117135650817,paya lebar mrt station,paya lebar
San_Cheloo,2015-12-27 11:55:00,0,0,Almost all my energy gonna be gone by just walking up this fort canning park.,,,,680960066183237632,https://twitter.com/San_Cheloo/status/680960066183237632,fort canning mrt station,fort canning
kennethleongwq,2015-12-27 11:55:00,0,0,Gardens by the bay & marina barrage! #marinabarrage https://www. instagram.com/p/_x-uwRBf3J/,,,#marinabarrage,680960251911221250,https://twitter.com/kennethleongwq/status/680960251911221250,gardens by the bay mrt station,gardens by the bay
anthonyjevon1,2015-12-27 11:56:00,0,0,Last Sunday on 2015 (at GBI Tanah Merah ) — https:// path.com/p/i7lBY,,,,680960445516091392,https://twitter.com/anthonyjevon1/status/680960445516091392,tanah merah mrt station,tanah merah
eisen,2015-12-27 11:56:00,2,0,DT1 / BP6: Bukit Panjang Interchange. #DTL2 pic.twitter.com/W41mrJgQig,,,#DTL2,680960534414397440,https://twitter.com/eisen/status/680960534414397440,bukit panjang mrt station,bukit panjang
silverbtf,2015-12-27 11:57:00,0,0,@iam_somewhere @hellofrmSG punggol got nice nasi lemak meh? I prefer changi village's!,,@iam_somewhere @hellofrmSG,,680960705936273409,https://twitter.com/silverbtf/status/680960705936273409,punggol mrt station,punggol
AhxianEstella,2015-12-27 11:57:00,0,0,"I'm at Tampines Bus Interchange in Singapore, SINGAPORE https://www. swarmapp.com/c/kEi8r2btkyE",,,,680960606741086208,https://twitter.com/AhxianEstella/status/680960606741086208,tampines mrt station,tampines
sufinaarnieee,2015-12-27 11:58:00,0,1,"Awai laaa kita balik nak buat fyp .. (@Tanah merah jitra in Jitra, Kedah) https://www. swarmapp.com/c/5MWISqVEDGG",,@Tanah,,680960968491425792,https://twitter.com/sufinaarnieee/status/680960968491425792,tanah merah mrt station,tanah merah
eisen,2015-12-27 11:58:00,1,0,#DTL2 trivia: Bukit Panjang Station’s working name was Petir. It was renamed after concerns it would be confused with Petir LRT Station.,,,#DTL2,680960799188205568,https://twitter.com/eisen/status/680960799188205568,bukit panjang mrt station,bukit panjang
defsouled,2015-12-27 11:59:00,0,2,just keep swimming @choa chu kang sports complex pic.twitter.com/Zae2R3Y3by,,@choa,,680961220929691649,https://twitter.com/defsouled/status/680961220929691649,choa chu kang mrt station,choa chu kang
eisen,2015-12-27 11:59:00,4,2,"Bukit Panjang Interchange’s artwork: Punctum of the Long Hills, by John Clang. Bukit Panjang means “long hill”. #DTL pic.twitter.com/60DjEsQi4T",,,#DTL,680961057100177410,https://twitter.com/eisen/status/680961057100177410,bukit panjang mrt station,bukit panjang
ItsRyanLai,2015-12-27 11:59:00,0,0,punggol so nice,,,,680961128524980224,https://twitter.com/ItsRyanLai/status/680961128524980224,punggol mrt station,punggol
venetian0219,2015-12-27 12:00:00,0,0,@_ hogang 혹시..이 말이..어제 사태에 관한..? ㅜㅜ,,@_,,680961493760802817,https://twitter.com/venetian0219/status/680961493760802817,hougang mrt station,hougang
DamnFriendly_WJ,2015-12-27 12:00:00,0,0,I'm at Chinatown MRT Interchange (NE4/DT19) - @sbs_transit in Singapore https://www. swarmapp.com/c/ltRhCANhWJe,,@sbs_transit,,680961476199321602,https://twitter.com/DamnFriendly_WJ/status/680961476199321602,chinatown mrt station,chinatown mrt
_hogang,2015-12-27 12:01:00,0,0,@venetian0219 ㅇㅇ...... 지인이 어제 거미 보고 나와서 배우님 계시다구 하셔가지구요.ㅋㅋ,,@venetian0219,,680961787798261760,https://twitter.com/_hogang/status/680961787798261760,hougang mrt station,hougang
rentinsingapore,2015-12-27 12:01:00,0,0,Blk 283 Tampines St http://www. rentinsingapore.com/showad/147161/ tampines-available-blk-283-tampines-street-22-2-bedrooms-+-dining-.html …,,,,680961576766156802,https://twitter.com/rentinsingapore/status/680961576766156802,tampines mrt station,tampines
DamnFriendly_WJ,2015-12-27 12:01:00,0,0,"On Train Set 049-050 , North East Line to Serangoon [ > Punggol (7) ]",,,,680961584861032448,https://twitter.com/DamnFriendly_WJ/status/680961584861032448,punggol mrt station,punggol
_arvindran,2015-12-27 12:02:00,0,2,Next year simei hope everything goes well,,,,680961841586044932,https://twitter.com/_arvindran/status/680961841586044932,simei mrt station,simei
aysyatot,2015-12-27 12:02:00,0,0,25122015. #DeeNazmi #sneakpreview #photoshoot #changiairport … https://www. instagram.com/p/_x_e0yvIust9 ORyzOzxvBq6WS39yWaiXk8SQ00/ …,,,#DeeNazmi #sneakpreview #photoshoot #changiairport,680961899098456064,https://twitter.com/aysyatot/status/680961899098456064,changi airport mrt station,changi airport
99throses,2015-12-27 12:02:00,0,0,I'm at Changi Airport Terminal 2 - @fansofchangi in Singapore https://www. swarmapp.com/c/gFSt7BTaiKs,,@fansofchangi,,680961866252836868,https://twitter.com/99throses/status/680961866252836868,changi airport mrt station,changi airport
venetian0219,2015-12-27 12:04:00,0,0,@_ hogang 혹시 했는데 ㅋㅋㅋ 덕계못인가봅니다 ㅜㅜ,,@_,,680962413634519041,https://twitter.com/venetian0219/status/680962413634519041,hougang mrt station,hougang
donutgyu,2015-12-27 12:04:00,0,0,@doIceandbanana @lmaomyung Jurong east :>,,@doIceandbanana @lmaomyung,,680962465048346624,https://twitter.com/donutgyu/status/680962465048346624,jurong east mrt station,jurong east
busesINgapore,2015-12-27 12:05:00,0,0,"The launch of SMRT service 979 finally sees the Yew Tee/ Choa Chu Kang Crescent area be served with more buses,... http:// fb.me/32OF74hUz",,,,680962558560448512,https://twitter.com/busesINgapore/status/680962558560448512,choa chu kang mrt station,choa chu kang
_hogang,2015-12-27 12:05:00,0,0,@venetian0219 큽... 전 촘 많이 슬플 뻔... 원래 거미 낮공 보려다가 안본거라서.......ㅋㅋㅋㅋㅋㅋ,,@venetian0219,,680962807714586624,https://twitter.com/_hogang/status/680962807714586624,hougang mrt station,hougang
venetian0219,2015-12-27 12:06:00,0,0,@_ hogang 헉...아숩다 ㅜㅜ 배우님은 어제 밤공 보신거져?,,@_,,680963029110927362,https://twitter.com/venetian0219/status/680963029110927362,hougang mrt station,hougang
fourGoTwiThu,2015-12-27 12:07:00,0,0,I'm at Changi Airport MRT Station (CG2) - @smrt_singapore in Singapore w/ @warongs https://www. swarmapp.com/c/dAv2kuP6GtE pic.twitter.com/YT8x3gClH1,,@smrt_singapore @warongs,,680963209164099586,https://twitter.com/fourGoTwiThu/status/680963209164099586,changi airport mrt station,changi airport
AssThrowKnot,2015-12-27 12:08:00,0,0,Merry Christmas ya filthy animal #vscocam #merrychristmas @Hougang https://www. instagram.com/p/_yAPJmxlfx/,,@Hougang,#vscocam #merrychristmas,680963554728607744,https://twitter.com/AssThrowKnot/status/680963554728607744,hougang mrt station,hougang
ItsCherryLorh,2015-12-27 12:08:00,0,0,I'm at Bedok Mall in Singapore https://www. swarmapp.com/c/8aly3LiEJJn,,,,680963496209727489,https://twitter.com/ItsCherryLorh/status/680963496209727489,bedok mrt station,bedok
itisshanhere_,2015-12-27 12:08:00,0,1,I'm at Buona Vista MRT Interchange (EW21/CC22) - @smrt_singapore in Singapore https://www. swarmapp.com/c/9KKEAVs3IV7,,@smrt_singapore,,680963465587126273,https://twitter.com/itisshanhere_/status/680963465587126273,buona vista mrt station,buona vista
charisahy,2015-12-27 12:08:00,0,2,I'm at Singapore Changi Airport (SIN) - @fansofchangi in Singapore https://www. swarmapp.com/c/1HxFCjHL1iS,,@fansofchangi,,680963460767838209,https://twitter.com/charisahy/status/680963460767838209,changi airport mrt station,changi airport
itisshanhere_,2015-12-27 12:08:00,0,0,I'm at Buona Vista in Singapore https://www. swarmapp.com/c/8vwDktwmRwG,,,,680963434150756352,https://twitter.com/itisshanhere_/status/680963434150756352,buona vista mrt station,buona vista
_hogang,2015-12-27 12:09:00,0,0,@venetian0219 네넹ㅋㅋ 저 낮공에 거기 있었으면 촘 슬플 뻔 했어요ㅋㅋㅋ,,@venetian0219,,680963635087147008,https://twitter.com/_hogang/status/680963635087147008,hougang mrt station,hougang
janarette13,2015-12-27 12:09:00,0,0,I'm at Kranji MRT Station (NS7) - @smrt_singapore in Singapore https://www. swarmapp.com/c/7y1JXybOJpC,,@smrt_singapore,,680963731984101376,https://twitter.com/janarette13/status/680963731984101376,kranji mrt station,kranji mrt
nikkgupta11,2015-12-27 12:10:00,0,1,Breakky to gogo by @boostjuiceoz at @changiairport !! #Transit @Changi Airport https://www. instagram.com/p/_yAaTgzaqz/,,@boostjuiceoz @changiairport @Changi,#Transit,680963940612988928,https://twitter.com/nikkgupta11/status/680963940612988928,changi airport mrt station,changi airport
nikkgupta11,2015-12-27 12:10:00,0,0,Breakky to gogo by @boost_juice at @changiairport !! #Transit http:// ift.tt/1TlMgtC pic.twitter.com/OoKlVsyms5,,@boost_juice @changiairport,#Transit,680963957885108224,https://twitter.com/nikkgupta11/status/680963957885108224,changi airport mrt station,changi airport
najihahmusa2,2015-12-27 12:11:00,0,0,Jalan jam di tanah merah .. Penat nuggu giliran nak jalan...,,,,680964296650539010,https://twitter.com/najihahmusa2/status/680964296650539010,tanah merah mrt station,tanah merah
Henry_Gepenk,2015-12-27 12:11:00,0,0,I'm at Singapore Changi Airport (SIN) - @fansofchangi in Singapore w/ @fifie_ https://www. swarmapp.com/c/a2jqX8liV1k,,@fansofchangi @fifie_,,680964117692346368,https://twitter.com/Henry_Gepenk/status/680964117692346368,changi airport mrt station,changi airport
oporitus,2015-12-27 12:11:00,0,0,@femaledaily Raffles City Shopping Mall deket mrt City Hall #MasterCard #STB #GoldenJubilee,,@femaledaily,#MasterCard #STB #GoldenJubilee,680964083659587584,https://twitter.com/oporitus/status/680964083659587584,city hall mrt station,city hall mrt
royroy_royroy,2015-12-27 12:11:00,0,0,off tomorrow (@Yew Tee Point in Singapore) https://www. swarmapp.com/c/ciumJXLGpva,,@Yew,,680964139313938432,https://twitter.com/royroy_royroy/status/680964139313938432,yew tee mrt station,yew tee
venetian0219,2015-12-27 12:12:00,0,0,@_ hogang 그쵸 ㅜㅜ 진짜 좀 귀뜸이라도 해주시지..수니들 생각 좀!!,,@_,,680964570593165313,https://twitter.com/venetian0219/status/680964570593165313,hougang mrt station,hougang
_patbingsu,2015-12-27 12:12:00,0,0,@howowons OMG THIS BACKGROUND LOOK LIKE IN YEWTEE,,@howowons,,680964338895556608,https://twitter.com/_patbingsu/status/680964338895556608,yew tee mrt station,yew tee
zenny_xoxo2301,2015-12-27 12:13:00,0,0,Childhood memories @Gardens by the Bay https://www. instagram.com/p/_yAvGPrgSO/,,@Gardens,,680964660401537024,https://twitter.com/zenny_xoxo2301/status/680964660401537024,gardens by the bay mrt station,gardens by the bay
_patbingsu,2015-12-27 12:13:00,0,0,@howowons u live yewtee ??,,@howowons,,680964588976779264,https://twitter.com/_patbingsu/status/680964588976779264,yew tee mrt station,yew tee
najywan,2015-12-27 12:14:00,0,0,Just posted a photo @Gardens by the Bay https://www. instagram.com/p/_yA2ucN2KG/,,@Gardens,,680964920486150148,https://twitter.com/najywan/status/680964920486150148,gardens by the bay mrt station,gardens by the bay
AhxianEstella,2015-12-27 12:16:00,0,0,I'm at Tampines MRT Station (EW2/DT32) - @smrt_singapore in Singapore https://www. swarmapp.com/c/4ZNrIz8oJHX,,@smrt_singapore,,680965538013659136,https://twitter.com/AhxianEstella/status/680965538013659136,tampines mrt station,tampines
howowons,2015-12-27 12:16:00,0,0,@_patbingsu u live yewtee ? i'm crying too omg aaaa,,@_patbingsu,,680965346698735616,https://twitter.com/howowons/status/680965346698735616,yew tee mrt station,yew tee
beyondethereal,2015-12-27 12:16:00,0,0,I'm at Tanah Merah Ferry Terminal in Singapore https://www. swarmapp.com/c/7ELT2jGxI26,,,,680965530547798017,https://twitter.com/beyondethereal/status/680965530547798017,tanah merah mrt station,tanah merah
HypeRecordsSG,2015-12-27 12:17:00,0,0,Any plans on the 31st December yet?? Come down to Punggol East and join Cavin Soh -苏梽诚 & Jermaine Leong at the... http:// fb.me/2sih9yBWU,,,,680965771049046016,https://twitter.com/HypeRecordsSG/status/680965771049046016,punggol mrt station,punggol
Tomo_LYLTTF,2015-12-27 12:21:00,0,1,Safely landed back on the sunny spore~ :) See you Changi airport in 4 days for Bali! 無事にシンガポール帰ってきたよん。4日後のバリまで、さよならチャンギ空港〜。,,,,680966670265925635,https://twitter.com/Tomo_LYLTTF/status/680966670265925635,changi airport mrt station,changi airport
_kcxy,2015-12-27 12:22:00,0,0,I'm at Tampines St11 Blk 124 https://www. swarmapp.com/c/3bY9XX8eOTS,,,,680966979772104704,https://twitter.com/_kcxy/status/680966979772104704,tampines mrt station,tampines
elsoboleva20733,2015-12-27 12:22:00,0,0,"RT PornForFree_ru Now online  Worgreen, 39, Jurong East New Town: smile a lot aleast a bit http:// bit.ly/1NHHLIb  #flirt #dating",,,#flirt #dating,680967010789027840,https://twitter.com/elsoboleva20733/status/680967010789027840,jurong east mrt station,jurong east
syafiqhuge,2015-12-27 12:22:00,0,0,@iQa_Adam at bedok issit ?,,@iQa_Adam,,680966934779662336,https://twitter.com/syafiqhuge/status/680966934779662336,bedok mrt station,bedok
_VicNesh_,2015-12-27 12:23:00,0,2,Woww Bukit panjang station to Beauty World station like 10 mins only!!!Yayyy Can sleep even more longer when school open,,,,680967224929067011,https://twitter.com/_VicNesh_/status/680967224929067011,bukit panjang mrt station,bukit panjang
AhxianEstella,2015-12-27 12:23:00,0,1,Last day. (@Simei MRT Station (EW3) - @smrt_singapore in Singapore) https://www. swarmapp.com/c/dpJrL8uv1p0,,@Simei @smrt_singapore,,680967090036170752,https://twitter.com/AhxianEstella/status/680967090036170752,simei mrt station,simei
_diannong,2015-12-27 12:23:00,0,0,"Lovely afternoon @Tampines Ave, Singapore https://www. instagram.com/p/_yB7aSjo-Jng Ru85y34v7n2A6rkXTD8IFJEfw0/ …",,@Tampines,,680967282525274112,https://twitter.com/_diannong/status/680967282525274112,tampines mrt station,tampines
haikaalrazak,2015-12-27 12:24:00,1,1,@ilvpa that carpet looks like your tampines house nye carpet. r u back by any chance?,,@ilvpa,,680967377987633152,https://twitter.com/haikaalrazak/status/680967377987633152,tampines mrt station,tampines
