username,date,retweets,favorites,text,geo,mentions,hashtags,id,permalink,place,key
onefm913,2016-02-19 12:23:00,0,0,"Join ONE FM as we broadcast live from Chevron House, Raffles Place for TAFEP's Fair@Work Promise initiative :)... http:// fb.me/12M0P4Tz7",,@Work,,700536068144148480,https://twitter.com/onefm913/status/700536068144148480,raffles place mrt station,raffles place
jxdxnc,2016-02-19 12:23:00,0,0,wah there's a cheap sushi place at bishan,,,,700536168589369344,https://twitter.com/jxdxnc/status/700536168589369344,bishan mrt station,bishan
ari_pic_,2016-02-19 12:26:00,0,0,"A residential apartment block in Everton Park | Tanjong Pagar , Singapore @Everton Park https://www. instagram.com/p/BB9FIthi6NZ/",,@Everton,,700536839300640769,https://twitter.com/ari_pic_/status/700536839300640769,tanjong pagar mrt station,tanjong pagar
laurenceputra,2016-02-19 12:27:00,0,0,dean of soc kickstarting the CNY lunch @NUSS Kent Ridge Guild House https://www. instagram.com/p/BB9FS-IqkhR/,,@NUSS,,700537191852810245,https://twitter.com/laurenceputra/status/700537191852810245,kent ridge mrt station,kent ridge
NadiraFu,2016-02-19 12:27:00,0,0,Bedok Mall is my new favourite place because the have halal food everywhere!!!,,,,700537257040564224,https://twitter.com/NadiraFu/status/700537257040564224,bedok mrt station,bedok
buckseng,2016-02-19 12:27:00,0,0,"Despite the odds, this may help explain why the 7 Eleven Yishun Singapore Pools outlet is so popular. Hey IBM Watson… https:// lnkd.in/eUYTd2t",,,,700537261864013824,https://twitter.com/buckseng/status/700537261864013824,yishun mrt station,yishun
luketucker,2016-02-19 12:28:00,1,4,Singapore Gardens By The Bay with @RobynJTucker taking in the view. pic.twitter.com/ojom9EEjcB,,@RobynJTucker,,700537529754202112,https://twitter.com/luketucker/status/700537529754202112,gardens by the bay mrt station,gardens by the bay
norvinyecla,2016-02-19 12:29:00,1,3,MRT 7 will commence construction soon. This means Commonwealth traffic will get a little worse.. Pero ok lang. For the greater good!,,,,700537770767290368,https://twitter.com/norvinyecla/status/700537770767290368,commonwealth mrt station,commonwealth mrt
tyahmere,2016-02-19 12:29:00,0,0,"I'm at Hotel Maa in Tanah Merah , Kelantan https://www. swarmapp.com/c/48zbnYa50fT",,,,700537619860615168,https://twitter.com/tyahmere/status/700537619860615168,tanah merah mrt station,tanah merah
firnfactor,2016-02-19 12:30:00,0,0,Guess who is breathing Choa Chu Kang for the first time,,,,700538004096438272,https://twitter.com/firnfactor/status/700538004096438272,choa chu kang mrt station,choa chu kang
mirbuilder,2016-02-19 12:30:00,0,0,"The #SkyHabitat residential complex in #Bishan , #Singapore looks like a three-dimensional matrix of living units... http:// fb.me/7QQiOOtGa",,,#SkyHabitat #Bishan #Singapore,700537802371502080,https://twitter.com/mirbuilder/status/700537802371502080,bishan mrt station,bishan
Sandytee2929Tee,2016-02-19 12:30:00,0,0,@MightyStags tampines rover fc . Go stags rover go. I love tampines rover fc . Go rover go. #lovetrfc .,,@MightyStags,#lovetrfc,700537860621897728,https://twitter.com/Sandytee2929Tee/status/700537860621897728,tampines mrt station,tampines
thenewpaper,2016-02-19 12:30:00,0,1,Warriors unfazed by star-studded Tampines http:// ebx.sh/1TtuV53 pic.twitter.com/fpBU05S7YK,,,,700537872441593857,https://twitter.com/thenewpaper/status/700537872441593857,tampines mrt station,tampines
ajiSABHA,2016-02-19 12:31:00,0,0,At @changiairport — https:// path.com/p/2AxwzP,,@changiairport,,700538295516688385,https://twitter.com/ajiSABHA/status/700538295516688385,changi airport mrt station,changi airport
shannyxx_,2016-02-19 12:32:00,0,0,I'm at Yio Chu Kang MRT Station (NS15) in Singapore https://www. swarmapp.com/c/78vM1OJmEsC,,,,700538364731269120,https://twitter.com/shannyxx_/status/700538364731269120,yio chu kang mrt station,yio chu kang
WatertownSG,2016-02-19 12:32:00,0,0,Watertown - final 4 units of 3 and 4-bedroom for sale! Either pool view or Punggol Waterway view! Seamlessly... http:// fb.me/2N2YUcXFh,,,,700538401800515584,https://twitter.com/WatertownSG/status/700538401800515584,punggol mrt station,punggol
Abe7745Abe,2016-02-19 12:33:00,0,0,Signature at Yishun 梨景园 | Executive Condominium http://www. sinnewlaunch.sg/signature-at-y ishun/ …,,,,700538746635038720,https://twitter.com/Abe7745Abe/status/700538746635038720,yishun mrt station,yishun
JOSHUAAAAAHHHHH,2016-02-19 12:35:00,0,0,I'm at Bedok Camp II in Singapore https://www. swarmapp.com/c/9dTJb0hLo98,,,,700539163624529920,https://twitter.com/JOSHUAAAAAHHHHH/status/700539163624529920,bedok mrt station,bedok
jimmytamburian,2016-02-19 12:35:00,0,0,I'm at Tanah Merah MRT Interchange (EW4) - @smrt_singapore in Singapore https://www. swarmapp.com/c/6RMDHoMfiUh,,@smrt_singapore,,700539196201639936,https://twitter.com/jimmytamburian/status/700539196201639936,tanah merah mrt station,tanah merah
shxrlynns,2016-02-19 12:35:00,0,0,I'm at Ang Mo Kio Polyclinic (NHG) in Singapore https://www. swarmapp.com/c/gcLC11jYwBv,,,,700539160222892032,https://twitter.com/shxrlynns/status/700539160222892032,ang mo kio mrt station,ang mo kio
hellofrmSG,2016-02-19 12:35:00,1,0,"@kenzoschancos the NUS Baba House isn't at NUS, it's around Outram Park , they still have the guided tour :)",,@kenzoschancos,,700539249959923714,https://twitter.com/hellofrmSG/status/700539249959923714,outram park mrt station,outram park
Fussicca,2016-02-19 12:35:00,0,1,This year's toto hongbao draw winner will be from Punggol plaza,,,,700539227822379009,https://twitter.com/Fussicca/status/700539227822379009,punggol mrt station,punggol
9vbriel,2016-02-19 12:35:00,3,6,My hood - Yishun pic.twitter.com/3tn5am7Yax,,,,700539121270296577,https://twitter.com/9vbriel/status/700539121270296577,yishun mrt station,yishun
msdimplestyles,2016-02-19 12:37:00,0,0,did i just cross platforms at jurong east by passing through the train? and did i just cross the train over and over??,,,,700539677493764096,https://twitter.com/msdimplestyles/status/700539677493764096,jurong east mrt station,jurong east
saberu,2016-02-19 12:37:00,0,0,@aMrazing cobain ramen bar suzuki di circular road deket mrt clarke quay de..,,@aMrazing,,700539776475115525,https://twitter.com/saberu/status/700539776475115525,clarke quay mrt station,clarke quay
nurinqistinanq,2016-02-19 12:38:00,0,0,"""Next station , yew tee."" bitch, why you make it sound as if yew tee is only 2 minutes away from kranji when really it's a damn lifetime.",,,,700539984915202048,https://twitter.com/nurinqistinanq/status/700539984915202048,kranji mrt station,kranji station
shannyxx_,2016-02-19 12:38:00,0,0,I'm at Khatib MRT Station (NS14) in Singapore https://www. swarmapp.com/c/9RqOELhAtbL,,,,700539979022389250,https://twitter.com/shannyxx_/status/700539979022389250,khatib mrt station,khatib mrt
Abe7745Abe,2016-02-19 12:39:00,0,0,The Wisteria Yishun | http://WWW. SINNEWLAUNCH.SG http://www. sinnewlaunch.sg/the-wisteria-y ishun/ …,,,,700540212531703808,https://twitter.com/Abe7745Abe/status/700540212531703808,yishun mrt station,yishun
QLDTrafficNCSC,2016-02-19 12:39:00,0,0,"Pacific Motorway, Underwood - Congestion Northbound from Tanah Merah , Long delays expected, Allow extra trave http:// 131940.com/i=57639497",,,,700540283436425216,https://twitter.com/QLDTrafficNCSC/status/700540283436425216,tanah merah mrt station,tanah merah
Wesifer,2016-02-19 12:40:00,0,0,I'm at Redhill MRT Station (EW18) - @smrt_singapore in Singapore https://www. swarmapp.com/c/1IwNuMy0t8W,,@smrt_singapore,,700540470523465728,https://twitter.com/Wesifer/status/700540470523465728,redhill mrt station,redhill mrt
shannyxx_,2016-02-19 12:40:00,0,0,I'm at Bus Stop 59041 (Bef Khatib Stn ) in Singapore https://www. swarmapp.com/c/hh6qeuGWGFE,,,,700540547962970112,https://twitter.com/shannyxx_/status/700540547962970112,khatib mrt station,khatib stn
InstaSingapore,2016-02-19 12:41:00,0,0,.Wesifer Nice check-in: I'm at Redhill MRT Station (EW18) - smrt_singapore in Singapore https://www. swarmapp.com/c/1IwNuMy0t8W,,,,700540669803237377,https://twitter.com/InstaSingapore/status/700540669803237377,redhill mrt station,redhill mrt
shafielovesfood,2016-02-19 12:41:00,0,0,Won my myself a trip to explore the flora & fauna that makes Changi Airport so beautiful as part… https://www. instagram.com/p/BB9G7LpLqqs/,,,,700540784798380032,https://twitter.com/shafielovesfood/status/700540784798380032,changi airport mrt station,changi airport
InstaSingapore,2016-02-19 12:41:00,0,0,RT shannyxx_: I'm at Yio Chu Kang MRT Station (NS15) in Singapore https://www. swarmapp.com/c/78vM1OJmEsC,,,,700540749503397892,https://twitter.com/InstaSingapore/status/700540749503397892,yio chu kang mrt station,yio chu kang
InstaSingapore,2016-02-19 12:41:00,0,0,RT Wesifer: I'm at Redhill MRT Station (EW18) - smrt_singapore in Singapore https://www. swarmapp.com/c/1IwNuMy0t8W,,,,700540782495797248,https://twitter.com/InstaSingapore/status/700540782495797248,redhill mrt station,redhill mrt
InstaSingapore,2016-02-19 12:41:00,0,0,.shannyxx_ Nice check-in: I'm at Khatib MRT Station (NS14) in Singapore https://www. swarmapp.com/c/9RqOELhAtbL,,,,700540660198330368,https://twitter.com/InstaSingapore/status/700540660198330368,khatib mrt station,khatib mrt
InstaSingapore,2016-02-19 12:41:00,0,0,.JOSHUAAAAAHHHHH Nice check-in: I'm at Bedok Camp II in Singapore https://www. swarmapp.com/c/9dTJb0hLo98,,,,700540647212785665,https://twitter.com/InstaSingapore/status/700540647212785665,bedok mrt station,bedok
InstaSingapore,2016-02-19 12:41:00,0,0,.jimmytamburian Nice check-in: I'm at Tanah Merah MRT Interchange (EW4) - smrt_singapore in Singapore https://www. swarmapp.com/c/6RMDHoMfiUh,,,,700540649817427968,https://twitter.com/InstaSingapore/status/700540649817427968,tanah merah mrt station,tanah merah
InstaSingapore,2016-02-19 12:41:00,0,0,RT jimmytamburian: I'm at Tanah Merah MRT Interchange (EW4) - smrt_singapore in Singapore https://www. swarmapp.com/c/6RMDHoMfiUh,,,,700540766070947840,https://twitter.com/InstaSingapore/status/700540766070947840,tanah merah mrt station,tanah merah
InstaSingapore,2016-02-19 12:41:00,0,0,.SHERLYNNNNNx Nice check-in: I'm at Ang Mo Kio Polyclinic (NHG) in Singapore https://www. swarmapp.com/c/gcLC11jYwBv,,,,700540644792598528,https://twitter.com/InstaSingapore/status/700540644792598528,ang mo kio mrt station,ang mo kio
InstaSingapore,2016-02-19 12:41:00,0,0,.shannyxx_ Nice check-in: I'm at Yio Chu Kang MRT Station (NS15) in Singapore https://www. swarmapp.com/c/78vM1OJmEsC,,,,700540625167458304,https://twitter.com/InstaSingapore/status/700540625167458304,yio chu kang mrt station,yio chu kang
InstaSingapore,2016-02-19 12:41:00,0,0,RT shannyxx_: I'm at Bus Stop 59041 (Bef Khatib Stn ) in Singapore https://www. swarmapp.com/c/hh6qeuGWGFE,,,,700540784286814209,https://twitter.com/InstaSingapore/status/700540784286814209,khatib mrt station,khatib stn
InstaSingapore,2016-02-19 12:41:00,0,0,RT SHERLYNNNNNx: I'm at Ang Mo Kio Polyclinic (NHG) in Singapore https://www. swarmapp.com/c/gcLC11jYwBv,,,,700540760836464641,https://twitter.com/InstaSingapore/status/700540760836464641,ang mo kio mrt station,ang mo kio
Ashxmathers,2016-02-19 12:41:00,0,0,Off to yishun .,,,,700540806654853121,https://twitter.com/Ashxmathers/status/700540806654853121,yishun mrt station,yishun
InstaSingapore,2016-02-19 12:41:00,0,0,RT shannyxx_: I'm at Khatib MRT Station (NS14) in Singapore https://www. swarmapp.com/c/9RqOELhAtbL,,,,700540774220484609,https://twitter.com/InstaSingapore/status/700540774220484609,khatib mrt station,khatib mrt
InstaSingapore,2016-02-19 12:41:00,0,0,RT JOSHUAAAAAHHHHH: I'm at Bedok Camp II in Singapore https://www. swarmapp.com/c/9dTJb0hLo98,,,,700540762430291969,https://twitter.com/InstaSingapore/status/700540762430291969,bedok mrt station,bedok
_alhamsmileyy,2016-02-19 12:43:00,0,1,@SueAidahh paperh ku smpai jurong east aku picit kau ok,,@SueAidahh,,700541304841723904,https://twitter.com/_alhamsmileyy/status/700541304841723904,jurong east mrt station,jurong east
2Piglety4U,2016-02-19 12:43:00,0,0,I'm at Ang Mo Kio Secondary School in Singapore https://www. swarmapp.com/c/2nYkOEV7rSK,,,,700541187657179136,https://twitter.com/2Piglety4U/status/700541187657179136,ang mo kio mrt station,ang mo kio
IndoTTJournal,2016-02-19 12:43:00,0,0,World’s first Aerotel opens at Changi Airport http://www. ttjournal.co.id/worlds-first-a erotel-opens-at-changi-airport/ … pic.twitter.com/jJGyOln5mo,,,,700541305651224576,https://twitter.com/IndoTTJournal/status/700541305651224576,changi airport mrt station,changi airport
combiemohtar,2016-02-19 12:43:00,0,0,Kembang idong berlari kejo bas. (@Tuas Checkpoint (Second Link ) in Singapore) https://www. swarmapp.com/c/gtBIF4AkEul,,@Tuas,,700541097391603712,https://twitter.com/combiemohtar/status/700541097391603712,tuas link mrt station,tuas link
QLDTrafficNCSC,2016-02-19 12:44:00,0,0,"Pacific Motorway, Underwood - Congestion Northbound From Tanah Merah due to an earlier grass fire , Long dela http:// 131940.com/i=57639497",,,,700541541480165377,https://twitter.com/QLDTrafficNCSC/status/700541541480165377,tanah merah mrt station,tanah merah
ThiaNugroho,2016-02-19 12:44:00,0,0,"With Steven, Dad, and Mom at @changiairport — https:// path.com/p/3RUoQM",,@changiairport,,700541441542520832,https://twitter.com/ThiaNugroho/status/700541441542520832,changi airport mrt station,changi airport
BBQCurryPuff,2016-02-19 12:45:00,0,0,"Dim sum lunch @Peony Jade, Clarke Quay .",,@Peony,,700541777296510976,https://twitter.com/BBQCurryPuff/status/700541777296510976,clarke quay mrt station,clarke quay
carlmorner,2016-02-19 12:46:00,1,1,Singapore. Again. #singapore #adultchords @One Raffles Place https://www. instagram.com/p/BB9HefBmzBt/,,@One,#singapore #adultchords,700541994922192896,https://twitter.com/carlmorner/status/700541994922192896,raffles place mrt station,raffles place
waaiisss,2016-02-19 12:48:00,0,0,I'm at Bishan MRT Interchange (NS17/CC15) - @smrt_singapore in Singapore https://www. swarmapp.com/c/iiEKwY6MwZZ,,@smrt_singapore,,700542423508901888,https://twitter.com/waaiisss/status/700542423508901888,bishan mrt station,bishan
ofmeowandbake,2016-02-19 12:48:00,0,0,"Actually on my recent trip back to SG, I realized that libraries have water coolers (or is it only bedok library)? Go in for free water!!!",,,,700542433507999744,https://twitter.com/ofmeowandbake/status/700542433507999744,bedok mrt station,bedok
burrn,2016-02-19 12:50:00,0,0,#tru #lightandshadows #minimal_lookup #architecture #linesandshapes @Bedok Corner https://www. instagram.com/p/BB9H7HmiM47/,,@Bedok,#tru #lightandshadows #minimal_lookup #architecture #linesandshapes,700542982630445056,https://twitter.com/burrn/status/700542982630445056,bedok mrt station,bedok
burrn,2016-02-19 12:51:00,0,0,#tru #lightandshadows #minimal_lookup #architecture #linesandshapes @Bedok Corner https://www. instagram.com/p/BB9H_31CM5E/,,@Bedok,#tru #lightandshadows #minimal_lookup #architecture #linesandshapes,700543142525702145,https://twitter.com/burrn/status/700543142525702145,bedok mrt station,bedok
PARANOID_LUST,2016-02-19 12:51:00,0,0,Work (@Jalan Besar Stadium in Singapore) https://www. swarmapp.com/c/gO2xWiNbAhn,,@Jalan,,700543199253757952,https://twitter.com/PARANOID_LUST/status/700543199253757952,jalan besar mrt station,jalan besar
andri_ys,2016-02-19 12:52:00,0,1,"Great time in @ChangiAirport , never get bored with entertaining things inside each terminals",,@ChangiAirport,,700543411128918016,https://twitter.com/andri_ys/status/700543411128918016,changi airport mrt station,changi airport
nicolausdeka,2016-02-19 12:54:00,0,0,Tachdawn (at @changiairport ) — https:// path.com/p/Bdcun,,@changiairport,,700543926558535680,https://twitter.com/nicolausdeka/status/700543926558535680,changi airport mrt station,changi airport
ken0515to,2016-02-19 12:55:00,0,2,第2節 vs Tampines pic.twitter.com/AiRdTyTe65,,,,700544187658186753,https://twitter.com/ken0515to/status/700544187658186753,tampines mrt station,tampines
limyunxuann,2016-02-19 12:56:00,0,0,"I'm at Golden Place Eating House @Kallang Sector Amenities Centre in MacPherson, Singapore https://www. swarmapp.com/c/l5anq7eQwQD",,@Kallang,,700544486930255872,https://twitter.com/limyunxuann/status/700544486930255872,kallang mrt station,kallang
weirdoahliss,2016-02-19 12:57:00,0,0,@V_licious95 Hi! I submitted the form a past 12 midnight last night for today's meetup at toa payoh MRT!>< Can I check if it's confirmed?,,@V_licious95,,700544626428522497,https://twitter.com/weirdoahliss/status/700544626428522497,toa payoh mrt station,toa payoh
AmyKhor,2016-02-19 12:58:00,0,1,"Dear residents, do join us for the official opening of our newly-transformed Bukit Batok Canal under the ABC... http:// fb.me/87aqRYMQB",,,,700544917899235328,https://twitter.com/AmyKhor/status/700544917899235328,bukit batok mrt station,bukit batok
cwyceline,2016-02-19 12:59:00,0,0,I'm at HomeTeamNS @Bukit Batok in Singapore https://www. swarmapp.com/c/iqeCZWdsaDa,,@Bukit,,700545278642880512,https://twitter.com/cwyceline/status/700545278642880512,bukit batok mrt station,bukit batok
blamberz,2016-02-19 12:59:00,0,0,Flying home now #bernie #goinghomenow #singapore #urlaub #vacation @Singapore Changi Airport … https://www. instagram.com/p/BB9I6VDTcmY/,,@Singapore,#bernie #goinghomenow #singapore #urlaub #vacation,700545143921889280,https://twitter.com/blamberz/status/700545143921889280,changi airport mrt station,changi airport
11streetMY,2016-02-19 13:00:00,0,0,Singapore Gardens By The Bay E-Ticket at 16% off. Buy them here: http:// bit.ly/20FRLpi . Enjoy your holidays!,,,,700545539872530434,https://twitter.com/11streetMY/status/700545539872530434,gardens by the bay mrt station,gardens by the bay
johnyeungx,2016-02-19 13:00:00,0,0,I'm at Punggol Plaza - @punggollatest in Singapore https://www. swarmapp.com/c/arQrLLxEr3t,,@punggollatest,,700545561494220800,https://twitter.com/johnyeungx/status/700545561494220800,punggol mrt station,punggol
LatestNewLaunch,2016-02-19 13:00:00,1,0,#Centrium Square - An exception business & investment opportunity! 1 min to Farrer Park MRT . http:// buff.ly/1SRHB5Y pic.twitter.com/BpW7j1xs3c,,,#Centrium,700545410666991616,https://twitter.com/LatestNewLaunch/status/700545410666991616,farrer park mrt station,farrer park mrt
ThiaNugroho,2016-02-19 13:01:00,0,0,"Hello Phuket! (with Steven, Mom, and Dad at @changiairport ) [pic] — https:// path.com/p/4n58uK",,@changiairport,,700545740339175424,https://twitter.com/ThiaNugroho/status/700545740339175424,changi airport mrt station,changi airport
ChampionTutor5,2016-02-19 13:01:00,0,0,"P6 Mathematics,Science tuition @629 Bedok Reservoir Rd. 8 x 2hrs/month http:// bit.ly/1OiW3M4",,@629,,700545749822472192,https://twitter.com/ChampionTutor5/status/700545749822472192,bedok mrt station,bedok
nicolausdeka,2016-02-19 13:01:00,0,0,Finally touchdown! (at Singapore Changi Airport (SIN)) [pic] — https:// path.com/p/2vYs6L,,,,700545809385811968,https://twitter.com/nicolausdeka/status/700545809385811968,changi airport mrt station,changi airport
_shuqii,2016-02-19 13:02:00,0,0,I'm at Yio Chu Kang MRT Station (NS15) - @smrt_singapore in Singapore https://www. swarmapp.com/c/dVdDwhrIXQL,,@smrt_singapore,,700546005050249216,https://twitter.com/_shuqii/status/700546005050249216,yio chu kang mrt station,yio chu kang
alisoncroggon,2016-02-19 13:02:00,3,0,"Me at @AustBookReview 's Arts Update on #PerthFest 2016: William Kentridge , Aditi Mangaldas, and more. https://www. australianbookreview.com.au/component/k2/1 01-arts-update/2948-perth-international-arts-festival-2016 …",,@AustBookReview,#PerthFest,700545913161326592,https://twitter.com/alisoncroggon/status/700545913161326592,kent ridge mrt station,kent ridge
chesarifah,2016-02-19 13:03:00,0,0,"I'm at Shell in Tanah Merah , Kelantan https://www. swarmapp.com/c/joresS5BVeB",,,,700546246466007040,https://twitter.com/chesarifah/status/700546246466007040,tanah merah mrt station,tanah merah
ji_ddongi,2016-02-19 13:03:00,0,0,@nwhbaby91 aljunied,,@nwhbaby91,,700546126710059008,https://twitter.com/ji_ddongi/status/700546126710059008,aljunied mrt station,aljunied
aaassliem,2016-02-19 13:03:00,0,0,"I'm at Tampines Bus Interchange in Singapore, SINGAPORE https://www. swarmapp.com/c/2QZ5m8TddaF",,,,700546104891457536,https://twitter.com/aaassliem/status/700546104891457536,tampines mrt station,tampines
Abe7745Abe,2016-02-19 13:04:00,0,0,Symphony Suites @Yishun | (+65) 90267877 http://www. sinnewlaunch.sg/symphony-suite s/ …,,@Yishun,,700546364824879105,https://twitter.com/Abe7745Abe/status/700546364824879105,yishun mrt station,yishun
iArchiee,2016-02-19 13:05:00,0,0,@BarangConfused kau kat hospital mana sekarang? Yang dekat dengan Yio Chu Kang MRT eh?,,@BarangConfused,,700546782271377408,https://twitter.com/iArchiee/status/700546782271377408,yio chu kang mrt station,yio chu kang
nwhbaby91,2016-02-19 13:05:00,0,0,@sungzyu ok lah aljunied quite near ^^,,@sungzyu,,700546612326567936,https://twitter.com/nwhbaby91/status/700546612326567936,aljunied mrt station,aljunied
Isabeltxx,2016-02-19 13:06:00,0,0,I'm at Hougang 1 in Singapore https://www. swarmapp.com/c/2MPcj9E56wX,,,,700546974723022848,https://twitter.com/Isabeltxx/status/700546974723022848,hougang mrt station,hougang
estheryeungx,2016-02-19 13:07:00,0,1,I'm at Punggol Plaza - @punggollatest in Singapore w/ @johnyeungx https://www. swarmapp.com/c/fC8tzWwL7yb,,@punggollatest @johnyeungx,,700547322246254592,https://twitter.com/estheryeungx/status/700547322246254592,punggol mrt station,punggol
deideixx_,2016-02-19 13:08:00,1,2,"I'm at Tampines Bus Interchange in Singapore, SINGAPORE w/ @notperfect_gurl https://www. swarmapp.com/c/fPdYhxy2YEW",,@notperfect_gurl,,700547569852817408,https://twitter.com/deideixx_/status/700547569852817408,tampines mrt station,tampines
JiaMing_T,2016-02-19 13:08:00,0,0,(@Acacia Breeze in ( Yishun New Town)) https://www. swarmapp.com/c/hhb5kj5I6tR,,@Acacia,,700547559295688704,https://twitter.com/JiaMing_T/status/700547559295688704,yishun mrt station,yishun
Jeffvynxn,2016-02-19 13:09:00,0,0,I'm at Jurong East MRT Interchange (NS1/EW24) - @smrt_singapore in Singapore https://www. swarmapp.com/c/5cI5Bkhktog,,@smrt_singapore,,700547807611117568,https://twitter.com/Jeffvynxn/status/700547807611117568,jurong east mrt station,jurong east
joel_lwf,2016-02-19 13:10:00,0,0,I'm at Ang Mo Kio in Singapore https://www. swarmapp.com/c/a32jlAMdtaD,,,,700548049676980224,https://twitter.com/joel_lwf/status/700548049676980224,ang mo kio mrt station,ang mo kio
chatwithhat,2016-02-19 13:10:00,0,0,A table full of huatness. #tobeapartner @NUSS Kent Ridge Guild House https://www. instagram.com/p/BB9KL-kul3k/,,@NUSS,#tobeapartner,700547952595566593,https://twitter.com/chatwithhat/status/700547952595566593,kent ridge mrt station,kent ridge
Stephanielyh,2016-02-19 13:11:00,0,0,I'm at Punggol in Singapore https://www. swarmapp.com/c/20gB0jP7IUF,,,,700548342779142146,https://twitter.com/Stephanielyh/status/700548342779142146,punggol mrt station,punggol
tohkenghoe,2016-02-19 13:11:00,0,0,"Helped nearby drivers by reporting road construction on Keppel Rd, Tanjong Pagar on @waze - Drive Social. https:// goo.gl/2ovg4R",,@waze,,700548218883547136,https://twitter.com/tohkenghoe/status/700548218883547136,tanjong pagar mrt station,tanjong pagar
ArmyStb,2016-02-19 13:11:00,0,0,I'm at Telok Blangah Hill Park in Singapore https://www. swarmapp.com/c/bmbeyVQVlFb,,,,700548239272103936,https://twitter.com/ArmyStb/status/700548239272103936,telok blangah mrt station,telok blangah
waaiisss,2016-02-19 13:11:00,0,0,I'm at Queenstown MRT Station (EW19) - @smrt_singapore in Singapore https://www. swarmapp.com/c/1451MrZ9Ici,,@smrt_singapore,,700548233026740224,https://twitter.com/waaiisss/status/700548233026740224,queenstown mrt station,queenstown mrt
tohkenghoe,2016-02-19 13:11:00,0,0,"Helped nearby drivers by reporting a heavy traffic jam on Keppel Rd, Tanjong Pagar on @waze - Drive Social. https:// goo.gl/Pp76zZ",,@waze,,700548193902321664,https://twitter.com/tohkenghoe/status/700548193902321664,tanjong pagar mrt station,tanjong pagar
Stephanielyh,2016-02-19 13:12:00,0,0,I'm at Blk 211B Punggol Field https://www. swarmapp.com/c/aBgBkmjFyQp,,,,700548374349660160,https://twitter.com/Stephanielyh/status/700548374349660160,punggol mrt station,punggol
nicolecwx,2016-02-19 13:13:00,0,0,I'm at Yishun Secondary School in Singapore https://www. swarmapp.com/c/d2f4hXEHcE4,,,,700548734321631233,https://twitter.com/nicolecwx/status/700548734321631233,yishun mrt station,yishun
dlSingapore,2016-02-19 13:13:00,0,0,"Indian-Origin Engineer, Credited For Role In Developing Port, Changi Airport Dies In Singapore: Singapore: A t... http:// binged.it/1QN6gCp",,,,700548841578180609,https://twitter.com/dlSingapore/status/700548841578180609,changi airport mrt station,changi airport
joannemissa,2016-02-19 13:15:00,0,0,#Back #house #changiairportsingapore #firsttime #happy @Singapore Changi Airport Terminal 3… https://www. instagram.com/p/BB9KyFIQ22b/,,@Singapore,#Back #house #changiairportsingapore #firsttime #happy,700549268415782912,https://twitter.com/joannemissa/status/700549268415782912,changi airport mrt station,changi airport
zurika_najwa99,2016-02-19 13:15:00,0,0,Nasib dan brek ja tadi..kalau tidak aku dok hospital tak pun tanah merah batu dua la jawapnya..,,,,700549271070740480,https://twitter.com/zurika_najwa99/status/700549271070740480,tanah merah mrt station,tanah merah
sporeathletics,2016-02-19 13:16:00,1,0,"REGISTRATION OPENS Series 3, 5-6 Mar, Bukit Gombak Stadium Download entry form at http://www. singaporeathletics.org.sg/downloads/1632 Details http://www. singaporeathletics.org.sg/2016-sa-track- and-field-series-3 …",,,,700549408941699072,https://twitter.com/sporeathletics/status/700549408941699072,bukit gombak mrt station,bukit gombak
