username,date,retweets,favorites,text,geo,mentions,hashtags,id,permalink,place,key
emileneeeeee,2015-12-27 15:42:00,0,0,I'm at Ang Mo Kio Central Market & Food Centre in Singapore https://www. swarmapp.com/c/fl8eKkDMbv5,,,,681017307234172928,https://twitter.com/emileneeeeee/status/681017307234172928,ang mo kio mrt station,ang mo kio
m4ximoff,2015-12-27 15:42:00,0,0,off to kallang,,,,681017229987557376,https://twitter.com/m4ximoff/status/681017229987557376,kallang mrt station,kallang
EricNRamos,2015-12-27 15:43:00,0,0,Zeke Skywalker Hehehe #StarWars #StarWarsAtChangi @Changi Airport https://www. instagram.com/p/_yYyS3MTT4/,,@Changi,#StarWars #StarWarsAtChangi,681017554932899840,https://twitter.com/EricNRamos/status/681017554932899840,changi airport mrt station,changi airport
rainnabe,2015-12-27 15:43:00,0,0,"@desmondoteo it's at block 138 Tampines , opp the Tampines round market.",,@desmondoteo,,681017541368524800,https://twitter.com/rainnabe/status/681017541368524800,tampines mrt station,tampines
VERSACHWE,2015-12-27 15:44:00,0,0,@yoonsjunghan PASIR RIS,,@yoonsjunghan,,681017712617758720,https://twitter.com/VERSACHWE/status/681017712617758720,pasir ris mrt station,pasir ris
irrinoying,2015-12-27 15:45:00,0,1,tampines on a Sunday is a terrible idea,,,,681018068324069376,https://twitter.com/irrinoying/status/681018068324069376,tampines mrt station,tampines
FloriiCabj,2015-12-27 15:45:00,0,0,@Huily_ Caldecott me tiene enamorada,,@Huily_,,681018022463684608,https://twitter.com/FloriiCabj/status/681018022463684608,caldescott mrt station,caldescott
Cinogard,2015-12-27 15:46:00,0,0,SMRT APM 100 [121]-[127]: Pending → Bukit Panjang (Service A): http:// youtu.be/aNQsKzrcBWY?a via @YouTube,,@YouTube,,681018230064988161,https://twitter.com/Cinogard/status/681018230064988161,bukit panjang mrt station,bukit panjang
SingaporePolice,2015-12-27 15:46:00,1,4,Join us at the Delta League Dec 2015 Grand Finals at Jalan Besar Stadium this evening! http:// on.fb.me/1mkoEdS pic.twitter.com/mrHO93FZib,,,,681018347454988288,https://twitter.com/SingaporePolice/status/681018347454988288,jalan besar mrt station,jalan besar
DanMicael,2015-12-27 15:46:00,0,1,Bedok palang ako :(,,,,681018374139203584,https://twitter.com/DanMicael/status/681018374139203584,bedok mrt station,bedok
doki81,2015-12-27 15:47:00,0,0,"@Uber_SING hi uber, why a ride from tampines to woodlands train checkpoint is $59-68? grabcar only cost $31~",,@Uber_SING,,681018607065665536,https://twitter.com/doki81/status/681018607065665536,tampines mrt station,tampines
ohxiaomin,2015-12-27 15:50:00,0,0,Exploring Singapore – Christmas at Gardens by the Bay https:// mintraveldiary.wordpress.com/2015/12/27/exp loring-singapore-christmas-at-gardens-by-the-bay … pic.twitter.com/ebY6CRQhyW,,,,681019217466925056,https://twitter.com/ohxiaomin/status/681019217466925056,gardens by the bay mrt station,gardens by the bay
Cinogard,2015-12-27 15:51:00,0,0,SMRT C151 [081/082]: Orchard → Newton (» Jurong East [D/E]): http:// youtu.be/jmlFJmtDcqQ?a via @YouTube,,@YouTube,,681019636020809728,https://twitter.com/Cinogard/status/681019636020809728,jurong east mrt station,jurong east
songboh,2015-12-27 15:51:00,0,0,#DTL2 5th stop: Rochor . Situated between Sim Lim Square and Lasalle College of the Arts. Bonus: Minister Khaw is here now!,,,#DTL2,681019554089144320,https://twitter.com/songboh/status/681019554089144320,rochor mrt station,rochor
Clouddyyyyyyy,2015-12-27 15:51:00,0,0,Our ride out! #HelloKittyEvaAir @Singapore Changi Airport Terminal 3 Departure Hall https://www. instagram.com/p/_yZwTJxrsL/,,@Singapore,#HelloKittyEvaAir,681019672259629056,https://twitter.com/Clouddyyyyyyy/status/681019672259629056,changi airport mrt station,changi airport
kassandralye,2015-12-27 15:51:00,0,0,my very own train station right at my doorstep! #downtownlinesingapore @King Albert Park MRT… https://www. instagram.com/p/_yZkEXqO7u/,,@King,#downtownlinesingapore,681019628739543040,https://twitter.com/kassandralye/status/681019628739543040,king albert park mrt station,king albert park
stompsingapore,2015-12-27 15:52:00,0,1,Men and woman fight in front of bystanders at Aljunied http:// goo.gl/CPEhR0 pic.twitter.com/klHnSWvXjj,,,,681019844267917313,https://twitter.com/stompsingapore/status/681019844267917313,aljunied mrt station,aljunied
poofthealpaca,2015-12-27 15:52:00,0,0,"@Flower Dome, Gardens by the Bay https://www. instagram.com/p/_yZyUnhqgRDT AFOAHnKK3hpXe2skQenT1arDE0/ …",,@Flower,,681019738810630144,https://twitter.com/poofthealpaca/status/681019738810630144,gardens by the bay mrt station,gardens by the bay
bellesimmm,2015-12-27 15:53:00,0,0,Waiting for annoying bae (@Bukit Batok MRT Station (NS2) - @smrt_singapore in Singapore) https://www. swarmapp.com/c/9fWEnspvRYQ,,@Bukit @smrt_singapore,,681019979895062528,https://twitter.com/bellesimmm/status/681019979895062528,bukit batok mrt station,bukit batok
Cloverstar81,2015-12-27 15:53:00,0,0,Haw Par Villa Singapore http:// mysingapore65.blogspot.sg/2015/11/haw-pa r-villa.html …,,,,681020158513516545,https://twitter.com/Cloverstar81/status/681020158513516545,haw par villa mrt station,haw par villa
_Shivashini_,2015-12-27 15:53:00,1,1,Really tired to travel to Hougang );,,,,681020017484234753,https://twitter.com/_Shivashini_/status/681020017484234753,hougang mrt station,hougang
justintanwc,2015-12-27 15:54:00,0,0,#DTL2 stills @Bukit Panjang MRT/LRT Station https://www. instagram.com/p/_yaCDKRP_w/,,@Bukit,#DTL2,681020279192174596,https://twitter.com/justintanwc/status/681020279192174596,bukit panjang mrt station,bukit panjang
csu2020,2015-12-27 15:54:00,0,0,Top 10 Bowlers with most maidens in Tests 10. Bishan Singh Bedi (India) – 1096 9. Courtney Walsh (West Indies) –... http:// fb.me/7zZemCnOt,,,,681020266210660352,https://twitter.com/csu2020/status/681020266210660352,bishan mrt station,bishan
YuviS12,2015-12-27 15:55:00,0,0,Top 10 Bowlers with most maidens in Tests 10. Bishan Singh Bedi (India) – 1096 9. Courtney Walsh (West Indies) –... http:// fb.me/4aAsTipaV,,,,681020607308238848,https://twitter.com/YuviS12/status/681020607308238848,bishan mrt station,bishan
fionajov,2015-12-27 15:55:00,0,0,yey swimming time (with Lola at Jalan Besar Swimming Complex) [pic] — https:// path.com/p/2q8MBN,,,,681020679240613888,https://twitter.com/fionajov/status/681020679240613888,jalan besar mrt station,jalan besar
deleonwolff,2015-12-27 15:57:00,0,0,I'm at Clementi MRT Station (EW23) - @smrt_singapore in Singapore https://www. swarmapp.com/c/7a9PMuqzBpy,,@smrt_singapore,,681021046187798528,https://twitter.com/deleonwolff/status/681021046187798528,clementi mrt station,clementi mrt
athiraazran,2015-12-27 15:59:00,0,0,who at tampines ahahahaha,,,,681021639094472704,https://twitter.com/athiraazran/status/681021639094472704,tampines mrt station,tampines
kuekj,2015-12-27 15:59:00,1,0,Honestly curious question: how many #DTL2 riders are also first-time riders of the Bukit Panjang LRT today?,,,#DTL2,681021484244979712,https://twitter.com/kuekj/status/681021484244979712,bukit panjang mrt station,bukit panjang
muhdismail323,2015-12-27 15:59:00,0,0,Just posted a photo @Jurong East Swimming Complex https://www. instagram.com/p/_yaqy2Ogsu/,,@Jurong,,681021687987490816,https://twitter.com/muhdismail323/status/681021687987490816,jurong east mrt station,jurong east
busesINgapore,2015-12-27 15:59:00,0,0,"SMRT's service 979 launched at Yew Tee MRT this morning, using a MAN Lion's City bendy bus~ http:// fb.me/2uK4dBa3b",,,,681021498451177472,https://twitter.com/busesINgapore/status/681021498451177472,yew tee mrt station,yew tee
ruilockhart,2015-12-27 16:00:00,0,0,I'm at Singapore Changi Airport (SIN) in Singapore https://www. swarmapp.com/c/iy4HAfCefQC,,,,681021722385080320,https://twitter.com/ruilockhart/status/681021722385080320,changi airport mrt station,changi airport
CHARMlNGJlMlN,2015-12-27 16:02:00,0,1,@jimjamedkookie OMG WTS I LIVE BESIDE KALLANG RIVER DLFFKLFJFLF LETS MEET SOON,,@jimjamedkookie,,681022306055921664,https://twitter.com/CHARMlNGJlMlN/status/681022306055921664,kallang mrt station,kallang
32resaep,2015-12-27 16:02:00,0,0,ปะกลับ (@Singapore Changi Airport (SIN) - @fansofchangi in Singapore) https://www. swarmapp.com/c/9GdvEV3sOmK,,@Singapore @fansofchangi,,681022441171320833,https://twitter.com/32resaep/status/681022441171320833,changi airport mrt station,changi airport
Darrylttk,2015-12-27 16:02:00,0,0,I'm at Bedok Mall in Singapore https://www. swarmapp.com/c/00ftob0HL4v,,,,681022438814183424,https://twitter.com/Darrylttk/status/681022438814183424,bedok mrt station,bedok
_ftnsyazwani,2015-12-27 16:04:00,0,0,@mohdamizal_ goodluck bishan .,,@mohdamizal_,,681022904536940544,https://twitter.com/_ftnsyazwani/status/681022904536940544,bishan mrt station,bishan
Clear_Liqueur,2015-12-27 16:04:00,0,0,LMAO at Gardens by the Bay with my father and I qualified for ~caregivers discount. XD,,,,681022953115369472,https://twitter.com/Clear_Liqueur/status/681022953115369472,gardens by the bay mrt station,gardens by the bay
RisaReally,2015-12-27 16:04:00,0,2,The Festives are all around me at the coolest & fun place airport in the world @changiairport @SG50 @TwitterSG pic.twitter.com/9ZvOeVVDTJ,,@changiairport @SG50 @TwitterSG,,681022917031759872,https://twitter.com/RisaReally/status/681022917031759872,changi airport mrt station,changi airport
SBSTransit_Ltd,2015-12-27 16:04:00,6,2,1600hrs: Light crowds at all DTL stations except for moderate crowd at Bukit Panjang and Beauty World stations.,,,,681022840049504256,https://twitter.com/SBSTransit_Ltd/status/681022840049504256,bukit panjang mrt station,bukit panjang
butterfingers67,2015-12-27 16:05:00,0,0,bye singapore. see ya soon! (@Changi Airport Terminal 1 - @fansofchangi in Singapore) https://www. swarmapp.com/c/dW9UA7XmVQB,,@Changi @fansofchangi,,681023096216752129,https://twitter.com/butterfingers67/status/681023096216752129,changi airport mrt station,changi airport
2Dumbass4You,2015-12-27 16:05:00,0,0,I'm at Lakeside MRT Station (EW26) - @smrt_singapore in Singapore https://www. swarmapp.com/c/lJFtuCdfB68,,@smrt_singapore,,681023127472705536,https://twitter.com/2Dumbass4You/status/681023127472705536,lakeside mrt station,lakeside mrt
ShaunShaunny,2015-12-27 16:07:00,0,0,I'm at Pasir Ris Bus Interchange in Singapore https://www. swarmapp.com/c/7MlOKGDOf7M,,,,681023544453627904,https://twitter.com/ShaunShaunny/status/681023544453627904,pasir ris mrt station,pasir ris
ayurizkiyani07,2015-12-27 16:07:00,0,0,@ristano320 iya kebetulan pas kmrin sy pas bnar2 dpt macetnya agak dipinggir jalan besar udah agak jauh dari warung,,@ristano320,,681023699101724677,https://twitter.com/ayurizkiyani07/status/681023699101724677,jalan besar mrt station,jalan besar
EnchancerMyLife,2015-12-27 16:07:00,0,0,0.o tampines bus interchange change te bus drop off point again,,,,681023709235122181,https://twitter.com/EnchancerMyLife/status/681023709235122181,tampines mrt station,tampines
Ciratabdg,2015-12-27 16:08:00,0,0,CDAC to open its 13th centre in Bedok in 2016: The new centre - to be opened in partnership with the South Eas... http:// bit.ly/1NHZH5n,,,,681023722522673152,https://twitter.com/Ciratabdg/status/681023722522673152,bedok mrt station,bedok
deleonwolff,2015-12-27 16:09:00,0,0,I'm at Buona Vista MRT Interchange (EW21/CC22) - @smrt_singapore in Singapore https://www. swarmapp.com/c/gYtKdLR7euo,,@smrt_singapore,,681023995685285888,https://twitter.com/deleonwolff/status/681023995685285888,buona vista mrt station,buona vista
shertimus,2015-12-27 16:11:00,0,0,Omg 25 mins from Bugis to Bukit Panjang ! RECORD BREAKERRRRRRR,,,,681024502386409473,https://twitter.com/shertimus/status/681024502386409473,bukit panjang mrt station,bukit panjang
Nrsrhfsha,2015-12-27 16:13:00,0,2,Off to pasir ris,,,,681025116298326016,https://twitter.com/Nrsrhfsha/status/681025116298326016,pasir ris mrt station,pasir ris
ismadLonggaq,2015-12-27 16:14:00,0,0,"Sat boh (@Tanah merah jitra in Jitra, Kedah) https://www. swarmapp.com/c/brCaxveL0Aq",,@Tanah,,681025362143371264,https://twitter.com/ismadLonggaq/status/681025362143371264,tanah merah mrt station,tanah merah
Nrsrhfsha,2015-12-27 16:15:00,0,0,Pasir ris beach buat ape lagi ? Clycling la,,,,681025720370397186,https://twitter.com/Nrsrhfsha/status/681025720370397186,pasir ris mrt station,pasir ris
emrehelms,2015-12-27 16:15:00,0,0,@Ahfeiruq yep. from BP to Rochor . plus the alrd existing stns.,,@Ahfeiruq,,681025478652628992,https://twitter.com/emrehelms/status/681025478652628992,rochor mrt station,rochor
ShaunShaunny,2015-12-27 16:16:00,0,0,I'm at Tampines MRT Station (EW2/DT32) - @smrt_singapore in Singapore https://www. swarmapp.com/c/cyXOS7MS4Jl,,@smrt_singapore,,681025844119224320,https://twitter.com/ShaunShaunny/status/681025844119224320,tampines mrt station,tampines
_FANTASTICBABY_,2015-12-27 16:16:00,0,0,I'm at Singapore Changi Airport (SIN) - @fansofchangi in Singapore https://www. swarmapp.com/c/fzEyd0gkD5n,,@fansofchangi,,681025889388343297,https://twitter.com/_FANTASTICBABY_/status/681025889388343297,changi airport mrt station,changi airport
DemocraAsia,2015-12-27 16:16:00,0,0,CNA: CDAC to open its 13th centre in Bedok in 2016 - The new centre - to be opened in partnership with the Sout... http:// ow.ly/39sn8w,,,,681025816793378817,https://twitter.com/DemocraAsia/status/681025816793378817,bedok mrt station,bedok
_kcxy,2015-12-27 16:17:00,0,0,I'm at Paya Lebar Square in Singapore https://www. swarmapp.com/c/etT0NEGJPNX,,,,681026220792885248,https://twitter.com/_kcxy/status/681026220792885248,paya lebar mrt station,paya lebar
songboh,2015-12-27 16:17:00,2,2,#DTL2 Rochor : Minister Khaw entered 观音堂佛祖庙 (Kwan Im Thong Hood Cho Temple). Bo bi bo bi trains don't break down! pic.twitter.com/vxFYpFD5C6,,,#DTL2,681026113846415360,https://twitter.com/songboh/status/681026113846415360,rochor mrt station,rochor
DukaKofi,2015-12-27 16:17:00,0,0,"Read Bridge, Clarke Quay , Singapore pic.twitter.com/liGB2lZuuL",,,,681025981600153600,https://twitter.com/DukaKofi/status/681025981600153600,clarke quay mrt station,clarke quay
Ashxmathers,2015-12-27 16:17:00,0,0,Fuark I need to go to Clarke quay tomorrow.,,,,681026061748977664,https://twitter.com/Ashxmathers/status/681026061748977664,clarke quay mrt station,clarke quay
zulhairimiyusuf,2015-12-27 16:18:00,0,0,Hi Sunday! @Gardens by the Bay https://www. instagram.com/p/_yc0ohEzZQo7 eApVsF4oYd9XVt49gwDvpcruI0/ …,,@Gardens,,681026415286988801,https://twitter.com/zulhairimiyusuf/status/681026415286988801,gardens by the bay mrt station,gardens by the bay
prettywhims,2015-12-27 16:20:00,0,0,I'm at Choa Chu Kang Bus Interchange - @smrt_singapore in Singapore https://www. swarmapp.com/c/cGR35kIhI1O,,@smrt_singapore,,681026878401024004,https://twitter.com/prettywhims/status/681026878401024004,choa chu kang mrt station,choa chu kang
scoopsg,2015-12-27 16:21:00,0,0,CNA | CDAC to open its 13th centre in Bedok in 2016 http:// bit.ly/1OmAbQr pic.twitter.com/hkvY8YcjQz,,,,681027185323343872,https://twitter.com/scoopsg/status/681027185323343872,bedok mrt station,bedok
EricNRamos,2015-12-27 16:21:00,0,0,Star Wars Experience #StarWarsChangi #StarWars @Changi Airport https://www. instagram.com/p/_ydIDysTZs/,,@Changi,#StarWarsChangi #StarWars,681027094327869440,https://twitter.com/EricNRamos/status/681027094327869440,changi airport mrt station,changi airport
AlienAFA,2015-12-27 16:21:00,0,0,With my Princess ! @Gardens by the Bay https://www. instagram.com/p/_ydGF4LjLM6n wbBOMLxWui9CDCbnD5HivZ0Os0/ …,,@Gardens,,681027017542885378,https://twitter.com/AlienAFA/status/681027017542885378,gardens by the bay mrt station,gardens by the bay
emileneeeeee,2015-12-27 16:22:00,0,0,I'm at Hougang in Singapore https://www. swarmapp.com/c/f8kgzFzut7a,,,,681027322745597952,https://twitter.com/emileneeeeee/status/681027322745597952,hougang mrt station,hougang
newsSG,2015-12-27 16:22:00,0,0,CNA | CDAC to open its 13th centre in Bedok in 2016 http:// bit.ly/1OmAbQr pic.twitter.com/2Fok7jjRjw,,,,681027333138993153,https://twitter.com/newsSG/status/681027333138993153,bedok mrt station,bedok
scoo_ps,2015-12-27 16:22:00,0,0,CNA | CDAC to open its 13th centre in Bedok in 2016 http:// bit.ly/1OmAbQr #sgnews pic.twitter.com/G1w727HhKN,,,#sgnews,681027289019060224,https://twitter.com/scoo_ps/status/681027289019060224,bedok mrt station,bedok
dyntsh,2015-12-27 16:23:00,0,0,class vs estrellas!! (@Jalan Besar Stadium in Singapore) https://www. swarmapp.com/c/c71uEeD4gG5,,@Jalan,,681027606024708096,https://twitter.com/dyntsh/status/681027606024708096,jalan besar mrt station,jalan besar
Ziweeei,2015-12-27 16:23:00,0,0,I'm at Tai Seng MRT Station (CC11) - @smrt_singapore in Singapore https://www. swarmapp.com/c/4jZqY0YfRFE,,@smrt_singapore,,681027676073771008,https://twitter.com/Ziweeei/status/681027676073771008,tai seng mrt station,tai seng mrt
AricSZBPL,2015-12-27 16:23:00,0,0,"#Room &roommates in #SG , #Kallang ! http://www. mondinion.com/md/2787013/vso urce/twitterapp/ … #MondProp pic.twitter.com/DHhLkWU16O",,,#Room #SG #Kallang #MondProp,681027575309717504,https://twitter.com/AricSZBPL/status/681027575309717504,kallang mrt station,kallang
ermanlwk,2015-12-27 16:24:00,0,0,"Telok Banggah ( Telok Blangah ) - some commuter said it so confidently and loud enough for me to hear, i kennut!",,,,681027753336913920,https://twitter.com/ermanlwk/status/681027753336913920,telok blangah mrt station,telok blangah
janicefong_,2015-12-27 16:24:00,0,0,I'm at Punggol Plaza - @punggollatest in Singapore https://www. swarmapp.com/c/iJiAS9KIn0H,,@punggollatest,,681027905812623360,https://twitter.com/janicefong_/status/681027905812623360,punggol mrt station,punggol
Xiruisly,2015-12-27 16:24:00,0,0,@ZackBlueRanger Exactly why you should come to the Bishan shoot today,,@ZackBlueRanger,,681027956680998912,https://twitter.com/Xiruisly/status/681027956680998912,bishan mrt station,bishan
janicefong_,2015-12-27 16:25:00,0,0,"I'm at Prima Deli@Punggol Plaza in Singapore, Punggol https://www. swarmapp.com/c/a3ziAn78Pmw",,@Punggol,,681028047999492096,https://twitter.com/janicefong_/status/681028047999492096,punggol mrt station,punggol
eileenangggg,2015-12-27 16:25:00,0,0,I'm at Marsiling Sapphire https://www. swarmapp.com/c/gCvibXjdFnF,,,,681028081612656640,https://twitter.com/eileenangggg/status/681028081612656640,marsiling mrt station,marsiling
Fariisssss,2015-12-27 16:26:00,0,0,@Heynrl gardens by the bay isit??,,@Heynrl,,681028317684707330,https://twitter.com/Fariisssss/status/681028317684707330,gardens by the bay mrt station,gardens by the bay
mijingyo,2015-12-27 16:26:00,0,0,3 consecutive days in gangnam... it is like travelling from jookoon to pasir ris,,,,681028391793868800,https://twitter.com/mijingyo/status/681028391793868800,joo koon mrt station,joo koon
RRNaran,2015-12-27 16:26:00,0,0,Acting like monkeys #MonkeySZN #hawparvilla #singapore https://www. instagram.com/p/_ydp5_qTSf28 sUtjcNnZInnhPleXxr6mjM5wo0/ …,,,#MonkeySZN #hawparvilla #singapore,681028249577762816,https://twitter.com/RRNaran/status/681028249577762816,haw par villa mrt station,haw par villa
faizzikryy,2015-12-27 16:26:00,0,0,otw to kallang wave now,,,,681028464825090050,https://twitter.com/faizzikryy/status/681028464825090050,kallang mrt station,kallang
khailvanguard,2015-12-27 16:26:00,0,0,HAHAHAHAH fuck. I got lost searching for Downtown Line Bukit Panjang,,,,681028315809845248,https://twitter.com/khailvanguard/status/681028315809845248,bukit panjang mrt station,bukit panjang
lydiatohrq,2015-12-27 16:27:00,0,0,I'm at Punggol Plaza - @punggollatest in Singapore https://www. swarmapp.com/c/4F2FQPRfbHc,,@punggollatest,,681028738876862465,https://twitter.com/lydiatohrq/status/681028738876862465,punggol mrt station,punggol
undergroundfox_,2015-12-27 16:27:00,0,0,I'm at The Punggol Settlement in Singapore https://www. swarmapp.com/c/kNdtS3J8nNQ,,,,681028715225157632,https://twitter.com/undergroundfox_/status/681028715225157632,punggol mrt station,punggol
zenny_xoxo2301,2015-12-27 16:28:00,0,0,"""Childhood"" A part of life that creates beautiful memories // @boey_chee @Gardens by the Bay https://www. instagram.com/p/_yd-dprgfP/",,@boey_chee @Gardens,,681028960168198144,https://twitter.com/zenny_xoxo2301/status/681028960168198144,gardens by the bay mrt station,gardens by the bay
Muiz_Ismadi,2015-12-27 16:29:00,0,0,Tanah Merah belum https:// twitter.com/sbpgags/status /681028599688740864 …,,,,681029053172682752,https://twitter.com/Muiz_Ismadi/status/681029053172682752,tanah merah mrt station,tanah merah
dobbynuddin,2015-12-27 16:29:00,0,0,@SBPGags belumm... tanah merah belum ada,,@SBPGags,,681029001448521728,https://twitter.com/dobbynuddin/status/681029001448521728,tanah merah mrt station,tanah merah
faizzikryy,2015-12-27 16:30:00,0,0,should i go back home or go kallang wave? zz,,,,681029496917512193,https://twitter.com/faizzikryy/status/681029496917512193,kallang mrt station,kallang
BillyNg123,2015-12-27 16:30:00,0,0,Inside @the garden by the bay @Gardens by the Bay https://www. instagram.com/p/_yeOQ2itrBMP 0BGrfqfuNe26g74ABY1LxXttc0/ …,,@the @Gardens,,681029496011681793,https://twitter.com/BillyNg123/status/681029496011681793,gardens by the bay mrt station,gardens by the bay
eisen,2015-12-27 16:31:00,1,3,DT11 / NS21: Newton MRT Station. #DTL2 pic.twitter.com/8y7vj0P858,,,#DTL2,681029720431931392,https://twitter.com/eisen/status/681029720431931392,newton mrt station,newton mrt
nrdllhidris_,2015-12-27 16:31:00,0,0,off to punggol,,,,681029672512061440,https://twitter.com/nrdllhidris_/status/681029672512061440,punggol mrt station,punggol
thedina__,2015-12-27 16:31:00,0,0,@SBPGags tanah merah . Tapi dgr kata nak buat mrsm kat sini,,@SBPGags,,681029542589239296,https://twitter.com/thedina__/status/681029542589239296,tanah merah mrt station,tanah merah
theyishusblog,2015-12-27 16:31:00,0,0,"@kuekj @kosherjellyfish I don't get what you mean. Bedok , Bugis, comes to mine",,@kuekj @kosherjellyfish,,681029558578081793,https://twitter.com/theyishusblog/status/681029558578081793,bedok mrt station,bedok
aishiteruhelly,2015-12-27 16:32:00,0,0,@East Coast Park Bedok Jetty https://www. instagram.com/p/_yeWjSjgqb/,,@East,,681029795249917952,https://twitter.com/aishiteruhelly/status/681029795249917952,bedok mrt station,bedok
_shafiqqq,2015-12-27 16:32:00,0,0,Cycled to Punggol and back to Marsiling .,,,,681029818842923008,https://twitter.com/_shafiqqq/status/681029818842923008,marsiling mrt station,marsiling
TypewriterIntl,2015-12-27 16:32:00,3,0,CDAC to open its 13th centre in Bedok in 2016 http:// tinyurl.com/pkz73cg,,,,681029792737570817,https://twitter.com/TypewriterIntl/status/681029792737570817,bedok mrt station,bedok
dlSingapore,2015-12-27 16:32:00,0,0,CDAC to open its 13th centre in Bedok in 2016: The new centre - to be opened in partnership with the South Eas... http:// bit.ly/1NHZH5n,,,,681029794021031936,https://twitter.com/dlSingapore/status/681029794021031936,bedok mrt station,bedok
2Dumbass4You,2015-12-27 16:32:00,0,0,I'm at Commonwealth MRT Station (EW20) - @smrt_singapore in Singapore https://www. swarmapp.com/c/6qrPgiI87lI,,@smrt_singapore,,681029896727040000,https://twitter.com/2Dumbass4You/status/681029896727040000,commonwealth mrt station,commonwealth mrt
DianaBr44562703,2015-12-27 16:34:00,0,0,CDAC to open its 13th centre in Bedok in 2016 http:// cur.lv/tkxyp,,,,681030305046597632,https://twitter.com/DianaBr44562703/status/681030305046597632,bedok mrt station,bedok
iraisirais,2015-12-27 16:34:00,0,1,Gardens by the Bay #Singapore https://www. instagram.com/p/_yeqdMxDiC/,,,#Singapore,681030464057044992,https://twitter.com/iraisirais/status/681030464057044992,gardens by the bay mrt station,gardens by the bay
smattaiwan,2015-12-27 16:36:00,0,1,"Having cuppa coffee at Fun Toast, special offer $1 per cup at #DTL2 Rochor pic.twitter.com/b5r5Ou49ET",,,#DTL2,681030802080006144,https://twitter.com/smattaiwan/status/681030802080006144,rochor mrt station,rochor
Hydrogenillary,2015-12-27 16:37:00,0,0,@Gardens by the Bay https://www. instagram.com/p/_ye-2Qo7o_/,,@Gardens,,681031166934282240,https://twitter.com/Hydrogenillary/status/681031166934282240,gardens by the bay mrt station,gardens by the bay
Power98News,2015-12-27 16:38:00,0,0,"#HDB to use smart planning tools to assist in the development of upcoming towns and estates, following Punggol Northshore",,,#HDB,681031390134165504,https://twitter.com/Power98News/status/681031390134165504,punggol mrt station,punggol
aidilhazard98,2015-12-27 16:38:00,0,0,tanah merah takda https:// twitter.com/SBPGags/status /681028794237321216 …,,,,681031416574943233,https://twitter.com/aidilhazard98/status/681031416574943233,tanah merah mrt station,tanah merah
ItsWayneAng,2015-12-27 16:39:00,0,0,Ehwhshehwyeheiitnridheusuwvwe just sick of Tampines and pasir ris,,,,681031575027384324,https://twitter.com/ItsWayneAng/status/681031575027384324,pasir ris mrt station,pasir ris
GayPorkkkkkk,2015-12-27 16:39:00,0,0,What should i wear to Jalan Besar to watch a soccer match?,,,,681031741654433793,https://twitter.com/GayPorkkkkkk/status/681031741654433793,jalan besar mrt station,jalan besar
wweshirley90,2015-12-27 16:39:00,0,0,"Just finished slacking at changi airport , heading to Yishun cc to buy domino pizza.",,,,681031606325268482,https://twitter.com/wweshirley90/status/681031606325268482,changi airport mrt station,changi airport
weikai34,2015-12-27 16:39:00,0,1,來了快半年才嘗試第一次的咖椰吐司～味道還不錯^_^ @Bedok Mall https://www. instagram.com/p/_yfLJXhqnK/,,@Bedok,,681031586322735104,https://twitter.com/weikai34/status/681031586322735104,bedok mrt station,bedok
PREPOSSESSlNG,2015-12-27 16:40:00,3,1,"others : eh where you stay? me : tiong bahru other : where? me : *shows map and surrounding pic* others : wtf, you live in the jungle?",,,,681031870218289153,https://twitter.com/PREPOSSESSlNG/status/681031870218289153,tiong bahru mrt station,tiong bahru
