username,date,retweets,favorites,text,geo,mentions,hashtags,id,permalink,place,key
lwxl_,2015-12-27 19:47:00,0,0,sending bf to book in........... (@Pasir Ris Bus Interchange in Singapore) https://www. swarmapp.com/c/bFm85YR6ZTF,,@Pasir,,681079071804145664,https://twitter.com/lwxl_/status/681079071804145664,pasir ris mrt station,pasir ris
vansa733,2015-12-27 19:47:00,0,0,Last #Sunday of 2015 #ThankYouForAllYouHaveDone @The Punggol Settlement https://www. instagram.com/p/_y0s--Rfb9/,,@The,#Sunday #ThankYouForAllYouHaveDone,681078931420803073,https://twitter.com/vansa733/status/681078931420803073,punggol mrt station,punggol
siepasarrebo,2015-12-27 19:47:00,0,0,Giat angkut sampah di TPS tanah merah condet gedong 27/12/2015 @KebersihanDKI @KebersihanJT @MarnaekPSM @IsnawaAdji pic.twitter.com/LY2dtl2E2p,,@KebersihanDKI @KebersihanJT @MarnaekPSM @IsnawaAdji,,681079021795291136,https://twitter.com/siepasarrebo/status/681079021795291136,tanah merah mrt station,tanah merah
benlmk_,2015-12-27 19:49:00,0,0,I'm at Boon Keng MRT Station (NE9) - @sbs_transit in Singapore https://www. swarmapp.com/c/0l0a94f9imM,,@sbs_transit,,681079499199504384,https://twitter.com/benlmk_/status/681079499199504384,boon keng mrt station,boon keng mrt
riauaktual,2015-12-27 19:51:00,1,0,Warga Tanah Merah Inhu Desak Pemerintah Tutup Kafe Tempat Maksiat http:// dlvr.it/D6bdkf,,,,681079846768787456,https://twitter.com/riauaktual/status/681079846768787456,tanah merah mrt station,tanah merah
DataRiau,2015-12-27 19:51:00,0,0,Warga Tanah Merah Inhu Desak Pemerintah Tutup Kafe Tempat Maksiat http:// dlvr.it/D6bbg5,,,,681079849184669696,https://twitter.com/DataRiau/status/681079849184669696,tanah merah mrt station,tanah merah
mdsykri,2015-12-27 19:51:00,0,5,"Nego bedok sejuk boleh kayo, haha.",,,,681079970764992512,https://twitter.com/mdsykri/status/681079970764992512,bedok mrt station,bedok
DataRiau,2015-12-27 19:51:00,0,0,Warga Tanah Merah Inhu Desak Pemerintah Tutup Kafe Tempat Maksiat http:// dlvr.it/D6bbdw,,,,681079850203877377,https://twitter.com/DataRiau/status/681079850203877377,tanah merah mrt station,tanah merah
pesisir_news,2015-12-27 19:51:00,0,0,Warga Tanah Merah Inhu Desak Pemerintah Tutup Kafe Tempat Maksiat http:// dlvr.it/D6bXQl,,,,681079845619548160,https://twitter.com/pesisir_news/status/681079845619548160,tanah merah mrt station,tanah merah
IamNotMalay,2015-12-27 19:51:00,0,1,I reached joo koon in an hour from hougang ?! Whut ?!,,,,681079993070268417,https://twitter.com/IamNotMalay/status/681079993070268417,hougang mrt station,hougang
Novariqy,2015-12-27 19:51:00,0,0,Warga Tanah Merah Inhu Desak Pemerintah Tutup Kafe Tempat Maksiat http:// dlvr.it/D6bfYx,,,,681079845082664961,https://twitter.com/Novariqy/status/681079845082664961,tanah merah mrt station,tanah merah
OtaAkbar,2015-12-27 19:51:00,1,0,Warga Tanah Merah Inhu Desak Pemerintah Tutup Kafe Tempat Maksiat http:// dlvr.it/D6bbDm,,,,681079846647148544,https://twitter.com/OtaAkbar/status/681079846647148544,tanah merah mrt station,tanah merah
lccyx,2015-12-27 19:51:00,0,0,I'm at Yew Tee Point in Singapore w/ @benedictlah https://www. swarmapp.com/c/fUG4iPrwpjC,,@benedictlah,,681079844407492608,https://twitter.com/lccyx/status/681079844407492608,yew tee mrt station,yew tee
Darrenicorn,2015-12-27 19:52:00,0,0,I'm at Old Tampines Road in Singapore https://www. swarmapp.com/c/0qa5J5ONb5c,,,,681080135110520832,https://twitter.com/Darrenicorn/status/681080135110520832,tampines mrt station,tampines
babes_mentionz,2015-12-27 19:52:00,0,0,#asiadelight Avocado with gula melaka pergh.... @Tampines Greenwood https://www. instagram.com/p/_y1VNdDRtE/,,@Tampines,#asiadelight,681080312215007233,https://twitter.com/babes_mentionz/status/681080312215007233,tampines mrt station,tampines
mhbs94,2015-12-27 19:53:00,3,2,Have yet to go to Gardens By The Bay to see those beautiful festive lights...,,,,681080433442832389,https://twitter.com/mhbs94/status/681080433442832389,gardens by the bay mrt station,gardens by the bay
HatsuneMikuLc,2015-12-27 19:54:00,0,0,"Check out.. (@taman indah, tanah merah ) https://www. swarmapp.com/c/j1fstO6OyRU",,@taman,,681080789686161408,https://twitter.com/HatsuneMikuLc/status/681080789686161408,tanah merah mrt station,tanah merah
HatsuneMikuLc,2015-12-27 19:54:00,0,0,"Check out.. — at taman indah, tanah merah http:// fb.me/2sv5f07l2",,,,681080803841818624,https://twitter.com/HatsuneMikuLc/status/681080803841818624,tanah merah mrt station,tanah merah
isyrafjamaludin,2015-12-27 19:54:00,0,0,"Sorry dik muka blur, tapi nak post gak @Gardens by the Bay https://www. instagram.com/p/_y1fY1Mx3L/",,@Gardens,,681080670060322816,https://twitter.com/isyrafjamaludin/status/681080670060322816,gardens by the bay mrt station,gardens by the bay
woshiangel_,2015-12-27 19:55:00,0,0,Otw to changi airport,,,,681080993873182721,https://twitter.com/woshiangel_/status/681080993873182721,changi airport mrt station,changi airport
ShafiqahEsmail,2015-12-27 19:55:00,0,0,@lshyc_ @_Nhzrh I ade tapi di tampines tho,,@lshyc_ @_Nhzrh,,681081010117709824,https://twitter.com/ShafiqahEsmail/status/681081010117709824,tampines mrt station,tampines
Isabel_Bleh,2015-12-27 19:55:00,0,0,I'm at Bukit Batok in Singapore https://www. swarmapp.com/c/1on5spv3fUb,,,,681080933064306688,https://twitter.com/Isabel_Bleh/status/681080933064306688,bukit batok mrt station,bukit batok
babes_mentionz,2015-12-27 19:56:00,0,0,#asiadelight Avocado with gula melaka pergh.... @Tampines Greenwood https://www. instagram.com/p/_y1tuKDRt2/,,@Tampines,#asiadelight,681081153563037696,https://twitter.com/babes_mentionz/status/681081153563037696,tampines mrt station,tampines
Nikaimann_,2015-12-27 19:58:00,0,1,"Alhamdulillah (@Masjid Bukit Bunga in Tanah Merah , Kelantan) https://www. swarmapp.com/c/cirIN1RNB6v",,@Masjid,,681081603280486400,https://twitter.com/Nikaimann_/status/681081603280486400,tanah merah mrt station,tanah merah
shukviama,2015-12-27 19:58:00,0,0,why must my camp be at joo koon,,,,681081695466962944,https://twitter.com/shukviama/status/681081695466962944,joo koon mrt station,joo koon
BrianEmma2,2015-12-27 19:58:00,0,0,Outdoor racecourse to kids at preschool punggol : cpqDBDsBG,,,,681081736634105856,https://twitter.com/BrianEmma2/status/681081736634105856,punggol mrt station,punggol
wordrevel,2015-12-27 19:59:00,0,11,"Basically, Gardens by the Bay is how I imagine part of Luna to look like #thelunarchronicles pic.twitter.com/7CG3pKOr0l",,,#thelunarchronicles,681082090285236224,https://twitter.com/wordrevel/status/681082090285236224,gardens by the bay mrt station,gardens by the bay
MrsSuperwoman_,2015-12-27 19:59:00,0,0,Back and rest (@Marsiling in Singapore) https://www. swarmapp.com/c/eac3Tcv9HwZ,,@Marsiling,,681081885124984833,https://twitter.com/MrsSuperwoman_/status/681081885124984833,marsiling mrt station,marsiling
pxnkr0ses,2015-12-27 20:00:00,0,0,am i like the only person that didn't go to gardens by the bay like this holiday?,,,,681082114058530816,https://twitter.com/pxnkr0ses/status/681082114058530816,gardens by the bay mrt station,gardens by the bay
JREALYZ_,2015-12-27 20:03:00,0,0,"homeddd (@我的家 in pasir ris , singapore) https://www. swarmapp.com/c/2Yene3ieLUd",,@,,681082863727570944,https://twitter.com/JREALYZ_/status/681082863727570944,pasir ris mrt station,pasir ris
Paramitha_28,2015-12-27 20:04:00,0,0,Dia ji mau calla orang baru dia ndk mau dicalla dasar KALPIT ( kallang pi'ta),,,,681083110549794816,https://twitter.com/Paramitha_28/status/681083110549794816,kallang mrt station,kallang
salleh_syakir,2015-12-27 20:04:00,0,0,@takdeduit jumpa kat yio chu kang mrt,,@takdeduit,,681083323616083968,https://twitter.com/salleh_syakir/status/681083323616083968,yio chu kang mrt station,yio chu kang
TurismEnlighten,2015-12-27 20:05:00,0,0,I added a video to a @YouTube playlist http:// youtu.be/06Fr4vXFxVg?a Haw Par Villa,,@YouTube,,681083392486670337,https://twitter.com/TurismEnlighten/status/681083392486670337,haw par villa mrt station,haw par villa
TurismEnlighten,2015-12-27 20:05:00,0,1,Haw Par Villa : http:// youtu.be/06Fr4vXFxVg?a via @YouTube,,@YouTube,,681083509734260736,https://twitter.com/TurismEnlighten/status/681083509734260736,haw par villa mrt station,haw par villa
reyhanezra,2015-12-27 20:06:00,0,0,Touchdown.. (at Changi Airport Terminal 3) — https:// path.com/p/mMJ6X,,,,681083833744109568,https://twitter.com/reyhanezra/status/681083833744109568,changi airport mrt station,changi airport
bryancjy,2015-12-27 20:08:00,0,0,Journey to yewtee,,,,681084137877319680,https://twitter.com/bryancjy/status/681084137877319680,yew tee mrt station,yew tee
shannyxx_,2015-12-27 20:09:00,0,0,"I'm at Tampines Bus Interchange in Singapore, SINGAPORE https://www. swarmapp.com/c/1koaOmH8FwC",,,,681084467725889536,https://twitter.com/shannyxx_/status/681084467725889536,tampines mrt station,tampines
zaihansaad,2015-12-27 20:09:00,0,0,Lama tak bertweet ngan bishan .ni alang duk sekali dalam gua.boleh kot.,,,,681084556519194624,https://twitter.com/zaihansaad/status/681084556519194624,bishan mrt station,bishan
AadamCes,2015-12-27 20:09:00,0,0,God gives his hardest battles to his strongest soldiers. Cr: @phoebetyl @Gardens by the Bay https://www. instagram.com/p/_y3PyqqAek/,,@phoebetyl @Gardens,,681084524638408704,https://twitter.com/AadamCes/status/681084524638408704,gardens by the bay mrt station,gardens by the bay
Yiinghui,2015-12-27 20:12:00,1,1,#25dec gardens by the bay https://www. instagram.com/p/_y3lOUtMbetu aWCLuk7MTAj0Uq0sA9OSYIaw80/ …,,,#25dec,681085261015609344,https://twitter.com/Yiinghui/status/681085261015609344,gardens by the bay mrt station,gardens by the bay
mntashir,2015-12-27 20:12:00,0,0,"Maggi siam (@Kedai Makan Kak Som in Tanah Merah , Kelantan) https://www. swarmapp.com/c/0DTSfmZKTyb",,@Kedai,,681085146678824961,https://twitter.com/mntashir/status/681085146678824961,tanah merah mrt station,tanah merah
MyResponseTeams,2015-12-27 20:12:00,0,0,"Assalamualaikum.jom viralkan.Wallet Abdul Hafiz Kamaruddin dijumpai di medan selera payung, tanah merah .Kad... http:// fb.me/4KzRLY6xj",,,,681085133596823552,https://twitter.com/MyResponseTeams/status/681085133596823552,tanah merah mrt station,tanah merah
ameerikhwan,2015-12-27 20:13:00,0,0,I'm at Singapore Changi Airport (SIN) - @fansofchangi in Singapore https://www. swarmapp.com/c/dOsSQF3QM8T,,@fansofchangi,,681085520299048961,https://twitter.com/ameerikhwan/status/681085520299048961,changi airport mrt station,changi airport
ATWQ_,2015-12-27 20:13:00,0,0,I'm at Eunos MRT Station (EW7) - @smrt_singapore in Singapore https://www. swarmapp.com/c/g9MCEK4Iu7E,,@smrt_singapore,,681085451336331264,https://twitter.com/ATWQ_/status/681085451336331264,eunos mrt station,eunos mrt
aikenchew,2015-12-27 20:13:00,0,0,Marc Quinn's giant baby sculpture – titled Planet – in Singapore's Gardens by the Bay . @Gardens … https://www. instagram.com/p/_y3umdMN6g/,,@Gardens,,681085584035704832,https://twitter.com/aikenchew/status/681085584035704832,gardens by the bay mrt station,gardens by the bay
Isabel_Bleh,2015-12-27 20:14:00,0,0,I'm at Woodlands MRT Station (NS9) - @smrt_singapore in Singapore https://www. swarmapp.com/c/kMgln4xIa9i,,@smrt_singapore,,681085729322196992,https://twitter.com/Isabel_Bleh/status/681085729322196992,woodlands mrt station,woodlands mrt
reefosupremo,2015-12-27 20:14:00,0,0,Fucking Joo Koon,,,,681085781738307584,https://twitter.com/reefosupremo/status/681085781738307584,joo koon mrt station,joo koon
EchaaAhmad,2015-12-27 20:16:00,0,0,221215 Gardens By The Bay | Christmas Wonderland https:// youtu.be/UeV9Uwp4Krc,,,,681086262283862017,https://twitter.com/EchaaAhmad/status/681086262283862017,gardens by the bay mrt station,gardens by the bay
lixuaan,2015-12-27 20:17:00,0,0,Back in sg (@Tuas Checkpoint (Second Link ) in Singapore) https://www. swarmapp.com/c/brfRk7351L4,,@Tuas,,681086431243141120,https://twitter.com/lixuaan/status/681086431243141120,tuas link mrt station,tuas link
tiqxh,2015-12-27 20:18:00,0,1,Throwback when Mrs Norlinda keep meeting us at Jurong East for english consultation before n levels,,,,681086775347949568,https://twitter.com/tiqxh/status/681086775347949568,jurong east mrt station,jurong east
eisen,2015-12-27 20:18:00,0,0,". @ArvinTunas @omgitsjy @POZboySG Similarly, the working name for Chinatown MRT Station was Kreta Ayer. But “ Chinatown ” was used instead.",,@ArvinTunas @omgitsjy @POZboySG,,681086665679572992,https://twitter.com/eisen/status/681086665679572992,chinatown mrt station,chinatown mrt
dopeypoppy,2015-12-27 20:19:00,0,0,I'm at Kallang MRT Station (EW10) - @smrt_singapore in Singapore https://www. swarmapp.com/c/2Qxy1lJUNUT,,@smrt_singapore,,681086987948945408,https://twitter.com/dopeypoppy/status/681086987948945408,kallang mrt station,kallang
ChampionTutor5,2015-12-27 20:20:00,0,0,"S4 Maths A,Maths E/D,Chinese tuition @196 Punggol Field. 4 x 2hrs/month http:// bit.ly/1YFWI5X",,@196,,681087149945430016,https://twitter.com/ChampionTutor5/status/681087149945430016,punggol mrt station,punggol
dopeypoppy,2015-12-27 20:21:00,0,0,I'm at Aljunied MRT Station (EW9) - @smrt_singapore in Singapore https://www. swarmapp.com/c/4y8XhuuTj5B,,@smrt_singapore,,681087518058635264,https://twitter.com/dopeypoppy/status/681087518058635264,aljunied mrt station,aljunied
reeenyy_,2015-12-27 20:22:00,0,0,I'm at Tampines West Foodcourt https://www. swarmapp.com/c/3NNK8KcpiKX,,,,681087829565390848,https://twitter.com/reeenyy_/status/681087829565390848,tampines mrt station,tampines
ZaiCutler,2015-12-27 20:22:00,0,1,"@_arieyudhistira haahah insyallah, aku pon kalau gym train dekat ngan rmah kau je bedok gymbox",,@_arieyudhistira,,681087807318667264,https://twitter.com/ZaiCutler/status/681087807318667264,bedok mrt station,bedok
simei_774,2015-12-27 20:22:00,0,0,これが現実なんだよなぁ・・・,,,,681087804324069376,https://twitter.com/simei_774/status/681087804324069376,simei mrt station,simei
bytihusna_,2015-12-27 20:23:00,0,0,"again . last msa nk balik nnt kot . hm (@Pasaraya Cmart Kompleks B.D.I Tanah Merah in Jitra, Kedah) https://www. swarmapp.com/c/552ztayMUUZ",,@Pasaraya,,681087911014592512,https://twitter.com/bytihusna_/status/681087911014592512,tanah merah mrt station,tanah merah
shannyxx_,2015-12-27 20:23:00,0,0,I'm at Blk 704 Tampines Street 71 in Singapore https://www. swarmapp.com/c/iGOycAAo2lU,,,,681087997241094144,https://twitter.com/shannyxx_/status/681087997241094144,tampines mrt station,tampines
chirkhuat,2015-12-27 20:24:00,0,0,I'm at Simei MRT Station (EW3) - @smrt_singapore in Singapore https://www. swarmapp.com/c/0i6ft8FaTkf,,@smrt_singapore,,681088333116772352,https://twitter.com/chirkhuat/status/681088333116772352,simei mrt station,simei
chirkhuat,2015-12-27 20:24:00,0,0,I'm at Blk 120 Simei Street 1 https://www. swarmapp.com/c/enq16P9prHk,,,,681088219216228352,https://twitter.com/chirkhuat/status/681088219216228352,simei mrt station,simei
scoopsg,2015-12-27 20:25:00,0,0,CNA | CDAC to open its 13th centre in Bedok in 2016 http:// bit.ly/1OmAbQr pic.twitter.com/GKzM9qCZkg,,,,681088464268296192,https://twitter.com/scoopsg/status/681088464268296192,bedok mrt station,bedok
newsSG,2015-12-27 20:25:00,0,0,CNA | CDAC to open its 13th centre in Bedok in 2016 http:// bit.ly/1OmAbQr pic.twitter.com/rfelO9CdK7,,,,681088445242974208,https://twitter.com/newsSG/status/681088445242974208,bedok mrt station,bedok
scoo_ps,2015-12-27 20:25:00,0,0,CNA | CDAC to open its 13th centre in Bedok in 2016 http:// bit.ly/1OmAbQr #sgnews pic.twitter.com/SVVI6OYROA,,,#sgnews,681088464813604864,https://twitter.com/scoo_ps/status/681088464813604864,bedok mrt station,bedok
JesslynnNg,2015-12-27 20:26:00,0,0,I'm at Bukit Panjang Plaza in Singapore https://www. swarmapp.com/c/di3ocjsc3dC,,,,681088785828950016,https://twitter.com/JesslynnNg/status/681088785828950016,bukit panjang mrt station,bukit panjang
KatchHQ,2015-12-27 20:26:00,0,0,@blurboi |REPLAY| In self driving train to Gardens by the bay Singapore #katch #Periscope https:// ktch.tv/5szg pic.twitter.com/ZZdVi6iDOy,,@blurboi,#katch #Periscope,681088831978868736,https://twitter.com/KatchHQ/status/681088831978868736,gardens by the bay mrt station,gardens by the bay
kbbri,2015-12-27 20:27:00,0,0,[001] Gerbang KBBRI: Penduduk sambut baik pembinaan jambatan baharu Machang - Tanah Merah http:// fb.me/2DSiEXhZ6,,,,681089005245575168,https://twitter.com/kbbri/status/681089005245575168,tanah merah mrt station,tanah merah
TravelWithGitte,2015-12-27 20:27:00,0,1,Want a #beach_on_your_own in #Singapore ? Rent a bike and follow the #East_Coastway to almost #Changiairport Area H. pic.twitter.com/mxFevusSPr,,,#beach_on_your_own #Singapore #East_Coastway #Changiairport,681088985423151104,https://twitter.com/TravelWithGitte/status/681088985423151104,changi airport mrt station,changi airport
dopeypoppy,2015-12-27 20:28:00,0,0,I'm at Paya Lebar MRT Interchange (EW8/CC9) - @smrt_singapore in Singapore w/ @owtx_ https://www. swarmapp.com/c/eMUVkvNi9r7,,@smrt_singapore @owtx_,,681089242999734272,https://twitter.com/dopeypoppy/status/681089242999734272,paya lebar mrt station,paya lebar
Prorune117,2015-12-27 20:28:00,0,1,Need to pee but on the MRT getting to Clementi on time. HOLD ITTTT,,,,681089158421467136,https://twitter.com/Prorune117/status/681089158421467136,clementi mrt station,clementi mrt
dopeypoppy,2015-12-27 20:29:00,0,0,I'm at Paya Lebar Square in Singapore https://www. swarmapp.com/c/c5GbK53juoG,,,,681089450299011072,https://twitter.com/dopeypoppy/status/681089450299011072,paya lebar mrt station,paya lebar
faayzay,2015-12-27 20:29:00,0,0,@nur_rayhan09 tk tk serious!! Kat tampines afghanistan near mr teh tarik,,@nur_rayhan09,,681089428572344320,https://twitter.com/faayzay/status/681089428572344320,tampines mrt station,tampines
faayzay,2015-12-27 20:29:00,0,0,@capturethetime @farhanahmfdz wa beli kat tampines afghanistan,,@capturethetime @farhanahmfdz,,681089514161324032,https://twitter.com/faayzay/status/681089514161324032,tampines mrt station,tampines
_imamuhd,2015-12-27 20:29:00,0,0,Hais. Apiz baru je balik dari hougang . Daaa atok BP plak nak pinjam. GITUUU JEK,,,,681089497707069440,https://twitter.com/_imamuhd/status/681089497707069440,hougang mrt station,hougang
Ahzizizi,2015-12-27 20:33:00,0,0,@nuremeliyaa takpe liya kau diet tu mkn kau bungkus untok aku then nnti jmpe kat punggol ok thanks!,,@nuremeliyaa,,681090442788651008,https://twitter.com/Ahzizizi/status/681090442788651008,punggol mrt station,punggol
boypaduka,2015-12-27 20:33:00,0,0,"Selpih @Tanah Merah , Kelantan Darul Naim https://www. instagram.com/p/_y5_yLwlysI6 ZZnqqsxynfU2nOY1LfCIIiLi80/ …",,@Tanah,,681090578482774020,https://twitter.com/boypaduka/status/681090578482774020,tanah merah mrt station,tanah merah
hiidiribrahim,2015-12-27 20:35:00,0,0,@aris_cassells Mcm dkt tampines inter nye Koi je Jo hahahaha,,@aris_cassells,,681090908880777216,https://twitter.com/hiidiribrahim/status/681090908880777216,tampines mrt station,tampines
boypaduka,2015-12-27 20:35:00,0,0,"On @Tanah Merah , Kelantan Darul Naim https://www. instagram.com/p/_y6LMTwly-47 e9P6ry5vniQnKuNf0WeWz9VhI0/ …",,@Tanah,,681090969073131520,https://twitter.com/boypaduka/status/681090969073131520,tanah merah mrt station,tanah merah
RainaHusin,2015-12-27 20:36:00,0,0,"#throwback ... Yesterday while on the journey home back to SG, Cobroke called that his buyer for 181 Bedok ... http:// fb.me/21Fkn5xya",,,#throwback,681091344039727105,https://twitter.com/RainaHusin/status/681091344039727105,bedok mrt station,bedok
Christiephangg,2015-12-27 20:37:00,1,1,My ride from Bedok - Tampines = @juliannchoo ride from Bedok - Jurong East. What is happening.,,@juliannchoo,,681091536281456640,https://twitter.com/Christiephangg/status/681091536281456640,bedok mrt station,bedok
vennzv_,2015-12-27 20:38:00,0,0,Took wrong bus... and im at bedok,,,,681091876401750017,https://twitter.com/vennzv_/status/681091876401750017,bedok mrt station,bedok
miy0,2015-12-27 20:38:00,0,0,Back again... (@Singapore Changi Airport (SIN) - @fansofchangi in Singapore) https://www. swarmapp.com/c/cc5BOFRNzdS pic.twitter.com/fW0U0FuwAZ,,@Singapore @fansofchangi,,681091841597521921,https://twitter.com/miy0/status/681091841597521921,changi airport mrt station,changi airport
martincwh_,2015-12-27 20:38:00,0,1,Only when we graduate then got new mall at Punggol -.-,,,,681091851659575296,https://twitter.com/martincwh_/status/681091851659575296,punggol mrt station,punggol
sh9hrizal,2015-12-27 20:38:00,0,0,@afeeqjill singapore boonlay power #sbp,,@afeeqjill,#sbp,681091775717445632,https://twitter.com/sh9hrizal/status/681091775717445632,boon lay mrt station,boon lay
faayzay,2015-12-27 20:39:00,0,0,@keyrea_0623 beli kat tampines al azhar yang afghanistan tu hehehehe geylang dont have seh,,@keyrea_0623,,681092130203303937,https://twitter.com/faayzay/status/681092130203303937,tampines mrt station,tampines
lonelyboixx_,2015-12-27 20:39:00,0,0,I'm at 705 Tampines Street 71 https://www. swarmapp.com/c/jIRAztsQV4f,,,,681092007893331968,https://twitter.com/lonelyboixx_/status/681092007893331968,tampines mrt station,tampines
najywan,2015-12-27 20:40:00,0,0,Keemy. @Gardens by the Bay https://www. instagram.com/p/_y6y9ZN2OI/,,@Gardens,,681092339209650176,https://twitter.com/najywan/status/681092339209650176,gardens by the bay mrt station,gardens by the bay
abnorxmal,2015-12-27 20:40:00,0,3,Omg the view from the overhead bridge at Bukit Panjang makes for a very good drinking spot,,,,681092193063284736,https://twitter.com/abnorxmal/status/681092193063284736,bukit panjang mrt station,bukit panjang
AngelaSaull,2015-12-27 20:41:00,0,1,@Clarke Quay,,@Clarke,,681092505354420225,https://twitter.com/AngelaSaull/status/681092505354420225,clarke quay mrt station,clarke quay
BrechtDW,2015-12-27 20:41:00,0,0,"Driving to Telok Blangah , sharing real-time road info with wazers in my area. ETA 8:53 PM using @waze - Drive Social.",,@waze,,681092598291890176,https://twitter.com/BrechtDW/status/681092598291890176,telok blangah mrt station,telok blangah
newsSG,2015-12-27 20:42:00,0,0,TODAY | New CDAC centre in Bedok to offer help services http:// bit.ly/1OmVsJI pic.twitter.com/9oD0pa5ZEM,,,,681092811723149312,https://twitter.com/newsSG/status/681092811723149312,bedok mrt station,bedok
scoopsg,2015-12-27 20:42:00,0,0,TODAY | New CDAC centre in Bedok to offer help services http:// bit.ly/1OmVsJI pic.twitter.com/wWLXh2hjvt,,,,681092811744083971,https://twitter.com/scoopsg/status/681092811744083971,bedok mrt station,bedok
scoo_ps,2015-12-27 20:42:00,0,0,TODAY | New CDAC centre in Bedok to offer help services http:// bit.ly/1OmVsJI #sgnews pic.twitter.com/jESUajBSlr,,,#sgnews,681092811807014913,https://twitter.com/scoo_ps/status/681092811807014913,bedok mrt station,bedok
jeffrywiriana,2015-12-27 20:43:00,0,0,Just posted a photo @Changi Airport https://www. instagram.com/p/_y7Ee4RFUSn7 hYwo-RSxZZIRiaDvoqrpIo9bA0/ …,,@Changi,,681092931198038016,https://twitter.com/jeffrywiriana/status/681092931198038016,changi airport mrt station,changi airport
vaibhavtaksale,2015-12-27 20:43:00,0,0,#StarWarsTheForceAwakens came to Changi Airport . . pic.twitter.com/9hLWmvs0Ki,,,#StarWarsTheForceAwakens,681092923828469760,https://twitter.com/vaibhavtaksale/status/681092923828469760,changi airport mrt station,changi airport
Orchard_Hotels,2015-12-27 20:44:00,0,0,"Singapore Hotel Near Orchard Mrt Station, Singapore Hotel Near Orchard Mrt : http:// youtu.be/muYNx5jgvLA?a via @YouTube",,@YouTube,,681093254599847936,https://twitter.com/Orchard_Hotels/status/681093254599847936,orchard mrt station,orchard mrt
nigelmak,2015-12-27 20:44:00,0,0,Last book in to pasir ris camp,,,,681093341665083392,https://twitter.com/nigelmak/status/681093341665083392,pasir ris mrt station,pasir ris
lisauyenx,2015-12-27 20:45:00,0,0,I'm at Blk 348 Ang Mo Kio Ave 3 https://www. swarmapp.com/c/ha2FwdIXNOg,,,,681093646062587904,https://twitter.com/lisauyenx/status/681093646062587904,ang mo kio mrt station,ang mo kio
101DEGREE,2015-12-27 20:45:00,0,0,I'm at Outram Park Ya Hua Rou Gu Cha | 欧南园亚华肉骨茶 in Singapore https://www. swarmapp.com/c/jIIzhtSjhGa,,,,681093485420744704,https://twitter.com/101DEGREE/status/681093485420744704,outram park mrt station,outram park
rentinsingapore,2015-12-27 20:45:00,0,0,Boon Lay condo maid room for r http://www. rentinsingapore.com/showad/147182/ boon%20lay-available-boon-lay-condo-maid-room-for-rent-.html …,,,,681093521437274112,https://twitter.com/rentinsingapore/status/681093521437274112,boon lay mrt station,boon lay
jeffrywiriana,2015-12-27 20:46:00,0,0,Just posted a photo @Changi Airport https://www. instagram.com/p/_y7a8jxFVASi hFVGYfvZhaHJJ8AzUvFbplpjs0/ …,,@Changi,,681093703239335936,https://twitter.com/jeffrywiriana/status/681093703239335936,changi airport mrt station,changi airport
MeiNeeeee,2015-12-27 20:46:00,0,0,I'm at Ang Mo Kio Bus Interchange in Singapore https://www. swarmapp.com/c/iiIvEmPzeAf,,,,681093754665721856,https://twitter.com/MeiNeeeee/status/681093754665721856,ang mo kio mrt station,ang mo kio
Dannafide,2015-12-27 20:48:00,0,0,@UkhtiAidaaaa tampines blk 915 st 91,,@UkhtiAidaaaa,,681094307512594432,https://twitter.com/Dannafide/status/681094307512594432,tampines mrt station,tampines
jasssj__,2015-12-27 20:48:00,0,1,that habit of mine smiling to my phone will never change © @meineeeee @Clarke Quay https://www. instagram.com/p/_y7pDahZt_/,,@meineeeee @Clarke,,681094189191426048,https://twitter.com/jasssj__/status/681094189191426048,clarke quay mrt station,clarke quay
norashikaffendy,2015-12-27 20:48:00,0,0,cos having two family is better than having one @Jurong East Swimming Complex https://www. instagram.com/p/_y7u7Ggh5f/,,@Jurong,,681094392258674688,https://twitter.com/norashikaffendy/status/681094392258674688,jurong east mrt station,jurong east
