username,date,retweets,favorites,text,geo,mentions,hashtags,id,permalink,place,key
Sg_Real_Estate,2013-03-07 10:03:00,0,0,"@hdbresale Blk552,, Choa Chu Kang , Near MRT: Blk552,, Choa Chu Kang , Near MRT approved unit, high ... http:// bit.ly/10hNIpl",,@hdbresale,,309484402990252032,https://twitter.com/Sg_Real_Estate/status/309484402990252032,choa chu kang mrt station,choa chu kang
nooraishah08,2013-03-07 10:03:00,0,0,OMGEEEEEEE WE SAW NARAIN AT SIMEI MRT YESTERDAY,,,,309484390961012737,https://twitter.com/nooraishah08/status/309484390961012737,simei mrt station,simei
nas_arif09,2013-03-07 10:03:00,0,0,I'm at WPSC #02-14/15 @Tanjong Pagar Complex http:// 4sq.com/XTTJ8B,,@Tanjong,#02,309484541901410304,https://twitter.com/nas_arif09/status/309484541901410304,tanjong pagar mrt station,tanjong pagar
ravisharma70,2013-03-07 10:04:00,0,0,"Dhania, aaloo, tamatar, round spinach ka Akaal at #NTUC #Fairprice #Tampines",,,#NTUC #Fairprice #Tampines,309484568405225472,https://twitter.com/ravisharma70/status/309484568405225472,tampines mrt station,tampines
Adly_Raiyan,2013-03-07 10:05:00,0,0,At Bedok polyclinic now... Waste time...,,,,309485046560079872,https://twitter.com/Adly_Raiyan/status/309485046560079872,bedok mrt station,bedok
Gloria_SF,2013-03-07 10:05:00,0,0,@dhanyakhishoree hahaha its at Tampines ! He told me abt the outing on monday and he say u irritate u alot! Hahah!:p,,@dhanyakhishoree,,309484948941860865,https://twitter.com/Gloria_SF/status/309484948941860865,tampines mrt station,tampines
EsparzaRM,2013-03-07 10:08:00,0,2,@simei _l do you? pic.twitter.com/bhzhfCmr1s,,@simei,,309485568146952193,https://twitter.com/EsparzaRM/status/309485568146952193,simei mrt station,simei
sivasothi,2013-03-07 10:08:00,1,0,"Launch of ‘ Fort Canning Hill, Exploring Singapore’s Heritage and Nature’ by Melissa Diagana and Jyoti Angresh. http:// campl.us/ocLU",,,,309485650325934081,https://twitter.com/sivasothi/status/309485650325934081,fort canning mrt station,fort canning
TitiSiregar,2013-03-07 10:08:00,10,5,@adamlambert yesterday at changi airport waving to glamberts with big smile #AdamLambertSGMar8 cc @GaleChester pic.twitter.com/BwgjQvIQcz,,@adamlambert @GaleChester,#AdamLambertSGMar8,309485720614105088,https://twitter.com/TitiSiregar/status/309485720614105088,changi airport mrt station,changi airport
gibbyzeng,2013-03-07 10:08:00,0,0,"I'm at Changi Fire Station ( Tampines , Singapore) http:// 4sq.com/WL6LSB",,,,309485753564528640,https://twitter.com/gibbyzeng/status/309485753564528640,tampines mrt station,tampines
HaBeChoo,2013-03-07 10:11:00,0,0,Exploring a brand new place again. (@Bus Stop 52559 ( Caldecott Station)) http:// 4sq.com/W6JI7w,,@Bus,,309486407796281344,https://twitter.com/HaBeChoo/status/309486407796281344,caldescott mrt station,caldescott
Nicholas_CZJ,2013-03-07 10:11:00,0,0,Alr late for 11mins yet still at pasir ris eating,,,,309486470815694850,https://twitter.com/Nicholas_CZJ/status/309486470815694850,pasir ris mrt station,pasir ris
CISsingapore,2013-03-07 10:11:00,0,0,"I posted 15 photos on Facebook in the album ""Parade of Nations - Lakeside and Tanjong Katong "" http:// fb.me/12nqoFhOr",,,,309486450666262529,https://twitter.com/CISsingapore/status/309486450666262529,tanjong katong mrt station,tanjong katong
inezxuhui,2013-03-07 10:11:00,0,0,@shakayourheart what time at bedok ? my phone no batt my charger spoil,,@shakayourheart,,309486441518489602,https://twitter.com/inezxuhui/status/309486441518489602,bedok mrt station,bedok
SGJobListings,2013-03-07 10:11:00,0,0,#job #singapore Finance Executive (Up to $2.8K/5 Days/US MNC/ Dhoby Ghaut ) - Achieve Career Co http:// mrkt.ms/10hPs1L #jobs #banking #finance,,,#job #singapore #jobs #banking #finance,309486348899848193,https://twitter.com/SGJobListings/status/309486348899848193,dhoby ghaut mrt station,dhoby ghaut
vivienching,2013-03-07 10:13:00,0,0,WALAO I alighted alr then recieve the text. Okay can~“RT@SarahOYsq My cute cousin though Marina Bay Sands's nearest mrt is Marina Bay . :x”,,@SarahOYsq,,309486854141509632,https://twitter.com/vivienching/status/309486854141509632,marina bay mrt station,marina bay mrt
inezxuhui,2013-03-07 10:14:00,0,0,@shakayourheart u reaching text 81394883 I alr at bedok waiting. Mad my phone charger spoil,,@shakayourheart,,309487128444813313,https://twitter.com/inezxuhui/status/309487128444813313,bedok mrt station,bedok
rrachkee,2013-03-07 10:14:00,0,0,raffles place still confuses me,,,,309487182287089664,https://twitter.com/rrachkee/status/309487182287089664,raffles place mrt station,raffles place
bearybernie,2013-03-07 10:14:00,0,0,Clarke Quay ! http:// instagr.am/p/WigV5dD0zj/,,,,309487199378878465,https://twitter.com/bearybernie/status/309487199378878465,clarke quay mrt station,clarke quay
Sgadsonline,2013-03-07 10:15:00,0,0,Rooms for rent at Chiltern Park Condo near Lorong Chuan MRT http://www. sgadsonline.com/viewdetail_679 597.html …,,,,309487331700785152,https://twitter.com/Sgadsonline/status/309487331700785152,lorong chuan mrt station,lorong chuan
cxyclara_,2013-03-07 10:15:00,0,0,@Itskennnnnn relaxing at Bedok stadium hahaha,,@Itskennnnnn,,309487392337825793,https://twitter.com/cxyclara_/status/309487392337825793,bedok mrt station,bedok
zaryaaa,2013-03-07 10:15:00,0,0,Muahahahahaha #rjmbloopers RT @ivqferrari : the awkward moment is when u find ur dad's taking candid pictures of himself at changi airport !,,@ivqferrari,#rjmbloopers,309487555546578944,https://twitter.com/zaryaaa/status/309487555546578944,changi airport mrt station,changi airport
hxlimo,2013-03-07 10:15:00,0,0,Gardens by the bay,,,,309487338772373504,https://twitter.com/hxlimo/status/309487338772373504,gardens by the bay mrt station,gardens by the bay
_DidderDio,2013-03-07 10:15:00,0,0,Vou deixar a Simei mexer aqui,,,,309487366458990592,https://twitter.com/_DidderDio/status/309487366458990592,simei mrt station,simei
anaknoormohamed,2013-03-07 10:15:00,0,0,@Farahinfernaley pat tanjong pagar ..,,@Farahinfernaley,,309487472864288768,https://twitter.com/anaknoormohamed/status/309487472864288768,tanjong pagar mrt station,tanjong pagar
Sgadsonline,2013-03-07 10:16:00,0,0,【CALL:8522-9091】 2+1 Yishun Blk 148 Furn No AC Immed [$1800] http://www. sgadsonline.com/viewdetail_680 324.html …,,,,309487677579853824,https://twitter.com/Sgadsonline/status/309487677579853824,yishun mrt station,yishun
feleishaa,2013-03-07 10:16:00,0,1,@chelseadpike double yew tee eff tomorrow ;),,@chelseadpike,,309487755031879680,https://twitter.com/feleishaa/status/309487755031879680,yew tee mrt station,yew tee
zeehwee,2013-03-07 10:16:00,0,0,Ohhhh I reached on time!! 10:15 exactly reached dhoby ghaut YAY but the mrt stuck so I'm the earliest :D,,,,309487812154105858,https://twitter.com/zeehwee/status/309487812154105858,dhoby ghaut mrt station,dhoby ghaut
wongkendall,2013-03-07 10:17:00,0,0,"School End of Season Sale@Safra Tampines , 8 to 10 March 2013: [[Read more here ... http://tualobang.blogspot.... http:// bit.ly/WUqlBk",,@Safra,,309488005549264896,https://twitter.com/wongkendall/status/309488005549264896,tampines mrt station,tampines
tualobang,2013-03-07 10:17:00,0,0,"School End of Season Sale@Safra Tampines , 8 to 10 March 2013: [[Read more here ... http://tualobang.blogspot.... http:// bit.ly/VI3c3e",,@Safra,,309488029540708352,https://twitter.com/tualobang/status/309488029540708352,tampines mrt station,tampines
BestPromosSG,2013-03-07 10:17:00,0,0,"#sgdeals School End of Season Sale@Safra Tampines , 8 to 10 March 2013: [[Read more here ... http://tualobang.... http:// bit.ly/VI3c3e",,@Safra,#sgdeals,309488031759466496,https://twitter.com/BestPromosSG/status/309488031759466496,tampines mrt station,tampines
SgHotLobangs,2013-03-07 10:17:00,0,0,"School End of Season Sale@Safra Tampines , 8 to 10 March 2013: [[Read more here ... http://tualo... http:// bit.ly/VI3c3e have a look!!",,@Safra,,309488035811184640,https://twitter.com/SgHotLobangs/status/309488035811184640,tampines mrt station,tampines
DamnFriendly_WJ,2013-03-07 10:17:00,0,0,At TANAH MERAH MRT. Now wait for Westbound Train to Paya Lebar,,,,309487914683871233,https://twitter.com/DamnFriendly_WJ/status/309487914683871233,paya lebar mrt station,paya lebar
johnsonshn,2013-03-07 10:17:00,0,0,"#singapore School End of Season Sale@Safra Tampines , 8 to 10 March 2013 http:// bit.ly/WUqlBk #sales",,@Safra,#singapore #sales,309488037065261058,https://twitter.com/johnsonshn/status/309488037065261058,tampines mrt station,tampines
vincentho1990,2013-03-07 10:17:00,0,0,Kallang mrt reception rly sucky ttm keep running on gprs,,,,309487960955449344,https://twitter.com/vincentho1990/status/309487960955449344,kallang mrt station,kallang
engrRJ,2013-03-07 10:17:00,0,0,I'm at Boon Keng MRT Station (NE9) (Singapore) http:// 4sq.com/XS7Pq8,,,,309487925786189824,https://twitter.com/engrRJ/status/309487925786189824,boon keng mrt station,boon keng mrt
SGLobangKing88,2013-03-07 10:17:00,0,0,"#sglobang School End of Season Sale@Safra Tampines , 8 to 10 March 2013: [[Read more here ... http://tualobang... http:// bit.ly/VI3c3e",,@Safra,#sglobang,309488033613361152,https://twitter.com/SGLobangKing88/status/309488033613361152,tampines mrt station,tampines
Acewong8818,2013-03-07 10:18:00,0,0,I'm at Pasir Ris Bus Interchange (Singapore) http:// 4sq.com/XTUPkA,,,,309488273603043328,https://twitter.com/Acewong8818/status/309488273603043328,pasir ris mrt station,pasir ris
Ya5min4phrodite,2013-03-07 10:19:00,0,0,"Off to paya lebar to buy boxes for the cupcakes -.-""",,,,309488489831989248,https://twitter.com/Ya5min4phrodite/status/309488489831989248,paya lebar mrt station,paya lebar
rocketswarve,2013-03-07 10:19:00,0,0,@Girlfriend's Crib (@Yishun Street 11) http:// 4sq.com/WL7YZV,,@Girlfriend @Yishun,,309488444495761408,https://twitter.com/rocketswarve/status/309488444495761408,yishun mrt station,yishun
nadiandin,2013-03-07 10:19:00,0,0,Tanah merah depan rumah subur banget. Tapi kenapa harus ada cacingnya? (⌣́_⌣̀),,,,309488514607771648,https://twitter.com/nadiandin/status/309488514607771648,tanah merah mrt station,tanah merah
nanamaryawi,2013-03-07 10:20:00,0,0,"cacing itu yg buat tanah subur:p RT @nadiandin : Tanah merah depan rumah subur banget. Tapi kenapa harus ada cacingnya? (⌣́_⌣̀)""",,@nadiandin,,309488674674982913,https://twitter.com/nanamaryawi/status/309488674674982913,tanah merah mrt station,tanah merah
Darryliquee,2013-03-07 10:20:00,0,0,I'm at Hougang Stadium w/ @shatteredlovexx @chinliqi @aeithnaaa @prifilia http:// 4sq.com/YZTMhu,,@shatteredlovexx @chinliqi @aeithnaaa @prifilia,,309488580810637312,https://twitter.com/Darryliquee/status/309488580810637312,hougang mrt station,hougang
DamnFriendly_WJ,2013-03-07 10:20:00,0,0,"Onboard SMRT C151A Train Set 509-510 , Schedule 162 on the East West Line. Train terminates at Joo Koon",,,,309488771160764416,https://twitter.com/DamnFriendly_WJ/status/309488771160764416,joo koon mrt station,joo koon
NildoFerreiraBt,2013-03-07 10:21:00,0,0,"2 Sm16:13 Prosseguiram seu caminho, Davi e os seus homens; e Simei ...atirava pedras contra ele... SIGA SEU CAMINHO, apesar das pedradas",,,,309488852568010752,https://twitter.com/NildoFerreiraBt/status/309488852568010752,simei mrt station,simei
shimmertje8,2013-03-07 10:21:00,0,0,Blind guy travelling to tanah merah by himself. With luggage. #respect . Also lady kills wandering cockroach. #respect,,,#respect #respect,309488955127119874,https://twitter.com/shimmertje8/status/309488955127119874,tanah merah mrt station,tanah merah
tim_eoy,2013-03-07 10:21:00,2,0,Any other guy (Singapore) has a birthday around May-July? Maybe you can join my party for RT together at Bedok camp~,,,,309488960642621440,https://twitter.com/tim_eoy/status/309488960642621440,bedok mrt station,bedok
_joannneee,2013-03-07 10:21:00,0,0,I'm at Tampines Bus Interchange (Singapore) http:// 4sq.com/WL87wr,,,,309488838110236672,https://twitter.com/_joannneee/status/309488838110236672,tampines mrt station,tampines
nadiandin,2013-03-07 10:21:00,0,0,"Tapikan....... Ah yaudahlah (⌣́_⌣̀) wkwk "" @nanamaryawi : cacing itu yg buat tanah subur:p RT @nadiandin : Tanah merah depan rumah subur banget",,@nanamaryawi @nadiandin,,309488960609067008,https://twitter.com/nadiandin/status/309488960609067008,tanah merah mrt station,tanah merah
SaunderWatson,2013-03-07 10:21:00,0,0,"Loh meng appear, superintendent so that jalan besar grc. loh had unliterary cop-out strongly in passage to th... 101570",,,,309488939184562176,https://twitter.com/SaunderWatson/status/309488939184562176,jalan besar mrt station,jalan besar
Shar_e_lynnnn,2013-03-07 10:22:00,0,0,@roxaneruiz joo koon,,@roxaneruiz,,309489322015469568,https://twitter.com/Shar_e_lynnnn/status/309489322015469568,joo koon mrt station,joo koon
gablatupeirissa,2013-03-07 10:22:00,0,0,stripes #rail #train #station @Stasiun Kranji http:// instagr.am/p/WihLYfxwlV/,,@Stasiun,#rail #train #station,309489240830513153,https://twitter.com/gablatupeirissa/status/309489240830513153,kranji mrt station,kranji station
everlastjoylove,2013-03-07 10:23:00,0,0,"I wonder birrth rates in Pasir Ris is it too many, all the childcare here are full. What an ass.",,,,309489425279238144,https://twitter.com/everlastjoylove/status/309489425279238144,pasir ris mrt station,pasir ris
sgxin,2013-03-07 10:23:00,0,0,杨厝港（ Yio Chu Kang )MRT(Seasons Park)公寓主人房出租（近苹果公司） http://www. sgxin.com/viewdetail_533 293.html …,,,,309489388172242944,https://twitter.com/sgxin/status/309489388172242944,yio chu kang mrt station,yio chu kang
MFDBN,2013-03-07 10:23:00,0,0,Now at hougang stadium,,,,309489345549721600,https://twitter.com/MFDBN/status/309489345549721600,hougang mrt station,hougang
HaikelWaddup,2013-03-07 10:23:00,0,0,Last exam paper!!!! (@ITE College Central ( Ang Mo Kio Campus) w/ 29 others) http:// 4sq.com/YdLi49,,@ITE,,309489372460355585,https://twitter.com/HaikelWaddup/status/309489372460355585,ang mo kio mrt station,ang mo kio
tintinnz,2013-03-07 10:23:00,0,0,@Winnaoza oh simei ite hahaha (:,,@Winnaoza,,309489339174354944,https://twitter.com/tintinnz/status/309489339174354944,simei mrt station,simei
BlueM00NX,2013-03-07 10:23:00,0,0,I hope I will get well soon!! Tmr going Tampines trail park with CCA frens!!!,,,,309489395025715200,https://twitter.com/BlueM00NX/status/309489395025715200,tampines mrt station,tampines
Adriantnggg_,2013-03-07 10:24:00,0,0,I'm at ITE College Central ( Ang Mo Kio Campus) w/ @carmineroses @meowyoumeowlvin http:// 4sq.com/YAup6D,,@carmineroses @meowyoumeowlvin,,309489750262304770,https://twitter.com/Adriantnggg_/status/309489750262304770,ang mo kio mrt station,ang mo kio
Mr_N3rd_Guy,2013-03-07 10:24:00,0,0,I'm at Stadium@ITE College central( Ang Mo Kio ) http:// 4sq.com/XS9a06,,@ITE,,309489652442742785,https://twitter.com/Mr_N3rd_Guy/status/309489652442742785,ang mo kio mrt station,ang mo kio
WeitingToDance,2013-03-07 10:24:00,0,0,Staying at pasir ris for less than 5 minutes. Win liao.,,,,309489771292545024,https://twitter.com/WeitingToDance/status/309489771292545024,pasir ris mrt station,pasir ris
Patcheez94,2013-03-07 10:25:00,0,0,"Works at Somerset at 10.30am, woke up at 10am. Tweeting at 10.25am at her first mrt stop.  #screwed",,,#screwed,309490002608410624,https://twitter.com/Patcheez94/status/309490002608410624,somerset mrt station,somerset mrt
sherynaSing,2013-03-07 10:25:00,1,0,"Commercial/Industrial: Retail Space Jurong East Street 31 for RENT 300 sq ft -Singapore, http:// bit.ly/ZeiGvU #fb",,,#fb,309489870072586240,https://twitter.com/sherynaSing/status/309489870072586240,jurong east mrt station,jurong east
suckfreeradio,2013-03-07 10:26:00,0,0,#nowplaying Caldecott ~ Nomads ~ @CaldecottMusic ~ http:// suckfreeradio.com #suckfreeradio,,@CaldecottMusic,#nowplaying #suckfreeradio,309490240828080128,https://twitter.com/suckfreeradio/status/309490240828080128,caldescott mrt station,caldescott
oneleggedlun,2013-03-07 10:26:00,0,0,"@xixiorange It's at Clementi, have free shuttle bus from Jurong East ! Far for you ah,.",,@xixiorange,,309490205574963200,https://twitter.com/oneleggedlun/status/309490205574963200,jurong east mrt station,jurong east
vajoojoo,2013-03-07 10:27:00,0,0,gonna be playing at jalan besar stadium later on,,,,309490352828583936,https://twitter.com/vajoojoo/status/309490352828583936,jalan besar mrt station,jalan besar
suckfreemusic,2013-03-07 10:27:00,0,0,#nowplaying Caldecott - Nomads http:// suckfreeradio.com #fb #suckfreeradio,,,#nowplaying #fb #suckfreeradio,309490376887119874,https://twitter.com/suckfreemusic/status/309490376887119874,caldescott mrt station,caldescott
zoecheext,2013-03-07 10:27:00,0,0,@NickCheesecake kallang head take over here. wui go idk where,,@NickCheesecake,,309490351926829056,https://twitter.com/zoecheext/status/309490351926829056,kallang mrt station,kallang
idzuwan1,2013-03-07 10:27:00,0,0,@SunfiqCullen Ohh kau sampai pasir ris dlm kul rape ? Epppppp.. :P,,@SunfiqCullen,,309490517299830785,https://twitter.com/idzuwan1/status/309490517299830785,pasir ris mrt station,pasir ris
Insanitystaph,2013-03-07 10:27:00,0,0,"Off to meet feyn at Paya Lebar , then to nyp",,,,309490421774565377,https://twitter.com/Insanitystaph/status/309490421774565377,paya lebar mrt station,paya lebar
gayfk_,2013-03-07 10:28:00,0,0,morning @SAF Yacht Club ( Tanah Merah Clubhouse) http:// instagr.am/p/Wih8Nnjyv5/,,@SAF,,309490798636974082,https://twitter.com/gayfk_/status/309490798636974082,tanah merah mrt station,tanah merah
walkingtarts,2013-03-07 10:29:00,0,0,"A for AirLeeFen, B for BearLun #english #again @British Council ( Toa Payoh Centre) http:// instagr.am/p/WihuuZST5o/",,@British,#english #again,309490986856378368,https://twitter.com/walkingtarts/status/309490986856378368,toa payoh mrt station,toa payoh
DamnFriendly_WJ,2013-03-07 10:29:00,0,0,At PAYA LEBAR MRT . Now wait for Anti-Clockwise Bound Circle Line train to Marymount,,,,309490976899084288,https://twitter.com/DamnFriendly_WJ/status/309490976899084288,marymount mrt station,marymount mrt
EmmanStrong,2013-03-07 10:30:00,0,0,Who stays in ang mo kio or near here? Please find me. Blk 715 ang mo kio ave 6.,,,,309491304574894080,https://twitter.com/EmmanStrong/status/309491304574894080,ang mo kio mrt station,ang mo kio
hiannie,2013-03-07 10:30:00,0,0,"At mum's house . Still water runs deep. Last week, a man drowned in this river while fishing. #kallang pic.twitter.com/cC8oROZAWR",,,#kallang,309491304981725184,https://twitter.com/hiannie/status/309491304981725184,kallang mrt station,kallang
TRWFC,2013-03-07 10:32:00,8,2,"[NEXT GAME] MALAYSIA SUPER LEAGUE 2013 LIONS XII FC vs KELANTAN 9 March 2013 Stadium Jalan Besar , Singapura",,,,309491779936350209,https://twitter.com/TRWFC/status/309491779936350209,jalan besar mrt station,jalan besar
YasminZorlu,2013-03-07 10:32:00,0,0,@Ainiiexx kau go woodlands kan? woodlands mmg!! that time aku kat woodlands kene tunggu 3 jam sak. yishun 1 and a half hour je,,@Ainiiexx,,309491804242321410,https://twitter.com/YasminZorlu/status/309491804242321410,yishun mrt station,yishun
faizalzulkefle,2013-03-07 10:34:00,0,0,"[NEXT GAME] MALAYSIA SUPER LEAGUE 2013 LIONS XII FC vs KELANTAN 9 March 2013 Stadium Jalan Besar , Singapura",,,,309492307437170690,https://twitter.com/faizalzulkefle/status/309492307437170690,jalan besar mrt station,jalan besar
zoecheext,2013-03-07 10:34:00,0,0,@LLLAYTIN @NickCheesecake fucking serious. kallang ahsen here le,,@LLLAYTIN @NickCheesecake,,309492150272393217,https://twitter.com/zoecheext/status/309492150272393217,kallang mrt station,kallang
kelvincorps,2013-03-07 10:35:00,0,0,I'm at ITE College Central ( Ang Mo Kio Campus) (Singapore) w/ 31 others http:// 4sq.com/YZWeVh,,,,309492457266085889,https://twitter.com/kelvincorps/status/309492457266085889,ang mo kio mrt station,ang mo kio
kentleejoon,2013-03-07 10:37:00,0,0,The heart attack moment when you're at somerset and the train indicator shows you're at marsiling,,,,309492849261568001,https://twitter.com/kentleejoon/status/309492849261568001,marsiling mrt station,marsiling
TrulyEunice,2013-03-07 10:38:00,0,0,@Yanhaoegg @anna_nana29 hmm.. actually hougang got selegie beancurd. It's good enough for me. Lol!!!,,@Yanhaoegg @anna_nana29,,309493113834074112,https://twitter.com/TrulyEunice/status/309493113834074112,hougang mrt station,hougang
SGJobListings,2013-03-07 10:39:00,0,0,#job #singapore Kindergarten Teacher (English) - PAP Community Foundation – Toa Payoh East http:// mrkt.ms/109e0Gw #jobs #education,,,#job #singapore #jobs #education,309493407779287041,https://twitter.com/SGJobListings/status/309493407779287041,toa payoh mrt station,toa payoh
Slyqx,2013-03-07 10:40:00,0,0,I'm at Bukit Batok Driving Centre (BBDC) (Singapore) http:// 4sq.com/WUv4TF,,,,309493632715612160,https://twitter.com/Slyqx/status/309493632715612160,bukit batok mrt station,bukit batok
kaikai520,2013-03-07 10:40:00,0,0,"Sore throat, running nose, cough. (@Tampines Blk 930) http:// 4sq.com/YdMMLD",,@Tampines,,309493695563059200,https://twitter.com/kaikai520/status/309493695563059200,tampines mrt station,tampines
irrinoying,2013-03-07 10:42:00,0,0,@ModishlyPosh some bedok family clinic aka some healthway clinic hahahaha.,,@ModishlyPosh,,309494341737533440,https://twitter.com/irrinoying/status/309494341737533440,bedok mrt station,bedok
_XiongXiong_,2013-03-07 10:42:00,0,0,"I'm at Coffee Shop, Block 422, Ang Mo Kio Ave 3 http:// 4sq.com/WvKv4i",,,,309494206999691267,https://twitter.com/_XiongXiong_/status/309494206999691267,ang mo kio mrt station,ang mo kio
nissssszhr,2013-03-07 10:42:00,0,0,"Sama changi airport juga jauh banget, sampe mikir itu bandara apa pasar -___- kasian kyuhyun cs...",,,,309494241183285250,https://twitter.com/nissssszhr/status/309494241183285250,changi airport mrt station,changi airport
wongtc89,2013-03-07 10:43:00,0,0,I'm at Blk 20 Marsiling Lane Hawker Centre (Singapore) http:// 4sq.com/YdN45e,,,,309494434326798337,https://twitter.com/wongtc89/status/309494434326798337,marsiling mrt station,marsiling
anadyaaa,2013-03-07 10:44:00,0,0,I'm at Singapore Changi Airport http:// 4sq.com/XXn5Qp,,,,309494800699232257,https://twitter.com/anadyaaa/status/309494800699232257,changi airport mrt station,changi airport
LTAsg,2013-03-07 10:45:00,0,0,Accident on AYE (towards ECP) at North Buona Vista Entrance,,,,309494965619277825,https://twitter.com/LTAsg/status/309494965619277825,buona vista mrt station,buona vista
LoneWolfSHYBOY,2013-03-07 10:45:00,0,0,So now I needa kill time for an hour at some place in tanjong pagar . Guess it's time to explore!,,,,309495086369095681,https://twitter.com/LoneWolfSHYBOY/status/309495086369095681,tanjong pagar mrt station,tanjong pagar
rentinsingapore,2013-03-07 10:46:00,0,0,mrt @dover - nice room for lady - Chinatown / Tiong Bahru Rooms Avail: mrt @dover - nice room for lady - c'w... http:// bit.ly/109ftMY,,@dover @dover,,309495327856148480,https://twitter.com/rentinsingapore/status/309495327856148480,chinatown mrt station,chinatown mrt
syairazisrz,2013-03-07 10:47:00,0,0,Heading to jurong east gym with @fez_45 cos pioneer is renovating. Zzz,,@fez_45,,309495372361908224,https://twitter.com/syairazisrz/status/309495372361908224,jurong east mrt station,jurong east
60s_rss,2013-03-07 10:47:00,0,0,"Thắng Tampines Rovers, Sài Gòn XT khởi đầu hoàn hảo tại AFC Cup http:// bit.ly/109fEYD",,,,309495573420072960,https://twitter.com/60s_rss/status/309495573420072960,tampines mrt station,tampines
CalvinChaan,2013-03-07 10:48:00,0,0,"WTF bedok poly clinic average waiting time is 3 hours, guess I'll just go to the pharmacy opposite",,,,309495854522314752,https://twitter.com/CalvinChaan/status/309495854522314752,bedok mrt station,bedok
JohnnyChuaa,2013-03-07 10:48:00,0,0,With the Keng siaos! Yh and aren! @bedok polyclinic,,@bedok,,309495852504870912,https://twitter.com/JohnnyChuaa/status/309495852504870912,bedok mrt station,bedok
StrangestDanger,2013-03-07 10:50:00,0,0,Meanwhile I wait around at yew tee,,,,309496143774089217,https://twitter.com/StrangestDanger/status/309496143774089217,yew tee mrt station,yew tee
timbuttpoo,2013-03-07 10:50:00,0,0,Haven't gone to Bukit batok for ages,,,,309496200372027392,https://twitter.com/timbuttpoo/status/309496200372027392,bukit batok mrt station,bukit batok
__zyzy,2013-03-07 10:51:00,0,0,I'm at ITE College Central ( Ang Mo Kio Campus) (Singapore) w/ 31 others http:// 4sq.com/Zeo4z1,,,,309496591276978176,https://twitter.com/__zyzy/status/309496591276978176,ang mo kio mrt station,ang mo kio
PandaCloudCandy,2013-03-07 10:51:00,0,0,"I'm at Little Bee's Hive ( Bukit Panjang New town, Bukit Panjang ) http:// 4sq.com/14vI53H",,,,309496515976638464,https://twitter.com/PandaCloudCandy/status/309496515976638464,bukit panjang mrt station,bukit panjang
PandaCloudCandy,2013-03-07 10:51:00,0,0,"I'm at Bee's study room ( bukit panjang , Singapore) http:// 4sq.com/WvLn90",,,,309496576005529600,https://twitter.com/PandaCloudCandy/status/309496576005529600,bukit panjang mrt station,bukit panjang
PussyPurrPurr,2013-03-07 10:52:00,0,0,Wtf?! I just realized im only at bedok ! Look at the time now look at it!,,,,309496626882428928,https://twitter.com/PussyPurrPurr/status/309496626882428928,bedok mrt station,bedok
DamnFriendly_WJ,2013-03-07 10:53:00,0,0,At MARYMOUNT MRT . Now wait for Bus 54/851 home :-),,,,309497051228549121,https://twitter.com/DamnFriendly_WJ/status/309497051228549121,marymount mrt station,marymount mrt
justeencase_,2013-03-07 10:53:00,0,1,"@hiiighkey all muh peeps be freakin'. Like, double yew tee eff?",,@hiiighkey,,309496927823745024,https://twitter.com/justeencase_/status/309496927823745024,yew tee mrt station,yew tee
RennerSoHandsum,2013-03-07 10:54:00,0,0,@momofuyu de office at tanjong pagar :O,,@momofuyu,,309497265746219008,https://twitter.com/RennerSoHandsum/status/309497265746219008,tanjong pagar mrt station,tanjong pagar
