username,date,retweets,favorites,text,geo,mentions,hashtags,id,permalink,place,key
shawnchua93,2013-03-07 16:02:00,0,0,@theobjextion hahah Qilong they all should be at tampines skatepark. Where you feel like riding?,,@theobjextion,,309574790295977984,https://twitter.com/shawnchua93/status/309574790295977984,tampines mrt station,tampines
akhi_harmizi,2013-03-07 16:02:00,0,0,Kt kallang ... -.-'' lama nya..,,,,309574889633886209,https://twitter.com/akhi_harmizi/status/309574889633886209,kallang mrt station,kallang
MienaiNoHikari,2013-03-07 16:02:00,0,0,I'm at Blk 228 Jurong East St 21 http:// 4sq.com/W7iNs2,,,,309574639422689280,https://twitter.com/MienaiNoHikari/status/309574639422689280,jurong east mrt station,jurong east
Ohitsfranky,2013-03-07 16:02:00,0,0,Arghhh the mrt towards joo koon is taking forever to come....,,,,309574708473520128,https://twitter.com/Ohitsfranky/status/309574708473520128,joo koon mrt station,joo koon
DannySturridge7,2013-03-07 16:02:00,1,0,With my baby amshar. Toa payoh kia olai http:// instagr.am/p/WjIGOyM9tw/,,,,309574743898611712,https://twitter.com/DannySturridge7/status/309574743898611712,toa payoh mrt station,toa payoh
larrylally,2013-03-07 16:03:00,0,0,Had a short chat with zuriel from boys town at bedok Mac today,,,,309574892800589824,https://twitter.com/larrylally/status/309574892800589824,bedok mrt station,bedok
valerieczq,2013-03-07 16:03:00,0,0,I'm at Bishan - Ang Mo Kio Park (Singapore) http:// 4sq.com/WLLt7p,,,,309574935112728576,https://twitter.com/valerieczq/status/309574935112728576,ang mo kio mrt station,ang mo kio
JonPaulChua,2013-03-07 16:03:00,0,0,@ChanYitCheng is it this?? Got this at tampines pic.twitter.com/5H9b6ZaQhH,,@ChanYitCheng,,309575104038313984,https://twitter.com/JonPaulChua/status/309575104038313984,tampines mrt station,tampines
awesomeshijia,2013-03-07 16:03:00,1,1,Why issit called cross country when it's just a small area? It's not even half of jurong east ..,,,,309574999235248129,https://twitter.com/awesomeshijia/status/309574999235248129,jurong east mrt station,jurong east
_jlyj,2013-03-07 16:04:00,0,0,At hougang mrt . :/ otw home .,,,,309575323442368512,https://twitter.com/_jlyj/status/309575323442368512,hougang mrt station,hougang
rabiesparty,2013-03-07 16:04:00,0,0,I'm at Raffles Place Mrt http:// 4sq.com/ZfkvZA,,,,309575214369501184,https://twitter.com/rabiesparty/status/309575214369501184,raffles place mrt station,raffles place
D_Dylan97,2013-03-07 16:04:00,0,0,@IzzLovesSoccer Still at punggol cc .,,@IzzLovesSoccer,,309575320099495936,https://twitter.com/D_Dylan97/status/309575320099495936,punggol mrt station,punggol
RockyDoodles,2013-03-07 16:04:00,0,0,@benbenisbenben cos got horsemeat reports! But now everything is checked. U GO BEFORE WORK OR AFTER. TAMPINES !,,@benbenisbenben,,309575287228727296,https://twitter.com/RockyDoodles/status/309575287228727296,tampines mrt station,tampines
benbenisbenben,2013-03-07 16:05:00,0,0,@RockyDoodles HAHHA B4 work ? 8 am ah LOL . after work sure packed lehhhh . U fetch me we go TAMPINES one ' LOL,,@RockyDoodles,,309575458964512768,https://twitter.com/benbenisbenben/status/309575458964512768,tampines mrt station,tampines
Adveryday,2013-03-07 16:05:00,0,0,"Talk of the Town! My Manhattan @Simei , Walk to MRT / Mall! Eileen @91173215!: Everything… http:// goo.gl/fb/u98a0",,@Simei @91173215,,309575583933820928,https://twitter.com/Adveryday/status/309575583933820928,simei mrt station,simei
shawnchua93,2013-03-07 16:05:00,0,0,@theobjextion hahaha then we ride at tampines skatepark there loh. Sean riding?,,@theobjextion,,309575406791585792,https://twitter.com/shawnchua93/status/309575406791585792,tampines mrt station,tampines
calebchern123,2013-03-07 16:06:00,0,0,Fuck lah the queue at koi jurong east is damn shit,,,,309575757812879361,https://twitter.com/calebchern123/status/309575757812879361,jurong east mrt station,jurong east
spotbaik,2013-03-07 16:06:00,0,0,Dumpside rail - Rochor Centre pic.twitter.com/aQUPGWYslH,,,,309575761776476160,https://twitter.com/spotbaik/status/309575761776476160,rochor mrt station,rochor
HEYNADIA,2013-03-07 16:07:00,0,0,RT @sarahmars : Bedok is so weird..,,@sarahmars,,309576045076561920,https://twitter.com/HEYNADIA/status/309576045076561920,bedok mrt station,bedok
xaffections,2013-03-07 16:07:00,0,0,Otw home now... from hougang @_@,,@_ @,,309576131340800000,https://twitter.com/xaffections/status/309576131340800000,hougang mrt station,hougang
JoshuaDanielFoo,2013-03-07 16:08:00,0,0,Woah pot-hole on the road at Siglap,,,,309576226476019712,https://twitter.com/JoshuaDanielFoo/status/309576226476019712,siglap mrt station,siglap
tuchoong,2013-03-07 16:08:00,1,0,"dear sg shcjs, if the flashmob is held at buona vista , will you guys come down and support us?",,,,309576174605070336,https://twitter.com/tuchoong/status/309576174605070336,buona vista mrt station,buona vista
neo_joelynn,2013-03-07 16:09:00,0,0,Gonna support netball team at bedok stadium tmr!! #teamdunman,,,#teamdunman,309576488812949504,https://twitter.com/neo_joelynn/status/309576488812949504,bedok mrt station,bedok
faranatashy,2013-03-07 16:09:00,0,0,@eerasaje Haah. Dekat Tanah Merah ni,,@eerasaje,,309576400317341696,https://twitter.com/faranatashy/status/309576400317341696,tanah merah mrt station,tanah merah
glennkeithven,2013-03-07 16:09:00,0,0,@MagnifiqueBeau attachment bro by the time reach pasir Ris 8pm liao,,@MagnifiqueBeau,,309576639241658368,https://twitter.com/glennkeithven/status/309576639241658368,pasir ris mrt station,pasir ris
mrai_R,2013-03-07 16:09:00,0,0,Hahaha. Out of all places. Commonwealth RT @experiment0626 : Met @mrai_R in the mrt . Hahaha,,@experiment0626 @mrai_R,,309576591028142080,https://twitter.com/mrai_R/status/309576591028142080,commonwealth mrt station,commonwealth mrt
seansjz,2013-03-07 16:10:00,1,0,Laoban and Koi are the best things that ever happened in toa payoh .,,,,309576668358512643,https://twitter.com/seansjz/status/309576668358512643,toa payoh mrt station,toa payoh
hmm_jlz,2013-03-07 16:11:00,0,0,Going JurongEast With Sis To Meet Daddy .,,,,309577024392024064,https://twitter.com/hmm_jlz/status/309577024392024064,jurong east mrt station,jurong east
Mael_Busa,2013-03-07 16:11:00,0,0,#random #work #confused #stuckup @Bukit Batok East Community Club (CC) http:// instagr.am/p/WjJGQtE6RZ/,,@Bukit,#random #work #confused #stuckup,309577022986915840,https://twitter.com/Mael_Busa/status/309577022986915840,bukit batok mrt station,bukit batok
PlacidPri,2013-03-07 16:11:00,0,0,Toa payoh service so fricking fast sia . Have been waiting for more than two hours already,,,,309576923988774912,https://twitter.com/PlacidPri/status/309576923988774912,toa payoh mrt station,toa payoh
MuhammadKhidir_,2013-03-07 16:12:00,0,0,"Alright, will b playing takraw at Pasir Ris today! (:",,,,309577307629178880,https://twitter.com/MuhammadKhidir_/status/309577307629178880,pasir ris mrt station,pasir ris
Ernestttan_,2013-03-07 16:12:00,0,0,@SHA0X1ANG_ hougang gym aimai ?,,@SHA0X1ANG_,,309577203375538176,https://twitter.com/Ernestttan_/status/309577203375538176,hougang mrt station,hougang
SeraLoveYunJae,2013-03-07 16:13:00,0,0,@MinMinYJ ehhh u live at serangoon uh? I live potong pasir sia.,,@MinMinYJ,,309577417075335168,https://twitter.com/SeraLoveYunJae/status/309577417075335168,potong pasir mrt station,potong pasir
dewberrydrops,2013-03-07 16:14:00,0,0,Late for facial with mom cause we got lost in simei lol,,,,309577704154488832,https://twitter.com/dewberrydrops/status/309577704154488832,simei mrt station,simei
PrimyHubPropSG,2013-03-07 16:15:00,0,0,Room For Rent : $800 Master room Simei MRT blk 164 NICK 91007377 DTZ: Room For Rent : Single Lady prefered att... http:// bit.ly/Zfmflw,,,,309577939161341952,https://twitter.com/PrimyHubPropSG/status/309577939161341952,simei mrt station,simei
mrjon1234,2013-03-07 16:15:00,0,0,@ashleysaysso if its at Serangoon . Or somewhere that's near my house or somewhere that I'll reach faster from my house I'll slap ur udders.,,@ashleysaysso,,309578065514729473,https://twitter.com/mrjon1234/status/309578065514729473,serangoon mrt station,serangoon
BarneyBlues,2013-03-07 16:16:00,0,0,I'm at Tampines Sports Hall (Singapore) http:// 4sq.com/XTaobr,,,,309578311552610305,https://twitter.com/BarneyBlues/status/309578311552610305,tampines mrt station,tampines
SittehRhinnaFry,2013-03-07 16:16:00,0,0,Ok gotta train to Serangoon and then change to circle line and head to BV.,,,,309578364707012609,https://twitter.com/SittehRhinnaFry/status/309578364707012609,serangoon mrt station,serangoon
AfiQuarts,2013-03-07 16:16:00,0,0,From hme to YCK to thomson to golazo and nw heading back hme then off to serangoon .. pfft,,,,309578410450108416,https://twitter.com/AfiQuarts/status/309578410450108416,serangoon mrt station,serangoon
SherylRiar,2013-03-07 16:16:00,0,1,Getting a foot massage before flying off. #bangkok #likeaboss #changiairport http:// instagr.am/p/WjJnO1Pg_O/,,,#bangkok #likeaboss #changiairport,309578225821024256,https://twitter.com/SherylRiar/status/309578225821024256,changi airport mrt station,changi airport
Josephinix,2013-03-07 16:16:00,0,0,@altaigo @yoongjh @ivohtf @xiiaosilent @obsess3d247 @hytilaus YAY TOMORROW AFTERNOON AT CITY HALL MRT 1PM?,,@altaigo @yoongjh @ivohtf @xiiaosilent @obsess3d247 @hytilaus,,309578389558288384,https://twitter.com/Josephinix/status/309578389558288384,city hall mrt station,city hall mrt
keojoloh,2013-03-07 16:16:00,0,0,@AngGuan @wailooney @123btxm @wesleytnk okay lor! 28mins from tanjong pagar only heheh,,@AngGuan @wailooney @123btxm @wesleytnk,,309578360659521536,https://twitter.com/keojoloh/status/309578360659521536,tanjong pagar mrt station,tanjong pagar
GlenceSaliendra,2013-03-07 16:17:00,1,0,NW: #TheManWithTheIronFists #movie #siesta #torrent @Blk 832 Yishun St 81 http:// instagr.am/p/WjJ2_cym8b/,,@Blk,#TheManWithTheIronFists #movie #siesta #torrent,309578655397474304,https://twitter.com/GlenceSaliendra/status/309578655397474304,yishun mrt station,yishun
GlenceSaliendra,2013-03-07 16:17:00,1,0,Photo: NW: #TheManWithTheIronFists #movie #siesta #torrent (at Blk 832 Yishun St 81) http:// tmblr.co/ZZbnKyfiksel,,,#TheManWithTheIronFists #movie #siesta #torrent,309578662464860160,https://twitter.com/GlenceSaliendra/status/309578662464860160,yishun mrt station,yishun
hunojoel,2013-03-07 16:17:00,0,0,Well the jurong east 's gym is kinda a little smaller than the jurong west one~,,,,309578649395421184,https://twitter.com/hunojoel/status/309578649395421184,jurong east mrt station,jurong east
sabrina_ngggg,2013-03-07 16:17:00,1,1,Lunch at paya lebar #JAYS,,,#JAYS,309578655418433536,https://twitter.com/sabrina_ngggg/status/309578655418433536,paya lebar mrt station,paya lebar
BookMarksHut,2013-03-07 16:17:00,0,0,hyhulberuntmalviucna wrote a new blog entry: Sant Ritz - Latest Launch at Potong Pasir !: Sant Ritz is a new a... http:// tinyurl.com/bdhzd2t,,,,309578424123523072,https://twitter.com/BookMarksHut/status/309578424123523072,potong pasir mrt station,potong pasir
AlexeyJohnson,2013-03-07 16:18:00,0,0,"Cycled to the middle of jurong east and clementi hahah, stuck so i head home! Cyclin is the best #Cardio",,,#Cardio,309578866714873856,https://twitter.com/AlexeyJohnson/status/309578866714873856,jurong east mrt station,jurong east
LeePriz94,2013-03-07 16:18:00,0,0,I'm at Thousands Taste @Bukit Batok Mrt Station http:// 4sq.com/YBt1Rf,,@Bukit,,309578759860805633,https://twitter.com/LeePriz94/status/309578759860805633,bukit batok mrt station,bukit batok
SGManyTutors,2013-03-07 16:18:00,0,0,"Sec 3 English @Crescent Rd (Near Dakota MRT ): by LWYQ (Posted Thu Mar 07, 2013 3:52 pm)Assignment code: C1469... http:// bit.ly/ZfmKvS",,@Crescent,,309578691334262785,https://twitter.com/SGManyTutors/status/309578691334262785,dakota mrt station,dakota mrt
Awesomiz,2013-03-07 16:18:00,0,0,I'm at Blk 525 Bedok North Street 3 (Singapore) http:// 4sq.com/Z0Hrtt,,,,309578748607475713,https://twitter.com/Awesomiz/status/309578748607475713,bedok mrt station,bedok
BlurKingg,2013-03-07 16:18:00,0,0,"@mschristinelim call bedok cc and complain, I complain abt them before, 64425317",,@mschristinelim,,309578818119667712,https://twitter.com/BlurKingg/status/309578818119667712,bedok mrt station,bedok
PlainJoanne,2013-03-07 16:18:00,0,0,Yay tomorrow going back bedok green! :D,,,,309578826256613376,https://twitter.com/PlainJoanne/status/309578826256613376,bedok mrt station,bedok
LeePriz94,2013-03-07 16:18:00,0,0,I just ousted @c_huishan as the mayor of Thousands Taste @Bukit Batok Mrt Station on @foursquare ! http:// 4sq.com/cLbubM,,@c_huishan @Bukit @foursquare,,309578759487508480,https://twitter.com/LeePriz94/status/309578759487508480,bukit batok mrt station,bukit batok
SGManyTutors,2013-03-07 16:18:00,0,0,"MARINA BAY MRT - Grade 10 humanities (Sec 4 Std) MALE TUTOR: by besttuition2005 (Posted Thu Mar 07, 2013 4:11 ... http:// bit.ly/XTb0Om",,,,309578693787918336,https://twitter.com/SGManyTutors/status/309578693787918336,marina bay mrt station,marina bay mrt
hyingg,2013-03-07 16:19:00,0,0,@CinnamonMELtzs sembawang shopping center!,,@CinnamonMELtzs,,309578963074809856,https://twitter.com/hyingg/status/309578963074809856,sembawang mrt station,sembawang
RydhaSyarriel,2013-03-07 16:19:00,0,0,Eunos MRT stop connection 1% sia,,,,309579134630260736,https://twitter.com/RydhaSyarriel/status/309579134630260736,eunos mrt station,eunos mrt
Wook_mE_Up,2013-03-07 16:19:00,0,0,@meatyoudumpling Bukitbatok can? Ö Sorry for inconvenience! ><,,@meatyoudumpling,,309579008041971712,https://twitter.com/Wook_mE_Up/status/309579008041971712,bukit batok mrt station,bukit batok
FuZhaoRong,2013-03-07 16:19:00,0,0,Saw my bro half way when walking to mrt station and drag him to chinatown w me hahaha,,,,309579079022166016,https://twitter.com/FuZhaoRong/status/309579079022166016,chinatown mrt station,chinatown mrt
gembira_soda,2013-03-07 16:20:00,0,0,I just realise all went to simei and then get into r/s. 1 with a dancer another with a skater what's next matrep ah? Lol,,,,309579257351385088,https://twitter.com/gembira_soda/status/309579257351385088,simei mrt station,simei
BarneyBlues,2013-03-07 16:21:00,0,0,I'm at Tampines Central Park Street Soccer Court (Singapore) http:// 4sq.com/Zfnv87,,,,309579649581731840,https://twitter.com/BarneyBlues/status/309579649581731840,tampines mrt station,tampines
BarneyBlues,2013-03-07 16:21:00,0,0,I'm at Tampines Central Park (Singapore) http:// 4sq.com/YOxmgY,,,,309579615972777984,https://twitter.com/BarneyBlues/status/309579615972777984,tampines mrt station,tampines
sarhmdn,2013-03-07 16:21:00,0,0,Off to tanah merah .,,,,309579552995282944,https://twitter.com/sarhmdn/status/309579552995282944,tanah merah mrt station,tanah merah
fazilrahman_,2013-03-07 16:21:00,0,0,@inkt_ hahaha idk wher mine also i got alot toolbox all semangat after school bawak toolbox pegi kedai kat bukitbatok race ah bro.,,@inkt_,,309579600328007680,https://twitter.com/fazilrahman_/status/309579600328007680,bukit batok mrt station,bukit batok
katycatsecrets,2013-03-07 16:21:00,0,0,"@MarchingBones okay, then i'll meet you at ang mo kio at 8? Do you know how to get there from amk hub?",,@MarchingBones,,309579527212912640,https://twitter.com/katycatsecrets/status/309579527212912640,ang mo kio mrt station,ang mo kio
Sgadsonline,2013-03-07 16:23:00,0,0,5I @200D Sengkang East Road FF AC MRT $2.6k! WOW http://www. sgadsonline.com/viewdetail_680 422.html …,,@200D,,309580058002079744,https://twitter.com/Sgadsonline/status/309580058002079744,sengkang mrt station,sengkang mrt
engivor,2013-03-07 16:23:00,0,0,@AlexAllTimeLow we should have met you at Changi airport too if only we knew your flight #2thaifanswhocameallthewayfromThailandtoseeyou,,@AlexAllTimeLow,#2thaifanswhocameallthewayfromThailandtoseeyou,309579937839476736,https://twitter.com/engivor/status/309579937839476736,changi airport mrt station,changi airport
DXNIXL_S,2013-03-07 16:24:00,0,0,Anybody legal living in Tampines wanna help me buy ciggs?? Please~,,,,309580236008333312,https://twitter.com/DXNIXL_S/status/309580236008333312,tampines mrt station,tampines
pooptatooo,2013-03-07 16:24:00,0,0,hougang swimming complex smells terrible it's like chlorine in the air like sprayed everywhere,,,,309580324663328768,https://twitter.com/pooptatooo/status/309580324663328768,hougang mrt station,hougang
creamcheeeeze,2013-03-07 16:24:00,0,0,Cb step out of redhill mrt only bump into people!!,,,,309580397052841984,https://twitter.com/creamcheeeeze/status/309580397052841984,redhill mrt station,redhill mrt
Adzhar_06,2013-03-07 16:24:00,0,0,bored nye kat jurong east .. sorang cepat ah zuhairi dtg,,,,309580183038484480,https://twitter.com/Adzhar_06/status/309580183038484480,jurong east mrt station,jurong east
tuchoong,2013-03-07 16:25:00,0,0,@ZieTing we trying to tie down the venue. so now i asking if ppl will come down if it is in buona vista . haha,,@ZieTing,,309580669196054528,https://twitter.com/tuchoong/status/309580669196054528,buona vista mrt station,buona vista
ffuuaaddd,2013-03-07 16:25:00,0,0,Otw to paya lebar .,,,,309580561456984065,https://twitter.com/ffuuaaddd/status/309580561456984065,paya lebar mrt station,paya lebar
ceadotcom,2013-03-07 16:25:00,0,0,RiverSails Update | RiverSails @Upper Serangoon Crescent http:// goo.gl/Kfm1Z,,@Upper,,309580480628543488,https://twitter.com/ceadotcom/status/309580480628543488,serangoon mrt station,serangoon
axyraffsha,2013-03-07 16:26:00,0,0,At sembawang now,,,,309580750028693504,https://twitter.com/axyraffsha/status/309580750028693504,sembawang mrt station,sembawang
jeromeweee,2013-03-07 16:26:00,0,0,At kallang now !,,,,309580718357504000,https://twitter.com/jeromeweee/status/309580718357504000,kallang mrt station,kallang
RusydiPoppycock,2013-03-07 16:26:00,0,0,Going simei to climb later :) who wanna tag along?,,,,309580751341514752,https://twitter.com/RusydiPoppycock/status/309580751341514752,simei mrt station,simei
S3Danial,2013-03-07 16:27:00,0,0,Otw to ITE simei,,,,309581001976340481,https://twitter.com/S3Danial/status/309581001976340481,simei mrt station,simei
Sg_Real_Estate,2013-03-07 16:27:00,0,0,"@hdbresale Blk 641, Yishun , 2+1 , High floor, furniture,: !!!Blk 641, Yishun , 2+1 , High floor, furniture, ... http:// bit.ly/14wAAJF",,@hdbresale,,309581171472355328,https://twitter.com/Sg_Real_Estate/status/309581171472355328,yishun mrt station,yishun
joellaiwj,2013-03-07 16:27:00,0,0,Swimming session cut short by CAT 1- 070313 @Jurong East Swimming Complex http:// instagr.am/p/WjK8PyhGbS/,,@Jurong,,309580991977115648,https://twitter.com/joellaiwj/status/309580991977115648,jurong east mrt station,jurong east
jessie_xinn,2013-03-07 16:27:00,0,0,Yishun safra with Hong & Xuan. Hub iz happy because I allow him to bowl. Lol! Been long since we hang around like that.,,,,309581018225074176,https://twitter.com/jessie_xinn/status/309581018225074176,yishun mrt station,yishun
azieanna_,2013-03-07 16:27:00,0,0,@IdaMohtov Pasir Ris .,,@IdaMohtov,,309581178598461441,https://twitter.com/azieanna_/status/309581178598461441,pasir ris mrt station,pasir ris
FarhanLex,2013-03-07 16:27:00,0,0,Gonna rush to jurong east first.,,,,309580952668102656,https://twitter.com/FarhanLex/status/309580952668102656,jurong east mrt station,jurong east
ldahoPotato,2013-03-07 16:28:00,0,0,To Pasir Ris I go.,,,,309581390377263105,https://twitter.com/ldahoPotato/status/309581390377263105,pasir ris mrt station,pasir ris
_zac22,2013-03-07 16:28:00,0,0,@MiranMohr ahahaha siao on. Kalau fort canning ok ah. Senang. Ahaha kk good luck,,@MiranMohr,,309581344604819456,https://twitter.com/_zac22/status/309581344604819456,fort canning mrt station,fort canning
Oipali,2013-03-07 16:28:00,0,0,I'm at Bandar Tanah Merah http:// 4sq.com/Zfoi9e,,,,309581261331111936,https://twitter.com/Oipali/status/309581261331111936,tanah merah mrt station,tanah merah
ridgefolks,2013-03-07 16:29:00,0,0,Headed to Jalan Besar later to cover the Young Lions-DPMM match... Anybody watches the #SLeague ? *looks around hopefully*,,,#SLeague,309581507620651008,https://twitter.com/ridgefolks/status/309581507620651008,jalan besar mrt station,jalan besar
Sgadsonline,2013-03-07 16:29:00,0,0,3+1 Blk 234 jurong east st 21 FF AC MRT $2.5knett!! http://www. sgadsonline.com/viewdetail_680 424.html …,,,,309581607092776960,https://twitter.com/Sgadsonline/status/309581607092776960,jurong east mrt station,jurong east
rukrutp,2013-03-07 16:29:00,0,0,Watch Tampines Rovers – Xuan Thanh Sai Gon live stream 3/06/2013 http:// recentevents.pl.ua/27564/,,,,309581520014823424,https://twitter.com/rukrutp/status/309581520014823424,tampines mrt station,tampines
Devanatics,2013-03-07 16:29:00,0,0,Hayang dong basoo.. RT @Ferry_ Angmokio : Aku lg ngebasooooooo RT @MithaPhewPhow : Pgn yg pedesssssss segerrrrrrr!!! Biar cengharrrr,,@Ferry_ @MithaPhewPhow,,309581657202110464,https://twitter.com/Devanatics/status/309581657202110464,ang mo kio mrt station,ang mo kio
thefifthivy,2013-03-07 16:30:00,0,0,So ATL was in Changi Airport right,,,,309581848965693440,https://twitter.com/thefifthivy/status/309581848965693440,changi airport mrt station,changi airport
AfsLx,2013-03-07 16:30:00,0,0,@FarhanLex @faxzjambu @shafiqrsd @haqryl Picit satu lamtai . Makan sempang bedok pa ?,,@FarhanLex @faxzjambu @shafiqrsd @haqryl,,309581881266016256,https://twitter.com/AfsLx/status/309581881266016256,bedok mrt station,bedok
_aaenn,2013-03-07 16:31:00,0,0,I'm at Jurong East Temporary Bus Interchange (Singapore) http:// 4sq.com/VJaweX,,,,309582050602659841,https://twitter.com/_aaenn/status/309582050602659841,jurong east mrt station,jurong east
BabyShaFi,2013-03-07 16:31:00,0,0,@ciknurazie hahaha! ore kelate baik2 lako...cari hok beloh2 pasir mas n tanah merah . hehehe...,,@ciknurazie,,309581974861910016,https://twitter.com/BabyShaFi/status/309581974861910016,tanah merah mrt station,tanah merah
akmalazan,2013-03-07 16:31:00,0,0,@shariffmunshi tampines rovers making it!!! Hahahaha,,@shariffmunshi,,309582075529400320,https://twitter.com/akmalazan/status/309582075529400320,tampines mrt station,tampines
mthasia,2013-03-07 16:31:00,0,0,REAL KIASU HERE PLEASE “ @furrychan : Tomorrow I'm waking up at 7am and then jog to Ikea tampines to have my meatballs.”,,@furrychan,,309582141568724992,https://twitter.com/mthasia/status/309582141568724992,tampines mrt station,tampines
flyfurryfly,2013-03-07 16:31:00,0,0,Tomorrow I'm waking up at 7am and then jog to Ikea tampines to have my meatballs.,,,,309582002305261568,https://twitter.com/flyfurryfly/status/309582002305261568,tampines mrt station,tampines
yangz1990,2013-03-07 16:31:00,0,0,I'm at Bus Stop 64541 ( Hougang Central Bus Interchange) (Singapore) http:// 4sq.com/13Ih01y,,,,309581972987064321,https://twitter.com/yangz1990/status/309581972987064321,hougang mrt station,hougang
s_a_d_i_q_1_8,2013-03-07 16:32:00,0,0,@LiindaPiink i wish i can join.. Im in bedok area also.. But ive got something..,,@LiindaPiink,,309582314692804609,https://twitter.com/s_a_d_i_q_1_8/status/309582314692804609,bedok mrt station,bedok
WoShiHaoRen_,2013-03-07 16:32:00,0,0,on the train to yishun !,,,,309582322246746112,https://twitter.com/WoShiHaoRen_/status/309582322246746112,yishun mrt station,yishun
andykohby,2013-03-07 16:32:00,0,0,"Just now at bukit batok 's badminton court there , I saw so many pro and im like like WTF AM I NOW ?",,,,309582326449451009,https://twitter.com/andykohby/status/309582326449451009,bukit batok mrt station,bukit batok
Haanli,2013-03-07 16:32:00,0,0,Suppose to meet at NP at 5 and I'm still at tanah merah,,,,309582289011101696,https://twitter.com/Haanli/status/309582289011101696,tanah merah mrt station,tanah merah
sotxng_,2013-03-07 16:32:00,0,0,Outside Serangoon Sec~,,,,309582305746378752,https://twitter.com/sotxng_/status/309582305746378752,serangoon mrt station,serangoon
izzmel1only,2013-03-07 16:32:00,0,0,"@helloimss_ haha, take him to yew tee . Maybe he will appreciate the memories he had there",,@helloimss_,,309582348184330240,https://twitter.com/izzmel1only/status/309582348184330240,yew tee mrt station,yew tee
haqryl,2013-03-07 16:33:00,0,0,@FarhanLex @AfsLx @FAXZJAMBU @ShafiqRsd kite gi punggol waterpark,,@FarhanLex @AfsLx @FAXZJAMBU @ShafiqRsd,,309582468112068610,https://twitter.com/haqryl/status/309582468112068610,punggol mrt station,punggol
swagmasterr95,2013-03-07 16:34:00,0,0,@Janghzh lavender or kallang ?,,@Janghzh,,309582740943142912,https://twitter.com/swagmasterr95/status/309582740943142912,kallang mrt station,kallang
Sgadsonline,2013-03-07 16:34:00,0,0,2+1 hougang blk 410 FF AC MRT $2.2k nego! Prefer 2year lease http://www. sgadsonline.com/viewdetail_680 427.html …,,,,309582788665937920,https://twitter.com/Sgadsonline/status/309582788665937920,hougang mrt station,hougang
ateynteyn,2013-03-07 16:34:00,0,0,"@daadaaa molep ! jd testimoni tuk sy dehh, haha ! tp bedok ye aadop cermin kang?",,@daadaaa,,309582909113765888,https://twitter.com/ateynteyn/status/309582909113765888,bedok mrt station,bedok
helloimss_,2013-03-07 16:36:00,0,0,@izzmel1only Hahah i thought chua chu kang ?! Haha,,@izzmel1only,,309583225053921280,https://twitter.com/helloimss_/status/309583225053921280,choa chu kang mrt station,chua chu kang
snflwrkisses,2013-03-07 16:36:00,0,0,@SabrinaNg1D Thats why I emo and she confiscated my notebook where I copied my geog notes on it. Haha nope at Kallang . You? :),,@SabrinaNg1D,,309583360009838592,https://twitter.com/snflwrkisses/status/309583360009838592,kallang mrt station,kallang
izzmel1only,2013-03-07 16:36:00,0,0,"@helloimss_ no lah, Yew Tee",,@helloimss_,,309583373200932865,https://twitter.com/izzmel1only/status/309583373200932865,yew tee mrt station,yew tee
news_singapore,2013-03-07 16:36:00,0,0,(ST) Serial molester in Jurong East connected to molest cases in lifts nabbed http:// bit.ly/ZfpOIl,,,,309583199686770688,https://twitter.com/news_singapore/status/309583199686770688,jurong east mrt station,jurong east
