username,date,retweets,favorites,text,geo,mentions,hashtags,id,permalink,place,key
kalanamith,2013-03-07 19:53:00,0,0,I'm at Blk 244 Bukit Batok East Avenue 5 (Singapore) [pic]: http:// 4sq.com/10jYXgV,,,,309632794139701249,https://twitter.com/kalanamith/status/309632794139701249,bukit batok mrt station,bukit batok
wahyu99x,2013-03-07 19:54:00,0,0,Tanah merah hampir kebanjiran,,,,309633230217285633,https://twitter.com/wahyu99x/status/309633230217285633,tanah merah mrt station,tanah merah
CLARENCEloveGOD,2013-03-07 19:54:00,0,0,"@leepingzz Haha! From pasir ris , go airport. GOOD JOB LA !",,@leepingzz,,309633047601504257,https://twitter.com/CLARENCEloveGOD/status/309633047601504257,pasir ris mrt station,pasir ris
timlmh,2013-03-07 19:54:00,0,0,The punggol waterway is really nice.,,,,309633239088250880,https://twitter.com/timlmh/status/309633239088250880,punggol mrt station,punggol
humanerrorlmao,2013-03-07 19:54:00,0,0,@Maisarah15_ go punggol ah tmr,,@Maisarah15_,,309633271451500544,https://twitter.com/humanerrorlmao/status/309633271451500544,punggol mrt station,punggol
Weixunnn,2013-03-07 19:54:00,0,0,Terribly hate the internet in tampines .,,,,309633067113390080,https://twitter.com/Weixunnn/status/309633067113390080,tampines mrt station,tampines
Izuuusmiles,2013-03-07 19:55:00,0,0,Alone time. Travelling to tampines to my childhood barber. Botak time. Byebye long hair~,,,,309633428846940160,https://twitter.com/Izuuusmiles/status/309633428846940160,tampines mrt station,tampines
GlenceSaliendra,2013-03-07 19:55:00,0,0,Photo: still lazy to take a shower. #blackandwhite #bnw #lazy #offday (at Blk 832 Yishun St 81) http:// tmblr.co/ZZbnKyfj2lzb,,,#blackandwhite #bnw #lazy #offday,309633501697806336,https://twitter.com/GlenceSaliendra/status/309633501697806336,yishun mrt station,yishun
PBandJerri,2013-03-07 19:55:00,0,0,@CharmaineL_ oh yahh. Btw i saw you at pasir ris town park that day..,,@CharmaineL_,,309633396873764864,https://twitter.com/PBandJerri/status/309633396873764864,pasir ris mrt station,pasir ris
GlenceSaliendra,2013-03-07 19:55:00,0,0,still lazy to take a shower. #blackandwhite #bnw #lazy #offday @Blk 832 Yishun St 81 http:// instagr.am/p/WjivmMSm4w/,,@Blk,#blackandwhite #bnw #lazy #offday,309633494525566976,https://twitter.com/GlenceSaliendra/status/309633494525566976,yishun mrt station,yishun
Kefli_AlHaq,2013-03-07 19:56:00,0,0,""" @5thJulySon : @kefli97 mana kau?"" Serangoon asal??",,@5thJulySon @kefli97,,309633721584197632,https://twitter.com/Kefli_AlHaq/status/309633721584197632,serangoon mrt station,serangoon
fizzyy,2013-03-07 19:56:00,0,0,@dreamyoceans i want to ): maybe she will be at clarke quay !,,@dreamyoceans,,309633559809892352,https://twitter.com/fizzyy/status/309633559809892352,clarke quay mrt station,clarke quay
_SaifullahMuhd_,2013-03-07 19:56:00,0,0,Things to do tomorrow Go to Bukit Panjang Rebel,,,,309633758305337344,https://twitter.com/_SaifullahMuhd_/status/309633758305337344,bukit panjang mrt station,bukit panjang
Jackson_LKS,2013-03-07 19:56:00,0,0,At Jalan Besar Stadium!,,,,309633609420136448,https://twitter.com/Jackson_LKS/status/309633609420136448,jalan besar mrt station,jalan besar
11May1995,2013-03-07 19:56:00,0,0,Cb sia RT @LTURNYEO Classic Alex RT @11May1995 : Wa fuck. Take wrong bus at tampines inter again. Fuck you sbs,,@LTURNYEO @11May1995,,309633757751681025,https://twitter.com/11May1995/status/309633757751681025,tampines mrt station,tampines
domhotward,2013-03-07 19:57:00,0,0,Sialan nih yg nginjek. AARGHH tanah merah ! pic.twitter.com/B5edeIPEcX,,,,309633925247008769,https://twitter.com/domhotward/status/309633925247008769,tanah merah mrt station,tanah merah
Izzraimy,2013-03-07 19:57:00,0,0,Where do you stay uh? (: — Choa Chu kang . :) http:// ask.fm/a/2qc8mi7q,,,,309633941487374336,https://twitter.com/Izzraimy/status/309633941487374336,choa chu kang mrt station,choa chu kang
joannecht_,2013-03-07 19:57:00,0,0,I'm at Bukit Batok Driving Centre (BBDC) (Singapore) http:// 4sq.com/YeutGj,,,,309633855059537920,https://twitter.com/joannecht_/status/309633855059537920,bukit batok mrt station,bukit batok
SaatMuhd,2013-03-07 19:58:00,0,0,Reached Simei,,,,309634126338727937,https://twitter.com/SaatMuhd/status/309634126338727937,simei mrt station,simei
5thJulySon,2013-03-07 19:58:00,1,0,"""@kefli97: "" @5thJulySon : @kefli97 mana kau?"" Serangoon asal??"" aku mendak tanya jer.",,@kefli97 @5thJulySon @kefli97,,309634105019084802,https://twitter.com/5thJulySon/status/309634105019084802,serangoon mrt station,serangoon
vJesslynv,2013-03-07 19:58:00,0,0,Watching sg soccer at jalan besar with @Chuting,,@Chuting,,309634207276212225,https://twitter.com/vJesslynv/status/309634207276212225,jalan besar mrt station,jalan besar
effabahash1,2013-03-07 19:58:00,0,0,where in tampines is there photocopy services?,,,,309634102204706816,https://twitter.com/effabahash1/status/309634102204706816,tampines mrt station,tampines
Joannalalala,2013-03-07 19:58:00,0,0,Maybe I made the right choice since it is at yew tee my gosh,,,,309634202100457472,https://twitter.com/Joannalalala/status/309634202100457472,yew tee mrt station,yew tee
melmelmelissaaa,2013-03-07 19:58:00,0,0,"And if I rmb to bring my wallet out, I could have do shopping. Or Maybe I should walk over to gardens by the bay ?",,,,309634098496937984,https://twitter.com/melmelmelissaaa/status/309634098496937984,gardens by the bay mrt station,gardens by the bay
bentunvfivh,2013-03-07 19:58:00,1,1,@sweetlavender13 OFCOS LA INGT! miss you more! skrg buat apa? rindu naik mrt gi paya lebar ........ :'),,@sweetlavender13,,309634149642280960,https://twitter.com/bentunvfivh/status/309634149642280960,paya lebar mrt station,paya lebar
NatashaAida,2013-03-07 19:59:00,0,0,Spent almost 8 hours at Changi airport . I got nothing to complain about :),,,,309634485035597824,https://twitter.com/NatashaAida/status/309634485035597824,changi airport mrt station,changi airport
afqhomr,2013-03-07 19:59:00,0,1,Feel like going jogging now. Anyone? Bedok reservoir?,,,,309634381130125312,https://twitter.com/afqhomr/status/309634381130125312,bedok mrt station,bedok
vrprima,2013-03-07 19:59:00,0,0,"2. Pada detik ini,sedang mengamati indahnya marina bay dgn Mrt yg smpat salah arah ke somerset",,,,309634324226007041,https://twitter.com/vrprima/status/309634324226007041,marina bay mrt station,marina bay mrt
invxncxble_,2013-03-07 20:00:00,0,0,At Hougang Ave 9 (:,,,,309634640610742272,https://twitter.com/invxncxble_/status/309634640610742272,hougang mrt station,hougang
ainfatinixx,2013-03-07 20:00:00,0,0,@ierahhunny @fiqahh97 pergi la USA. upper serangoon avenue. Hahahahaha,,@ierahhunny @fiqahh97,,309634586349019137,https://twitter.com/ainfatinixx/status/309634586349019137,serangoon mrt station,serangoon
FaDhLi201,2013-03-07 20:00:00,0,0,Bsk futsal with tampines swensens staff and supervisors ! :),,,,309634687800844288,https://twitter.com/FaDhLi201/status/309634687800844288,tampines mrt station,tampines
Patrickjbn,2013-03-07 20:01:00,0,0,"Kereeennn "" @domhotward : Sialan nih yg nginjek. AARGHH tanah merah ! pic.twitter.com/UwV7uXkbOt """,,@domhotward,,309634995935408129,https://twitter.com/Patrickjbn/status/309634995935408129,tanah merah mrt station,tanah merah
joelynrichelle,2013-03-07 20:01:00,0,0,@awfullywicked nah.. Just hair cut. I'm at hougang mall! Haha..,,@awfullywicked,,309634800539541504,https://twitter.com/joelynrichelle/status/309634800539541504,hougang mrt station,hougang
Marcus_RQ,2013-03-07 20:01:00,0,0,I'm at Blk 507 Ang Mo Kio Ave8 (Singapore) http:// 4sq.com/YCd11p,,,,309635010523168768,https://twitter.com/Marcus_RQ/status/309635010523168768,ang mo kio mrt station,ang mo kio
VisitSG_ID,2013-03-07 20:01:00,0,0,"Kalau km skrg ada di Clarke Quay , SG, apa yang sedang km lakukan, Guys? http:// bit.ly/V8gh5O http:// ow.ly/i/1Dlyb",,,,309634939752701952,https://twitter.com/VisitSG_ID/status/309634939752701952,clarke quay mrt station,clarke quay
Amrazmxn,2013-03-07 20:01:00,0,0,@fivecar otw changi airport !,,@fivecar,,309634933335396353,https://twitter.com/Amrazmxn/status/309634933335396353,changi airport mrt station,changi airport
LTAsg,2013-03-07 20:01:00,1,0,Accident on PIE (towards Changi Airport ) after Paya Lebar Rd with congestion till Kallang Way. Avoid lane 1,,,,309634844651057154,https://twitter.com/LTAsg/status/309634844651057154,changi airport mrt station,changi airport
YO_sissy,2013-03-07 20:02:00,0,0,"@th_masquerade #03-06, Eastpoint Mall (3 Simei St. 6), Singapore 538766, Singapore",,@th_masquerade,#03,309635212655079424,https://twitter.com/YO_sissy/status/309635212655079424,simei mrt station,simei
burpingduck,2013-03-07 20:02:00,0,0,"I have a problem with direction. Despite being to gardens by the bay like, 7 times, I still have no idea how to take the bus to marina bay",,,,309635173429956608,https://twitter.com/burpingduck/status/309635173429956608,gardens by the bay mrt station,gardens by the bay
ChiaChuenNam,2013-03-07 20:02:00,0,1,Bukit merah. Ri. Cat high. Bedok south. Northbrooks. Victori. 'Lucky siol',,,,309635097022316545,https://twitter.com/ChiaChuenNam/status/309635097022316545,bedok mrt station,bedok
IamTayTarik,2013-03-07 20:02:00,0,0,Jalan besar Hahha!!!,,,,309635194271440896,https://twitter.com/IamTayTarik/status/309635194271440896,jalan besar mrt station,jalan besar
ZizieCaipirinha,2013-03-07 20:02:00,0,0,"@ZakwanRshd Thought of fetching you boys back to Tampines but fikir balik, never mind lah another time okay? Send my regards to the rest!",,@ZakwanRshd,,309635187938041856,https://twitter.com/ZizieCaipirinha/status/309635187938041856,tampines mrt station,tampines
JeveJessica,2013-03-07 20:03:00,0,0,"Bagus kok, bermotif drpd polos wkkw "" @domhotward : Sialan nih yg nginjek. AARGHH tanah merah ! pic.twitter.com/inmpCHCa1z """"",,@domhotward,,309635450539212800,https://twitter.com/JeveJessica/status/309635450539212800,tanah merah mrt station,tanah merah
BranCKH,2013-03-07 20:03:00,0,0,@MeowKai_Gary why come pasir ris ? 0.o,,@MeowKai_Gary,,309635305433100288,https://twitter.com/BranCKH/status/309635305433100288,pasir ris mrt station,pasir ris
gabetan13,2013-03-07 20:03:00,0,0,31' Al-Qaasimy slides in on Adi and gets a yellow. Things starting to heat up at the Jalan Besar Stadium! #SLeague,,,#SLeague,309635491777626112,https://twitter.com/gabetan13/status/309635491777626112,jalan besar mrt station,jalan besar
SGManyTutors,2013-03-07 20:03:00,0,0,"YEW TEE Mrt - Sec. 4 Emaths & Combined Chemistry: by winnie (Posted Thu Mar 07, 2013 7:49 pm)CCK North 6 ( Jus... http:// bit.ly/VJQy3T",,,,309635302056656896,https://twitter.com/SGManyTutors/status/309635302056656896,yew tee mrt station,yew tee
nadya_ds,2013-03-07 20:03:00,0,0,"Aaaahhhh... Msh 1,5 jam lg (with @Myra_vidya and Dinda at Changi Airport Terminal 1 Departure Hall) — http:// path.com/p/2IxMuK",,@Myra_vidya,,309635514162618369,https://twitter.com/nadya_ds/status/309635514162618369,changi airport mrt station,changi airport
ruzrawks,2013-03-07 20:03:00,0,0,Off to dhoby ghaut,,,,309635349636845569,https://twitter.com/ruzrawks/status/309635349636845569,dhoby ghaut mrt station,dhoby ghaut
_patrickL,2013-03-07 20:04:00,0,0,Tml need go tanjong pagar,,,,309635736410402817,https://twitter.com/_patrickL/status/309635736410402817,tanjong pagar mrt station,tanjong pagar
Patrickjbn,2013-03-07 20:04:00,0,0,"Buset, gua ga ada nginjek tanah merah , paling si kepin. Wkwkwk "" @domhotward : @Patrickjbn ketek. lu ya pat yg injek?! :(""",,@domhotward @Patrickjbn,,309635711932440576,https://twitter.com/Patrickjbn/status/309635711932440576,tanah merah mrt station,tanah merah
seito__simei,2013-03-07 20:04:00,0,0,やべぇ、なんかpso2またんやりたくなつまてきたわ,,,,309635737408647168,https://twitter.com/seito__simei/status/309635737408647168,simei mrt station,simei
thRiverCard,2013-03-07 20:04:00,0,0,I'm at HomeTeamNS @Bukit Batok (Singapore) http:// 4sq.com/YOMKKk,,@Bukit,,309635666021601280,https://twitter.com/thRiverCard/status/309635666021601280,bukit batok mrt station,bukit batok
StarTutor,2013-03-07 20:04:00,0,0,O2 CL tuition @56 Bukit Batok St31. 1x1.5hrs/month. Preferred Gender: f. http:// startutor.sg/r:25818,,@56,,309635588993200128,https://twitter.com/StarTutor/status/309635588993200128,bukit batok mrt station,bukit batok
BrotherTKO,2013-03-07 20:05:00,0,1,Talked to @sarrahrossi and @farisahaziz for the first time in my 4 years of sembawang ... Hahaha,,@sarrahrossi @farisahaziz,,309635915020656641,https://twitter.com/BrotherTKO/status/309635915020656641,sembawang mrt station,sembawang
Pacman77777,2013-03-07 20:05:00,0,0,Leychey la bedok stadium zzzzz,,,,309636038488383488,https://twitter.com/Pacman77777/status/309636038488383488,bedok mrt station,bedok
fahmianhar,2013-03-07 20:05:00,0,0,"RT @Singasik: Kalau km skrg ada di Clarke Quay , SG, apa yang sedang km lakukan, Guys? | main slingshot bungee http:// twitpic.com/c9bx2m",,@Singasik,,309636038610006016,https://twitter.com/fahmianhar/status/309636038610006016,clarke quay mrt station,clarke quay
adyshinyo,2013-03-07 20:05:00,0,0,"Batu bata merah yg bru jadi, enak antioksidan RT @beetibee : Hih gmn rasanya? ""adyshinyo: Pernah tapi tanah",,@beetibee,,309635978312695810,https://twitter.com/adyshinyo/status/309635978312695810,tanah merah mrt station,tanah merah
seito__simei,2013-03-07 20:05:00,0,0,ﾔｽﾐﾉｺﾌでなくて萎えてたけどまたやるかぬぉ,,,,309635896569905153,https://twitter.com/seito__simei/status/309635896569905153,simei mrt station,simei
eunicegrx,2013-03-07 20:05:00,0,0,Finally!!!! With my girls ruiyyi agneslicious_ @Bedok Food Centre ( Bedok Corner) http:// instagr.am/p/Wjjl3xs6Vw/,,@Bedok,,309635906980167680,https://twitter.com/eunicegrx/status/309635906980167680,bedok mrt station,bedok
Vampirebite_,2013-03-07 20:05:00,0,0,which school are you from? — Marsiling Secondary School. FTW ! http:// ask.fm/a/2o1d6a9f,,,,309635909039570945,https://twitter.com/Vampirebite_/status/309635909039570945,marsiling mrt station,marsiling
SeanHsj,2013-03-07 20:06:00,0,0,@furerbenarfa I know of one person who is like this. Very scary. Stays around hougang avenue 8. Freaky.,,@furerbenarfa,,309636168323039232,https://twitter.com/SeanHsj/status/309636168323039232,hougang mrt station,hougang
xheryII,2013-03-07 20:06:00,0,0,@Kickbangwall582 Yishun :) !,,@Kickbangwall582,,309636132046508033,https://twitter.com/xheryII/status/309636132046508033,yishun mrt station,yishun
ayesupgel,2013-03-07 20:06:00,0,0,"Had a gd time at the jurong east complex gym today! Gd condition, big area & cheap! $1.50 student, $2.50 adult. No time limit. Recommended!",,,,309636071858266113,https://twitter.com/ayesupgel/status/309636071858266113,jurong east mrt station,jurong east
_mamiyaki,2013-03-07 20:06:00,0,0,@mwunady oh yeah can hoot at tampines nearby.. i finding ppl to go jiak lol,,@mwunady,,309636141248806912,https://twitter.com/_mamiyaki/status/309636141248806912,tampines mrt station,tampines
86_popo,2013-03-07 20:07:00,0,0,#instaweatherpro app http:// bit.ly/TBWsjq #weather now in #Toa Payoh is my... pic.twitter.com/gSpbXJvC4A,,,#instaweatherpro #weather #Toa,309636519268855808,https://twitter.com/86_popo/status/309636519268855808,toa payoh mrt station,toa payoh
SunKimHyuk,2013-03-07 20:07:00,0,1,Still at Kallang macs. Saw Adi. :),,,,309636323281616896,https://twitter.com/SunKimHyuk/status/309636323281616896,kallang mrt station,kallang
zendricktzy,2013-03-07 20:07:00,0,1,@BreadTalk Tampines Mall with @vincentLeeKW & @TheAlanchild . Sausages bread! Nom nom!!,,@BreadTalk @vincentLeeKW @TheAlanchild,,309636526231412738,https://twitter.com/zendricktzy/status/309636526231412738,tampines mrt station,tampines
sayatitin,2013-03-07 20:07:00,0,0,Saatnya kembali ke penginapan (@Clarke Quay MRT Station (NE5)) http:// 4sq.com/16aTABl,,@Clarke,,309636389140570112,https://twitter.com/sayatitin/status/309636389140570112,clarke quay mrt station,clarke quay
charliejburness,2013-03-07 20:07:00,0,0,"@GregJRutherford @andrewsteele ...Sling in the Long Bar in Raffles, go to Marina Bay Sands and Clarke Quay for restaurants/bars.",,@GregJRutherford @andrewsteele,,309636493952049152,https://twitter.com/charliejburness/status/309636493952049152,clarke quay mrt station,clarke quay
tweet_hoot,2013-03-07 20:07:00,0,0,RT @_dandyu2013@mwunady oh yeah can #hoot at tampines nearby.. i finding ppl to go jiak lol http:// bit.ly/10k3JLq,,@_dandyu2013 @mwunady,#hoot,309636428680273920,https://twitter.com/tweet_hoot/status/309636428680273920,tampines mrt station,tampines
RubxieeJurxme,2013-03-07 20:07:00,0,0,@AdlnIlyn tinggal hougang :),,@AdlnIlyn,,309636478982557696,https://twitter.com/RubxieeJurxme/status/309636478982557696,hougang mrt station,hougang
freezesus,2013-03-07 20:07:00,0,0,@_Haneyxnx ikr hais. We have to cycle all the way from tamp to woodlands and east coast and all and then.... we go back to Tampines .,,@_Haneyxnx,,309636335122137088,https://twitter.com/freezesus/status/309636335122137088,tampines mrt station,tampines
taxiautofare,2013-03-07 20:08:00,0,0,Check Singapore fare from 24 Mount Elizabeth to Changi Airport @http://www. taxiautofare.com !,,@http,,309636796571070464,https://twitter.com/taxiautofare/status/309636796571070464,changi airport mrt station,changi airport
_suriyahriaa,2013-03-07 20:08:00,0,0,at khatib now. haiss 4 more station to go.,,,,309636776992071682,https://twitter.com/_suriyahriaa/status/309636776992071682,khatib mrt station,khatib station
SaladBoy_96,2013-03-07 20:08:00,0,0,@JonAttack617 go blk 146 toa payoh da bao some good food here thx,,@JonAttack617,,309636687099727872,https://twitter.com/SaladBoy_96/status/309636687099727872,toa payoh mrt station,toa payoh
kekekurniasih,2013-03-07 20:08:00,0,0,"Seandainya rumah gw deket ke jalan besar , tiap kmana2 gw mending naek angkot deh....",,,,309636785019944960,https://twitter.com/kekekurniasih/status/309636785019944960,jalan besar mrt station,jalan besar
AlexShuoFeng,2013-03-07 20:08:00,0,0,Take wrong bus. Now go tampines instead of grandma house. -.-,,,,309636753365532673,https://twitter.com/AlexShuoFeng/status/309636753365532673,tampines mrt station,tampines
MonkeyySoon,2013-03-07 20:08:00,0,0,I'm at Bedok Camp Alpha Coy http:// 4sq.com/WMhL1P,,,,309636613552607232,https://twitter.com/MonkeyySoon/status/309636613552607232,bedok mrt station,bedok
SaatMuhd,2013-03-07 20:08:00,0,0,Selamat hari ni simei tak banyak org main,,,,309636737729175552,https://twitter.com/SaatMuhd/status/309636737729175552,simei mrt station,simei
kalanamith,2013-03-07 20:08:00,0,0,Closing soon (@Bukit Batok East Community Club (CC)) http:// 4sq.com/Ztc6j5,,@Bukit,,309636584582561793,https://twitter.com/kalanamith/status/309636584582561793,bukit batok mrt station,bukit batok
Jintingg,2013-03-07 20:09:00,0,1,Came back from a jog with @KPriscilia and my sis! Ran all the way to hougang 1 to get stuff!,,@KPriscilia,,309636887268716545,https://twitter.com/Jintingg/status/309636887268716545,hougang mrt station,hougang
farisahaziz,2013-03-07 20:09:00,0,1,Achievement :b haha! RT @AbangTKO: Talked to @sarrahrossi and @farisahaziz for the first time in my 4 years of sembawang ... Hahaha,,@AbangTKO @sarrahrossi @farisahaziz,,309636799100235777,https://twitter.com/farisahaziz/status/309636799100235777,sembawang mrt station,sembawang
cyjisjhry,2013-03-07 20:09:00,0,0,@Baekhannie then wheres the link ;~; eh- I schooling in tampines xD,,@Baekhannie,,309636966184542208,https://twitter.com/cyjisjhry/status/309636966184542208,tampines mrt station,tampines
MerrilynnThng,2013-03-07 20:09:00,0,0,"@Crysh99 @YeoooWeiBin STAAHHP. OR CRYSH, BATHE AT BEDOK RESERVOIR HAHAHAH",,@Crysh99 @YeoooWeiBin,,309637043917561856,https://twitter.com/MerrilynnThng/status/309637043917561856,bedok mrt station,bedok
Ashrafachaapp,2013-03-07 20:09:00,0,0,Heading to Aljunied now.,,,,309636820625416193,https://twitter.com/Ashrafachaapp/status/309636820625416193,aljunied mrt station,aljunied
artspieces,2013-03-07 20:10:00,0,0,I'm at 南南咖喱 @Blk 303 Jurong East Street 32 http:// 4sq.com/Zibprs,,@Blk,,309637232355069952,https://twitter.com/artspieces/status/309637232355069952,jurong east mrt station,jurong east
belvybay,2013-03-07 20:10:00,0,0,I have no idea which part of pasir ris i am at. What the hell. Where does 15 go? :],,,,309637070111002624,https://twitter.com/belvybay/status/309637070111002624,pasir ris mrt station,pasir ris
MRJMaier,2013-03-07 20:10:00,0,0,@Farhan_Koh east mane? Pasir ris? Tamp? Bedok ? Changi?,,@Farhan_Koh,,309637200469975040,https://twitter.com/MRJMaier/status/309637200469975040,bedok mrt station,bedok
siiinclair,2013-03-07 20:10:00,0,0,@llouis21 buona vista ? Everything is at sistic,,@llouis21,,309637077002223616,https://twitter.com/siiinclair/status/309637077002223616,buona vista mrt station,buona vista
luthfi21,2013-03-07 20:11:00,0,0,"Maboklah, ngapain lagi. RT @Singasik: Kalau km skrg ada di Clarke Quay , SG, apa yang sedang km lakukan, Guys?",,@Singasik,,309637344171016192,https://twitter.com/luthfi21/status/309637344171016192,clarke quay mrt station,clarke quay
artspieces,2013-03-07 20:11:00,0,0,I'm at Esso Station @Jurong East (Singapore) http:// 4sq.com/WwoNwV,,@Jurong,,309637435350994944,https://twitter.com/artspieces/status/309637435350994944,jurong east mrt station,jurong east
QPHENOMENON,2013-03-07 20:11:00,0,0,That bitch went to toa payoh buy make up instead of clothes . Lol waste time .,,,,309637437427179522,https://twitter.com/QPHENOMENON/status/309637437427179522,toa payoh mrt station,toa payoh
HusmiOhHusmi,2013-03-07 20:11:00,0,0,First game vs Tampines changkat. Rabak ja. pic.twitter.com/3bg0db3Hc6,,,,309637375913508864,https://twitter.com/HusmiOhHusmi/status/309637375913508864,tampines mrt station,tampines
Bobbyflair,2013-03-07 20:12:00,0,0,@78792434 bedok,,@78792434,,309637660446695424,https://twitter.com/Bobbyflair/status/309637660446695424,bedok mrt station,bedok
fara_fauzia,2013-03-07 20:14:00,0,0,Di @diadaraCS iki lho @rangga_sena nabung terus ndk kali seh garai tanah merah Banjir tok wakakak!!! http:// myloc.me/rewhR,,@diadaraCS @rangga_sena,,309638136940609536,https://twitter.com/fara_fauzia/status/309638136940609536,tanah merah mrt station,tanah merah
_fxlzxh_,2013-03-07 20:14:00,0,0,Omw to changi airport,,,,309638236861517825,https://twitter.com/_fxlzxh_/status/309638236861517825,changi airport mrt station,changi airport
AMushthaq,2013-03-07 20:14:00,0,0,Changi Airport to tender its mega contracts http:// bit.ly/13HfOuS,,,,309638070716735491,https://twitter.com/AMushthaq/status/309638070716735491,changi airport mrt station,changi airport
P31Y1NG_,2013-03-07 20:14:00,0,0,I scared i cant wake tml. 510 wake. 6am go out. 635/640 reach clementi station . Then go mac/busstop meet friends.,,,,309638094955634688,https://twitter.com/P31Y1NG_/status/309638094955634688,clementi mrt station,clementi station
taxiautofare,2013-03-07 20:14:00,0,0,Check Singapore fare from Bedok north to The paragon @http://www. taxiautofare.com !,,@http,,309638135866880000,https://twitter.com/taxiautofare/status/309638135866880000,bedok mrt station,bedok
wjpapakong,2013-03-07 20:14:00,0,0,@TheHolyACJH you want confirm first? Cause drizzing at yishun,,@TheHolyACJH,,309638201230888961,https://twitter.com/wjpapakong/status/309638201230888961,yishun mrt station,yishun
IskandarAfiqv,2013-03-07 20:14:00,0,0,Tomorrow aft school going bedok point.,,,,309638202606632960,https://twitter.com/IskandarAfiqv/status/309638202606632960,bedok mrt station,bedok
daaarren_,2013-03-07 20:15:00,0,0,Eating at bedok inter,,,,309638495008350208,https://twitter.com/daaarren_/status/309638495008350208,bedok mrt station,bedok
RezaKhadiva,2013-03-07 20:15:00,0,0,"Kasian kakinya jd jrng dipake RT @ikekekekeee: Seandainya rumah gw deket ke jalan besar , tiap kmana2 gw mending naek angkot deh....",,@ikekekekeee,,309638475026665472,https://twitter.com/RezaKhadiva/status/309638475026665472,jalan besar mrt station,jalan besar
StarTutor,2013-03-07 20:15:00,0,0,O1 CL tuition @534 Hougang St 52. 4x2hrs/month. http:// startutor.sg/r:25814,,@534,,309638322400153601,https://twitter.com/StarTutor/status/309638322400153601,hougang mrt station,hougang
erwxn_,2013-03-07 20:16:00,0,0,Otw to simei for takraw,,,,309638649065111552,https://twitter.com/erwxn_/status/309638649065111552,simei mrt station,simei
arieandika,2013-03-07 20:16:00,0,0,"I'm at Jumbo Seafood Restaurant ( Clarke Quay , Singapore) http:// 4sq.com/13Hiqcl",,,,309638619780489216,https://twitter.com/arieandika/status/309638619780489216,clarke quay mrt station,clarke quay
listpipetoo,2013-03-07 20:16:00,0,0,"#Xocai #MLM #sjokogate , #sjokolademafia , #sjokoservice : Singapore, Sentosa, Little India, Clarke Quay , Chin... - http:// listpipe.info/la2g",,,#Xocai #MLM #sjokogate #sjokolademafia #sjokoservice,309638685429751810,https://twitter.com/listpipetoo/status/309638685429751810,clarke quay mrt station,clarke quay
RubxieeJurxme,2013-03-07 20:16:00,0,0,"@AdlnIlyn Bedok north, kau?",,@AdlnIlyn,,309638803365179392,https://twitter.com/RubxieeJurxme/status/309638803365179392,bedok mrt station,bedok
ItsHaykalRadzi,2013-03-07 20:16:00,1,0,@Dannyyforshort sumpaah bedok doo.. Gentle laa haha,,@Dannyyforshort,,309638671441752064,https://twitter.com/ItsHaykalRadzi/status/309638671441752064,bedok mrt station,bedok
junwaay,2013-03-07 20:16:00,0,0,@zOhyEE @angstyyyy ohhh! Night walk during camps lo!(: no lah they doing in school! Its just that before the walk they got siglap pract(:,,@zOhyEE @angstyyyy,,309638624943685632,https://twitter.com/junwaay/status/309638624943685632,siglap mrt station,siglap
JavierNgoh,2013-03-07 20:16:00,0,0,Serangoon field jialat...,,,,309638762130968577,https://twitter.com/JavierNgoh/status/309638762130968577,serangoon mrt station,serangoon
najibaosman,2013-03-07 20:16:00,0,0,"Tadi mama cakap nakgi pasar malam tanah merah , now duk tengok tv jaa ! Hmmm nakpiiii",,,,309638581545209856,https://twitter.com/najibaosman/status/309638581545209856,tanah merah mrt station,tanah merah
